[I 2025-04-23 12:38:03,338] Trial 47 finished with value: 0.5228998515984482 and parameters: {'ff_dim': 2048, 'dropout_rate': 0.161022400942511, 'embed_dim': 256, 'learning_rate': 6.912041532977275e-05, 'optimizer': 'AdamW', 'weight_decay': 5.577420998492196e-06, 'batch_size': 10, 'num_heads': 2, 'num_transformer_blocks': 4}. Best is trial 35 with value: 0.5264969717407668.
Hyperparameters: num_heads=2, num_transformer_blocks=4, learning_rate=6.239041462802021e-05, optimizer=AdamW, weight_decay=0.0004388941414635483, batch_size=32,factor=1
Divergence detected. Stopping training after 10 epochs.
Early stopping at epoch 29
Trial 48, Fold 2: Test Accuracy = 0.5559
Divergence detected. Stopping training after 10 epochs.
Early stopping at epoch 28
Trial 49, Fold 1: Test Accuracy = 0.5272
Divergence detected. Stopping training after 10 epochs.
Early stopping at epoch 21
Trial 48, Fold 3: Test Accuracy = 0.4719
Divergence detected. Stopping training after 10 epochs.
Early stopping at epoch 25
Trial 49, Fold 2: Test Accuracy = 0.6085
Divergence detected. Stopping training after 10 epochs.
Early stopping at epoch 18
Trial 49, Fold 3: Test Accuracy = 0.5127
Divergence detected. Stopping training after 10 epochs.
Early stopping at epoch 26
Trial 48, Fold 4: Test Accuracy = 0.5185
Divergence detected. Stopping training after 10 epochs.
Early stopping at epoch 10
Trial 49, Fold 4: Test Accuracy = 0.5083
Trial 48, Fold 5: Test Accuracy = 0.5296
Trial 48: Mean Accuracy = 0.5117, Fold Accuracies = [np.float64(0.4828157174691829), np.float64(0.5558576277709532), np.float64(0.47190869790711104), np.float64(0.518503191188842), np.float64(0.5296401502717293)]
[I 2025-04-23 12:45:44,241] Trial 48 finished with value: 0.5117450769215637 and parameters: {'ff_dim': 2048, 'dropout_rate': 0.17003470655011474, 'embed_dim': 256, 'learning_rate': 9.602210308643173e-05, 'optimizer': 'AdamW', 'weight_decay': 0.0004146484177195346, 'batch_size': 32, 'num_heads': 2, 'num_transformer_blocks': 2}. Best is trial 35 with value: 0.5264969717407668.
Hyperparameters: num_heads=2, num_transformer_blocks=4, learning_rate=2.0588679231253206e-05, optimizer=AdamW, weight_decay=0.0007122741704439564, batch_size=32,factor=1
Divergence detected. Stopping training after 10 epochs.
Early stopping at epoch 24
Trial 49, Fold 5: Test Accuracy = 0.5060
Trial 49: Mean Accuracy = 0.5325, Fold Accuracies = [np.float64(0.5271931680347522), np.float64(0.6084733633839248), np.float64(0.5127097475682506), np.float64(0.5083343810242226), np.float64(0.50595148995149)]
[I 2025-04-23 12:46:09,410] Trial 49 finished with value: 0.532532429992528 and parameters: {'ff_dim': 2048, 'dropout_rate': 0.1696505706058007, 'embed_dim': 256, 'learning_rate': 6.239041462802021e-05, 'optimizer': 'AdamW', 'weight_decay': 0.0004388941414635483, 'batch_size': 32, 'num_heads': 2, 'num_transformer_blocks': 4}. Best is trial 49 with value: 0.532532429992528.
Hyperparameters: num_heads=2, num_transformer_blocks=4, learning_rate=3.3444918887251412e-06, optimizer=AdamW, weight_decay=0.0007357856222928108, batch_size=32,factor=1
Divergence detected. Stopping training after 10 epochs.
Early stopping at epoch 21
Trial 50, Fold 1: Test Accuracy = 0.4067
Divergence detected. Stopping training after 10 epochs.
Early stopping at epoch 18
Trial 51, Fold 1: Test Accuracy = 0.4249
Trial 50, Fold 2: Test Accuracy = 0.5706
Trial 51, Fold 2: Test Accuracy = 0.4977
Divergence detected. Stopping training after 10 epochs.
Early stopping at epoch 13
Trial 51, Fold 3: Test Accuracy = 0.4181
Divergence detected. Stopping training after 10 epochs.
Early stopping at epoch 24
Trial 50, Fold 3: Test Accuracy = 0.4648
Divergence detected. Stopping training after 10 epochs.
Early stopping at epoch 25
Trial 51, Fold 4: Test Accuracy = 0.5223
Trial 50, Fold 4: Test Accuracy = 0.5206
Divergence detected. Stopping training after 10 epochs.
Early stopping at epoch 18
Trial 51, Fold 5: Test Accuracy = 0.4707
Trial 51: Mean Accuracy = 0.4667, Fold Accuracies = [np.float64(0.42491819694789995), np.float64(0.49774068163154794), np.float64(0.4181011744354775), np.float64(0.5223191142277974), np.float64(0.4706668125615494)]
[I 2025-04-23 12:54:04,204] Trial 51 finished with value: 0.4667491959608544 and parameters: {'ff_dim': 2048, 'dropout_rate': 0.18904049461108868, 'embed_dim': 128, 'learning_rate': 3.3444918887251412e-06, 'optimizer': 'AdamW', 'weight_decay': 0.0007357856222928108, 'batch_size': 32, 'num_heads': 2, 'num_transformer_blocks': 4}. Best is trial 49 with value: 0.532532429992528.
Hyperparameters: num_heads=2, num_transformer_blocks=4, learning_rate=2.22679242405182e-05, optimizer=AdamW, weight_decay=0.0004194254773729084, batch_size=32,factor=1
Divergence detected. Stopping training after 10 epochs.
Early stopping at epoch 27
Trial 50, Fold 5: Test Accuracy = 0.5222
Trial 50: Mean Accuracy = 0.4970, Fold Accuracies = [np.float64(0.4067247750416067), np.float64(0.5705958849932761), np.float64(0.4648057472971517), np.float64(0.5205700524931939), np.float64(0.5222044716781559)]
[I 2025-04-23 12:55:28,812] Trial 50 finished with value: 0.49698018630067686 and parameters: {'ff_dim': 2048, 'dropout_rate': 0.16899619111635114, 'embed_dim': 128, 'learning_rate': 2.0588679231253206e-05, 'optimizer': 'AdamW', 'weight_decay': 0.0007122741704439564, 'batch_size': 32, 'num_heads': 2, 'num_transformer_blocks': 4}. Best is trial 49 with value: 0.532532429992528.
Hyperparameters: num_heads=2, num_transformer_blocks=4, learning_rate=5.776228143403907e-05, optimizer=AdamW, weight_decay=0.00042715611858770887, batch_size=32,factor=1
Divergence detected. Stopping training after 10 epochs.
Early stopping at epoch 29
Trial 52, Fold 1: Test Accuracy = 0.5068
Divergence detected. Stopping training after 10 epochs.
Early stopping at epoch 21
Trial 53, Fold 1: Test Accuracy = 0.5165
Divergence detected. Stopping training after 10 epochs.
Early stopping at epoch 14
Trial 52, Fold 2: Test Accuracy = 0.4959
Divergence detected. Stopping training after 10 epochs.
Early stopping at epoch 21
Divergence detected. Stopping training after 10 epochs.
Early stopping at epoch 25
Trial 52, Fold 3: Test Accuracy = 0.4741
Trial 53, Fold 2: Test Accuracy = 0.5498
Divergence detected. Stopping training after 10 epochs.
Early stopping at epoch 17
Trial 52, Fold 4: Test Accuracy = 0.5423
Divergence detected. Stopping training after 10 epochs.
Early stopping at epoch 19
Trial 53, Fold 3: Test Accuracy = 0.4950
Divergence detected. Stopping training after 10 epochs.
Early stopping at epoch 10
Trial 52, Fold 5: Test Accuracy = 0.3842
Trial 52: Mean Accuracy = 0.4806, Fold Accuracies = [np.float64(0.5067656765676567), np.float64(0.4958594430012105), np.float64(0.47412000733873255), np.float64(0.5422690889280027), np.float64(0.38415873363241787)]
[I 2025-04-23 13:01:11,664] Trial 52 finished with value: 0.4806345898936041 and parameters: {'ff_dim': 2048, 'dropout_rate': 0.16578841235103584, 'embed_dim': 256, 'learning_rate': 2.22679242405182e-05, 'optimizer': 'AdamW', 'weight_decay': 0.0004194254773729084, 'batch_size': 32, 'num_heads': 2, 'num_transformer_blocks': 4}. Best is trial 49 with value: 0.532532429992528.
Hyperparameters: num_heads=2, num_transformer_blocks=4, learning_rate=6.216415270059321e-05, optimizer=AdamW, weight_decay=0.00030801726703133737, batch_size=32,factor=1
Divergence detected. Stopping training after 10 epochs.
Early stopping at epoch 23
Trial 53, Fold 4: Test Accuracy = 0.5465
Trial 54, Fold 1: Test Accuracy = 0.5248
Divergence detected. Stopping training after 10 epochs.
Early stopping at epoch 18
Trial 53, Fold 5: Test Accuracy = 0.4980
Trial 53: Mean Accuracy = 0.5212, Fold Accuracies = [np.float64(0.5165298581140165), np.float64(0.549844572657318), np.float64(0.4950231109183767), np.float64(0.5464985588429767), np.float64(0.49795469963891015)]
[I 2025-04-23 13:03:44,812] Trial 53 finished with value: 0.5211701600343197 and parameters: {'ff_dim': 2048, 'dropout_rate': 0.1555059310430146, 'embed_dim': 256, 'learning_rate': 5.776228143403907e-05, 'optimizer': 'AdamW', 'weight_decay': 0.00042715611858770887, 'batch_size': 32, 'num_heads': 2, 'num_transformer_blocks': 4}. Best is trial 49 with value: 0.532532429992528.
Hyperparameters: num_heads=2, num_transformer_blocks=4, learning_rate=4.984139627050361e-05, optimizer=AdamW, weight_decay=0.00013538149893196035, batch_size=32,factor=1
Divergence detected. Stopping training after 10 epochs.
Early stopping at epoch 18
Trial 54, Fold 2: Test Accuracy = 0.5353
Trial 55, Fold 1: Test Accuracy = 0.5728
Divergence detected. Stopping training after 10 epochs.
Early stopping at epoch 19
Trial 54, Fold 3: Test Accuracy = 0.4711
Divergence detected. Stopping training after 10 epochs.
Early stopping at epoch 29
Trial 55, Fold 2: Test Accuracy = 0.5792
Divergence detected. Stopping training after 10 epochs.
Early stopping at epoch 25
Trial 54, Fold 4: Test Accuracy = 0.5056
Divergence detected. Stopping training after 10 epochs.
Early stopping at epoch 21
Trial 55, Fold 3: Test Accuracy = 0.4214
Trial 54, Fold 5: Test Accuracy = 0.5585
Trial 54: Mean Accuracy = 0.5191, Fold Accuracies = [np.float64(0.5248321627034499), np.float64(0.5352760212837845), np.float64(0.4711235964872569), np.float64(0.5056005868621115), np.float64(0.5585109968267863)]
[I 2025-04-23 13:10:28,338] Trial 54 finished with value: 0.5190686728326778 and parameters: {'ff_dim': 2048, 'dropout_rate': 0.14590844852471602, 'embed_dim': 256, 'learning_rate': 6.216415270059321e-05, 'optimizer': 'AdamW', 'weight_decay': 0.00030801726703133737, 'batch_size': 32, 'num_heads': 2, 'num_transformer_blocks': 4}. Best is trial 49 with value: 0.532532429992528.
Hyperparameters: num_heads=2, num_transformer_blocks=4, learning_rate=5.5300653512197166e-05, optimizer=AdamW, weight_decay=0.0002095548991227728, batch_size=32,factor=1
Divergence detected. Stopping training after 10 epochs.
Early stopping at epoch 18
Trial 55, Fold 4: Test Accuracy = 0.5034
Divergence detected. Stopping training after 10 epochs.
Early stopping at epoch 15
Trial 56, Fold 1: Test Accuracy = 0.3814
Divergence detected. Stopping training after 10 epochs.
Early stopping at epoch 23
Divergence detected. Stopping training after 10 epochs.
Early stopping at epoch 16
Trial 55, Fold 5: Test Accuracy = 0.5204
Trial 55: Mean Accuracy = 0.5194, Fold Accuracies = [np.float64(0.5727962539843728), np.float64(0.5792280880171309), np.float64(0.42136540137069095), np.float64(0.5034265312584397), np.float64(0.5204064631433053)]
[I 2025-04-23 13:12:53,611] Trial 55 finished with value: 0.519444547554788 and parameters: {'ff_dim': 2048, 'dropout_rate': 0.14897672619109176, 'embed_dim': 256, 'learning_rate': 4.984139627050361e-05, 'optimizer': 'AdamW', 'weight_decay': 0.00013538149893196035, 'batch_size': 32, 'num_heads': 2, 'num_transformer_blocks': 4}. Best is trial 49 with value: 0.532532429992528.
Hyperparameters: num_heads=2, num_transformer_blocks=4, learning_rate=5.44296497456728e-05, optimizer=AdamW, weight_decay=0.00022029446878958327, batch_size=32,factor=1
Trial 56, Fold 2: Test Accuracy = 0.5516
Divergence detected. Stopping training after 10 epochs.
Early stopping at epoch 18
Trial 56, Fold 3: Test Accuracy = 0.4850
Divergence detected. Stopping training after 10 epochs.
Early stopping at epoch 21
Trial 57, Fold 1: Test Accuracy = 0.4779
Divergence detected. Stopping training after 10 epochs.
Early stopping at epoch 12
Trial 56, Fold 4: Test Accuracy = 0.4353
Divergence detected. Stopping training after 10 epochs.
Early stopping at epoch 18
Trial 57, Fold 2: Test Accuracy = 0.4459
Divergence detected. Stopping training after 10 epochs.
Early stopping at epoch 22
Trial 56, Fold 5: Test Accuracy = 0.5287
Trial 56: Mean Accuracy = 0.4764, Fold Accuracies = [np.float64(0.3814081408140814), np.float64(0.5515735864698498), np.float64(0.48502210223976955), np.float64(0.4353297277245396), np.float64(0.5287318087318087)]
[I 2025-04-23 13:16:54,345] Trial 56 finished with value: 0.4764130731960098 and parameters: {'ff_dim': 2048, 'dropout_rate': 0.415483077676429, 'embed_dim': 64, 'learning_rate': 5.5300653512197166e-05, 'optimizer': 'AdamW', 'weight_decay': 0.0002095548991227728, 'batch_size': 32, 'num_heads': 2, 'num_transformer_blocks': 4}. Best is trial 49 with value: 0.532532429992528.
Hyperparameters: num_heads=2, num_transformer_blocks=4, learning_rate=3.346768871835303e-05, optimizer=AdamW, weight_decay=0.0002484036843579792, batch_size=32,factor=1
Divergence detected. Stopping training after 10 epochs.
Early stopping at epoch 16
Trial 57, Fold 3: Test Accuracy = 0.4390
Divergence detected. Stopping training after 10 epochs.
Early stopping at epoch 19
Trial 57, Fold 4: Test Accuracy = 0.4393
Trial 58, Fold 1: Test Accuracy = 0.5033
Divergence detected. Stopping training after 10 epochs.
Early stopping at epoch 13
Trial 57, Fold 5: Test Accuracy = 0.4631
Trial 57: Mean Accuracy = 0.4530, Fold Accuracies = [np.float64(0.47790682914445287), np.float64(0.4459327794223931), np.float64(0.4389901141554143), np.float64(0.4393122142132075), np.float64(0.4630656891709523)]
[I 2025-04-23 13:21:09,016] Trial 57 finished with value: 0.45304152522128405 and parameters: {'ff_dim': 2048, 'dropout_rate': 0.14855367753758741, 'embed_dim': 64, 'learning_rate': 5.44296497456728e-05, 'optimizer': 'AdamW', 'weight_decay': 0.00022029446878958327, 'batch_size': 32, 'num_heads': 2, 'num_transformer_blocks': 4}. Best is trial 49 with value: 0.532532429992528.
Hyperparameters: num_heads=2, num_transformer_blocks=4, learning_rate=7.284526993920349e-06, optimizer=AdamW, weight_decay=0.00011039485055506353, batch_size=32,factor=1
Divergence detected. Stopping training after 10 epochs.
Early stopping at epoch 18
Trial 58, Fold 2: Test Accuracy = 0.5753
Trial 59, Fold 1: Test Accuracy = 0.4301
Divergence detected. Stopping training after 10 epochs.
Early stopping at epoch 17
Trial 58, Fold 3: Test Accuracy = 0.4816
Divergence detected. Stopping training after 10 epochs.
Early stopping at epoch 17
Trial 59, Fold 2: Test Accuracy = 0.4682
Trial 58, Fold 4: Test Accuracy = 0.4877
Divergence detected. Stopping training after 10 epochs.
Early stopping at epoch 27
Trial 59, Fold 3: Test Accuracy = 0.3960
Divergence detected. Stopping training after 10 epochs.
Early stopping at epoch 18
Trial 58, Fold 5: Test Accuracy = 0.4978
Trial 58: Mean Accuracy = 0.5092, Fold Accuracies = [np.float64(0.5033017404304533), np.float64(0.5753052747402738), np.float64(0.48164321422718676), np.float64(0.4877069965573653), np.float64(0.49784498668709193)]
[I 2025-04-23 13:30:28,775] Trial 58 finished with value: 0.5091604425284741 and parameters: {'ff_dim': 2048, 'dropout_rate': 0.31724538291279003, 'embed_dim': 2048, 'learning_rate': 3.346768871835303e-05, 'optimizer': 'AdamW', 'weight_decay': 0.0002484036843579792, 'batch_size': 32, 'num_heads': 2, 'num_transformer_blocks': 4}. Best is trial 49 with value: 0.532532429992528.
Hyperparameters: num_heads=2, num_transformer_blocks=4, learning_rate=6.549463381615125e-06, optimizer=AdamW, weight_decay=0.00044488207558891416, batch_size=32,factor=1
Divergence detected. Stopping training after 10 epochs.
Early stopping at epoch 23
Trial 59, Fold 4: Test Accuracy = 0.5146
Trial 60, Fold 1: Test Accuracy = 0.4500
Divergence detected. Stopping training after 10 epochs.
Early stopping at epoch 14
Trial 60, Fold 2: Test Accuracy = 0.5171
Divergence detected. Stopping training after 10 epochs.
Early stopping at epoch 27
Trial 59, Fold 5: Test Accuracy = 0.5195
Trial 59: Mean Accuracy = 0.4657, Fold Accuracies = [np.float64(0.4300901243970552), np.float64(0.46817396506702647), np.float64(0.3959972932466982), np.float64(0.5146036468955755), np.float64(0.5195156289893131)]
[I 2025-04-23 13:34:10,597] Trial 59 finished with value: 0.4656761317191337 and parameters: {'ff_dim': 2048, 'dropout_rate': 0.19399877053790793, 'embed_dim': 32, 'learning_rate': 7.284526993920349e-06, 'optimizer': 'AdamW', 'weight_decay': 0.00011039485055506353, 'batch_size': 32, 'num_heads': 2, 'num_transformer_blocks': 4}. Best is trial 49 with value: 0.532532429992528.
Hyperparameters: num_heads=2, num_transformer_blocks=4, learning_rate=0.0001602083486791871, optimizer=Adam, weight_decay=0.0004397531417914412, batch_size=32,factor=1
Divergence detected. Stopping training after 10 epochs.
Early stopping at epoch 10
Trial 61, Fold 1: Test Accuracy = 0.4108
Divergence detected. Stopping training after 10 epochs.
Early stopping at epoch 28
Trial 60, Fold 3: Test Accuracy = 0.3486
Divergence detected. Stopping training after 10 epochs.
Early stopping at epoch 22
Trial 60, Fold 4: Test Accuracy = 0.5075
Divergence detected. Stopping training after 10 epochs.
Early stopping at epoch 28
Trial 61, Fold 2: Test Accuracy = 0.5861
Divergence detected. Stopping training after 10 epochs.
Early stopping at epoch 12
Trial 60, Fold 5: Test Accuracy = 0.4057
Trial 60: Mean Accuracy = 0.4458, Fold Accuracies = [np.float64(0.45001551437195), np.float64(0.5170951896677877), np.float64(0.34860528341089037), np.float64(0.5075067052216914), np.float64(0.4057079913922019)]
[I 2025-04-23 13:38:14,610] Trial 60 finished with value: 0.4457861368129043 and parameters: {'ff_dim': 2048, 'dropout_rate': 0.19289272317129424, 'embed_dim': 32, 'learning_rate': 6.549463381615125e-06, 'optimizer': 'AdamW', 'weight_decay': 0.00044488207558891416, 'batch_size': 32, 'num_heads': 2, 'num_transformer_blocks': 4}. Best is trial 49 with value: 0.532532429992528.
Hyperparameters: num_heads=2, num_transformer_blocks=4, learning_rate=0.00014822696419469476, optimizer=AdamW, weight_decay=0.00033085915094848437, batch_size=32,factor=1
Divergence detected. Stopping training after 10 epochs.
Early stopping at epoch 26
Trial 61, Fold 3: Test Accuracy = 0.4767
Trial 62, Fold 1: Test Accuracy = 0.5354
Divergence detected. Stopping training after 10 epochs.
Early stopping at epoch 21
Trial 61, Fold 4: Test Accuracy = 0.4964
Divergence detected. Stopping training after 10 epochs.
Early stopping at epoch 20
Trial 62, Fold 2: Test Accuracy = 0.5232
Divergence detected. Stopping training after 10 epochs.
Early stopping at epoch 20
Trial 61, Fold 5: Test Accuracy = 0.3333
Trial 61: Mean Accuracy = 0.4607, Fold Accuracies = [np.float64(0.41076274294096077), np.float64(0.5860545005403737), np.float64(0.47670982275584234), np.float64(0.4964103005863965), np.float64(0.3333333333333333)]
[I 2025-04-23 13:42:49,983] Trial 61 finished with value: 0.46065414003138133 and parameters: {'ff_dim': 2048, 'dropout_rate': 0.1253409390272827, 'embed_dim': 512, 'learning_rate': 0.0001602083486791871, 'optimizer': 'Adam', 'weight_decay': 0.0004397531417914412, 'batch_size': 32, 'num_heads': 2, 'num_transformer_blocks': 4}. Best is trial 49 with value: 0.532532429992528.
Hyperparameters: num_heads=2, num_transformer_blocks=4, learning_rate=5.588301207937919e-07, optimizer=AdamW, weight_decay=0.0009948105193387717, batch_size=32,factor=1
Divergence detected. Stopping training after 10 epochs.
Early stopping at epoch 20
Trial 62, Fold 3: Test Accuracy = 0.4596
Divergence detected. Stopping training after 10 epochs.
Early stopping at epoch 13
Trial 63, Fold 1: Test Accuracy = 0.4004
Divergence detected. Stopping training after 10 epochs.
Early stopping at epoch 23
Trial 63, Fold 2: Test Accuracy = 0.5233
Trial 62, Fold 4: Test Accuracy = 0.5182
Divergence detected. Stopping training after 10 epochs.
Early stopping at epoch 19
Trial 62, Fold 5: Test Accuracy = 0.4815
Trial 62: Mean Accuracy = 0.5036, Fold Accuracies = [np.float64(0.5353777044371104), np.float64(0.5231887274480717), np.float64(0.45963352932408735), np.float64(0.5182457308536429), np.float64(0.4814554473501842)]
[I 2025-04-23 13:47:32,276] Trial 62 finished with value: 0.5035802278826192 and parameters: {'ff_dim': 2048, 'dropout_rate': 0.12163147008638478, 'embed_dim': 256, 'learning_rate': 0.00014822696419469476, 'optimizer': 'AdamW', 'weight_decay': 0.00033085915094848437, 'batch_size': 32, 'num_heads': 2, 'num_transformer_blocks': 4}. Best is trial 49 with value: 0.532532429992528.
Hyperparameters: num_heads=2, num_transformer_blocks=4, learning_rate=6.774067501450027e-05, optimizer=AdamW, weight_decay=0.0009321206727785573, batch_size=32,factor=1
Trial 63, Fold 3: Test Accuracy = 0.4160
Divergence detected. Stopping training after 10 epochs.
Early stopping at epoch 23
Trial 64, Fold 1: Test Accuracy = 0.5087
Divergence detected. Stopping training after 10 epochs.
Early stopping at epoch 21
Trial 63, Fold 4: Test Accuracy = 0.5032
Trial 64, Fold 2: Test Accuracy = 0.5651
Trial 63, Fold 5: Test Accuracy = 0.4621
Trial 63: Mean Accuracy = 0.4610, Fold Accuracies = [np.float64(0.4003518941637753), np.float64(0.5233085773964955), np.float64(0.41602049020721327), np.float64(0.503215149920686), np.float64(0.46214013203486887)]
