[I 2025-04-23 09:16:31,872] Trial 15 finished with value: 0.36335835309033093 and parameters: {'ff_dim': 256, 'dropout_rate': 0.35592725471147957, 'embed_dim': 32, 'learning_rate': 1.7759407652033478e-06, 'optimizer': 'Adam', 'weight_decay': 4.433452227775363e-05, 'batch_size': 16, 'num_heads': 4, 'num_transformer_blocks': 8}. Best is trial 3 with value: 0.5001062718954308.
Trial 16, Fold 1: Test Accuracy = 0.3333
Hyperparameters: num_heads=16, num_transformer_blocks=16, learning_rate=0.003416795230508094, optimizer=Adam, weight_decay=3.6556182140626694e-06, batch_size=32,factor=1
Divergence detected. Stopping training after 10 epochs.
Early stopping at epoch 13
Trial 16, Fold 2: Test Accuracy = 0.3333
Divergence detected. Stopping training after 10 epochs.
Early stopping at epoch 16
Trial 17, Fold 1: Test Accuracy = 0.3333
Divergence detected. Stopping training after 10 epochs.
Early stopping at epoch 18
Trial 16, Fold 3: Test Accuracy = 0.3333
Divergence detected. Stopping training after 10 epochs.
Early stopping at epoch 18
Trial 17, Fold 2: Test Accuracy = 0.3333
Divergence detected. Stopping training after 10 epochs.
Early stopping at epoch 10
Trial 16, Fold 4: Test Accuracy = 0.3333
Divergence detected. Stopping training after 10 epochs.
Early stopping at epoch 10
Trial 17, Fold 3: Test Accuracy = 0.3333
Divergence detected. Stopping training after 10 epochs.
Early stopping at epoch 11
Trial 16, Fold 5: Test Accuracy = 0.3333
Trial 16: Mean Accuracy = 0.3333, Fold Accuracies = [np.float64(0.3333333333333333), np.float64(0.3333333333333333), np.float64(0.3333333333333333), np.float64(0.3333333333333333), np.float64(0.3333333333333333)]
[I 2025-04-23 09:36:34,203] Trial 16 finished with value: 0.3333333333333333 and parameters: {'ff_dim': 256, 'dropout_rate': 0.33438422206213847, 'embed_dim': 32, 'learning_rate': 0.001118689340029803, 'optimizer': 'Adam', 'weight_decay': 6.842648098346012e-05, 'batch_size': 16, 'num_heads': 16, 'num_transformer_blocks': 16}. Best is trial 3 with value: 0.5001062718954308.
Hyperparameters: num_heads=4, num_transformer_blocks=2, learning_rate=0.01352236215570645, optimizer=Adam, weight_decay=4.371624333643005e-06, batch_size=32,factor=1
Divergence detected. Stopping training after 10 epochs.
Early stopping at epoch 12
Trial 18, Fold 1: Test Accuracy = 0.3333
Divergence detected. Stopping training after 10 epochs.
Early stopping at epoch 15
Trial 18, Fold 2: Test Accuracy = 0.3333
Divergence detected. Stopping training after 10 epochs.
Early stopping at epoch 19
Trial 17, Fold 4: Test Accuracy = 0.3333
Divergence detected. Stopping training after 10 epochs.
Early stopping at epoch 12
Trial 18, Fold 3: Test Accuracy = 0.3333
Divergence detected. Stopping training after 10 epochs.
Early stopping at epoch 14
Trial 17, Fold 5: Test Accuracy = 0.3333
Trial 17: Mean Accuracy = 0.3333, Fold Accuracies = [np.float64(0.3333333333333333), np.float64(0.3333333333333333), np.float64(0.3333333333333333), np.float64(0.3333333333333333), np.float64(0.3333333333333333)]
[I 2025-04-23 10:11:42,124] Trial 17 finished with value: 0.3333333333333333 and parameters: {'ff_dim': 64, 'dropout_rate': 0.17858075802662535, 'embed_dim': 2048, 'learning_rate': 0.003416795230508094, 'optimizer': 'Adam', 'weight_decay': 3.6556182140626694e-06, 'batch_size': 32, 'num_heads': 16, 'num_transformer_blocks': 16}. Best is trial 3 with value: 0.5001062718954308.
Hyperparameters: num_heads=4, num_transformer_blocks=2, learning_rate=7.675351118570675e-05, optimizer=AdamW, weight_decay=1.0343836322071669e-05, batch_size=10,factor=1
Divergence detected. Stopping training after 10 epochs.
Early stopping at epoch 17
Trial 18, Fold 4: Test Accuracy = 0.3333
Divergence detected. Stopping training after 10 epochs.
Early stopping at epoch 17
Trial 19, Fold 1: Test Accuracy = 0.5342
Divergence detected. Stopping training after 10 epochs.
Early stopping at epoch 21
Trial 18, Fold 5: Test Accuracy = 0.3333
Trial 18: Mean Accuracy = 0.3333, Fold Accuracies = [np.float64(0.3333333333333333), np.float64(0.3333333333333333), np.float64(0.3333333333333333), np.float64(0.3333333333333333), np.float64(0.3333333333333333)]
[I 2025-04-23 10:14:37,901] Trial 18 finished with value: 0.3333333333333333 and parameters: {'ff_dim': 64, 'dropout_rate': 0.2011266562961302, 'embed_dim': 2048, 'learning_rate': 0.01352236215570645, 'optimizer': 'Adam', 'weight_decay': 4.371624333643005e-06, 'batch_size': 32, 'num_heads': 4, 'num_transformer_blocks': 2}. Best is trial 3 with value: 0.5001062718954308.
Hyperparameters: num_heads=1, num_transformer_blocks=8, learning_rate=7.305988293715165e-05, optimizer=AdamW, weight_decay=1.2670346946266844e-05, batch_size=10,factor=1
Divergence detected. Stopping training after 10 epochs.
Early stopping at epoch 14
Trial 19, Fold 2: Test Accuracy = 0.4639
Divergence detected. Stopping training after 10 epochs.
Early stopping at epoch 16
Trial 20, Fold 1: Test Accuracy = 0.4560
Trial 19, Fold 3: Test Accuracy = 0.4800
Divergence detected. Stopping training after 10 epochs.
Early stopping at epoch 19
Trial 20, Fold 2: Test Accuracy = 0.4836
Divergence detected. Stopping training after 10 epochs.
Early stopping at epoch 17
Trial 19, Fold 4: Test Accuracy = 0.5262
Divergence detected. Stopping training after 10 epochs.
Early stopping at epoch 17
Trial 19, Fold 5: Test Accuracy = 0.5542
Trial 19: Mean Accuracy = 0.5117, Fold Accuracies = [np.float64(0.5341563002454092), np.float64(0.46388873505581624), np.float64(0.48003454393298345), np.float64(0.5262401943893437), np.float64(0.5542275230696283)]
[I 2025-04-23 10:20:36,782] Trial 19 finished with value: 0.5117094593386362 and parameters: {'ff_dim': 1024, 'dropout_rate': 0.21212374307436915, 'embed_dim': 256, 'learning_rate': 7.675351118570675e-05, 'optimizer': 'AdamW', 'weight_decay': 1.0343836322071669e-05, 'batch_size': 10, 'num_heads': 4, 'num_transformer_blocks': 2}. Best is trial 19 with value: 0.5117094593386362.
Hyperparameters: num_heads=1, num_transformer_blocks=2, learning_rate=0.00014226499442852582, optimizer=AdamW, weight_decay=9.760742761225985e-06, batch_size=10,factor=1
Divergence detected. Stopping training after 10 epochs.
Early stopping at epoch 19
Trial 20, Fold 3: Test Accuracy = 0.4456
Divergence detected. Stopping training after 10 epochs.
Early stopping at epoch 22
Trial 21, Fold 1: Test Accuracy = 0.4948
Divergence detected. Stopping training after 10 epochs.
Early stopping at epoch 15
Trial 20, Fold 4: Test Accuracy = 0.4888
Divergence detected. Stopping training after 10 epochs.
Early stopping at epoch 15
Trial 21, Fold 2: Test Accuracy = 0.5645
Divergence detected. Stopping training after 10 epochs.
Early stopping at epoch 20
Trial 20, Fold 5: Test Accuracy = 0.5396
Trial 20: Mean Accuracy = 0.4827, Fold Accuracies = [np.float64(0.456045668669431), np.float64(0.48362467918811936), np.float64(0.4455968531345416), np.float64(0.4888427710880774), np.float64(0.5396237370974213)]
[I 2025-04-23 10:25:34,370] Trial 20 finished with value: 0.48274674183551813 and parameters: {'ff_dim': 1024, 'dropout_rate': 0.12015192253905788, 'embed_dim': 256, 'learning_rate': 7.305988293715165e-05, 'optimizer': 'AdamW', 'weight_decay': 1.2670346946266844e-05, 'batch_size': 10, 'num_heads': 1, 'num_transformer_blocks': 8}. Best is trial 19 with value: 0.5117094593386362.
Hyperparameters: num_heads=1, num_transformer_blocks=2, learning_rate=9.946806439424143e-05, optimizer=AdamW, weight_decay=1.0791549440935509e-05, batch_size=10,factor=1
Divergence detected. Stopping training after 10 epochs.
Early stopping at epoch 26
Trial 21, Fold 3: Test Accuracy = 0.4465
Divergence detected. Stopping training after 10 epochs.
Early stopping at epoch 22
Trial 22, Fold 1: Test Accuracy = 0.5035
Divergence detected. Stopping training after 10 epochs.
Early stopping at epoch 28
Trial 21, Fold 4: Test Accuracy = 0.4923
Divergence detected. Stopping training after 10 epochs.
Early stopping at epoch 15
Trial 22, Fold 2: Test Accuracy = 0.5558
Divergence detected. Stopping training after 10 epochs.
Early stopping at epoch 13
Trial 21, Fold 5: Test Accuracy = 0.5195
Trial 21: Mean Accuracy = 0.5035, Fold Accuracies = [np.float64(0.4948189049674198), np.float64(0.5645166117342749), np.float64(0.44654866450687664), np.float64(0.4923339099513561), np.float64(0.5194823649560492)]
[I 2025-04-23 10:29:30,208] Trial 21 finished with value: 0.5035400912231953 and parameters: {'ff_dim': 1024, 'dropout_rate': 0.11255061144123749, 'embed_dim': 256, 'learning_rate': 0.00014226499442852582, 'optimizer': 'AdamW', 'weight_decay': 9.760742761225985e-06, 'batch_size': 10, 'num_heads': 1, 'num_transformer_blocks': 2}. Best is trial 19 with value: 0.5117094593386362.
Hyperparameters: num_heads=1, num_transformer_blocks=2, learning_rate=0.00037698625147838044, optimizer=AdamW, weight_decay=8.414266036097707e-06, batch_size=10,factor=1
Divergence detected. Stopping training after 10 epochs.
Early stopping at epoch 20
Trial 22, Fold 3: Test Accuracy = 0.4976
Divergence detected. Stopping training after 10 epochs.
Early stopping at epoch 14
Trial 23, Fold 1: Test Accuracy = 0.4827
Divergence detected. Stopping training after 10 epochs.
Early stopping at epoch 18
Trial 22, Fold 4: Test Accuracy = 0.5120
Divergence detected. Stopping training after 10 epochs.
Early stopping at epoch 16
Trial 23, Fold 2: Test Accuracy = 0.5719
Divergence detected. Stopping training after 10 epochs.
Early stopping at epoch 22
Trial 23, Fold 3: Test Accuracy = 0.4882
Divergence detected. Stopping training after 10 epochs.
Early stopping at epoch 28
Trial 22, Fold 5: Test Accuracy = 0.5075
Trial 22: Mean Accuracy = 0.5153, Fold Accuracies = [np.float64(0.5035337508109786), np.float64(0.5558221762401182), np.float64(0.4975573034023179), np.float64(0.5119641449134995), np.float64(0.5075286136338768)]
[I 2025-04-23 10:34:25,619] Trial 22 finished with value: 0.5152811978001581 and parameters: {'ff_dim': 1024, 'dropout_rate': 0.10252880813301629, 'embed_dim': 256, 'learning_rate': 9.946806439424143e-05, 'optimizer': 'AdamW', 'weight_decay': 1.0791549440935509e-05, 'batch_size': 10, 'num_heads': 1, 'num_transformer_blocks': 2}. Best is trial 22 with value: 0.5152811978001581.
Hyperparameters: num_heads=1, num_transformer_blocks=2, learning_rate=0.0003604553830162405, optimizer=AdamW, weight_decay=1.9576117683951112e-06, batch_size=10,factor=1
Divergence detected. Stopping training after 10 epochs.
Early stopping at epoch 22
Trial 23, Fold 4: Test Accuracy = 0.4987
Divergence detected. Stopping training after 10 epochs.
Early stopping at epoch 21
Trial 24, Fold 1: Test Accuracy = 0.3333
Divergence detected. Stopping training after 10 epochs.
Early stopping at epoch 21
Trial 24, Fold 2: Test Accuracy = 0.5382
Trial 23, Fold 5: Test Accuracy = 0.5182
Trial 23: Mean Accuracy = 0.5119, Fold Accuracies = [np.float64(0.48274167160305775), np.float64(0.571929897429701), np.float64(0.4881617931075746), np.float64(0.4986777752943623), np.float64(0.518194404931247)]
[I 2025-04-23 10:38:35,935] Trial 23 finished with value: 0.5119411084731885 and parameters: {'ff_dim': 1024, 'dropout_rate': 0.15776799792753643, 'embed_dim': 256, 'learning_rate': 0.00037698625147838044, 'optimizer': 'AdamW', 'weight_decay': 8.414266036097707e-06, 'batch_size': 10, 'num_heads': 1, 'num_transformer_blocks': 2}. Best is trial 22 with value: 0.5152811978001581.
Hyperparameters: num_heads=1, num_transformer_blocks=2, learning_rate=0.0004935659486585016, optimizer=AdamW, weight_decay=2.3518747628942767e-06, batch_size=10,factor=1
Divergence detected. Stopping training after 10 epochs.
Early stopping at epoch 18
Trial 24, Fold 3: Test Accuracy = 0.4735
Divergence detected. Stopping training after 10 epochs.
Early stopping at epoch 14
Trial 25, Fold 1: Test Accuracy = 0.4482
Divergence detected. Stopping training after 10 epochs.
Early stopping at epoch 13
Trial 25, Fold 2: Test Accuracy = 0.5675
Divergence detected. Stopping training after 10 epochs.
Early stopping at epoch 20
Trial 24, Fold 4: Test Accuracy = 0.4412
Divergence detected. Stopping training after 10 epochs.
Early stopping at epoch 16
Trial 25, Fold 3: Test Accuracy = 0.4490
Divergence detected. Stopping training after 10 epochs.
Early stopping at epoch 26
Trial 24, Fold 5: Test Accuracy = 0.4853
Trial 24: Mean Accuracy = 0.4543, Fold Accuracies = [np.float64(0.3333333333333333), np.float64(0.5382410838351088), np.float64(0.4734508112979417), np.float64(0.4411670151208958), np.float64(0.4853295400663822)]
[I 2025-04-23 10:43:35,634] Trial 24 finished with value: 0.4543043567307324 and parameters: {'ff_dim': 1024, 'dropout_rate': 0.10245233086774186, 'embed_dim': 256, 'learning_rate': 0.0003604553830162405, 'optimizer': 'AdamW', 'weight_decay': 1.9576117683951112e-06, 'batch_size': 10, 'num_heads': 1, 'num_transformer_blocks': 2}. Best is trial 22 with value: 0.5152811978001581.
Hyperparameters: num_heads=1, num_transformer_blocks=2, learning_rate=0.0006629806680061919, optimizer=AdamW, weight_decay=6.144113293590712e-06, batch_size=10,factor=1
Divergence detected. Stopping training after 10 epochs.
Early stopping at epoch 19
Trial 25, Fold 4: Test Accuracy = 0.3647
Divergence detected. Stopping training after 10 epochs.
Early stopping at epoch 18
Trial 26, Fold 1: Test Accuracy = 0.3325
Divergence detected. Stopping training after 10 epochs.
Early stopping at epoch 12
Trial 26, Fold 2: Test Accuracy = 0.3333
Trial 25, Fold 5: Test Accuracy = 0.3333
Trial 25: Mean Accuracy = 0.4325, Fold Accuracies = [np.float64(0.44818199768694816), np.float64(0.5674560121321152), np.float64(0.4489520464659316), np.float64(0.36467558833663943), np.float64(0.3333333333333333)]
[I 2025-04-23 10:46:34,522] Trial 25 finished with value: 0.4325197955909935 and parameters: {'ff_dim': 1024, 'dropout_rate': 0.15842152303974752, 'embed_dim': 256, 'learning_rate': 0.0004935659486585016, 'optimizer': 'AdamW', 'weight_decay': 2.3518747628942767e-06, 'batch_size': 10, 'num_heads': 1, 'num_transformer_blocks': 2}. Best is trial 22 with value: 0.5152811978001581.
Hyperparameters: num_heads=1, num_transformer_blocks=2, learning_rate=0.012536172710404083, optimizer=AdamW, weight_decay=4.553472968901147e-06, batch_size=10,factor=1
Divergence detected. Stopping training after 10 epochs.
Early stopping at epoch 18
Trial 26, Fold 3: Test Accuracy = 0.4821
Divergence detected. Stopping training after 10 epochs.
Early stopping at epoch 19
Trial 27, Fold 1: Test Accuracy = 0.3333
Divergence detected. Stopping training after 10 epochs.
Early stopping at epoch 11
Trial 26, Fold 4: Test Accuracy = 0.3333
Divergence detected. Stopping training after 10 epochs.
Early stopping at epoch 19
Trial 26, Fold 5: Test Accuracy = 0.3333
Trial 26: Mean Accuracy = 0.3629, Fold Accuracies = [np.float64(0.3325082508250825), np.float64(0.3333333333333333), np.float64(0.4821227469204195), np.float64(0.3333333333333333), np.float64(0.3333333333333333)]
Divergence detected. Stopping training after 10 epochs.
Early stopping at epoch 26
[I 2025-04-23 10:50:29,321] Trial 26 finished with value: 0.3629261995491003 and parameters: {'ff_dim': 1024, 'dropout_rate': 0.15597417735827646, 'embed_dim': 256, 'learning_rate': 0.0006629806680061919, 'optimizer': 'AdamW', 'weight_decay': 6.144113293590712e-06, 'batch_size': 10, 'num_heads': 1, 'num_transformer_blocks': 2}. Best is trial 22 with value: 0.5152811978001581.
Hyperparameters: num_heads=1, num_transformer_blocks=2, learning_rate=0.009605817865134158, optimizer=AdamW, weight_decay=1.4095975240028338e-05, batch_size=10,factor=1
Trial 27, Fold 2: Test Accuracy = 0.3333
Divergence detected. Stopping training after 10 epochs.
Early stopping at epoch 19
Trial 28, Fold 1: Test Accuracy = 0.3333
Divergence detected. Stopping training after 10 epochs.
Early stopping at epoch 21
Trial 27, Fold 3: Test Accuracy = 0.3333
Divergence detected. Stopping training after 10 epochs.
Early stopping at epoch 19
Trial 28, Fold 2: Test Accuracy = 0.3333
Divergence detected. Stopping training after 10 epochs.
Early stopping at epoch 25
Trial 27, Fold 4: Test Accuracy = 0.3333
Trial 28, Fold 3: Test Accuracy = 0.3333
Divergence detected. Stopping training after 10 epochs.
Early stopping at epoch 21
Trial 27, Fold 5: Test Accuracy = 0.3333
Trial 27: Mean Accuracy = 0.3333, Fold Accuracies = [np.float64(0.3333333333333333), np.float64(0.3333333333333333), np.float64(0.3333333333333333), np.float64(0.3333333333333333), np.float64(0.3333333333333333)]
[I 2025-04-23 10:56:16,331] Trial 27 finished with value: 0.3333333333333333 and parameters: {'ff_dim': 1024, 'dropout_rate': 0.2151047941481461, 'embed_dim': 256, 'learning_rate': 0.012536172710404083, 'optimizer': 'AdamW', 'weight_decay': 4.553472968901147e-06, 'batch_size': 10, 'num_heads': 1, 'num_transformer_blocks': 2}. Best is trial 22 with value: 0.5152811978001581.
Hyperparameters: num_heads=2, num_transformer_blocks=2, learning_rate=6.085527027438838e-06, optimizer=AdamW, weight_decay=1.1149037376408378e-05, batch_size=10,factor=1
Divergence detected. Stopping training after 10 epochs.
Early stopping at epoch 13
Trial 29, Fold 1: Test Accuracy = 0.4390
Divergence detected. Stopping training after 10 epochs.
Early stopping at epoch 19
Trial 28, Fold 4: Test Accuracy = 0.3364
Divergence detected. Stopping training after 10 epochs.
Early stopping at epoch 10
Trial 28, Fold 5: Test Accuracy = 0.3333
Trial 28: Mean Accuracy = 0.3340, Fold Accuracies = [np.float64(0.3333333333333333), np.float64(0.3333333333333333), np.float64(0.3333333333333333), np.float64(0.33641975308641975), np.float64(0.3333333333333333)]
[I 2025-04-23 10:59:36,861] Trial 28 finished with value: 0.3339506172839506 and parameters: {'ff_dim': 1024, 'dropout_rate': 0.21838487274826512, 'embed_dim': 256, 'learning_rate': 0.009605817865134158, 'optimizer': 'AdamW', 'weight_decay': 1.4095975240028338e-05, 'batch_size': 10, 'num_heads': 1, 'num_transformer_blocks': 2}. Best is trial 22 with value: 0.5152811978001581.
Hyperparameters: num_heads=2, num_transformer_blocks=4, learning_rate=2.1376740062637037e-05, optimizer=AdamW, weight_decay=7.543842998472109e-05, batch_size=10,factor=1
Divergence detected. Stopping training after 10 epochs.
Early stopping at epoch 18
Trial 29, Fold 2: Test Accuracy = 0.5310
Divergence detected. Stopping training after 10 epochs.
Early stopping at epoch 14
Trial 29, Fold 3: Test Accuracy = 0.4550
Divergence detected. Stopping training after 10 epochs.
Early stopping at epoch 19
Trial 30, Fold 1: Test Accuracy = 0.4680
Divergence detected. Stopping training after 10 epochs.
Early stopping at epoch 12
Trial 30, Fold 2: Test Accuracy = 0.5190
Divergence detected. Stopping training after 10 epochs.
Early stopping at epoch 18
Trial 29, Fold 4: Test Accuracy = 0.5396
Divergence detected. Stopping training after 10 epochs.
Early stopping at epoch 11
Trial 29, Fold 5: Test Accuracy = 0.4277
Trial 29: Mean Accuracy = 0.4784, Fold Accuracies = [np.float64(0.438991847902739), np.float64(0.5309582765549447), np.float64(0.4550400175367115), np.float64(0.5395758442836434), np.float64(0.42766371229529127)]
[I 2025-04-23 11:07:26,573] Trial 29 finished with value: 0.478445939714666 and parameters: {'ff_dim': 1024, 'dropout_rate': 0.49942545853373055, 'embed_dim': 1024, 'learning_rate': 6.085527027438838e-06, 'optimizer': 'AdamW', 'weight_decay': 1.1149037376408378e-05, 'batch_size': 10, 'num_heads': 2, 'num_transformer_blocks': 2}. Best is trial 22 with value: 0.5152811978001581.
Hyperparameters: num_heads=8, num_transformer_blocks=4, learning_rate=2.9887977710041065e-05, optimizer=AdamW, weight_decay=0.00014958050698253043, batch_size=10,factor=1
Divergence detected. Stopping training after 10 epochs.
Early stopping at epoch 15
Trial 30, Fold 3: Test Accuracy = 0.4542
Divergence detected. Stopping training after 10 epochs.
Early stopping at epoch 15
Trial 31, Fold 1: Test Accuracy = 0.4346
Trial 30, Fold 4: Test Accuracy = 0.5221
Divergence detected. Stopping training after 10 epochs.
Early stopping at epoch 21
Trial 31, Fold 2: Test Accuracy = 0.5660
Divergence detected. Stopping training after 10 epochs.
Early stopping at epoch 17
Trial 30, Fold 5: Test Accuracy = 0.4467
Trial 30: Mean Accuracy = 0.4820, Fold Accuracies = [np.float64(0.467991735070943), np.float64(0.5189879657785744), np.float64(0.4542114449810826), np.float64(0.5220882341984932), np.float64(0.44665105591421383)]
[I 2025-04-23 11:14:21,765] Trial 30 finished with value: 0.48198608718866137 and parameters: {'ff_dim': 1024, 'dropout_rate': 0.26120699590655505, 'embed_dim': 1024, 'learning_rate': 2.1376740062637037e-05, 'optimizer': 'AdamW', 'weight_decay': 7.543842998472109e-05, 'batch_size': 10, 'num_heads': 2, 'num_transformer_blocks': 4}. Best is trial 22 with value: 0.5152811978001581.
Hyperparameters: num_heads=1, num_transformer_blocks=2, learning_rate=8.165372419606142e-05, optimizer=AdamW, weight_decay=7.224607270542794e-06, batch_size=10,factor=1
Divergence detected. Stopping training after 10 epochs.
Early stopping at epoch 15
Trial 31, Fold 3: Test Accuracy = 0.4347
Divergence detected. Stopping training after 10 epochs.
Early stopping at epoch 15
Trial 32, Fold 1: Test Accuracy = 0.4264
Divergence detected. Stopping training after 10 epochs.
Early stopping at epoch 21
Trial 31, Fold 4: Test Accuracy = 0.5288
Divergence detected. Stopping training after 10 epochs.
Early stopping at epoch 22
Trial 32, Fold 2: Test Accuracy = 0.5555
Divergence detected. Stopping training after 10 epochs.
Early stopping at epoch 10
Trial 31, Fold 5: Test Accuracy = 0.4482
Trial 31: Mean Accuracy = 0.4825, Fold Accuracies = [np.float64(0.4346041014357846), np.float64(0.5659815920548295), np.float64(0.43471789695011065), np.float64(0.5287989853695788), np.float64(0.448185286501076)]
