[I 2025-04-23 13:51:43,146] Trial 63 finished with value: 0.4610072487446078 and parameters: {'ff_dim': 2048, 'dropout_rate': 0.14394445711297874, 'embed_dim': 256, 'learning_rate': 5.588301207937919e-07, 'optimizer': 'AdamW', 'weight_decay': 0.0009948105193387717, 'batch_size': 32, 'num_heads': 2, 'num_transformer_blocks': 4}. Best is trial 49 with value: 0.532532429992528.
Hyperparameters: num_heads=2, num_transformer_blocks=4, learning_rate=8.18759527696858e-05, optimizer=AdamW, weight_decay=0.0005504465945118995, batch_size=32,factor=1
Divergence detected. Stopping training after 10 epochs.
Early stopping at epoch 22
Trial 65, Fold 1: Test Accuracy = 0.4446
Trial 64, Fold 3: Test Accuracy = 0.4912
Divergence detected. Stopping training after 10 epochs.
Early stopping at epoch 24
Divergence detected. Stopping training after 10 epochs.
Early stopping at epoch 20
Trial 65, Fold 2: Test Accuracy = 0.5753
Trial 64, Fold 4: Test Accuracy = 0.5221
Divergence detected. Stopping training after 10 epochs.
Early stopping at epoch 24
Trial 65, Fold 3: Test Accuracy = 0.5116
Divergence detected. Stopping training after 10 epochs.
Early stopping at epoch 25
Trial 64, Fold 5: Test Accuracy = 0.4900
Trial 64: Mean Accuracy = 0.5154, Fold Accuracies = [np.float64(0.5087374122027587), np.float64(0.5651036946788301), np.float64(0.49119052932858803), np.float64(0.5220910474425478), np.float64(0.4900092643250538)]
[I 2025-04-23 13:57:07,609] Trial 64 finished with value: 0.5154263895955558 and parameters: {'ff_dim': 64, 'dropout_rate': 0.14370293835011544, 'embed_dim': 256, 'learning_rate': 6.774067501450027e-05, 'optimizer': 'AdamW', 'weight_decay': 0.0009321206727785573, 'batch_size': 32, 'num_heads': 2, 'num_transformer_blocks': 4}. Best is trial 49 with value: 0.532532429992528.
Hyperparameters: num_heads=2, num_transformer_blocks=4, learning_rate=1.4506702888419731e-05, optimizer=AdamW, weight_decay=0.0005823485164852788, batch_size=32,factor=1
Divergence detected. Stopping training after 10 epochs.
Early stopping at epoch 21
Trial 65, Fold 4: Test Accuracy = 0.4993
Divergence detected. Stopping training after 10 epochs.
Early stopping at epoch 26
Trial 66, Fold 1: Test Accuracy = 0.5278
Divergence detected. Stopping training after 10 epochs.
Early stopping at epoch 22
Trial 65, Fold 5: Test Accuracy = 0.5519
Trial 65: Mean Accuracy = 0.5165, Fold Accuracies = [np.float64(0.44456080223406963), np.float64(0.575269823209439), np.float64(0.5116020543156222), np.float64(0.4992815556735178), np.float64(0.551854105117263)]
[I 2025-04-23 14:00:22,355] Trial 65 finished with value: 0.5165136681099823 and parameters: {'ff_dim': 64, 'dropout_rate': 0.15398271751569925, 'embed_dim': 256, 'learning_rate': 8.18759527696858e-05, 'optimizer': 'AdamW', 'weight_decay': 0.0005504465945118995, 'batch_size': 32, 'num_heads': 2, 'num_transformer_blocks': 4}. Best is trial 49 with value: 0.532532429992528.
Hyperparameters: num_heads=2, num_transformer_blocks=4, learning_rate=3.296987679957724e-05, optimizer=AdamW, weight_decay=0.0005645167640848443, batch_size=32,factor=1
Divergence detected. Stopping training after 10 epochs.
Early stopping at epoch 26
Trial 66, Fold 2: Test Accuracy = 0.5146
Divergence detected. Stopping training after 10 epochs.
Early stopping at epoch 26
Trial 67, Fold 1: Test Accuracy = 0.5048
Divergence detected. Stopping training after 10 epochs.
Early stopping at epoch 21
Trial 66, Fold 3: Test Accuracy = 0.4831
Divergence detected. Stopping training after 10 epochs.
Early stopping at epoch 19
Trial 67, Fold 2: Test Accuracy = 0.5596
Divergence detected. Stopping training after 10 epochs.
Early stopping at epoch 23
Trial 66, Fold 4: Test Accuracy = 0.5196
Divergence detected. Stopping training after 10 epochs.
Early stopping at epoch 22
Trial 67, Fold 3: Test Accuracy = 0.4880
Divergence detected. Stopping training after 10 epochs.
Early stopping at epoch 19
Trial 66, Fold 5: Test Accuracy = 0.5068
Trial 66: Mean Accuracy = 0.5104, Fold Accuracies = [np.float64(0.5278123325153028), np.float64(0.5146418318554171), np.float64(0.4830507047645371), np.float64(0.5195628141132499), np.float64(0.5067819236240289)]
[I 2025-04-23 14:06:44,933] Trial 66 finished with value: 0.5103699213745072 and parameters: {'ff_dim': 64, 'dropout_rate': 0.15517323951841316, 'embed_dim': 256, 'learning_rate': 1.4506702888419731e-05, 'optimizer': 'AdamW', 'weight_decay': 0.0005823485164852788, 'batch_size': 32, 'num_heads': 2, 'num_transformer_blocks': 4}. Best is trial 49 with value: 0.532532429992528.
Hyperparameters: num_heads=2, num_transformer_blocks=4, learning_rate=2.6718426817519378e-05, optimizer=AdamW, weight_decay=0.00028781494466060837, batch_size=32,factor=1
Divergence detected. Stopping training after 10 epochs.
Early stopping at epoch 24
Trial 67, Fold 4: Test Accuracy = 0.4185
Divergence detected. Stopping training after 10 epochs.
Early stopping at epoch 28
Trial 68, Fold 1: Test Accuracy = 0.5001
Divergence detected. Stopping training after 10 epochs.
Early stopping at epoch 10
Trial 67, Fold 5: Test Accuracy = 0.4454
Trial 67: Mean Accuracy = 0.4833, Fold Accuracies = [np.float64(0.5047946461312797), np.float64(0.5596428303719069), np.float64(0.4880262171719458), np.float64(0.41845938218832357), np.float64(0.44538556370135324)]
[I 2025-04-23 14:09:36,557] Trial 67 finished with value: 0.4832617279129618 and parameters: {'ff_dim': 64, 'dropout_rate': 0.18329189706393392, 'embed_dim': 1024, 'learning_rate': 3.296987679957724e-05, 'optimizer': 'AdamW', 'weight_decay': 0.0005645167640848443, 'batch_size': 32, 'num_heads': 2, 'num_transformer_blocks': 4}. Best is trial 49 with value: 0.532532429992528.
Hyperparameters: num_heads=16, num_transformer_blocks=8, learning_rate=0.0005824536435413073, optimizer=Adam, weight_decay=0.00028266055994269774, batch_size=32,factor=1
Divergence detected. Stopping training after 10 epochs.
Early stopping at epoch 13
Trial 69, Fold 1: Test Accuracy = 0.3333
Divergence detected. Stopping training after 10 epochs.
Early stopping at epoch 19
Trial 68, Fold 2: Test Accuracy = 0.5834
Divergence detected. Stopping training after 10 epochs.
Early stopping at epoch 13
Trial 69, Fold 2: Test Accuracy = 0.3333
Divergence detected. Stopping training after 10 epochs.
Early stopping at epoch 16
Trial 68, Fold 3: Test Accuracy = 0.4323
Divergence detected. Stopping training after 10 epochs.
Early stopping at epoch 25
Trial 69, Fold 3: Test Accuracy = 0.3678
Divergence detected. Stopping training after 10 epochs.
Early stopping at epoch 25
Trial 68, Fold 4: Test Accuracy = 0.5254
Divergence detected. Stopping training after 10 epochs.
Early stopping at epoch 15
Trial 69, Fold 4: Test Accuracy = 0.3333
Divergence detected. Stopping training after 10 epochs.
Early stopping at epoch 10
Trial 69, Fold 5: Test Accuracy = 0.3333
Trial 69: Mean Accuracy = 0.3402, Fold Accuracies = [np.float64(0.3333333333333333), np.float64(0.3333333333333333), np.float64(0.3678154218751944), np.float64(0.3333333333333333), np.float64(0.3333333333333333)]
[I 2025-04-23 14:16:33,074] Trial 69 finished with value: 0.3402297510417055 and parameters: {'ff_dim': 512, 'dropout_rate': 0.16366288026217837, 'embed_dim': 256, 'learning_rate': 0.0005824536435413073, 'optimizer': 'Adam', 'weight_decay': 0.00028266055994269774, 'batch_size': 32, 'num_heads': 16, 'num_transformer_blocks': 8}. Best is trial 49 with value: 0.532532429992528.
Hyperparameters: num_heads=2, num_transformer_blocks=4, learning_rate=0.00012629178391633105, optimizer=AdamW, weight_decay=0.00015794716482435108, batch_size=32,factor=1
Divergence detected. Stopping training after 10 epochs.
Early stopping at epoch 24
Trial 68, Fold 5: Test Accuracy = 0.5101
Trial 68: Mean Accuracy = 0.5102, Fold Accuracies = [np.float64(0.5000782770584751), np.float64(0.5834405270153251), np.float64(0.432274459066313), np.float64(0.5253806028180557), np.float64(0.5100692271218586)]
[I 2025-04-23 14:16:54,324] Trial 68 finished with value: 0.5102486186160056 and parameters: {'ff_dim': 64, 'dropout_rate': 0.20418441885360075, 'embed_dim': 1024, 'learning_rate': 2.6718426817519378e-05, 'optimizer': 'AdamW', 'weight_decay': 0.00028781494466060837, 'batch_size': 32, 'num_heads': 2, 'num_transformer_blocks': 4}. Best is trial 49 with value: 0.532532429992528.
Hyperparameters: num_heads=2, num_transformer_blocks=1, learning_rate=0.00012147399917568301, optimizer=AdamW, weight_decay=0.00014676515588118956, batch_size=32,factor=1
Divergence detected. Stopping training after 10 epochs.
Early stopping at epoch 15
Trial 70, Fold 1: Test Accuracy = 0.5122
Trial 71, Fold 1: Test Accuracy = 0.4944
Divergence detected. Stopping training after 10 epochs.
Early stopping at epoch 27
Trial 70, Fold 2: Test Accuracy = 0.5411
Divergence detected. Stopping training after 10 epochs.
Early stopping at epoch 27
Trial 71, Fold 2: Test Accuracy = 0.5056
Divergence detected. Stopping training after 10 epochs.
Early stopping at epoch 27
Trial 70, Fold 3: Test Accuracy = 0.4781
Divergence detected. Stopping training after 10 epochs.
Early stopping at epoch 10
Trial 70, Fold 4: Test Accuracy = 0.5117
Divergence detected. Stopping training after 10 epochs.
Early stopping at epoch 23
Trial 71, Fold 3: Test Accuracy = 0.4644
Divergence detected. Stopping training after 10 epochs.
Early stopping at epoch 15
Trial 71, Fold 4: Test Accuracy = 0.4823
Divergence detected. Stopping training after 10 epochs.
Early stopping at epoch 20
Trial 70, Fold 5: Test Accuracy = 0.5106
Trial 70: Mean Accuracy = 0.5108, Fold Accuracies = [np.float64(0.5122323770838623), np.float64(0.5410979038425824), np.float64(0.4781414315664514), np.float64(0.5117229819921337), np.float64(0.5105652697231645)]
[I 2025-04-23 14:24:12,508] Trial 70 finished with value: 0.5107519928416389 and parameters: {'ff_dim': 256, 'dropout_rate': 0.19987676032720608, 'embed_dim': 256, 'learning_rate': 0.00012629178391633105, 'optimizer': 'AdamW', 'weight_decay': 0.00015794716482435108, 'batch_size': 32, 'num_heads': 2, 'num_transformer_blocks': 4}. Best is trial 49 with value: 0.532532429992528.
Hyperparameters: num_heads=2, num_transformer_blocks=4, learning_rate=6.651243311623869e-05, optimizer=AdamW, weight_decay=0.0005758983656646324, batch_size=32,factor=1
Divergence detected. Stopping training after 10 epochs.
Early stopping at epoch 15
Trial 71, Fold 5: Test Accuracy = 0.5027
Trial 71: Mean Accuracy = 0.4899, Fold Accuracies = [np.float64(0.49442893007249444), np.float64(0.5056335768930418), np.float64(0.4643981723061332), np.float64(0.4822802487761419), np.float64(0.5027467629572893)]
[I 2025-04-23 14:25:08,617] Trial 71 finished with value: 0.4898975382010201 and parameters: {'ff_dim': 256, 'dropout_rate': 0.12022093935379985, 'embed_dim': 256, 'learning_rate': 0.00012147399917568301, 'optimizer': 'AdamW', 'weight_decay': 0.00014676515588118956, 'batch_size': 32, 'num_heads': 2, 'num_transformer_blocks': 1}. Best is trial 49 with value: 0.532532429992528.
Hyperparameters: num_heads=2, num_transformer_blocks=4, learning_rate=5.9639203441279376e-05, optimizer=AdamW, weight_decay=0.0007250865757694028, batch_size=32,factor=1
Divergence detected. Stopping training after 10 epochs.
Early stopping at epoch 23
Trial 72, Fold 1: Test Accuracy = 0.5035
Divergence detected. Stopping training after 10 epochs.
Early stopping at epoch 21
Trial 73, Fold 1: Test Accuracy = 0.5355
Divergence detected. Stopping training after 10 epochs.
Early stopping at epoch 26
Trial 72, Fold 2: Test Accuracy = 0.5757
Divergence detected. Stopping training after 10 epochs.
Early stopping at epoch 28
Trial 73, Fold 2: Test Accuracy = 0.5830
Divergence detected. Stopping training after 10 epochs.
Early stopping at epoch 23
Trial 72, Fold 3: Test Accuracy = 0.4626
Divergence detected. Stopping training after 10 epochs.
Early stopping at epoch 11
Trial 73, Fold 3: Test Accuracy = 0.4566
Divergence detected. Stopping training after 10 epochs.
Early stopping at epoch 23
Trial 72, Fold 4: Test Accuracy = 0.5181
Divergence detected. Stopping training after 10 epochs.
Early stopping at epoch 29
Trial 73, Fold 4: Test Accuracy = 0.4953
Divergence detected. Stopping training after 10 epochs.
Early stopping at epoch 22
Trial 72, Fold 5: Test Accuracy = 0.5479
Trial 72: Mean Accuracy = 0.5216, Fold Accuracies = [np.float64(0.5035464443880285), np.float64(0.5757111143555904), np.float64(0.46257556154408835), np.float64(0.5181432899666912), np.float64(0.5478673815515921)]
[I 2025-04-23 14:33:10,094] Trial 72 finished with value: 0.5215687583611982 and parameters: {'ff_dim': 64, 'dropout_rate': 0.14721312685926044, 'embed_dim': 256, 'learning_rate': 6.651243311623869e-05, 'optimizer': 'AdamW', 'weight_decay': 0.0005758983656646324, 'batch_size': 32, 'num_heads': 2, 'num_transformer_blocks': 4}. Best is trial 49 with value: 0.532532429992528.
Hyperparameters: num_heads=2, num_transformer_blocks=4, learning_rate=0.0002201495632861018, optimizer=AdamW, weight_decay=0.0005572679513245397, batch_size=32,factor=1
Divergence detected. Stopping training after 10 epochs.
Early stopping at epoch 20
Trial 73, Fold 5: Test Accuracy = 0.5149
Trial 73: Mean Accuracy = 0.5171, Fold Accuracies = [np.float64(0.5355229753744605), np.float64(0.5830472038181927), np.float64(0.4565861285776652), np.float64(0.49527336195469623), np.float64(0.5148729620308568)]
[I 2025-04-23 14:33:35,368] Trial 73 finished with value: 0.5170605263511743 and parameters: {'ff_dim': 64, 'dropout_rate': 0.14964349691024567, 'embed_dim': 256, 'learning_rate': 5.9639203441279376e-05, 'optimizer': 'AdamW', 'weight_decay': 0.0007250865757694028, 'batch_size': 32, 'num_heads': 2, 'num_transformer_blocks': 4}. Best is trial 49 with value: 0.532532429992528.
Hyperparameters: num_heads=2, num_transformer_blocks=4, learning_rate=0.00022799998691568334, optimizer=AdamW, weight_decay=0.0007857327588024335, batch_size=16,factor=1
Divergence detected. Stopping training after 10 epochs.
Early stopping at epoch 20
Trial 75, Fold 1: Test Accuracy = 0.4776
Trial 74, Fold 1: Test Accuracy = 0.4798
Divergence detected. Stopping training after 10 epochs.
Early stopping at epoch 20
Trial 75, Fold 2: Test Accuracy = 0.4841
Trial 74, Fold 2: Test Accuracy = 0.5324
Divergence detected. Stopping training after 10 epochs.
Early stopping at epoch 22
Trial 75, Fold 3: Test Accuracy = 0.5126
Divergence detected. Stopping training after 10 epochs.
Early stopping at epoch 20
Trial 74, Fold 3: Test Accuracy = 0.4511
Divergence detected. Stopping training after 10 epochs.
Early stopping at epoch 17
Trial 75, Fold 4: Test Accuracy = 0.4872
Divergence detected. Stopping training after 10 epochs.
Early stopping at epoch 20
Trial 74, Fold 4: Test Accuracy = 0.4835
Divergence detected. Stopping training after 10 epochs.
Early stopping at epoch 15
Trial 75, Fold 5: Test Accuracy = 0.4904
Trial 75: Mean Accuracy = 0.4904, Fold Accuracies = [np.float64(0.47764308482130263), np.float64(0.4840706552505745), np.float64(0.5125796253804716), np.float64(0.48720788825872213), np.float64(0.49041222599117335)]
[I 2025-04-23 14:41:37,535] Trial 75 finished with value: 0.4903826959404488 and parameters: {'ff_dim': 64, 'dropout_rate': 0.17559164083925288, 'embed_dim': 256, 'learning_rate': 0.00022799998691568334, 'optimizer': 'AdamW', 'weight_decay': 0.0007857327588024335, 'batch_size': 16, 'num_heads': 2, 'num_transformer_blocks': 4}. Best is trial 49 with value: 0.532532429992528.
Hyperparameters: num_heads=2, num_transformer_blocks=4, learning_rate=1.2795091618414846e-05, optimizer=AdamW, weight_decay=6.302300236797727e-05, batch_size=32,factor=1
Divergence detected. Stopping training after 10 epochs.
Early stopping at epoch 26
Trial 74, Fold 5: Test Accuracy = 0.4885
Trial 74: Mean Accuracy = 0.4871, Fold Accuracies = [np.float64(0.4798277904713548), np.float64(0.5324108803055628), np.float64(0.4511454061837558), np.float64(0.48352098641261326), np.float64(0.48853309990152094)]
[I 2025-04-23 14:42:30,500] Trial 74 finished with value: 0.48708763265496147 and parameters: {'ff_dim': 64, 'dropout_rate': 0.15108803942087573, 'embed_dim': 256, 'learning_rate': 0.0002201495632861018, 'optimizer': 'AdamW', 'weight_decay': 0.0005572679513245397, 'batch_size': 32, 'num_heads': 2, 'num_transformer_blocks': 4}. Best is trial 49 with value: 0.532532429992528.
Hyperparameters: num_heads=2, num_transformer_blocks=32, learning_rate=1.4553612306940976e-05, optimizer=AdamW, weight_decay=6.645169071553924e-05, batch_size=32,factor=1
Divergence detected. Stopping training after 10 epochs.
Early stopping at epoch 14
Trial 76, Fold 1: Test Accuracy = 0.4883
Divergence detected. Stopping training after 10 epochs.
Early stopping at epoch 22
Trial 76, Fold 2: Test Accuracy = 0.5356
Divergence detected. Stopping training after 10 epochs.
Early stopping at epoch 16
Trial 77, Fold 1: Test Accuracy = 0.3333
Divergence detected. Stopping training after 10 epochs.
Early stopping at epoch 20
Trial 76, Fold 3: Test Accuracy = 0.4642
Divergence detected. Stopping training after 10 epochs.
Early stopping at epoch 26
Trial 76, Fold 4: Test Accuracy = 0.5240
Divergence detected. Stopping training after 10 epochs.
Early stopping at epoch 10
Trial 77, Fold 2: Test Accuracy = 0.3333
Divergence detected. Stopping training after 10 epochs.
Early stopping at epoch 16
Trial 76, Fold 5: Test Accuracy = 0.5231
Trial 76: Mean Accuracy = 0.5070, Fold Accuracies = [np.float64(0.4883014583509633), np.float64(0.5356068323141193), np.float64(0.46417793090630965), np.float64(0.52403276789068), np.float64(0.5230742969690337)]
[I 2025-04-23 16:28:00,533] Trial 76 finished with value: 0.5070386572862212 and parameters: {'ff_dim': 2048, 'dropout_rate': 0.14073650227565318, 'embed_dim': 256, 'learning_rate': 1.2795091618414846e-05, 'optimizer': 'AdamW', 'weight_decay': 6.302300236797727e-05, 'batch_size': 32, 'num_heads': 2, 'num_transformer_blocks': 4}. Best is trial 49 with value: 0.532532429992528.