c:\Users\Gabriel\anaconda3\envs\CUDAENV\Lib\site-packages\tqdm\auto.py:21: TqdmWarning: IProgress not found. Please update jupyter and ipywidgets. See https://ipywidgets.readthedocs.io/en/stable/user_install.html
  from .autonotebook import tqdm as notebook_tqdm
[I 2025-04-23 07:36:15,122] A new study created in memory with name: no-name-2236af4b-a62b-41d1-a5ca-ef79b3c8acd3
Hyperparameters: num_heads=8, num_transformer_blocks=4, learning_rate=1.8283824125863145e-05, optimizer=Adam, weight_decay=9.997287344979877e-05, batch_size=10,factor=1Hyperparameters: num_heads=4, num_transformer_blocks=8, learning_rate=2.069458433103691e-05, optimizer=Adam, weight_decay=3.2822135177505066e-05, batch_size=32,factor=1

Divergence detected. Stopping training after 10 epochs.
Early stopping at epoch 10
Trial 1, Fold 1: Test Accuracy = 0.4822
Divergence detected. Stopping training after 10 epochs.
Early stopping at epoch 20
Trial 0, Fold 1: Test Accuracy = 0.4083
Divergence detected. Stopping training after 10 epochs.
Early stopping at epoch 23
Trial 1, Fold 2: Test Accuracy = 0.5218
Divergence detected. Stopping training after 10 epochs.
Early stopping at epoch 29
Trial 0, Fold 2: Test Accuracy = 0.5751
Divergence detected. Stopping training after 10 epochs.
Early stopping at epoch 23
Trial 1, Fold 3: Test Accuracy = 0.4968
Divergence detected. Stopping training after 10 epochs.
Early stopping at epoch 15
Trial 0, Fold 3: Test Accuracy = 0.4660
Divergence detected. Stopping training after 10 epochs.
Early stopping at epoch 12
Trial 1, Fold 4: Test Accuracy = 0.4170
Divergence detected. Stopping training after 10 epochs.
Early stopping at epoch 15
Trial 0, Fold 4: Test Accuracy = 0.4317
Divergence detected. Stopping training after 10 epochs.
Early stopping at epoch 16
Trial 0, Fold 5: Test Accuracy = 0.4696
Trial 0: Mean Accuracy = 0.4701, Fold Accuracies = [np.float64(0.4082515302812333), np.float64(0.5751260592106293), np.float64(0.46602503058467093), np.float64(0.43170112793625076), np.float64(0.4696420469052048)]
[I 2025-04-23 07:51:48,873] Trial 0 finished with value: 0.4701491589835978 and parameters: {'ff_dim': 64, 'dropout_rate': 0.2473503655787865, 'embed_dim': 256, 'learning_rate': 1.8283824125863145e-05, 'optimizer': 'Adam', 'weight_decay': 9.997287344979877e-05, 'batch_size': 10, 'num_heads': 8, 'num_transformer_blocks': 4}. Best is trial 0 with value: 0.4701491589835978.
Hyperparameters: num_heads=2, num_transformer_blocks=16, learning_rate=2.788553790319569e-07, optimizer=AdamW, weight_decay=1.8370914756371888e-06, batch_size=32,factor=1
Divergence detected. Stopping training after 10 epochs.
Early stopping at epoch 26
Trial 1, Fold 5: Test Accuracy = 0.4798
Trial 1: Mean Accuracy = 0.4795, Fold Accuracies = [np.float64(0.4822268765338073), np.float64(0.5218228995352564), np.float64(0.4968351848277794), np.float64(0.41700183074282055), np.float64(0.47978611810190763)]
[I 2025-04-23 07:51:54,735] Trial 1 finished with value: 0.4795345819483142 and parameters: {'ff_dim': 2048, 'dropout_rate': 0.23310133579685638, 'embed_dim': 2048, 'learning_rate': 2.069458433103691e-05, 'optimizer': 'Adam', 'weight_decay': 3.2822135177505066e-05, 'batch_size': 32, 'num_heads': 4, 'num_transformer_blocks': 8}. Best is trial 1 with value: 0.4795345819483142.
Hyperparameters: num_heads=16, num_transformer_blocks=2, learning_rate=0.00012258766126501403, optimizer=Adam, weight_decay=9.190336620772277e-06, batch_size=10,factor=1
Divergence detected. Stopping training after 10 epochs.
Early stopping at epoch 16
Trial 3, Fold 1: Test Accuracy = 0.4250
Divergence detected. Stopping training after 10 epochs.
Early stopping at epoch 21
Trial 2, Fold 1: Test Accuracy = 0.3858
Divergence detected. Stopping training after 10 epochs.
Early stopping at epoch 17
Trial 3, Fold 2: Test Accuracy = 0.5399
Trial 2, Fold 2: Test Accuracy = 0.4458
Divergence detected. Stopping training after 10 epochs.
Early stopping at epoch 25
Trial 3, Fold 3: Test Accuracy = 0.5139
Divergence detected. Stopping training after 10 epochs.
Early stopping at epoch 10
Trial 2, Fold 3: Test Accuracy = 0.3548
Divergence detected. Stopping training after 10 epochs.
Early stopping at epoch 13
Trial 3, Fold 4: Test Accuracy = 0.4965
Divergence detected. Stopping training after 10 epochs.
Early stopping at epoch 10
Trial 2, Fold 4: Test Accuracy = 0.3062
Divergence detected. Stopping training after 10 epochs.
Early stopping at epoch 10
Divergence detected. Stopping training after 10 epochs.
Early stopping at epoch 16
Trial 2, Fold 5: Test Accuracy = 0.3663
Trial 2: Mean Accuracy = 0.3718, Fold Accuracies = [np.float64(0.38576626893458577), np.float64(0.4458494997907871), np.float64(0.3547811233608642), np.float64(0.3062183170514408), np.float64(0.3662705620600358)]
[I 2025-04-23 07:59:34,529] Trial 2 finished with value: 0.3717771542395427 and parameters: {'ff_dim': 32, 'dropout_rate': 0.2829762511196685, 'embed_dim': 64, 'learning_rate': 2.788553790319569e-07, 'optimizer': 'AdamW', 'weight_decay': 1.8370914756371888e-06, 'batch_size': 32, 'num_heads': 2, 'num_transformer_blocks': 16}. Best is trial 1 with value: 0.4795345819483142.
Hyperparameters: num_heads=8, num_transformer_blocks=8, learning_rate=3.872098720389553e-06, optimizer=AdamW, weight_decay=0.0009072019271699699, batch_size=32,factor=1
Trial 3, Fold 5: Test Accuracy = 0.5252
Trial 3: Mean Accuracy = 0.5001, Fold Accuracies = [np.float64(0.42498942201912504), np.float64(0.5398519958023149), np.float64(0.5139282101461419), np.float64(0.49651885300353577), np.float64(0.5252428785060363)]
[I 2025-04-23 07:59:35,547] Trial 3 finished with value: 0.5001062718954308 and parameters: {'ff_dim': 256, 'dropout_rate': 0.16452368240097198, 'embed_dim': 32, 'learning_rate': 0.00012258766126501403, 'optimizer': 'Adam', 'weight_decay': 9.190336620772277e-06, 'batch_size': 10, 'num_heads': 16, 'num_transformer_blocks': 2}. Best is trial 3 with value: 0.5001062718954308.
Hyperparameters: num_heads=16, num_transformer_blocks=32, learning_rate=1.464087804473956e-05, optimizer=AdamW, weight_decay=9.508392573789285e-06, batch_size=16,factor=1
Divergence detected. Stopping training after 10 epochs.
Early stopping at epoch 16
Trial 4, Fold 1: Test Accuracy = 0.4423
Divergence detected. Stopping training after 10 epochs.
Early stopping at epoch 11
Trial 5, Fold 1: Test Accuracy = 0.4575
Divergence detected. Stopping training after 10 epochs.
Early stopping at epoch 27
Trial 4, Fold 2: Test Accuracy = 0.5091
Divergence detected. Stopping training after 10 epochs.
Early stopping at epoch 17
Trial 4, Fold 3: Test Accuracy = 0.4602
Divergence detected. Stopping training after 10 epochs.
Early stopping at epoch 11
Trial 4, Fold 4: Test Accuracy = 0.4297
Divergence detected. Stopping training after 10 epochs.
Early stopping at epoch 15
Trial 4, Fold 5: Test Accuracy = 0.4875
Trial 4: Mean Accuracy = 0.4658, Fold Accuracies = [np.float64(0.4423274378719923), np.float64(0.5090535657946849), np.float64(0.4601817104065187), np.float64(0.4297236113827347), np.float64(0.4875366378524273)]
[I 2025-04-23 08:06:27,060] Trial 4 finished with value: 0.46576459266167164 and parameters: {'ff_dim': 512, 'dropout_rate': 0.2539449052350844, 'embed_dim': 512, 'learning_rate': 3.872098720389553e-06, 'optimizer': 'AdamW', 'weight_decay': 0.0009072019271699699, 'batch_size': 32, 'num_heads': 8, 'num_transformer_blocks': 8}. Best is trial 3 with value: 0.5001062718954308.
Hyperparameters: num_heads=8, num_transformer_blocks=4, learning_rate=4.714188462164739e-05, optimizer=Adam, weight_decay=0.00031479202457711713, batch_size=16,factor=1
Trial 5, Fold 2: Test Accuracy = 0.4306
Divergence detected. Stopping training after 10 epochs.
Early stopping at epoch 27
Trial 6, Fold 1: Test Accuracy = 0.5067
Divergence detected. Stopping training after 10 epochs.
Early stopping at epoch 10
Trial 5, Fold 3: Test Accuracy = 0.3665
Divergence detected. Stopping training after 10 epochs.
Early stopping at epoch 25
Trial 6, Fold 2: Test Accuracy = 0.5640
Divergence detected. Stopping training after 10 epochs.
Early stopping at epoch 13
Trial 6, Fold 3: Test Accuracy = 0.4079
Divergence detected. Stopping training after 10 epochs.
Early stopping at epoch 20
Trial 6, Fold 4: Test Accuracy = 0.4934
Divergence detected. Stopping training after 10 epochs.
Early stopping at epoch 18
Trial 6, Fold 5: Test Accuracy = 0.4225
Trial 6: Mean Accuracy = 0.4789, Fold Accuracies = [np.float64(0.5066683591436066), np.float64(0.5640343450514976), np.float64(0.4079371357604629), np.float64(0.49338974954755277), np.float64(0.4225217930481089)]
[I 2025-04-23 08:15:09,750] Trial 6 finished with value: 0.47891027651024576 and parameters: {'ff_dim': 2048, 'dropout_rate': 0.23637060698001347, 'embed_dim': 128, 'learning_rate': 4.714188462164739e-05, 'optimizer': 'Adam', 'weight_decay': 0.00031479202457711713, 'batch_size': 16, 'num_heads': 8, 'num_transformer_blocks': 4}. Best is trial 3 with value: 0.5001062718954308.
Hyperparameters: num_heads=4, num_transformer_blocks=32, learning_rate=1.1300532205898714e-07, optimizer=AdamW, weight_decay=1.1158908717192549e-06, batch_size=10,factor=1
Divergence detected. Stopping training after 10 epochs.
Early stopping at epoch 25
Trial 5, Fold 4: Test Accuracy = 0.3685
Trial 5, Fold 5: Test Accuracy = 0.5134
Trial 5: Mean Accuracy = 0.4273, Fold Accuracies = [np.float64(0.4574765168824575), np.float64(0.430626738313721), np.float64(0.36653069361347596), np.float64(0.36848879513995597), np.float64(0.513407302038881)]
[I 2025-04-23 08:20:35,297] Trial 5 finished with value: 0.42730600919769834 and parameters: {'ff_dim': 256, 'dropout_rate': 0.1322411188820127, 'embed_dim': 128, 'learning_rate': 1.464087804473956e-05, 'optimizer': 'AdamW', 'weight_decay': 9.508392573789285e-06, 'batch_size': 16, 'num_heads': 16, 'num_transformer_blocks': 32}. Best is trial 3 with value: 0.5001062718954308.
Hyperparameters: num_heads=4, num_transformer_blocks=8, learning_rate=0.0012069035822977324, optimizer=Adam, weight_decay=0.00016495532346743976, batch_size=32,factor=1
Divergence detected. Stopping training after 10 epochs.
Early stopping at epoch 18
Trial 7, Fold 1: Test Accuracy = 0.3350
Trial 8, Fold 1: Test Accuracy = 0.3333
Divergence detected. Stopping training after 10 epochs.
Early stopping at epoch 12
Trial 8, Fold 2: Test Accuracy = 0.3333
Divergence detected. Stopping training after 10 epochs.
Early stopping at epoch 10
Trial 7, Fold 2: Test Accuracy = 0.3691
Divergence detected. Stopping training after 10 epochs.
Early stopping at epoch 19
Trial 8, Fold 3: Test Accuracy = 0.3333
Divergence detected. Stopping training after 10 epochs.
Early stopping at epoch 26
Trial 8, Fold 4: Test Accuracy = 0.3333
Divergence detected. Stopping training after 10 epochs.
Early stopping at epoch 11
Trial 8, Fold 5: Test Accuracy = 0.3333
Trial 8: Mean Accuracy = 0.3333, Fold Accuracies = [np.float64(0.3333333333333333), np.float64(0.3333333333333333), np.float64(0.3333333333333333), np.float64(0.3333333333333333), np.float64(0.3333333333333333)]
[I 2025-04-23 08:28:13,196] Trial 8 finished with value: 0.3333333333333333 and parameters: {'ff_dim': 512, 'dropout_rate': 0.15525701264036093, 'embed_dim': 512, 'learning_rate': 0.0012069035822977324, 'optimizer': 'Adam', 'weight_decay': 0.00016495532346743976, 'batch_size': 32, 'num_heads': 4, 'num_transformer_blocks': 8}. Best is trial 3 with value: 0.5001062718954308.
Hyperparameters: num_heads=2, num_transformer_blocks=2, learning_rate=0.0023825791186337215, optimizer=Adam, weight_decay=4.544984059815047e-05, batch_size=32,factor=1
Divergence detected. Stopping training after 10 epochs.
Early stopping at epoch 15
Trial 7, Fold 3: Test Accuracy = 0.3316
Trial 9, Fold 1: Test Accuracy = 0.4291
Divergence detected. Stopping training after 10 epochs.
Early stopping at epoch 15
Trial 9, Fold 2: Test Accuracy = 0.3699
Divergence detected. Stopping training after 10 epochs.
Early stopping at epoch 10
Trial 9, Fold 3: Test Accuracy = 0.3333
Divergence detected. Stopping training after 10 epochs.
Early stopping at epoch 13
Trial 7, Fold 4: Test Accuracy = 0.4033
Trial 9, Fold 4: Test Accuracy = 0.4955
Divergence detected. Stopping training after 10 epochs.
Early stopping at epoch 10
Trial 7, Fold 5: Test Accuracy = 0.3447
Trial 7: Mean Accuracy = 0.3567, Fold Accuracies = [np.float64(0.334984908747285), np.float64(0.3690728816346806), np.float64(0.3316028538456468), np.float64(0.40326805831059453), np.float64(0.34468862384651855)]
[I 2025-04-23 08:35:27,474] Trial 7 finished with value: 0.3567234652769451 and parameters: {'ff_dim': 2048, 'dropout_rate': 0.1276854686386112, 'embed_dim': 64, 'learning_rate': 1.1300532205898714e-07, 'optimizer': 'AdamW', 'weight_decay': 1.1158908717192549e-06, 'batch_size': 10, 'num_heads': 4, 'num_transformer_blocks': 32}. Best is trial 3 with value: 0.5001062718954308.
Hyperparameters: num_heads=1, num_transformer_blocks=2, learning_rate=0.07308273614132964, optimizer=Adam, weight_decay=1.9896906561865664e-05, batch_size=32,factor=1
Trial 9, Fold 5: Test Accuracy = 0.4533
Trial 9: Mean Accuracy = 0.4162, Fold Accuracies = [np.float64(0.4291007305858791), np.float64(0.3698760301221939), np.float64(0.3333333333333333), np.float64(0.4954666997271347), np.float64(0.45331611773717034)]
[I 2025-04-23 08:36:10,485] Trial 9 finished with value: 0.4162185823011423 and parameters: {'ff_dim': 32, 'dropout_rate': 0.3603024717217307, 'embed_dim': 128, 'learning_rate': 0.0023825791186337215, 'optimizer': 'Adam', 'weight_decay': 4.544984059815047e-05, 'batch_size': 32, 'num_heads': 2, 'num_transformer_blocks': 2}. Best is trial 3 with value: 0.5001062718954308.
Hyperparameters: num_heads=16, num_transformer_blocks=2, learning_rate=0.08816982927030116, optimizer=Adam, weight_decay=6.6796111169415665e-06, batch_size=10,factor=1
Divergence detected. Stopping training after 10 epochs.
Early stopping at epoch 15
Trial 10, Fold 1: Test Accuracy = 0.3333
Divergence detected. Stopping training after 10 epochs.
Early stopping at epoch 17
Trial 11, Fold 1: Test Accuracy = 0.3333
Divergence detected. Stopping training after 10 epochs.
Early stopping at epoch 17
Trial 10, Fold 2: Test Accuracy = 0.3333
Divergence detected. Stopping training after 10 epochs.
Early stopping at epoch 13
Trial 11, Fold 2: Test Accuracy = 0.3333
Divergence detected. Stopping training after 10 epochs.
Early stopping at epoch 19
Trial 10, Fold 3: Test Accuracy = 0.3333
Divergence detected. Stopping training after 10 epochs.
Early stopping at epoch 22
Trial 11, Fold 3: Test Accuracy = 0.3333
Divergence detected. Stopping training after 10 epochs.
Early stopping at epoch 15
Trial 10, Fold 4: Test Accuracy = 0.3333
Divergence detected. Stopping training after 10 epochs.
Early stopping at epoch 15
Trial 11, Fold 4: Test Accuracy = 0.3333
Divergence detected. Stopping training after 10 epochs.
Early stopping at epoch 19
Trial 11, Fold 5: Test Accuracy = 0.3333
Trial 11: Mean Accuracy = 0.3333, Fold Accuracies = [np.float64(0.3333333333333333), np.float64(0.3333333333333333), np.float64(0.3333333333333333), np.float64(0.3333333333333333), np.float64(0.3333333333333333)]
[I 2025-04-23 08:45:30,139] Trial 11 finished with value: 0.3333333333333333 and parameters: {'ff_dim': 256, 'dropout_rate': 0.473755130985294, 'embed_dim': 32, 'learning_rate': 0.08816982927030116, 'optimizer': 'Adam', 'weight_decay': 6.6796111169415665e-06, 'batch_size': 10, 'num_heads': 16, 'num_transformer_blocks': 2}. Best is trial 3 with value: 0.5001062718954308.
Hyperparameters: num_heads=1, num_transformer_blocks=1, learning_rate=0.00019379263344299262, optimizer=Adam, weight_decay=1.8388133728476674e-05, batch_size=10,factor=1
Trial 10, Fold 5: Test Accuracy = 0.3333
Trial 10: Mean Accuracy = 0.3333, Fold Accuracies = [np.float64(0.3333333333333333), np.float64(0.3333333333333333), np.float64(0.3333333333333333), np.float64(0.3333333333333333), np.float64(0.3333333333333333)]
[I 2025-04-23 08:45:41,630] Trial 10 finished with value: 0.3333333333333333 and parameters: {'ff_dim': 2048, 'dropout_rate': 0.28458464874904554, 'embed_dim': 2048, 'learning_rate': 0.07308273614132964, 'optimizer': 'Adam', 'weight_decay': 1.9896906561865664e-05, 'batch_size': 32, 'num_heads': 1, 'num_transformer_blocks': 2}. Best is trial 3 with value: 0.5001062718954308.
Hyperparameters: num_heads=16, num_transformer_blocks=1, learning_rate=0.00028286499895843146, optimizer=Adam, weight_decay=4.057731098014215e-06, batch_size=10,factor=1
Divergence detected. Stopping training after 10 epochs.
Early stopping at epoch 20
Trial 12, Fold 1: Test Accuracy = 0.5525
Divergence detected. Stopping training after 10 epochs.
Early stopping at epoch 21
Trial 13, Fold 1: Test Accuracy = 0.4934
Divergence detected. Stopping training after 10 epochs.
Early stopping at epoch 13
Trial 13, Fold 2: Test Accuracy = 0.5341
Divergence detected. Stopping training after 10 epochs.
Early stopping at epoch 19
Trial 12, Fold 2: Test Accuracy = 0.4992
Divergence detected. Stopping training after 10 epochs.
Early stopping at epoch 22
Trial 13, Fold 3: Test Accuracy = 0.3839
Divergence detected. Stopping training after 10 epochs.
Early stopping at epoch 19
Trial 12, Fold 3: Test Accuracy = 0.3403
Divergence detected. Stopping training after 10 epochs.
Early stopping at epoch 23
Trial 13, Fold 4: Test Accuracy = 0.4684
Divergence detected. Stopping training after 10 epochs.
Early stopping at epoch 25
Trial 12, Fold 4: Test Accuracy = 0.4521
Divergence detected. Stopping training after 10 epochs.
Early stopping at epoch 25
Trial 13, Fold 5: Test Accuracy = 0.4817
Trial 13: Mean Accuracy = 0.4723, Fold Accuracies = [np.float64(0.4934289582804434), np.float64(0.5341222732388631), np.float64(0.38393227927742607), np.float64(0.4684410281960781), np.float64(0.4817113469745049)]
[I 2025-04-23 09:05:42,127] Trial 13 finished with value: 0.47232717719346307 and parameters: {'ff_dim': 1024, 'dropout_rate': 0.1963021871565799, 'embed_dim': 1024, 'learning_rate': 0.00028286499895843146, 'optimizer': 'Adam', 'weight_decay': 4.057731098014215e-06, 'batch_size': 10, 'num_heads': 16, 'num_transformer_blocks': 1}. Best is trial 3 with value: 0.5001062718954308.
Hyperparameters: num_heads=4, num_transformer_blocks=8, learning_rate=1.7536120058423462e-06, optimizer=Adam, weight_decay=2.4683341687335222e-05, batch_size=10,factor=1
Divergence detected. Stopping training after 10 epochs.
Early stopping at epoch 21
Trial 12, Fold 5: Test Accuracy = 0.3456
Trial 12: Mean Accuracy = 0.4379, Fold Accuracies = [np.float64(0.5525337790189275), np.float64(0.4991584631684467), np.float64(0.3402674030814734), np.float64(0.452084439229272), np.float64(0.3455855855855856)]
[I 2025-04-23 09:06:00,622] Trial 12 finished with value: 0.437925934016741 and parameters: {'ff_dim': 128, 'dropout_rate': 0.19570188198520835, 'embed_dim': 2048, 'learning_rate': 0.00019379263344299262, 'optimizer': 'Adam', 'weight_decay': 1.8388133728476674e-05, 'batch_size': 10, 'num_heads': 1, 'num_transformer_blocks': 1}. Best is trial 3 with value: 0.5001062718954308.
Hyperparameters: num_heads=4, num_transformer_blocks=8, learning_rate=1.7759407652033478e-06, optimizer=Adam, weight_decay=4.433452227775363e-05, batch_size=16,factor=1
Divergence detected. Stopping training after 10 epochs.
Early stopping at epoch 13
Trial 14, Fold 1: Test Accuracy = 0.3538
Trial 15, Fold 1: Test Accuracy = 0.3515
Divergence detected. Stopping training after 10 epochs.
Early stopping at epoch 21
Trial 14, Fold 2: Test Accuracy = 0.4297
Divergence detected. Stopping training after 10 epochs.
Early stopping at epoch 29
Divergence detected. Stopping training after 10 epochs.
Early stopping at epoch 18
Trial 15, Fold 2: Test Accuracy = 0.4298
Trial 14, Fold 3: Test Accuracy = 0.3320
Divergence detected. Stopping training after 10 epochs.
Early stopping at epoch 12
Divergence detected. Stopping training after 10 epochs.
Early stopping at epoch 10
Trial 15, Fold 3: Test Accuracy = 0.3102
Trial 14, Fold 4: Test Accuracy = 0.3526
Divergence detected. Stopping training after 10 epochs.
Early stopping at epoch 10
Trial 14, Fold 5: Test Accuracy = 0.3830
Trial 14: Mean Accuracy = 0.3702, Fold Accuracies = [np.float64(0.35378268596090373), np.float64(0.42966779887808143), np.float64(0.3320368239172788), np.float64(0.3526109427045015), np.float64(0.3830236714447241)]
[I 2025-04-23 09:14:40,234] Trial 14 finished with value: 0.3702243845810979 and parameters: {'ff_dim': 128, 'dropout_rate': 0.3905046943509991, 'embed_dim': 32, 'learning_rate': 1.7536120058423462e-06, 'optimizer': 'Adam', 'weight_decay': 2.4683341687335222e-05, 'batch_size': 10, 'num_heads': 4, 'num_transformer_blocks': 8}. Best is trial 3 with value: 0.5001062718954308.
Hyperparameters: num_heads=16, num_transformer_blocks=16, learning_rate=0.001118689340029803, optimizer=Adam, weight_decay=6.842648098346012e-05, batch_size=16,factor=1
Divergence detected. Stopping training after 10 epochs.
Early stopping at epoch 17
Trial 15, Fold 4: Test Accuracy = 0.3608
Divergence detected. Stopping training after 10 epochs.
Early stopping at epoch 15
Divergence detected. Stopping training after 10 epochs.
Early stopping at epoch 11
Trial 15, Fold 5: Test Accuracy = 0.3645
Trial 15: Mean Accuracy = 0.3634, Fold Accuracies = [np.float64(0.3514710445403515), np.float64(0.4297735241534706), np.float64(0.3102177024948778), np.float64(0.3608230931249748), np.float64(0.3645064011379801)]
