[I 2025-04-23 11:17:47,563] Trial 31 finished with value: 0.48245757246227583 and parameters: {'ff_dim': 1024, 'dropout_rate': 0.26834778136028503, 'embed_dim': 256, 'learning_rate': 2.9887977710041065e-05, 'optimizer': 'AdamW', 'weight_decay': 0.00014958050698253043, 'batch_size': 10, 'num_heads': 8, 'num_transformer_blocks': 4}. Best is trial 22 with value: 0.5152811978001581.
Hyperparameters: num_heads=1, num_transformer_blocks=2, learning_rate=0.00010565873438544885, optimizer=AdamW, weight_decay=7.277229577358944e-06, batch_size=10,factor=1
Divergence detected. Stopping training after 10 epochs.
Early stopping at epoch 10
Trial 33, Fold 1: Test Accuracy = 0.4153
Divergence detected. Stopping training after 10 epochs.
Early stopping at epoch 25
Trial 32, Fold 3: Test Accuracy = 0.5034
Divergence detected. Stopping training after 10 epochs.
Early stopping at epoch 14
Trial 33, Fold 2: Test Accuracy = 0.4928
Divergence detected. Stopping training after 10 epochs.
Early stopping at epoch 12
Trial 32, Fold 4: Test Accuracy = 0.4979
Divergence detected. Stopping training after 10 epochs.
Early stopping at epoch 16
Trial 33, Fold 3: Test Accuracy = 0.4321
Divergence detected. Stopping training after 10 epochs.
Early stopping at epoch 20
Trial 32, Fold 5: Test Accuracy = 0.4883
Trial 32: Mean Accuracy = 0.4943, Fold Accuracies = [np.float64(0.42635257115455133), np.float64(0.5554508092179015), np.float64(0.5033682982109324), np.float64(0.49786164349329637), np.float64(0.4883270963270963)]
[I 2025-04-23 11:22:17,196] Trial 32 finished with value: 0.4942720836807556 and parameters: {'ff_dim': 1024, 'dropout_rate': 0.10948298131320945, 'embed_dim': 256, 'learning_rate': 8.165372419606142e-05, 'optimizer': 'AdamW', 'weight_decay': 7.224607270542794e-06, 'batch_size': 10, 'num_heads': 1, 'num_transformer_blocks': 2}. Best is trial 22 with value: 0.5152811978001581.
Hyperparameters: num_heads=1, num_transformer_blocks=2, learning_rate=0.0001627201930741366, optimizer=AdamW, weight_decay=2.9841580366717335e-05, batch_size=10,factor=1
Divergence detected. Stopping training after 10 epochs.
Early stopping at epoch 18
Trial 33, Fold 4: Test Accuracy = 0.5353
Divergence detected. Stopping training after 10 epochs.
Early stopping at epoch 19
Trial 34, Fold 1: Test Accuracy = 0.4358
Divergence detected. Stopping training after 10 epochs.
Early stopping at epoch 18
Trial 33, Fold 5: Test Accuracy = 0.5533
Trial 33: Mean Accuracy = 0.4858, Fold Accuracies = [np.float64(0.4153148007108403), np.float64(0.4927893544157364), np.float64(0.4321328734182477), np.float64(0.5353248385003896), np.float64(0.5532768720137141)]
[I 2025-04-23 11:24:28,097] Trial 33 finished with value: 0.4857677478117856 and parameters: {'ff_dim': 1024, 'dropout_rate': 0.11241256867758775, 'embed_dim': 256, 'learning_rate': 0.00010565873438544885, 'optimizer': 'AdamW', 'weight_decay': 7.277229577358944e-06, 'batch_size': 10, 'num_heads': 1, 'num_transformer_blocks': 2}. Best is trial 22 with value: 0.5152811978001581.
Hyperparameters: num_heads=1, num_transformer_blocks=1, learning_rate=0.00018976355911903259, optimizer=AdamW, weight_decay=3.2372972585945294e-05, batch_size=10,factor=1
Divergence detected. Stopping training after 10 epochs.
Early stopping at epoch 22
Trial 34, Fold 2: Test Accuracy = 0.5502
Divergence detected. Stopping training after 10 epochs.
Early stopping at epoch 19
Trial 35, Fold 1: Test Accuracy = 0.5648
Divergence detected. Stopping training after 10 epochs.
Early stopping at epoch 16
Trial 34, Fold 3: Test Accuracy = 0.5117
Divergence detected. Stopping training after 10 epochs.
Early stopping at epoch 15
Trial 35, Fold 2: Test Accuracy = 0.5653
Divergence detected. Stopping training after 10 epochs.
Early stopping at epoch 17
Trial 34, Fold 4: Test Accuracy = 0.4775
Trial 35, Fold 3: Test Accuracy = 0.5006
Divergence detected. Stopping training after 10 epochs.
Early stopping at epoch 17
Trial 34, Fold 5: Test Accuracy = 0.4870
Trial 34: Mean Accuracy = 0.4924, Fold Accuracies = [np.float64(0.4357563961524358), np.float64(0.550196780469577), np.float64(0.5116564329470968), np.float64(0.4774883240670895), np.float64(0.48695072400335554)]
[I 2025-04-23 11:30:08,999] Trial 34 finished with value: 0.4924097315279109 and parameters: {'ff_dim': 1024, 'dropout_rate': 0.13350404039058766, 'embed_dim': 256, 'learning_rate': 0.0001627201930741366, 'optimizer': 'AdamW', 'weight_decay': 2.9841580366717335e-05, 'batch_size': 10, 'num_heads': 1, 'num_transformer_blocks': 2}. Best is trial 22 with value: 0.5152811978001581.
Hyperparameters: num_heads=4, num_transformer_blocks=1, learning_rate=1.1261591391322177e-05, optimizer=AdamW, weight_decay=2.746631571186093e-06, batch_size=10,factor=1
Divergence detected. Stopping training after 10 epochs.
Early stopping at epoch 22
Trial 35, Fold 4: Test Accuracy = 0.4822
Divergence detected. Stopping training after 10 epochs.
Early stopping at epoch 26
Trial 36, Fold 1: Test Accuracy = 0.4203
Divergence detected. Stopping training after 10 epochs.
Early stopping at epoch 29
Trial 35, Fold 5: Test Accuracy = 0.5196
Trial 35: Mean Accuracy = 0.5265, Fold Accuracies = [np.float64(0.5648112888211898), np.float64(0.5652673870529611), np.float64(0.5005923935043216), np.float64(0.4822374680648296), np.float64(0.5195763212605318)]
[I 2025-04-23 11:33:56,696] Trial 35 finished with value: 0.5264969717407668 and parameters: {'ff_dim': 32, 'dropout_rate': 0.14314115443369435, 'embed_dim': 256, 'learning_rate': 0.00018976355911903259, 'optimizer': 'AdamW', 'weight_decay': 3.2372972585945294e-05, 'batch_size': 10, 'num_heads': 1, 'num_transformer_blocks': 1}. Best is trial 35 with value: 0.5264969717407668.
Hyperparameters: num_heads=4, num_transformer_blocks=1, learning_rate=3.9894442573799584e-05, optimizer=AdamW, weight_decay=4.267010378709485e-05, batch_size=10,factor=1
Trial 36, Fold 2: Test Accuracy = 0.4297
Divergence detected. Stopping training after 10 epochs.
Early stopping at epoch 17
Trial 37, Fold 1: Test Accuracy = 0.4274
Divergence detected. Stopping training after 10 epochs.
Early stopping at epoch 11
Trial 37, Fold 2: Test Accuracy = 0.4806
Divergence detected. Stopping training after 10 epochs.
Early stopping at epoch 27
Trial 36, Fold 3: Test Accuracy = 0.4478
Divergence detected. Stopping training after 10 epochs.
Early stopping at epoch 16
Trial 37, Fold 3: Test Accuracy = 0.4246
Divergence detected. Stopping training after 10 epochs.
Early stopping at epoch 20
Trial 36, Fold 4: Test Accuracy = 0.4970
Divergence detected. Stopping training after 10 epochs.
Early stopping at epoch 14
Trial 37, Fold 4: Test Accuracy = 0.4391
Divergence detected. Stopping training after 10 epochs.
Early stopping at epoch 26
Trial 36, Fold 5: Test Accuracy = 0.5003
Trial 36: Mean Accuracy = 0.4590, Fold Accuracies = [np.float64(0.4203393416264703), np.float64(0.4296718544772697), np.float64(0.4477987111681901), np.float64(0.49700011175369485), np.float64(0.5002513768829558)]
[I 2025-04-23 11:40:34,241] Trial 36 finished with value: 0.4590122791817161 and parameters: {'ff_dim': 512, 'dropout_rate': 0.17675582000690815, 'embed_dim': 256, 'learning_rate': 1.1261591391322177e-05, 'optimizer': 'AdamW', 'weight_decay': 2.746631571186093e-06, 'batch_size': 10, 'num_heads': 4, 'num_transformer_blocks': 1}. Best is trial 35 with value: 0.5264969717407668.
Hyperparameters: num_heads=8, num_transformer_blocks=1, learning_rate=4.6000976835422155e-05, optimizer=AdamW, weight_decay=4.163556023378834e-05, batch_size=16,factor=1
Divergence detected. Stopping training after 10 epochs.
Early stopping at epoch 27
Trial 37, Fold 5: Test Accuracy = 0.5051
Trial 37: Mean Accuracy = 0.4554, Fold Accuracies = [np.float64(0.4273659417223774), np.float64(0.48062171776162255), np.float64(0.4246454600593717), np.float64(0.43905989532403916), np.float64(0.5051379800853485)]
[I 2025-04-23 11:40:55,469] Trial 37 finished with value: 0.45536619899055186 and parameters: {'ff_dim': 32, 'dropout_rate': 0.17646987623657534, 'embed_dim': 64, 'learning_rate': 3.9894442573799584e-05, 'optimizer': 'AdamW', 'weight_decay': 4.267010378709485e-05, 'batch_size': 10, 'num_heads': 4, 'num_transformer_blocks': 1}. Best is trial 35 with value: 0.5264969717407668.
Hyperparameters: num_heads=8, num_transformer_blocks=32, learning_rate=0.000793818125734891, optimizer=AdamW, weight_decay=1.2673188245033402e-06, batch_size=16,factor=1
Divergence detected. Stopping training after 10 epochs.
Early stopping at epoch 10
Trial 38, Fold 1: Test Accuracy = 0.3723
Divergence detected. Stopping training after 10 epochs.
Early stopping at epoch 16
Trial 38, Fold 2: Test Accuracy = 0.4558
Divergence detected. Stopping training after 10 epochs.
Early stopping at epoch 11
Trial 38, Fold 3: Test Accuracy = 0.3821
Divergence detected. Stopping training after 10 epochs.
Early stopping at epoch 11
Trial 38, Fold 4: Test Accuracy = 0.4671
Divergence detected. Stopping training after 10 epochs.
Early stopping at epoch 23
Trial 39, Fold 1: Test Accuracy = 0.3333
Trial 38, Fold 5: Test Accuracy = 0.4887
Trial 38: Mean Accuracy = 0.4332, Fold Accuracies = [np.float64(0.37227158613297223), np.float64(0.45583151810307604), np.float64(0.38210514137517576), np.float64(0.4670934842939494), np.float64(0.4886854141590984)]
[I 2025-04-23 11:46:01,361] Trial 38 finished with value: 0.4331974288128544 and parameters: {'ff_dim': 32, 'dropout_rate': 0.1392614514356905, 'embed_dim': 64, 'learning_rate': 4.6000976835422155e-05, 'optimizer': 'AdamW', 'weight_decay': 4.163556023378834e-05, 'batch_size': 16, 'num_heads': 8, 'num_transformer_blocks': 1}. Best is trial 35 with value: 0.5264969717407668.
Hyperparameters: num_heads=1, num_transformer_blocks=32, learning_rate=1.0233067216752892e-05, optimizer=AdamW, weight_decay=1.5065839058212635e-05, batch_size=10,factor=1
Divergence detected. Stopping training after 10 epochs.
Early stopping at epoch 10
Trial 40, Fold 1: Test Accuracy = 0.4622
Divergence detected. Stopping training after 10 epochs.
Early stopping at epoch 18
Trial 39, Fold 2: Test Accuracy = 0.3333
Divergence detected. Stopping training after 10 epochs.
Early stopping at epoch 13
Trial 39, Fold 3: Test Accuracy = 0.3333
Divergence detected. Stopping training after 10 epochs.
Early stopping at epoch 19
Trial 40, Fold 2: Test Accuracy = 0.5422
Divergence detected. Stopping training after 10 epochs.
Early stopping at epoch 13
Trial 39, Fold 4: Test Accuracy = 0.3333
Divergence detected. Stopping training after 10 epochs.
Early stopping at epoch 15
Trial 40, Fold 3: Test Accuracy = 0.4708
Divergence detected. Stopping training after 10 epochs.
Early stopping at epoch 18
Trial 39, Fold 5: Test Accuracy = 0.3333
Trial 39: Mean Accuracy = 0.3333, Fold Accuracies = [np.float64(0.3333333333333333), np.float64(0.3333333333333333), np.float64(0.3333333333333333), np.float64(0.3333333333333333), np.float64(0.3333333333333333)]
[I 2025-04-23 12:02:18,797] Trial 39 finished with value: 0.3333333333333333 and parameters: {'ff_dim': 32, 'dropout_rate': 0.14505004195145652, 'embed_dim': 512, 'learning_rate': 0.000793818125734891, 'optimizer': 'AdamW', 'weight_decay': 1.2673188245033402e-06, 'batch_size': 16, 'num_heads': 8, 'num_transformer_blocks': 32}. Best is trial 35 with value: 0.5264969717407668.
Hyperparameters: num_heads=1, num_transformer_blocks=1, learning_rate=0.003559700501617953, optimizer=AdamW, weight_decay=1.803555639013722e-05, batch_size=10,factor=1
Divergence detected. Stopping training after 10 epochs.
Early stopping at epoch 19
Trial 41, Fold 1: Test Accuracy = 0.5641
Divergence detected. Stopping training after 10 epochs.
Early stopping at epoch 11
Trial 41, Fold 2: Test Accuracy = 0.3333
Divergence detected. Stopping training after 10 epochs.
Early stopping at epoch 20
Trial 40, Fold 4: Test Accuracy = 0.5163
Divergence detected. Stopping training after 10 epochs.
Early stopping at epoch 17
Trial 41, Fold 3: Test Accuracy = 0.4455
Divergence detected. Stopping training after 10 epochs.
Early stopping at epoch 11
Trial 41, Fold 4: Test Accuracy = 0.3333
Divergence detected. Stopping training after 10 epochs.
Early stopping at epoch 19
Trial 41, Fold 5: Test Accuracy = 0.4384
Trial 41: Mean Accuracy = 0.4229, Fold Accuracies = [np.float64(0.5641392344362641), np.float64(0.3333333333333333), np.float64(0.44547319072576946), np.float64(0.3333333333333333), np.float64(0.4384433016011963)]
[I 2025-04-23 12:08:38,144] Trial 41 finished with value: 0.42294447868597923 and parameters: {'ff_dim': 32, 'dropout_rate': 0.22310092889606853, 'embed_dim': 256, 'learning_rate': 0.003559700501617953, 'optimizer': 'AdamW', 'weight_decay': 1.803555639013722e-05, 'batch_size': 10, 'num_heads': 1, 'num_transformer_blocks': 1}. Best is trial 35 with value: 0.5264969717407668.
Hyperparameters: num_heads=1, num_transformer_blocks=2, learning_rate=0.0002721011257151207, optimizer=AdamW, weight_decay=1.0232708906587359e-05, batch_size=10,factor=1
Divergence detected. Stopping training after 10 epochs.
Early stopping at epoch 12
Trial 40, Fold 5: Test Accuracy = 0.4023
Trial 40: Mean Accuracy = 0.4788, Fold Accuracies = [np.float64(0.4622105159233872), np.float64(0.5421801894328426), np.float64(0.47083965743050643), np.float64(0.5163322398544719), np.float64(0.4023063063063063)]
[I 2025-04-23 12:09:14,196] Trial 40 finished with value: 0.4787737817895029 and parameters: {'ff_dim': 32, 'dropout_rate': 0.23607958152737044, 'embed_dim': 512, 'learning_rate': 1.0233067216752892e-05, 'optimizer': 'AdamW', 'weight_decay': 1.5065839058212635e-05, 'batch_size': 10, 'num_heads': 1, 'num_transformer_blocks': 32}. Best is trial 35 with value: 0.5264969717407668.
Hyperparameters: num_heads=1, num_transformer_blocks=2, learning_rate=0.00023518382693779285, optimizer=AdamW, weight_decay=1.0707013159905295e-05, batch_size=10,factor=1
Divergence detected. Stopping training after 10 epochs.
Early stopping at epoch 17
Trial 42, Fold 1: Test Accuracy = 0.5239
Divergence detected. Stopping training after 10 epochs.
Early stopping at epoch 11
Trial 43, Fold 1: Test Accuracy = 0.4833
Divergence detected. Stopping training after 10 epochs.
Early stopping at epoch 16
Trial 43, Fold 2: Test Accuracy = 0.5821
Divergence detected. Stopping training after 10 epochs.
Early stopping at epoch 25
Trial 42, Fold 2: Test Accuracy = 0.5763
Divergence detected. Stopping training after 10 epochs.
Early stopping at epoch 19
Trial 43, Fold 3: Test Accuracy = 0.4665
Divergence detected. Stopping training after 10 epochs.
Early stopping at epoch 22
Trial 42, Fold 3: Test Accuracy = 0.4715
Divergence detected. Stopping training after 10 epochs.
Early stopping at epoch 19
Trial 43, Fold 4: Test Accuracy = 0.4896
Divergence detected. Stopping training after 10 epochs.
Early stopping at epoch 23
Trial 42, Fold 4: Test Accuracy = 0.4416
Divergence detected. Stopping training after 10 epochs.
Early stopping at epoch 26
Trial 43, Fold 5: Test Accuracy = 0.5108
Trial 43: Mean Accuracy = 0.5065, Fold Accuracies = [np.float64(0.4833015993907083), np.float64(0.5820826005285146), np.float64(0.4664732439395227), np.float64(0.4896342627515622), np.float64(0.5108022030127293)]
[I 2025-04-23 12:16:52,188] Trial 43 finished with value: 0.5064587819246074 and parameters: {'ff_dim': 128, 'dropout_rate': 0.10172480134999679, 'embed_dim': 256, 'learning_rate': 0.00023518382693779285, 'optimizer': 'AdamW', 'weight_decay': 1.0707013159905295e-05, 'batch_size': 10, 'num_heads': 1, 'num_transformer_blocks': 2}. Best is trial 35 with value: 0.5264969717407668.
Hyperparameters: num_heads=1, num_transformer_blocks=16, learning_rate=0.0003497341460153218, optimizer=AdamW, weight_decay=2.5215161834579647e-05, batch_size=10,factor=1
Divergence detected. Stopping training after 10 epochs.
Early stopping at epoch 24
Trial 42, Fold 5: Test Accuracy = 0.5211
Trial 42: Mean Accuracy = 0.5069, Fold Accuracies = [np.float64(0.5238533468731489), np.float64(0.5763037213059365), np.float64(0.47151764300666704), np.float64(0.4415740624330642), np.float64(0.5210638654849181)]
[I 2025-04-23 12:17:52,156] Trial 42 finished with value: 0.5068625278207469 and parameters: {'ff_dim': 128, 'dropout_rate': 0.10336648219158691, 'embed_dim': 256, 'learning_rate': 0.0002721011257151207, 'optimizer': 'AdamW', 'weight_decay': 1.0232708906587359e-05, 'batch_size': 10, 'num_heads': 1, 'num_transformer_blocks': 2}. Best is trial 35 with value: 0.5264969717407668.
Hyperparameters: num_heads=1, num_transformer_blocks=16, learning_rate=0.0017621251426256652, optimizer=AdamW, weight_decay=2.5315863216221394e-05, batch_size=10,factor=1
Divergence detected. Stopping training after 10 epochs.
Early stopping at epoch 10
Trial 45, Fold 1: Test Accuracy = 0.3333
Divergence detected. Stopping training after 10 epochs.
Early stopping at epoch 18
Trial 44, Fold 1: Test Accuracy = 0.3333
Divergence detected. Stopping training after 10 epochs.
Early stopping at epoch 16
Trial 44, Fold 2: Test Accuracy = 0.3333
Divergence detected. Stopping training after 10 epochs.
Early stopping at epoch 19
Trial 45, Fold 2: Test Accuracy = 0.3333
Divergence detected. Stopping training after 10 epochs.
Early stopping at epoch 10
Trial 44, Fold 3: Test Accuracy = 0.3333
Divergence detected. Stopping training after 10 epochs.
Early stopping at epoch 11
Trial 45, Fold 3: Test Accuracy = 0.3333
Divergence detected. Stopping training after 10 epochs.
Early stopping at epoch 12
Trial 45, Fold 4: Test Accuracy = 0.3333
Divergence detected. Stopping training after 10 epochs.
Early stopping at epoch 19
Trial 44, Fold 4: Test Accuracy = 0.3333
Divergence detected. Stopping training after 10 epochs.
Early stopping at epoch 10
Trial 44, Fold 5: Test Accuracy = 0.3333
Trial 44: Mean Accuracy = 0.3333, Fold Accuracies = [np.float64(0.3333333333333333), np.float64(0.3333333333333333), np.float64(0.3333333333333333), np.float64(0.3333333333333333), np.float64(0.3333333333333333)]
[I 2025-04-23 12:29:53,763] Trial 44 finished with value: 0.3333333333333333 and parameters: {'ff_dim': 128, 'dropout_rate': 0.10055200046065618, 'embed_dim': 256, 'learning_rate': 0.0003497341460153218, 'optimizer': 'AdamW', 'weight_decay': 2.5215161834579647e-05, 'batch_size': 10, 'num_heads': 1, 'num_transformer_blocks': 16}. Best is trial 35 with value: 0.5264969717407668.
Hyperparameters: num_heads=1, num_transformer_blocks=4, learning_rate=0.0016183855478703372, optimizer=AdamW, weight_decay=5.408925439721246e-06, batch_size=10,factor=1
Divergence detected. Stopping training after 10 epochs.
Early stopping at epoch 10
Trial 45, Fold 5: Test Accuracy = 0.3333
Trial 45: Mean Accuracy = 0.3333, Fold Accuracies = [np.float64(0.3333333333333333), np.float64(0.3333333333333333), np.float64(0.3333333333333333), np.float64(0.3333333333333333), np.float64(0.3333333333333333)]
[I 2025-04-23 12:29:58,383] Trial 45 finished with value: 0.3333333333333333 and parameters: {'ff_dim': 128, 'dropout_rate': 0.1325161146981799, 'embed_dim': 128, 'learning_rate': 0.0017621251426256652, 'optimizer': 'AdamW', 'weight_decay': 2.5315863216221394e-05, 'batch_size': 10, 'num_heads': 1, 'num_transformer_blocks': 16}. Best is trial 35 with value: 0.5264969717407668.
Hyperparameters: num_heads=2, num_transformer_blocks=4, learning_rate=6.912041532977275e-05, optimizer=AdamW, weight_decay=5.577420998492196e-06, batch_size=10,factor=1
Divergence detected. Stopping training after 10 epochs.
Early stopping at epoch 14
Trial 46, Fold 1: Test Accuracy = 0.3333
Divergence detected. Stopping training after 10 epochs.
Early stopping at epoch 17
Trial 47, Fold 1: Test Accuracy = 0.5173
Divergence detected. Stopping training after 10 epochs.
Early stopping at epoch 10
Trial 46, Fold 2: Test Accuracy = 0.3333
Divergence detected. Stopping training after 10 epochs.
Early stopping at epoch 18
Trial 47, Fold 2: Test Accuracy = 0.5657
Divergence detected. Stopping training after 10 epochs.
Early stopping at epoch 15
Trial 46, Fold 3: Test Accuracy = 0.3333
Divergence detected. Stopping training after 10 epochs.
Early stopping at epoch 12
Trial 46, Fold 4: Test Accuracy = 0.3333
Divergence detected. Stopping training after 10 epochs.
Early stopping at epoch 19
Trial 47, Fold 3: Test Accuracy = 0.4821
Divergence detected. Stopping training after 10 epochs.
Early stopping at epoch 20
Divergence detected. Stopping training after 10 epochs.
Early stopping at epoch 18
Trial 46, Fold 5: Test Accuracy = 0.3333
Trial 46: Mean Accuracy = 0.3333, Fold Accuracies = [np.float64(0.3333333333333333), np.float64(0.3333333333333333), np.float64(0.3333333333333333), np.float64(0.3333333333333333), np.float64(0.3333333333333333)]
[I 2025-04-23 12:36:38,728] Trial 46 finished with value: 0.3333333333333333 and parameters: {'ff_dim': 128, 'dropout_rate': 0.13307479213595813, 'embed_dim': 256, 'learning_rate': 0.0016183855478703372, 'optimizer': 'AdamW', 'weight_decay': 5.408925439721246e-06, 'batch_size': 10, 'num_heads': 1, 'num_transformer_blocks': 4}. Best is trial 35 with value: 0.5264969717407668.
Hyperparameters: num_heads=2, num_transformer_blocks=2, learning_rate=9.602210308643173e-05, optimizer=AdamW, weight_decay=0.0004146484177195346, batch_size=32,factor=1
Trial 47, Fold 4: Test Accuracy = 0.5215
Divergence detected. Stopping training after 10 epochs.
Early stopping at epoch 16
Trial 48, Fold 1: Test Accuracy = 0.4828
Divergence detected. Stopping training after 10 epochs.
Early stopping at epoch 15
Trial 47, Fold 5: Test Accuracy = 0.5278
Trial 47: Mean Accuracy = 0.5229, Fold Accuracies = [np.float64(0.5173359002566923), np.float64(0.5657345501249683), np.float64(0.48212494430426195), np.float64(0.5215480913400199), np.float64(0.5277557719662983)]
