c:\Users\Gabriel\anaconda3\envs\cudaenv\Lib\site-packages\tqdm\auto.py:21: TqdmWarning: IProgress not found. Please update jupyter and ipywidgets. See https://ipywidgets.readthedocs.io/en/stable/user_install.html
  from .autonotebook import tqdm as notebook_tqdm
[I 2025-05-09 09:58:56,937] A new study created in memory with name: no-name-b6ceb15b-e5dc-483f-bf4d-77d06a5910a5
Hyperparameters: num_heads=2, num_transformer_blocks=4, learning_rate=0.00014957638446925025, optimizer=Adam, weight_decay=0.00025478724688789584, batch_size=16,factor=1
Hyperparameters: num_heads=8, num_transformer_blocks=8, learning_rate=2.5298034370526554e-06, optimizer=Adam, weight_decay=6.459712811892587e-05, batch_size=32,factor=1
Divergence detected. Stopping training after 10 epochs.
Early stopping at epoch 12
Trial 1, Fold 1: Test Accuracy = 0.5025
Divergence detected. Stopping training after 10 epochs.
Early stopping at epoch 15
Trial 0, Fold 1: Test Accuracy = 0.4458
Divergence detected. Stopping training after 10 epochs.
Early stopping at epoch 13
Trial 1, Fold 2: Test Accuracy = 0.3847
Divergence detected. Stopping training after 10 epochs.
Early stopping at epoch 21
Trial 0, Fold 2: Test Accuracy = 0.5008
Divergence detected. Stopping training after 10 epochs.
Early stopping at epoch 17
Trial 1, Fold 3: Test Accuracy = 0.4453
Divergence detected. Stopping training after 10 epochs.
Early stopping at epoch 21
Trial 0, Fold 3: Test Accuracy = 0.3948
Divergence detected. Stopping training after 10 epochs.
Early stopping at epoch 15
Trial 1, Fold 4: Test Accuracy = 0.4889
Divergence detected. Stopping training after 10 epochs.
Early stopping at epoch 18
Trial 0, Fold 4: Test Accuracy = 0.4958
Divergence detected. Stopping training after 10 epochs.
Early stopping at epoch 21
[I 2025-05-09 10:07:26,293] Trial 1 finished with value: 0.4535005421391043 and parameters: {'ff_dim': 32, 'dropout_rate': 0.26356084463848456, 'embed_dim': 2048, 'learning_rate': 2.5298034370526554e-06, 'optimizer': 'Adam', 'weight_decay': 6.459712811892587e-05, 'batch_size': 32, 'num_heads': 8, 'num_transformer_blocks': 8}. Best is trial 1 with value: 0.4535005421391043.
Trial 1, Fold 5: Test Accuracy = 0.4460
Trial 1: Mean Accuracy = 0.4535, Fold Accuracies = [np.float64(0.5025108225108225), np.float64(0.38473674555127496), np.float64(0.44534530382698817), np.float64(0.4888715659475424), np.float64(0.4460382728588936)]
Hyperparameters: num_heads=4, num_transformer_blocks=2, learning_rate=1.6494616695368336e-06, optimizer=Adam, weight_decay=7.963158112269603e-06, batch_size=16,factor=1
Divergence detected. Stopping training after 10 epochs.
Early stopping at epoch 11
[I 2025-05-09 10:07:41,272] Trial 0 finished with value: 0.46277505180999323 and parameters: {'ff_dim': 2048, 'dropout_rate': 0.48264534964809236, 'embed_dim': 32, 'learning_rate': 0.00014957638446925025, 'optimizer': 'Adam', 'weight_decay': 0.00025478724688789584, 'batch_size': 16, 'num_heads': 2, 'num_transformer_blocks': 4}. Best is trial 0 with value: 0.46277505180999323.
Trial 0, Fold 5: Test Accuracy = 0.4766
Trial 0: Mean Accuracy = 0.4628, Fold Accuracies = [np.float64(0.4458441558441559), np.float64(0.500773558368495), np.float64(0.39479110888730884), np.float64(0.4958274127037739), np.float64(0.4766390232462328)]
Hyperparameters: num_heads=1, num_transformer_blocks=8, learning_rate=0.008181184577648146, optimizer=AdamW, weight_decay=0.0002713712347068007, batch_size=10,factor=1
Divergence detected. Stopping training after 10 epochs.
Early stopping at epoch 12
Trial 2, Fold 1: Test Accuracy = 0.4726
Divergence detected. Stopping training after 10 epochs.
Early stopping at epoch 14
Trial 3, Fold 1: Test Accuracy = 0.3333
Trial 2, Fold 2: Test Accuracy = 0.4368
Divergence detected. Stopping training after 10 epochs.
Early stopping at epoch 19
Trial 3, Fold 2: Test Accuracy = 0.3333
Divergence detected. Stopping training after 10 epochs.
Early stopping at epoch 11
Trial 3, Fold 3: Test Accuracy = 0.3333
Divergence detected. Stopping training after 10 epochs.
Early stopping at epoch 28
Trial 2, Fold 3: Test Accuracy = 0.4440
Divergence detected. Stopping training after 10 epochs.
Early stopping at epoch 23
Trial 2, Fold 4: Test Accuracy = 0.5698
Divergence detected. Stopping training after 10 epochs.
Early stopping at epoch 19
Trial 3, Fold 4: Test Accuracy = 0.3333
Divergence detected. Stopping training after 10 epochs.
Early stopping at epoch 15
[I 2025-05-09 10:18:15,071] Trial 3 finished with value: 0.3333333333333333 and parameters: {'ff_dim': 64, 'dropout_rate': 0.1576328981576447, 'embed_dim': 1024, 'learning_rate': 0.008181184577648146, 'optimizer': 'AdamW', 'weight_decay': 0.0002713712347068007, 'batch_size': 10, 'num_heads': 1, 'num_transformer_blocks': 8}. Best is trial 0 with value: 0.46277505180999323.
Trial 3, Fold 5: Test Accuracy = 0.3333
Trial 3: Mean Accuracy = 0.3333, Fold Accuracies = [np.float64(0.3333333333333333), np.float64(0.3333333333333333), np.float64(0.3333333333333333), np.float64(0.3333333333333333), np.float64(0.3333333333333333)]
Hyperparameters: num_heads=2, num_transformer_blocks=2, learning_rate=6.21695516850386e-07, optimizer=Adam, weight_decay=0.00019274008015460436, batch_size=10,factor=1
Divergence detected. Stopping training after 10 epochs.
Early stopping at epoch 28
[I 2025-05-09 10:18:36,801] Trial 2 finished with value: 0.4790788580852764 and parameters: {'ff_dim': 32, 'dropout_rate': 0.3084362790543471, 'embed_dim': 1024, 'learning_rate': 1.6494616695368336e-06, 'optimizer': 'Adam', 'weight_decay': 7.963158112269603e-06, 'batch_size': 16, 'num_heads': 4, 'num_transformer_blocks': 2}. Best is trial 2 with value: 0.4790788580852764.
Trial 2, Fold 5: Test Accuracy = 0.4722
Trial 2: Mean Accuracy = 0.4791, Fold Accuracies = [np.float64(0.4726406926406927), np.float64(0.4367577814468293), np.float64(0.4439802988673238), np.float64(0.5698181529312188), np.float64(0.47219736454031747)]
Hyperparameters: num_heads=1, num_transformer_blocks=8, learning_rate=0.0005038557175037136, optimizer=AdamW, weight_decay=0.00048332242665265424, batch_size=32,factor=1
Divergence detected. Stopping training after 10 epochs.
Early stopping at epoch 17
Trial 4, Fold 1: Test Accuracy = 0.4816
Divergence detected. Stopping training after 10 epochs.
Early stopping at epoch 15
Trial 5, Fold 1: Test Accuracy = 0.3333
Divergence detected. Stopping training after 10 epochs.
Early stopping at epoch 23
Trial 5, Fold 2: Test Accuracy = 0.3333
Divergence detected. Stopping training after 10 epochs.
Early stopping at epoch 26
Trial 4, Fold 2: Test Accuracy = 0.4050
Divergence detected. Stopping training after 10 epochs.
Early stopping at epoch 12
Trial 5, Fold 3: Test Accuracy = 0.3333
Divergence detected. Stopping training after 10 epochs.
Early stopping at epoch 20
Trial 4, Fold 3: Test Accuracy = 0.4122
Divergence detected. Stopping training after 10 epochs.
Early stopping at epoch 11
Trial 5, Fold 4: Test Accuracy = 0.3333
Divergence detected. Stopping training after 10 epochs.
Early stopping at epoch 12
Trial 5, Fold 5: Test Accuracy = 0.3333
Trial 5: Mean Accuracy = 0.3333, Fold Accuracies = [np.float64(0.3333333333333333), np.float64(0.3333333333333333), np.float64(0.3333333333333333), np.float64(0.3333333333333333), np.float64(0.3333333333333333)]
[I 2025-05-09 10:24:38,828] Trial 5 finished with value: 0.3333333333333333 and parameters: {'ff_dim': 1024, 'dropout_rate': 0.318036894094731, 'embed_dim': 128, 'learning_rate': 0.0005038557175037136, 'optimizer': 'AdamW', 'weight_decay': 0.00048332242665265424, 'batch_size': 32, 'num_heads': 1, 'num_transformer_blocks': 8}. Best is trial 2 with value: 0.4790788580852764.
Hyperparameters: num_heads=4, num_transformer_blocks=16, learning_rate=0.000261747437563711, optimizer=AdamW, weight_decay=0.0005767542423787947, batch_size=16,factor=1
Divergence detected. Stopping training after 10 epochs.
Early stopping at epoch 21
Trial 4, Fold 4: Test Accuracy = 0.5441
Divergence detected. Stopping training after 10 epochs.
Early stopping at epoch 13
Trial 6, Fold 1: Test Accuracy = 0.3333
Divergence detected. Stopping training after 10 epochs.
Early stopping at epoch 22
[I 2025-05-09 10:26:57,437] Trial 4 finished with value: 0.4598989784129907 and parameters: {'ff_dim': 1024, 'dropout_rate': 0.17178480536415433, 'embed_dim': 512, 'learning_rate': 6.21695516850386e-07, 'optimizer': 'Adam', 'weight_decay': 0.00019274008015460436, 'batch_size': 10, 'num_heads': 2, 'num_transformer_blocks': 2}. Best is trial 2 with value: 0.4790788580852764.
Trial 4, Fold 5: Test Accuracy = 0.4565
Trial 4: Mean Accuracy = 0.4599, Fold Accuracies = [np.float64(0.48164502164502165), np.float64(0.4049685073075277), np.float64(0.41218943576868944), np.float64(0.5441475604720196), np.float64(0.4565443668716953)]
Hyperparameters: num_heads=16, num_transformer_blocks=4, learning_rate=0.0002726124111685776, optimizer=AdamW, weight_decay=0.00017221689262781232, batch_size=10,factor=1
Divergence detected. Stopping training after 10 epochs.
Early stopping at epoch 15
Trial 6, Fold 2: Test Accuracy = 0.3333
Divergence detected. Stopping training after 10 epochs.
Early stopping at epoch 10
Trial 7, Fold 1: Test Accuracy = 0.4143
Divergence detected. Stopping training after 10 epochs.
Early stopping at epoch 13
Trial 6, Fold 3: Test Accuracy = 0.3333
Divergence detected. Stopping training after 10 epochs.
Early stopping at epoch 15
Trial 7, Fold 2: Test Accuracy = 0.4558
Divergence detected. Stopping training after 10 epochs.
Early stopping at epoch 17
Trial 6, Fold 4: Test Accuracy = 0.3333
Divergence detected. Stopping training after 10 epochs.
Early stopping at epoch 18
Trial 7, Fold 3: Test Accuracy = 0.3333
Divergence detected. Stopping training after 10 epochs.
Early stopping at epoch 10
[I 2025-05-09 10:30:26,519] Trial 6 finished with value: 0.3333333333333333 and parameters: {'ff_dim': 256, 'dropout_rate': 0.3443305692063453, 'embed_dim': 128, 'learning_rate': 0.000261747437563711, 'optimizer': 'AdamW', 'weight_decay': 0.0005767542423787947, 'batch_size': 16, 'num_heads': 4, 'num_transformer_blocks': 16}. Best is trial 2 with value: 0.4790788580852764.
Trial 6, Fold 5: Test Accuracy = 0.3333
Trial 6: Mean Accuracy = 0.3333, Fold Accuracies = [np.float64(0.3333333333333333), np.float64(0.3333333333333333), np.float64(0.3333333333333333), np.float64(0.3333333333333333), np.float64(0.3333333333333333)]
Hyperparameters: num_heads=2, num_transformer_blocks=4, learning_rate=2.078646893834765e-05, optimizer=AdamW, weight_decay=0.00038616137444888866, batch_size=32,factor=1
Divergence detected. Stopping training after 10 epochs.
Early stopping at epoch 17
Trial 8, Fold 1: Test Accuracy = 0.5228
Divergence detected. Stopping training after 10 epochs.
Early stopping at epoch 23
Trial 7, Fold 4: Test Accuracy = 0.4301
Divergence detected. Stopping training after 10 epochs.
Early stopping at epoch 18
Trial 8, Fold 2: Test Accuracy = 0.4013
Divergence detected. Stopping training after 10 epochs.
Early stopping at epoch 17
[I 2025-05-09 10:33:31,662] Trial 7 finished with value: 0.4140562085291487 and parameters: {'ff_dim': 32, 'dropout_rate': 0.1877489990471375, 'embed_dim': 256, 'learning_rate': 0.0002726124111685776, 'optimizer': 'AdamW', 'weight_decay': 0.00017221689262781232, 'batch_size': 10, 'num_heads': 16, 'num_transformer_blocks': 4}. Best is trial 2 with value: 0.4790788580852764.
Trial 7, Fold 5: Test Accuracy = 0.4367
Trial 7: Mean Accuracy = 0.4141, Fold Accuracies = [np.float64(0.4143290043290044), np.float64(0.4558093316211093), np.float64(0.3333333333333333), np.float64(0.4301133935102343), np.float64(0.43669597985206215)]
Hyperparameters: num_heads=2, num_transformer_blocks=1, learning_rate=1.0012843231898847e-06, optimizer=Adam, weight_decay=0.0007013399484079567, batch_size=10,factor=1
Divergence detected. Stopping training after 10 epochs.
Early stopping at epoch 20
Trial 8, Fold 3: Test Accuracy = 0.4521
Divergence detected. Stopping training after 10 epochs.
Early stopping at epoch 26
Trial 9, Fold 1: Test Accuracy = 0.4492
Divergence detected. Stopping training after 10 epochs.
Early stopping at epoch 18
Trial 8, Fold 4: Test Accuracy = 0.4770
Divergence detected. Stopping training after 10 epochs.
Early stopping at epoch 19
Trial 9, Fold 2: Test Accuracy = 0.4146
Divergence detected. Stopping training after 10 epochs.
Early stopping at epoch 16
[I 2025-05-09 10:37:37,046] Trial 8 finished with value: 0.46119027151107117 and parameters: {'ff_dim': 256, 'dropout_rate': 0.19087439544191687, 'embed_dim': 1024, 'learning_rate': 2.078646893834765e-05, 'optimizer': 'AdamW', 'weight_decay': 0.00038616137444888866, 'batch_size': 32, 'num_heads': 2, 'num_transformer_blocks': 4}. Best is trial 2 with value: 0.4790788580852764.
Trial 8, Fold 5: Test Accuracy = 0.4527
Trial 8: Mean Accuracy = 0.4612, Fold Accuracies = [np.float64(0.5228138528138527), np.float64(0.4013055708432704), np.float64(0.45210741842888363), np.float64(0.4770411654173892), np.float64(0.45268335005196)]
Hyperparameters: num_heads=1, num_transformer_blocks=2, learning_rate=5.053460592896154e-05, optimizer=Adam, weight_decay=4.19549040097764e-05, batch_size=32,factor=1
Divergence detected. Stopping training after 10 epochs.
Early stopping at epoch 16
Trial 10, Fold 1: Test Accuracy = 0.4892
Trial 9, Fold 3: Test Accuracy = 0.4411
Divergence detected. Stopping training after 10 epochs.
Early stopping at epoch 14
Trial 10, Fold 2: Test Accuracy = 0.4215
Divergence detected. Stopping training after 10 epochs.
Early stopping at epoch 21
Trial 9, Fold 4: Test Accuracy = 0.5668
Divergence detected. Stopping training after 10 epochs.
Early stopping at epoch 22
Trial 10, Fold 3: Test Accuracy = 0.4387
Divergence detected. Stopping training after 10 epochs.
Early stopping at epoch 19
[I 2025-05-09 10:42:31,092] Trial 9 finished with value: 0.4672441208724365 and parameters: {'ff_dim': 128, 'dropout_rate': 0.4758574795088818, 'embed_dim': 512, 'learning_rate': 1.0012843231898847e-06, 'optimizer': 'Adam', 'weight_decay': 0.0007013399484079567, 'batch_size': 10, 'num_heads': 2, 'num_transformer_blocks': 1}. Best is trial 2 with value: 0.4790788580852764.
Trial 9, Fold 5: Test Accuracy = 0.4644
Trial 9: Mean Accuracy = 0.4672, Fold Accuracies = [np.float64(0.4491774891774892), np.float64(0.41464868831407076), np.float64(0.4411471454864129), np.float64(0.5668025768256256), np.float64(0.4644447045585842)]
Hyperparameters: num_heads=4, num_transformer_blocks=2, learning_rate=1.1012962877549561e-07, optimizer=Adam, weight_decay=3.1941828635411935e-06, batch_size=16,factor=1
Divergence detected. Stopping training after 10 epochs.
Early stopping at epoch 18
Trial 10, Fold 4: Test Accuracy = 0.5512
Divergence detected. Stopping training after 10 epochs.
Early stopping at epoch 10
Trial 11, Fold 1: Test Accuracy = 0.3841
Divergence detected. Stopping training after 10 epochs.
Early stopping at epoch 10
[I 2025-05-09 10:43:35,503] Trial 10 finished with value: 0.4680196465796394 and parameters: {'ff_dim': 512, 'dropout_rate': 0.2644773455231292, 'embed_dim': 64, 'learning_rate': 5.053460592896154e-05, 'optimizer': 'Adam', 'weight_decay': 4.19549040097764e-05, 'batch_size': 32, 'num_heads': 1, 'num_transformer_blocks': 2}. Best is trial 2 with value: 0.4790788580852764.
Trial 10, Fold 5: Test Accuracy = 0.4396
Trial 10: Mean Accuracy = 0.4680, Fold Accuracies = [np.float64(0.4891774891774892), np.float64(0.42145783648260265), np.float64(0.438655243345418), np.float64(0.5511845608904246), np.float64(0.43962310300226254)]
Hyperparameters: num_heads=4, num_transformer_blocks=2, learning_rate=1.3501085446174475e-07, optimizer=Adam, weight_decay=5.051918032771868e-06, batch_size=16,factor=1
Divergence detected. Stopping training after 10 epochs.
Early stopping at epoch 12
Trial 11, Fold 2: Test Accuracy = 0.3373
Divergence detected. Stopping training after 10 epochs.
Early stopping at epoch 10
Trial 12, Fold 1: Test Accuracy = 0.4008
Divergence detected. Stopping training after 10 epochs.
Early stopping at epoch 24
Trial 11, Fold 3: Test Accuracy = 0.2935
Trial 12, Fold 2: Test Accuracy = 0.4278
Divergence detected. Stopping training after 10 epochs.
Early stopping at epoch 10
Trial 11, Fold 4: Test Accuracy = 0.3201
Divergence detected. Stopping training after 10 epochs.
Early stopping at epoch 10
Trial 12, Fold 3: Test Accuracy = 0.3198
Divergence detected. Stopping training after 10 epochs.
Early stopping at epoch 21
Trial 12, Fold 4: Test Accuracy = 0.3747
[I 2025-05-09 10:48:30,498] Trial 11 finished with value: 0.33589274914683465 and parameters: {'ff_dim': 512, 'dropout_rate': 0.39565860943132314, 'embed_dim': 64, 'learning_rate': 1.1012962877549561e-07, 'optimizer': 'Adam', 'weight_decay': 3.1941828635411935e-06, 'batch_size': 16, 'num_heads': 4, 'num_transformer_blocks': 2}. Best is trial 2 with value: 0.4790788580852764.
Trial 11, Fold 5: Test Accuracy = 0.3444
Trial 11: Mean Accuracy = 0.3359, Fold Accuracies = [np.float64(0.3841125541125541), np.float64(0.33734177215189876), np.float64(0.2935415368229473), np.float64(0.32008934776903314), np.float64(0.34437853487774)]
Hyperparameters: num_heads=4, num_transformer_blocks=32, learning_rate=1.2729669410645611e-05, optimizer=Adam, weight_decay=9.087140908090127e-06, batch_size=32,factor=1
Divergence detected. Stopping training after 10 epochs.
Early stopping at epoch 10
[I 2025-05-09 10:49:14,105] Trial 12 finished with value: 0.3810049486497511 and parameters: {'ff_dim': 512, 'dropout_rate': 0.385912351177575, 'embed_dim': 64, 'learning_rate': 1.3501085446174475e-07, 'optimizer': 'Adam', 'weight_decay': 5.051918032771868e-06, 'batch_size': 16, 'num_heads': 4, 'num_transformer_blocks': 2}. Best is trial 2 with value: 0.4790788580852764.
Trial 12, Fold 5: Test Accuracy = 0.3820
Trial 12: Mean Accuracy = 0.3810, Fold Accuracies = [np.float64(0.40077922077922074), np.float64(0.42777166269186084), np.float64(0.31975460634310343), np.float64(0.3747181450127042), np.float64(0.38200110842186646)]
Hyperparameters: num_heads=1, num_transformer_blocks=32, learning_rate=1.5843128923788224e-05, optimizer=Adam, weight_decay=1.3583942375529081e-05, batch_size=32,factor=1
Divergence detected. Stopping training after 10 epochs.
Early stopping at epoch 10
Trial 14, Fold 1: Test Accuracy = 0.4167
Divergence detected. Stopping training after 10 epochs.
Early stopping at epoch 29
Trial 13, Fold 1: Test Accuracy = 0.4679
Divergence detected. Stopping training after 10 epochs.
Early stopping at epoch 17
Trial 14, Fold 2: Test Accuracy = 0.4209
Divergence detected. Stopping training after 10 epochs.
Early stopping at epoch 13
Trial 14, Fold 3: Test Accuracy = 0.4673
Divergence detected. Stopping training after 10 epochs.
Early stopping at epoch 27
Trial 13, Fold 2: Test Accuracy = 0.4410
Divergence detected. Stopping training after 10 epochs.
Early stopping at epoch 18
Trial 14, Fold 4: Test Accuracy = 0.4977
Divergence detected. Stopping training after 10 epochs.
Early stopping at epoch 19
Trial 13, Fold 3: Test Accuracy = 0.3333
Divergence detected. Stopping training after 10 epochs.
Early stopping at epoch 22
Trial 13, Fold 4: Test Accuracy = 0.4033
[I 2025-05-09 10:56:26,677] Trial 14 finished with value: 0.46516144179555907 and parameters: {'ff_dim': 512, 'dropout_rate': 0.25282405514490625, 'embed_dim': 64, 'learning_rate': 1.5843128923788224e-05, 'optimizer': 'Adam', 'weight_decay': 1.3583942375529081e-05, 'batch_size': 32, 'num_heads': 1, 'num_transformer_blocks': 32}. Best is trial 2 with value: 0.4790788580852764.
Trial 14, Fold 5: Test Accuracy = 0.5233
Trial 14: Mean Accuracy = 0.4652, Fold Accuracies = [np.float64(0.4166666666666667), np.float64(0.42088913349232554), np.float64(0.4673057172201301), np.float64(0.4976933754290968), np.float64(0.523252316169576)]
Hyperparameters: num_heads=16, num_transformer_blocks=2, learning_rate=1.0402392651089812e-05, optimizer=Adam, weight_decay=2.290251058153077e-05, batch_size=32,factor=1
Divergence detected. Stopping training after 10 epochs.
Early stopping at epoch 20
Trial 15, Fold 1: Test Accuracy = 0.4821
[I 2025-05-09 10:58:41,737] Trial 13 finished with value: 0.4251594760628711 and parameters: {'ff_dim': 512, 'dropout_rate': 0.25736604321647205, 'embed_dim': 64, 'learning_rate': 1.2729669410645611e-05, 'optimizer': 'Adam', 'weight_decay': 9.087140908090127e-06, 'batch_size': 32, 'num_heads': 4, 'num_transformer_blocks': 32}. Best is trial 2 with value: 0.4790788580852764.
Trial 13, Fold 5: Test Accuracy = 0.4802
Trial 13: Mean Accuracy = 0.4252, Fold Accuracies = [np.float64(0.46787878787878784), np.float64(0.4410383415886993), np.float64(0.3333333333333333), np.float64(0.4033447500914884), np.float64(0.48020216742204647)]
Hyperparameters: num_heads=16, num_transformer_blocks=2, learning_rate=0.004704006366373762, optimizer=Adam, weight_decay=1.3819737793145035e-06, batch_size=16,factor=1
Divergence detected. Stopping training after 10 epochs.
Early stopping at epoch 19
Trial 15, Fold 2: Test Accuracy = 0.4214
Divergence detected. Stopping training after 10 epochs.
Early stopping at epoch 18
Trial 16, Fold 1: Test Accuracy = 0.3333
Divergence detected. Stopping training after 10 epochs.
Early stopping at epoch 11
Trial 16, Fold 2: Test Accuracy = 0.3333
Divergence detected. Stopping training after 10 epochs.
Early stopping at epoch 29
Trial 15, Fold 3: Test Accuracy = 0.4260
Divergence detected. Stopping training after 10 epochs.
Early stopping at epoch 14
Trial 16, Fold 3: Test Accuracy = 0.3333
Divergence detected. Stopping training after 10 epochs.
Early stopping at epoch 16
Trial 16, Fold 4: Test Accuracy = 0.3333
Trial 15, Fold 4: Test Accuracy = 0.4313
Divergence detected. Stopping training after 10 epochs.
Early stopping at epoch 12
