[I 2025-06-03 21:20:02,604] Trial 133 finished with value: 0.5951573684702364 and parameters: {'ff_dim': 128, 'dropout_rate': 0.4599821080077381, 'embed_dim': 1024, 'learning_rate': 4.330574233886439e-05, 'optimizer': 'Adam', 'weight_decay': 1.3509061303826148e-06, 'batch_size': 32, 'num_heads': 8, 'num_transformer_blocks': 8}. Best is trial 26 with value: 0.6503238949630876.
Trial 133, Fold 1: Test Accuracy = 0.5952
Hyperparameters: num_heads=8, num_transformer_blocks=8, learning_rate=1.243465852749347e-05, optimizer=Adam, weight_decay=1.5003048898656208e-06, batch_size=32,factor=1
Divergence detected. Stopping training after 10 epochs.
Early stopping at epoch 18
[I 2025-06-03 21:20:05,930] Trial 131 finished with value: 0.6124972432482946 and parameters: {'ff_dim': 1024, 'dropout_rate': 0.21915840594831595, 'embed_dim': 1024, 'learning_rate': 1.1276971770881592e-05, 'optimizer': 'Adam', 'weight_decay': 1.399375238718454e-05, 'batch_size': 10, 'num_heads': 8, 'num_transformer_blocks': 32}. Best is trial 26 with value: 0.6503238949630876.
Trial 131, Fold 1: Test Accuracy = 0.6125
Hyperparameters: num_heads=8, num_transformer_blocks=8, learning_rate=2.9043708219627267e-06, optimizer=Adam, weight_decay=1.460071266418146e-06, batch_size=32,factor=1
Divergence detected. Stopping training after 10 epochs.
Early stopping at epoch 10
Trial 135, Fold 1: Test Accuracy = 0.4955
[I 2025-06-03 21:20:52,281] Trial 135 finished with value: 0.49552182039061776 and parameters: {'ff_dim': 128, 'dropout_rate': 0.4655505813253903, 'embed_dim': 256, 'learning_rate': 2.9043708219627267e-06, 'optimizer': 'Adam', 'weight_decay': 1.460071266418146e-06, 'batch_size': 32, 'num_heads': 8, 'num_transformer_blocks': 8}. Best is trial 26 with value: 0.6503238949630876.
Hyperparameters: num_heads=8, num_transformer_blocks=32, learning_rate=1.0579509702432528e-05, optimizer=Adam, weight_decay=1.5259367105489132e-06, batch_size=32,factor=1
Divergence detected. Stopping training after 10 epochs.
Early stopping at epoch 23
[I 2025-06-03 21:21:40,193] Trial 134 finished with value: 0.6036034015512569 and parameters: {'ff_dim': 128, 'dropout_rate': 0.465659499139645, 'embed_dim': 256, 'learning_rate': 1.243465852749347e-05, 'optimizer': 'Adam', 'weight_decay': 1.5003048898656208e-06, 'batch_size': 32, 'num_heads': 8, 'num_transformer_blocks': 8}. Best is trial 26 with value: 0.6503238949630876.
Trial 134, Fold 1: Test Accuracy = 0.6036
Hyperparameters: num_heads=8, num_transformer_blocks=8, learning_rate=1.1159399641543927e-05, optimizer=Adam, weight_decay=1.6084352287719507e-06, batch_size=32,factor=1
Divergence detected. Stopping training after 10 epochs.
Early stopping at epoch 12
[I 2025-06-03 21:21:56,285] Trial 136 finished with value: 0.434840108401084 and parameters: {'ff_dim': 128, 'dropout_rate': 0.4264085333440869, 'embed_dim': 256, 'learning_rate': 1.0579509702432528e-05, 'optimizer': 'Adam', 'weight_decay': 1.5259367105489132e-06, 'batch_size': 32, 'num_heads': 8, 'num_transformer_blocks': 32}. Best is trial 26 with value: 0.6503238949630876.
Trial 136, Fold 1: Test Accuracy = 0.4348
Hyperparameters: num_heads=16, num_transformer_blocks=8, learning_rate=3.972343814074571e-05, optimizer=Adam, weight_decay=1.091858531268128e-06, batch_size=32,factor=1
Divergence detected. Stopping training after 10 epochs.
Early stopping at epoch 10
[I 2025-06-03 21:22:27,543] Trial 137 finished with value: 0.5505453695916269 and parameters: {'ff_dim': 128, 'dropout_rate': 0.48406944421676856, 'embed_dim': 256, 'learning_rate': 1.1159399641543927e-05, 'optimizer': 'Adam', 'weight_decay': 1.6084352287719507e-06, 'batch_size': 32, 'num_heads': 8, 'num_transformer_blocks': 8}. Best is trial 26 with value: 0.6503238949630876.
Trial 137, Fold 1: Test Accuracy = 0.5505
Hyperparameters: num_heads=8, num_transformer_blocks=8, learning_rate=4.210010636086002e-05, optimizer=Adam, weight_decay=1.1765452882904726e-06, batch_size=32,factor=1
Divergence detected. Stopping training after 10 epochs.
Early stopping at epoch 14
[I 2025-06-03 21:22:59,222] Trial 138 finished with value: 0.4034254742547425 and parameters: {'ff_dim': 128, 'dropout_rate': 0.49392600314775603, 'embed_dim': 256, 'learning_rate': 3.972343814074571e-05, 'optimizer': 'Adam', 'weight_decay': 1.091858531268128e-06, 'batch_size': 32, 'num_heads': 16, 'num_transformer_blocks': 8}. Best is trial 26 with value: 0.6503238949630876.
Trial 138, Fold 1: Test Accuracy = 0.4034
Hyperparameters: num_heads=8, num_transformer_blocks=8, learning_rate=4.801986179979074e-06, optimizer=Adam, weight_decay=1.298890661170391e-06, batch_size=32,factor=1
Divergence detected. Stopping training after 10 epochs.
Early stopping at epoch 22
[I 2025-06-03 21:24:04,112] Trial 139 finished with value: 0.5582277357256331 and parameters: {'ff_dim': 128, 'dropout_rate': 0.4901880152000981, 'embed_dim': 256, 'learning_rate': 4.210010636086002e-05, 'optimizer': 'Adam', 'weight_decay': 1.1765452882904726e-06, 'batch_size': 32, 'num_heads': 8, 'num_transformer_blocks': 8}. Best is trial 26 with value: 0.6503238949630876.
Trial 139, Fold 1: Test Accuracy = 0.5582
Hyperparameters: num_heads=8, num_transformer_blocks=8, learning_rate=4.381966233615878e-06, optimizer=Adam, weight_decay=1.2647926098951371e-06, batch_size=32,factor=1
Divergence detected. Stopping training after 10 epochs.
Early stopping at epoch 16
[I 2025-06-03 21:24:11,924] Trial 140 finished with value: 0.543699747687132 and parameters: {'ff_dim': 128, 'dropout_rate': 0.44406715972228245, 'embed_dim': 256, 'learning_rate': 4.801986179979074e-06, 'optimizer': 'Adam', 'weight_decay': 1.298890661170391e-06, 'batch_size': 32, 'num_heads': 8, 'num_transformer_blocks': 8}. Best is trial 26 with value: 0.6503238949630876.
Trial 140, Fold 1: Test Accuracy = 0.5437
Hyperparameters: num_heads=8, num_transformer_blocks=8, learning_rate=2.7909385133629147e-05, optimizer=Adam, weight_decay=1.3373418817353601e-05, batch_size=32,factor=1
Divergence detected. Stopping training after 10 epochs.
Early stopping at epoch 21
[I 2025-06-03 21:26:00,140] Trial 142 finished with value: 0.5528397346042425 and parameters: {'ff_dim': 1024, 'dropout_rate': 0.4599109705648494, 'embed_dim': 1024, 'learning_rate': 2.7909385133629147e-05, 'optimizer': 'Adam', 'weight_decay': 1.3373418817353601e-05, 'batch_size': 32, 'num_heads': 8, 'num_transformer_blocks': 8}. Best is trial 26 with value: 0.6503238949630876.
Trial 142, Fold 1: Test Accuracy = 0.5528
Hyperparameters: num_heads=8, num_transformer_blocks=32, learning_rate=1.409819903495246e-05, optimizer=Adam, weight_decay=2.5888705497465068e-06, batch_size=32,factor=1
Divergence detected. Stopping training after 10 epochs.
Early stopping at epoch 26
[I 2025-06-03 21:26:12,431] Trial 141 finished with value: 0.5636062984767779 and parameters: {'ff_dim': 128, 'dropout_rate': 0.47361753523369704, 'embed_dim': 256, 'learning_rate': 4.381966233615878e-06, 'optimizer': 'Adam', 'weight_decay': 1.2647926098951371e-06, 'batch_size': 32, 'num_heads': 8, 'num_transformer_blocks': 8}. Best is trial 26 with value: 0.6503238949630876.
Trial 141, Fold 1: Test Accuracy = 0.5636
Hyperparameters: num_heads=8, num_transformer_blocks=32, learning_rate=1.1968081029347325e-05, optimizer=Adam, weight_decay=2.5536656373712486e-06, batch_size=32,factor=1
Divergence detected. Stopping training after 10 epochs.
Early stopping at epoch 10
[I 2025-06-03 21:27:27,067] Trial 144 finished with value: 0.3812417531071863 and parameters: {'ff_dim': 1024, 'dropout_rate': 0.4085177537670149, 'embed_dim': 1024, 'learning_rate': 1.1968081029347325e-05, 'optimizer': 'Adam', 'weight_decay': 2.5536656373712486e-06, 'batch_size': 32, 'num_heads': 8, 'num_transformer_blocks': 32}. Best is trial 26 with value: 0.6503238949630876.
Trial 144, Fold 1: Test Accuracy = 0.3812
Hyperparameters: num_heads=8, num_transformer_blocks=8, learning_rate=6.903724963573547e-06, optimizer=Adam, weight_decay=1.8168013426840205e-06, batch_size=32,factor=1
Divergence detected. Stopping training after 10 epochs.
Early stopping at epoch 24
[I 2025-06-03 21:28:09,260] Trial 143 finished with value: 0.5734871507335764 and parameters: {'ff_dim': 128, 'dropout_rate': 0.43813671239686774, 'embed_dim': 256, 'learning_rate': 1.409819903495246e-05, 'optimizer': 'Adam', 'weight_decay': 2.5888705497465068e-06, 'batch_size': 32, 'num_heads': 8, 'num_transformer_blocks': 32}. Best is trial 26 with value: 0.6503238949630876.
Trial 143, Fold 1: Test Accuracy = 0.5735
Hyperparameters: num_heads=8, num_transformer_blocks=8, learning_rate=1.9091249372108328e-05, optimizer=Adam, weight_decay=2.0855428744550207e-06, batch_size=32,factor=1
Divergence detected. Stopping training after 10 epochs.
Early stopping at epoch 15
[I 2025-06-03 21:28:34,670] Trial 145 finished with value: 0.4209985048126343 and parameters: {'ff_dim': 128, 'dropout_rate': 0.4200378252115713, 'embed_dim': 64, 'learning_rate': 6.903724963573547e-06, 'optimizer': 'Adam', 'weight_decay': 1.8168013426840205e-06, 'batch_size': 32, 'num_heads': 8, 'num_transformer_blocks': 8}. Best is trial 26 with value: 0.6503238949630876.
Trial 145, Fold 1: Test Accuracy = 0.4210
Hyperparameters: num_heads=4, num_transformer_blocks=8, learning_rate=1.904704193985763e-05, optimizer=AdamW, weight_decay=2.0619745216825846e-06, batch_size=32,factor=1
Divergence detected. Stopping training after 10 epochs.
Early stopping at epoch 10
[I 2025-06-03 21:29:05,376] Trial 146 finished with value: 0.5322863283805251 and parameters: {'ff_dim': 128, 'dropout_rate': 0.2969059335441002, 'embed_dim': 64, 'learning_rate': 1.9091249372108328e-05, 'optimizer': 'Adam', 'weight_decay': 2.0855428744550207e-06, 'batch_size': 32, 'num_heads': 8, 'num_transformer_blocks': 8}. Best is trial 26 with value: 0.6503238949630876.
Trial 146, Fold 1: Test Accuracy = 0.5323
Hyperparameters: num_heads=4, num_transformer_blocks=8, learning_rate=8.451675019350264e-05, optimizer=AdamW, weight_decay=1.5714021145724927e-05, batch_size=16,factor=1
Divergence detected. Stopping training after 10 epochs.
Early stopping at epoch 11
Trial 147, Fold 1: Test Accuracy = 0.4854
[I 2025-06-03 21:32:30,545] Trial 147 finished with value: 0.4853983739837398 and parameters: {'ff_dim': 1024, 'dropout_rate': 0.42769973137551764, 'embed_dim': 2048, 'learning_rate': 1.904704193985763e-05, 'optimizer': 'AdamW', 'weight_decay': 2.0619745216825846e-06, 'batch_size': 32, 'num_heads': 4, 'num_transformer_blocks': 8}. Best is trial 26 with value: 0.6503238949630876.
Hyperparameters: num_heads=1, num_transformer_blocks=32, learning_rate=5.597923949171476e-05, optimizer=Adam, weight_decay=1.5132283647198769e-05, batch_size=16,factor=1
Divergence detected. Stopping training after 10 epochs.
Early stopping at epoch 24
Trial 148, Fold 1: Test Accuracy = 0.3333
[I 2025-06-03 21:43:21,524] Trial 148 finished with value: 0.3333333333333333 and parameters: {'ff_dim': 1024, 'dropout_rate': 0.4310425186265874, 'embed_dim': 2048, 'learning_rate': 8.451675019350264e-05, 'optimizer': 'AdamW', 'weight_decay': 1.5714021145724927e-05, 'batch_size': 16, 'num_heads': 4, 'num_transformer_blocks': 8}. Best is trial 26 with value: 0.6503238949630876.
Hyperparameters: num_heads=1, num_transformer_blocks=32, learning_rate=5.262362313661389e-05, optimizer=Adam, weight_decay=1.1388756968500948e-05, batch_size=10,factor=1
Divergence detected. Stopping training after 10 epochs.
Early stopping at epoch 17
Trial 149, Fold 1: Test Accuracy = 0.3333
[I 2025-06-03 21:49:45,672] Trial 149 finished with value: 0.3333333333333333 and parameters: {'ff_dim': 1024, 'dropout_rate': 0.44975089528636136, 'embed_dim': 1024, 'learning_rate': 5.597923949171476e-05, 'optimizer': 'Adam', 'weight_decay': 1.5132283647198769e-05, 'batch_size': 16, 'num_heads': 1, 'num_transformer_blocks': 32}. Best is trial 26 with value: 0.6503238949630876.
Hyperparameters: num_heads=8, num_transformer_blocks=2, learning_rate=3.0385960196957858e-05, optimizer=Adam, weight_decay=1.12409718040724e-05, batch_size=10,factor=1
Divergence detected. Stopping training after 10 epochs.
Early stopping at epoch 16
Trial 151, Fold 1: Test Accuracy = 0.5862
[I 2025-06-03 21:51:53,793] Trial 151 finished with value: 0.5861585833099711 and parameters: {'ff_dim': 128, 'dropout_rate': 0.40051726090111495, 'embed_dim': 1024, 'learning_rate': 3.0385960196957858e-05, 'optimizer': 'Adam', 'weight_decay': 1.12409718040724e-05, 'batch_size': 10, 'num_heads': 8, 'num_transformer_blocks': 2}. Best is trial 26 with value: 0.6503238949630876.
Hyperparameters: num_heads=8, num_transformer_blocks=4, learning_rate=2.2299662909549243e-05, optimizer=Adam, weight_decay=4.9862343972045965e-06, batch_size=10,factor=1
Divergence detected. Stopping training after 10 epochs.
Early stopping at epoch 21
[I 2025-06-03 21:53:00,612] Trial 150 finished with value: 0.3333333333333333 and parameters: {'ff_dim': 128, 'dropout_rate': 0.45636702652212846, 'embed_dim': 1024, 'learning_rate': 5.262362313661389e-05, 'optimizer': 'Adam', 'weight_decay': 1.1388756968500948e-05, 'batch_size': 10, 'num_heads': 1, 'num_transformer_blocks': 32}. Best is trial 26 with value: 0.6503238949630876.
Trial 150, Fold 1: Test Accuracy = 0.3333
Hyperparameters: num_heads=8, num_transformer_blocks=4, learning_rate=2.429226726395969e-05, optimizer=Adam, weight_decay=3.945713168323091e-06, batch_size=10,factor=1
Divergence detected. Stopping training after 10 epochs.
Early stopping at epoch 16
[I 2025-06-03 21:53:39,888] Trial 152 finished with value: 0.5283709933651061 and parameters: {'ff_dim': 64, 'dropout_rate': 0.15408343968915328, 'embed_dim': 1024, 'learning_rate': 2.2299662909549243e-05, 'optimizer': 'Adam', 'weight_decay': 4.9862343972045965e-06, 'batch_size': 10, 'num_heads': 8, 'num_transformer_blocks': 4}. Best is trial 26 with value: 0.6503238949630876.
Trial 152, Fold 1: Test Accuracy = 0.5284
Hyperparameters: num_heads=8, num_transformer_blocks=4, learning_rate=2.7396936161857595e-05, optimizer=Adam, weight_decay=3.2797323544607516e-06, batch_size=10,factor=1
Divergence detected. Stopping training after 10 epochs.
Early stopping at epoch 15
[I 2025-06-03 21:54:31,021] Trial 153 finished with value: 0.5478858050649472 and parameters: {'ff_dim': 64, 'dropout_rate': 0.19692457769344504, 'embed_dim': 1024, 'learning_rate': 2.429226726395969e-05, 'optimizer': 'Adam', 'weight_decay': 3.945713168323091e-06, 'batch_size': 10, 'num_heads': 8, 'num_transformer_blocks': 4}. Best is trial 26 with value: 0.6503238949630876.
Trial 153, Fold 1: Test Accuracy = 0.5479
Hyperparameters: num_heads=8, num_transformer_blocks=4, learning_rate=8.605494375889457e-06, optimizer=Adam, weight_decay=3.422246953154291e-06, batch_size=10,factor=1
Divergence detected. Stopping training after 10 epochs.
Early stopping at epoch 13
[I 2025-06-03 21:55:07,262] Trial 154 finished with value: 0.5214650967199327 and parameters: {'ff_dim': 64, 'dropout_rate': 0.46908223427569473, 'embed_dim': 1024, 'learning_rate': 2.7396936161857595e-05, 'optimizer': 'Adam', 'weight_decay': 3.2797323544607516e-06, 'batch_size': 10, 'num_heads': 8, 'num_transformer_blocks': 4}. Best is trial 26 with value: 0.6503238949630876.
Trial 154, Fold 1: Test Accuracy = 0.5215
Hyperparameters: num_heads=8, num_transformer_blocks=4, learning_rate=8.120652689109823e-06, optimizer=Adam, weight_decay=2.1783396328342504e-05, batch_size=10,factor=1
Divergence detected. Stopping training after 10 epochs.
Early stopping at epoch 14
[I 2025-06-03 21:56:03,999] Trial 155 finished with value: 0.5466537706756378 and parameters: {'ff_dim': 64, 'dropout_rate': 0.24535643659376286, 'embed_dim': 1024, 'learning_rate': 8.605494375889457e-06, 'optimizer': 'Adam', 'weight_decay': 3.422246953154291e-06, 'batch_size': 10, 'num_heads': 8, 'num_transformer_blocks': 4}. Best is trial 26 with value: 0.6503238949630876.
Trial 155, Fold 1: Test Accuracy = 0.5467
Hyperparameters: num_heads=8, num_transformer_blocks=4, learning_rate=0.0001340806489579121, optimizer=Adam, weight_decay=1.8572892950073395e-05, batch_size=10,factor=1
Divergence detected. Stopping training after 10 epochs.
Early stopping at epoch 20
[I 2025-06-03 21:57:14,678] Trial 156 finished with value: 0.48732296047098406 and parameters: {'ff_dim': 512, 'dropout_rate': 0.48413493370303856, 'embed_dim': 1024, 'learning_rate': 8.120652689109823e-06, 'optimizer': 'Adam', 'weight_decay': 2.1783396328342504e-05, 'batch_size': 10, 'num_heads': 8, 'num_transformer_blocks': 4}. Best is trial 26 with value: 0.6503238949630876.
Trial 156, Fold 1: Test Accuracy = 0.4873
Hyperparameters: num_heads=8, num_transformer_blocks=8, learning_rate=0.00012892783230313994, optimizer=Adam, weight_decay=1.6342221133485596e-06, batch_size=10,factor=1
Divergence detected. Stopping training after 10 epochs.
Early stopping at epoch 14
[I 2025-06-03 21:57:38,668] Trial 157 finished with value: 0.34959349593495936 and parameters: {'ff_dim': 512, 'dropout_rate': 0.21057289607809726, 'embed_dim': 1024, 'learning_rate': 0.0001340806489579121, 'optimizer': 'Adam', 'weight_decay': 1.8572892950073395e-05, 'batch_size': 10, 'num_heads': 8, 'num_transformer_blocks': 4}. Best is trial 26 with value: 0.6503238949630876.
Trial 157, Fold 1: Test Accuracy = 0.3496
Hyperparameters: num_heads=8, num_transformer_blocks=8, learning_rate=3.817090972753421e-05, optimizer=Adam, weight_decay=1.7065652910883664e-06, batch_size=10,factor=1
Divergence detected. Stopping training after 10 epochs.
Early stopping at epoch 10
Trial 158, Fold 1: Test Accuracy = 0.3333
[I 2025-06-03 21:58:48,773] Trial 158 finished with value: 0.3333333333333333 and parameters: {'ff_dim': 2048, 'dropout_rate': 0.21138240675030265, 'embed_dim': 1024, 'learning_rate': 0.00012892783230313994, 'optimizer': 'Adam', 'weight_decay': 1.6342221133485596e-06, 'batch_size': 10, 'num_heads': 8, 'num_transformer_blocks': 8}. Best is trial 26 with value: 0.6503238949630876.
Hyperparameters: num_heads=8, num_transformer_blocks=4, learning_rate=4.5441279143770335e-05, optimizer=Adam, weight_decay=4.231607629839888e-06, batch_size=10,factor=1
Divergence detected. Stopping training after 10 epochs.
Early stopping at epoch 23
[I 2025-06-03 22:00:35,133] Trial 159 finished with value: 0.5739144939725259 and parameters: {'ff_dim': 2048, 'dropout_rate': 0.1851890214649858, 'embed_dim': 1024, 'learning_rate': 3.817090972753421e-05, 'optimizer': 'Adam', 'weight_decay': 1.7065652910883664e-06, 'batch_size': 10, 'num_heads': 8, 'num_transformer_blocks': 8}. Best is trial 26 with value: 0.6503238949630876.
Trial 159, Fold 1: Test Accuracy = 0.5739
Divergence detected. Stopping training after 10 epochs.
Early stopping at epoch 15
Hyperparameters: num_heads=8, num_transformer_blocks=4, learning_rate=0.0490192458305797, optimizer=Adam, weight_decay=1.2985509380887581e-05, batch_size=10,factor=1
[I 2025-06-03 22:00:37,301] Trial 160 finished with value: 0.5674656574151948 and parameters: {'ff_dim': 64, 'dropout_rate': 0.17375541012878595, 'embed_dim': 128, 'learning_rate': 4.5441279143770335e-05, 'optimizer': 'Adam', 'weight_decay': 4.231607629839888e-06, 'batch_size': 10, 'num_heads': 8, 'num_transformer_blocks': 4}. Best is trial 26 with value: 0.6503238949630876.
Trial 160, Fold 1: Test Accuracy = 0.5675
Hyperparameters: num_heads=8, num_transformer_blocks=16, learning_rate=7.192146634157417e-07, optimizer=Adam, weight_decay=1.9018382994779144e-05, batch_size=10,factor=1
Divergence detected. Stopping training after 10 epochs.
Early stopping at epoch 16
[I 2025-06-03 22:02:51,097] Trial 162 finished with value: 0.5263939818708532 and parameters: {'ff_dim': 64, 'dropout_rate': 0.18761018059114104, 'embed_dim': 1024, 'learning_rate': 7.192146634157417e-07, 'optimizer': 'Adam', 'weight_decay': 1.9018382994779144e-05, 'batch_size': 10, 'num_heads': 8, 'num_transformer_blocks': 16}. Best is trial 26 with value: 0.6503238949630876.
Trial 162, Fold 1: Test Accuracy = 0.5264
Hyperparameters: num_heads=8, num_transformer_blocks=2, learning_rate=1.3699723812544847e-07, optimizer=Adam, weight_decay=1.3901200117764658e-05, batch_size=10,factor=1
[I 2025-06-03 22:03:02,325] Trial 161 finished with value: 0.3333333333333333 and parameters: {'ff_dim': 64, 'dropout_rate': 0.23703526376978784, 'embed_dim': 128, 'learning_rate': 0.0490192458305797, 'optimizer': 'Adam', 'weight_decay': 1.2985509380887581e-05, 'batch_size': 10, 'num_heads': 8, 'num_transformer_blocks': 4}. Best is trial 26 with value: 0.6503238949630876.
Trial 161, Fold 1: Test Accuracy = 0.3333
Hyperparameters: num_heads=8, num_transformer_blocks=2, learning_rate=2.1170141561285303e-07, optimizer=Adam, weight_decay=2.2644022089853288e-05, batch_size=10,factor=1
Divergence detected. Stopping training after 10 epochs.
Early stopping at epoch 21
Trial 163, Fold 1: Test Accuracy = 0.4833
[I 2025-06-03 22:05:07,457] Trial 163 finished with value: 0.48332445565834964 and parameters: {'ff_dim': 1024, 'dropout_rate': 0.4177908436390044, 'embed_dim': 1024, 'learning_rate': 1.3699723812544847e-07, 'optimizer': 'Adam', 'weight_decay': 1.3901200117764658e-05, 'batch_size': 10, 'num_heads': 8, 'num_transformer_blocks': 2}. Best is trial 26 with value: 0.6503238949630876.
Hyperparameters: num_heads=8, num_transformer_blocks=1, learning_rate=1.9920942893806854e-07, optimizer=Adam, weight_decay=1.1449960715460778e-06, batch_size=10,factor=1
[I 2025-06-03 22:05:57,569] Trial 164 finished with value: 0.584400523315578 and parameters: {'ff_dim': 32, 'dropout_rate': 0.4141425576364578, 'embed_dim': 1024, 'learning_rate': 2.1170141561285303e-07, 'optimizer': 'Adam', 'weight_decay': 2.2644022089853288e-05, 'batch_size': 10, 'num_heads': 8, 'num_transformer_blocks': 2}. Best is trial 26 with value: 0.6503238949630876.
Trial 164, Fold 1: Test Accuracy = 0.5844
Hyperparameters: num_heads=2, num_transformer_blocks=1, learning_rate=3.1827455783877265e-07, optimizer=Adam, weight_decay=1.403337752543182e-06, batch_size=10,factor=1
