[I 2025-06-03 18:26:45,519] A new study created in memory with name: no-name-24ddd026-02af-4a62-baf1-635b7d7ea6a8
Hyperparameters: num_heads=1, num_transformer_blocks=1, learning_rate=0.0013193336254679069, optimizer=AdamW, weight_decay=4.347817447849854e-06, batch_size=32,factor=1Hyperparameters: num_heads=1, num_transformer_blocks=1, learning_rate=0.00679358174295443, optimizer=Adam, weight_decay=0.0006566370702890061, batch_size=16,factor=1

Divergence detected. Stopping training after 10 epochs.
Early stopping at epoch 11
[I 2025-06-03 18:27:40,753] Trial 1 finished with value: 0.3333333333333333 and parameters: {'ff_dim': 2048, 'dropout_rate': 0.43263635416977186, 'embed_dim': 2048, 'learning_rate': 0.0013193336254679069, 'optimizer': 'AdamW', 'weight_decay': 4.347817447849854e-06, 'batch_size': 32, 'num_heads': 1, 'num_transformer_blocks': 1}. Best is trial 1 with value: 0.3333333333333333.
Trial 1, Fold 1: Test Accuracy = 0.3333
Hyperparameters: num_heads=1, num_transformer_blocks=32, learning_rate=0.04807875297313321, optimizer=AdamW, weight_decay=3.484426353895784e-06, batch_size=32,factor=1
Divergence detected. Stopping training after 10 epochs.
Early stopping at epoch 19
Trial 0, Fold 1: Test Accuracy = 0.3333
[I 2025-06-03 18:31:10,133] Trial 0 finished with value: 0.3333333333333333 and parameters: {'ff_dim': 256, 'dropout_rate': 0.43362332700336836, 'embed_dim': 1024, 'learning_rate': 0.00679358174295443, 'optimizer': 'Adam', 'weight_decay': 0.0006566370702890061, 'batch_size': 16, 'num_heads': 1, 'num_transformer_blocks': 1}. Best is trial 1 with value: 0.3333333333333333.
Hyperparameters: num_heads=2, num_transformer_blocks=4, learning_rate=0.008186968632148342, optimizer=AdamW, weight_decay=3.204216421393228e-05, batch_size=10,factor=1
Divergence detected. Stopping training after 10 epochs.
Early stopping at epoch 12
Trial 2, Fold 1: Test Accuracy = 0.3333
[I 2025-06-03 18:44:32,662] Trial 2 finished with value: 0.3333333333333333 and parameters: {'ff_dim': 256, 'dropout_rate': 0.1738276010475397, 'embed_dim': 2048, 'learning_rate': 0.04807875297313321, 'optimizer': 'AdamW', 'weight_decay': 3.484426353895784e-06, 'batch_size': 32, 'num_heads': 1, 'num_transformer_blocks': 32}. Best is trial 1 with value: 0.3333333333333333.
Hyperparameters: num_heads=16, num_transformer_blocks=8, learning_rate=1.5750531398696317e-06, optimizer=AdamW, weight_decay=0.00010553449421366309, batch_size=16,factor=1
Divergence detected. Stopping training after 10 epochs.
Early stopping at epoch 19
Divergence detected. Stopping training after 10 epochs.
Early stopping at epoch 18
Trial 3, Fold 1: Test Accuracy = 0.3333
Trial 4, Fold 1: Test Accuracy = 0.5130
[I 2025-06-03 18:47:50,442] Trial 4 finished with value: 0.5130330810204654 and parameters: {'ff_dim': 1024, 'dropout_rate': 0.1394854895462511, 'embed_dim': 64, 'learning_rate': 1.5750531398696317e-06, 'optimizer': 'AdamW', 'weight_decay': 0.00010553449421366309, 'batch_size': 16, 'num_heads': 16, 'num_transformer_blocks': 8}. Best is trial 4 with value: 0.5130330810204654.
[I 2025-06-03 18:47:50,459] Trial 3 finished with value: 0.3333333333333333 and parameters: {'ff_dim': 32, 'dropout_rate': 0.27530344424204845, 'embed_dim': 1024, 'learning_rate': 0.008186968632148342, 'optimizer': 'AdamW', 'weight_decay': 3.204216421393228e-05, 'batch_size': 10, 'num_heads': 2, 'num_transformer_blocks': 4}. Best is trial 4 with value: 0.5130330810204654.
Hyperparameters: num_heads=8, num_transformer_blocks=8, learning_rate=1.2583875745165507e-05, optimizer=AdamW, weight_decay=2.589471277662896e-05, batch_size=32,factor=1
Hyperparameters: num_heads=4, num_transformer_blocks=16, learning_rate=8.375511762014259e-05, optimizer=Adam, weight_decay=0.000544808017025773, batch_size=10,factor=1
Divergence detected. Stopping training after 10 epochs.
Early stopping at epoch 16
[I 2025-06-03 18:49:33,758] Trial 6 finished with value: 0.3568858050649472 and parameters: {'ff_dim': 256, 'dropout_rate': 0.324941841283681, 'embed_dim': 256, 'learning_rate': 8.375511762014259e-05, 'optimizer': 'Adam', 'weight_decay': 0.000544808017025773, 'batch_size': 10, 'num_heads': 4, 'num_transformer_blocks': 16}. Best is trial 4 with value: 0.5130330810204654.
Trial 6, Fold 1: Test Accuracy = 0.3569
Hyperparameters: num_heads=16, num_transformer_blocks=8, learning_rate=7.693678195784438e-06, optimizer=Adam, weight_decay=0.00011078363714101272, batch_size=32,factor=1
Divergence detected. Stopping training after 10 epochs.
Early stopping at epoch 25
[I 2025-06-03 18:49:39,172] Trial 5 finished with value: 0.5881394262218484 and parameters: {'ff_dim': 128, 'dropout_rate': 0.3692721063835519, 'embed_dim': 256, 'learning_rate': 1.2583875745165507e-05, 'optimizer': 'AdamW', 'weight_decay': 2.589471277662896e-05, 'batch_size': 32, 'num_heads': 8, 'num_transformer_blocks': 8}. Best is trial 5 with value: 0.5881394262218484.
Trial 5, Fold 1: Test Accuracy = 0.5881
Hyperparameters: num_heads=1, num_transformer_blocks=32, learning_rate=0.0970330469435641, optimizer=AdamW, weight_decay=1.4287596891987518e-06, batch_size=10,factor=1
Divergence detected. Stopping training after 10 epochs.
Early stopping at epoch 22
[I 2025-06-03 18:51:08,108] Trial 7 finished with value: 0.56460685917204 and parameters: {'ff_dim': 32, 'dropout_rate': 0.3445514801480976, 'embed_dim': 512, 'learning_rate': 7.693678195784438e-06, 'optimizer': 'Adam', 'weight_decay': 0.00011078363714101272, 'batch_size': 32, 'num_heads': 16, 'num_transformer_blocks': 8}. Best is trial 5 with value: 0.5881394262218484.
Trial 7, Fold 1: Test Accuracy = 0.5646
Hyperparameters: num_heads=1, num_transformer_blocks=4, learning_rate=0.0105406404344277, optimizer=Adam, weight_decay=1.38414468782579e-06, batch_size=10,factor=1
Divergence detected. Stopping training after 10 epochs.
Early stopping at epoch 12
[I 2025-06-03 18:51:15,994] Trial 8 finished with value: 0.3333333333333333 and parameters: {'ff_dim': 512, 'dropout_rate': 0.3328680691280972, 'embed_dim': 32, 'learning_rate': 0.0970330469435641, 'optimizer': 'AdamW', 'weight_decay': 1.4287596891987518e-06, 'batch_size': 10, 'num_heads': 1, 'num_transformer_blocks': 32}. Best is trial 5 with value: 0.5881394262218484.
Trial 8, Fold 1: Test Accuracy = 0.3333
Hyperparameters: num_heads=1, num_transformer_blocks=1, learning_rate=0.0001237607747730718, optimizer=AdamW, weight_decay=0.00013490139993485483, batch_size=10,factor=1
Divergence detected. Stopping training after 10 epochs.
Early stopping at epoch 15
[I 2025-06-03 18:52:17,035] Trial 9 finished with value: 0.3333333333333333 and parameters: {'ff_dim': 1024, 'dropout_rate': 0.4766191822073682, 'embed_dim': 64, 'learning_rate': 0.0105406404344277, 'optimizer': 'Adam', 'weight_decay': 1.38414468782579e-06, 'batch_size': 10, 'num_heads': 1, 'num_transformer_blocks': 4}. Best is trial 5 with value: 0.5881394262218484.
Trial 9, Fold 1: Test Accuracy = 0.3333
Hyperparameters: num_heads=8, num_transformer_blocks=2, learning_rate=1.4825323936761478e-07, optimizer=AdamW, weight_decay=1.4042817096237775e-05, batch_size=32,factor=1
Divergence detected. Stopping training after 10 epochs.
Early stopping at epoch 15
[I 2025-06-03 18:52:20,188] Trial 10 finished with value: 0.5484235118213251 and parameters: {'ff_dim': 64, 'dropout_rate': 0.425025272326211, 'embed_dim': 32, 'learning_rate': 0.0001237607747730718, 'optimizer': 'AdamW', 'weight_decay': 0.00013490139993485483, 'batch_size': 10, 'num_heads': 1, 'num_transformer_blocks': 1}. Best is trial 5 with value: 0.5881394262218484.
Trial 10, Fold 1: Test Accuracy = 0.5484
Hyperparameters: num_heads=8, num_transformer_blocks=8, learning_rate=8.054615135714524e-07, optimizer=Adam, weight_decay=2.8311792140434e-05, batch_size=32,factor=1
Divergence detected. Stopping training after 10 epochs.
Early stopping at epoch 27
[I 2025-06-03 18:54:09,924] Trial 11 finished with value: 0.43820605550883096 and parameters: {'ff_dim': 128, 'dropout_rate': 0.2282748135637853, 'embed_dim': 256, 'learning_rate': 1.4825323936761478e-07, 'optimizer': 'AdamW', 'weight_decay': 1.4042817096237775e-05, 'batch_size': 32, 'num_heads': 8, 'num_transformer_blocks': 2}. Best is trial 5 with value: 0.5881394262218484.
Trial 11, Fold 1: Test Accuracy = 0.4382
Hyperparameters: num_heads=8, num_transformer_blocks=8, learning_rate=9.828119315447494e-06, optimizer=Adam, weight_decay=7.190269039180811e-05, batch_size=32,factor=1
[I 2025-06-03 18:54:28,938] Trial 12 finished with value: 0.5846976918045043 and parameters: {'ff_dim': 128, 'dropout_rate': 0.2483319449786801, 'embed_dim': 512, 'learning_rate': 8.054615135714524e-07, 'optimizer': 'Adam', 'weight_decay': 2.8311792140434e-05, 'batch_size': 32, 'num_heads': 8, 'num_transformer_blocks': 8}. Best is trial 5 with value: 0.5881394262218484.
Trial 12, Fold 1: Test Accuracy = 0.5847
Hyperparameters: num_heads=8, num_transformer_blocks=8, learning_rate=2.8651652621528425e-06, optimizer=Adam, weight_decay=2.2876768104774008e-05, batch_size=32,factor=1
Divergence detected. Stopping training after 10 epochs.
Early stopping at epoch 22
[I 2025-06-03 18:55:49,344] Trial 13 finished with value: 0.5875227548827212 and parameters: {'ff_dim': 32, 'dropout_rate': 0.35571723810745565, 'embed_dim': 512, 'learning_rate': 9.828119315447494e-06, 'optimizer': 'Adam', 'weight_decay': 7.190269039180811e-05, 'batch_size': 32, 'num_heads': 8, 'num_transformer_blocks': 8}. Best is trial 5 with value: 0.5881394262218484.
Trial 13, Fold 1: Test Accuracy = 0.5875
Hyperparameters: num_heads=8, num_transformer_blocks=8, learning_rate=1.7769287351742334e-05, optimizer=Adam, weight_decay=4.3021903523266696e-05, batch_size=32,factor=1
[I 2025-06-03 18:56:36,450] Trial 14 finished with value: 0.5810396224651901 and parameters: {'ff_dim': 128, 'dropout_rate': 0.25076649982390004, 'embed_dim': 128, 'learning_rate': 2.8651652621528425e-06, 'optimizer': 'Adam', 'weight_decay': 2.2876768104774008e-05, 'batch_size': 32, 'num_heads': 8, 'num_transformer_blocks': 8}. Best is trial 5 with value: 0.5881394262218484.
Trial 14, Fold 1: Test Accuracy = 0.5810
Hyperparameters: num_heads=8, num_transformer_blocks=8, learning_rate=3.461539792790534e-05, optimizer=Adam, weight_decay=0.0002545677491856814, batch_size=32,factor=1
Divergence detected. Stopping training after 10 epochs.
Early stopping at epoch 11
[I 2025-06-03 18:56:41,542] Trial 15 finished with value: 0.5656072329688814 and parameters: {'ff_dim': 128, 'dropout_rate': 0.3829465076196591, 'embed_dim': 128, 'learning_rate': 1.7769287351742334e-05, 'optimizer': 'Adam', 'weight_decay': 4.3021903523266696e-05, 'batch_size': 32, 'num_heads': 8, 'num_transformer_blocks': 8}. Best is trial 5 with value: 0.5881394262218484.
Trial 15, Fold 1: Test Accuracy = 0.5656
Hyperparameters: num_heads=8, num_transformer_blocks=2, learning_rate=0.00010986100171511135, optimizer=AdamW, weight_decay=8.739723735712548e-06, batch_size=32,factor=1
Divergence detected. Stopping training after 10 epochs.
Early stopping at epoch 22
[I 2025-06-03 18:58:17,112] Trial 16 finished with value: 0.5919292589477619 and parameters: {'ff_dim': 32, 'dropout_rate': 0.37836353824573477, 'embed_dim': 512, 'learning_rate': 3.461539792790534e-05, 'optimizer': 'Adam', 'weight_decay': 0.0002545677491856814, 'batch_size': 32, 'num_heads': 8, 'num_transformer_blocks': 8}. Best is trial 16 with value: 0.5919292589477619.
Trial 16, Fold 1: Test Accuracy = 0.5919
Hyperparameters: num_heads=4, num_transformer_blocks=16, learning_rate=0.0001178661737332715, optimizer=AdamW, weight_decay=0.0002722351003260034, batch_size=16,factor=1
Divergence detected. Stopping training after 10 epochs.
Early stopping at epoch 29
[I 2025-06-03 18:58:43,241] Trial 17 finished with value: 0.5204137931034483 and parameters: {'ff_dim': 32, 'dropout_rate': 0.37371446721344487, 'embed_dim': 256, 'learning_rate': 0.00010986100171511135, 'optimizer': 'AdamW', 'weight_decay': 8.739723735712548e-06, 'batch_size': 32, 'num_heads': 8, 'num_transformer_blocks': 2}. Best is trial 16 with value: 0.5919292589477619.
Trial 17, Fold 1: Test Accuracy = 0.5204
Hyperparameters: num_heads=4, num_transformer_blocks=16, learning_rate=0.0004081248932659297, optimizer=Adam, weight_decay=0.0002608156045259721, batch_size=16,factor=1
Divergence detected. Stopping training after 10 epochs.
Early stopping at epoch 11
[I 2025-06-03 18:59:18,044] Trial 18 finished with value: 0.5492045603214654 and parameters: {'ff_dim': 512, 'dropout_rate': 0.3922491742392207, 'embed_dim': 256, 'learning_rate': 0.0001178661737332715, 'optimizer': 'AdamW', 'weight_decay': 0.0002722351003260034, 'batch_size': 16, 'num_heads': 4, 'num_transformer_blocks': 16}. Best is trial 16 with value: 0.5919292589477619.
Trial 18, Fold 1: Test Accuracy = 0.5492
Hyperparameters: num_heads=2, num_transformer_blocks=8, learning_rate=0.0007563807668614231, optimizer=Adam, weight_decay=0.0002934494374891318, batch_size=32,factor=1
Divergence detected. Stopping training after 10 epochs.
Early stopping at epoch 11
Divergence detected. Stopping training after 10 epochs.
Early stopping at epoch 16
[I 2025-06-03 19:00:09,767] Trial 20 finished with value: 0.3333333333333333 and parameters: {'ff_dim': 64, 'dropout_rate': 0.48754295458125907, 'embed_dim': 512, 'learning_rate': 0.0007563807668614231, 'optimizer': 'Adam', 'weight_decay': 0.0002934494374891318, 'batch_size': 32, 'num_heads': 2, 'num_transformer_blocks': 8}. Best is trial 16 with value: 0.5919292589477619.
Trial 20, Fold 1: Test Accuracy = 0.3333
Hyperparameters: num_heads=8, num_transformer_blocks=8, learning_rate=2.853105348794372e-07, optimizer=Adam, weight_decay=0.00022740508011197526, batch_size=16,factor=1
[I 2025-06-03 19:00:10,146] Trial 19 finished with value: 0.3333333333333333 and parameters: {'ff_dim': 64, 'dropout_rate': 0.4958121341284249, 'embed_dim': 256, 'learning_rate': 0.0004081248932659297, 'optimizer': 'Adam', 'weight_decay': 0.0002608156045259721, 'batch_size': 16, 'num_heads': 4, 'num_transformer_blocks': 16}. Best is trial 16 with value: 0.5919292589477619.
Trial 19, Fold 1: Test Accuracy = 0.3333
Hyperparameters: num_heads=8, num_transformer_blocks=8, learning_rate=2.665825201952351e-05, optimizer=Adam, weight_decay=5.516487755530608e-05, batch_size=32,factor=1
Divergence detected. Stopping training after 10 epochs.
Early stopping at epoch 17
[I 2025-06-03 19:01:31,248] Trial 22 finished with value: 0.5435378936547987 and parameters: {'ff_dim': 32, 'dropout_rate': 0.30665238904471165, 'embed_dim': 512, 'learning_rate': 2.665825201952351e-05, 'optimizer': 'Adam', 'weight_decay': 5.516487755530608e-05, 'batch_size': 32, 'num_heads': 8, 'num_transformer_blocks': 8}. Best is trial 16 with value: 0.5919292589477619.
Trial 22, Fold 1: Test Accuracy = 0.5435
Hyperparameters: num_heads=8, num_transformer_blocks=8, learning_rate=6.383854380731627e-06, optimizer=Adam, weight_decay=8.656933512509698e-05, batch_size=32,factor=1
[I 2025-06-03 19:02:36,835] Trial 21 finished with value: 0.5520170077562845 and parameters: {'ff_dim': 2048, 'dropout_rate': 0.29781919974826393, 'embed_dim': 512, 'learning_rate': 2.853105348794372e-07, 'optimizer': 'Adam', 'weight_decay': 0.00022740508011197526, 'batch_size': 16, 'num_heads': 8, 'num_transformer_blocks': 8}. Best is trial 16 with value: 0.5919292589477619.
Trial 21, Fold 1: Test Accuracy = 0.5520
Hyperparameters: num_heads=8, num_transformer_blocks=8, learning_rate=6.6810291475187645e-06, optimizer=Adam, weight_decay=7.171869442970251e-05, batch_size=32,factor=1
Divergence detected. Stopping training after 10 epochs.
Early stopping at epoch 29
[I 2025-06-03 19:03:43,518] Trial 23 finished with value: 0.5422499766376974 and parameters: {'ff_dim': 32, 'dropout_rate': 0.36831839487237095, 'embed_dim': 512, 'learning_rate': 6.383854380731627e-06, 'optimizer': 'Adam', 'weight_decay': 8.656933512509698e-05, 'batch_size': 32, 'num_heads': 8, 'num_transformer_blocks': 8}. Best is trial 16 with value: 0.5919292589477619.
Trial 23, Fold 1: Test Accuracy = 0.5422
Hyperparameters: num_heads=8, num_transformer_blocks=8, learning_rate=1.9946131783322012e-05, optimizer=Adam, weight_decay=1.2461233524659157e-05, batch_size=32,factor=1
Divergence detected. Stopping training after 10 epochs.
Early stopping at epoch 24
[I 2025-06-03 19:04:24,826] Trial 24 finished with value: 0.5105493879076722 and parameters: {'ff_dim': 32, 'dropout_rate': 0.37126941384032125, 'embed_dim': 512, 'learning_rate': 6.6810291475187645e-06, 'optimizer': 'Adam', 'weight_decay': 7.171869442970251e-05, 'batch_size': 32, 'num_heads': 8, 'num_transformer_blocks': 8}. Best is trial 16 with value: 0.5919292589477619.
Trial 24, Fold 1: Test Accuracy = 0.5105
Hyperparameters: num_heads=8, num_transformer_blocks=8, learning_rate=3.9184066289991565e-05, optimizer=Adam, weight_decay=2.0147478549329628e-05, batch_size=32,factor=1
Divergence detected. Stopping training after 10 epochs.
Early stopping at epoch 16
[I 2025-06-03 19:04:57,911] Trial 25 finished with value: 0.54753826745164 and parameters: {'ff_dim': 32, 'dropout_rate': 0.40691749661151494, 'embed_dim': 512, 'learning_rate': 1.9946131783322012e-05, 'optimizer': 'Adam', 'weight_decay': 1.2461233524659157e-05, 'batch_size': 32, 'num_heads': 8, 'num_transformer_blocks': 8}. Best is trial 16 with value: 0.5919292589477619.
Trial 25, Fold 1: Test Accuracy = 0.5475
Hyperparameters: num_heads=2, num_transformer_blocks=2, learning_rate=3.8834055973784724e-05, optimizer=AdamW, weight_decay=0.0009153467137366323, batch_size=32,factor=1
Divergence detected. Stopping training after 10 epochs.
Early stopping at epoch 14
[I 2025-06-03 19:05:31,843] Trial 26 finished with value: 0.6503238949630876 and parameters: {'ff_dim': 32, 'dropout_rate': 0.4099952333473971, 'embed_dim': 512, 'learning_rate': 3.9184066289991565e-05, 'optimizer': 'Adam', 'weight_decay': 2.0147478549329628e-05, 'batch_size': 32, 'num_heads': 8, 'num_transformer_blocks': 8}. Best is trial 26 with value: 0.6503238949630876.
Trial 26, Fold 1: Test Accuracy = 0.6503
Hyperparameters: num_heads=2, num_transformer_blocks=4, learning_rate=5.258486107197146e-05, optimizer=AdamW, weight_decay=0.0009970642366440889, batch_size=32,factor=1
Divergence detected. Stopping training after 10 epochs.
Early stopping at epoch 16
[I 2025-06-03 19:06:10,640] Trial 27 finished with value: 0.4874581814783665 and parameters: {'ff_dim': 128, 'dropout_rate': 0.3508962316260365, 'embed_dim': 64, 'learning_rate': 3.8834055973784724e-05, 'optimizer': 'AdamW', 'weight_decay': 0.0009153467137366323, 'batch_size': 32, 'num_heads': 2, 'num_transformer_blocks': 2}. Best is trial 26 with value: 0.6503238949630876.
Trial 27, Fold 1: Test Accuracy = 0.4875
Hyperparameters: num_heads=16, num_transformer_blocks=4, learning_rate=0.0002954607860354472, optimizer=AdamW, weight_decay=6.927121073224244e-06, batch_size=32,factor=1
Divergence detected. Stopping training after 10 epochs.
Early stopping at epoch 16
[I 2025-06-03 19:06:43,309] Trial 28 finished with value: 0.5501085879824316 and parameters: {'ff_dim': 128, 'dropout_rate': 0.43918549983202815, 'embed_dim': 64, 'learning_rate': 5.258486107197146e-05, 'optimizer': 'AdamW', 'weight_decay': 0.0009970642366440889, 'batch_size': 32, 'num_heads': 2, 'num_transformer_blocks': 4}. Best is trial 26 with value: 0.6503238949630876.
Trial 28, Fold 1: Test Accuracy = 0.5501
Hyperparameters: num_heads=8, num_transformer_blocks=32, learning_rate=0.00027951500401996425, optimizer=Adam, weight_decay=5.48089923804259e-06, batch_size=32,factor=1
Divergence detected. Stopping training after 10 epochs.
Early stopping at epoch 10
[I 2025-06-03 19:07:01,553] Trial 29 finished with value: 0.47816792823100646 and parameters: {'ff_dim': 512, 'dropout_rate': 0.46050759585520085, 'embed_dim': 1024, 'learning_rate': 0.0002954607860354472, 'optimizer': 'AdamW', 'weight_decay': 6.927121073224244e-06, 'batch_size': 32, 'num_heads': 16, 'num_transformer_blocks': 4}. Best is trial 26 with value: 0.6503238949630876.
Trial 29, Fold 1: Test Accuracy = 0.4782
Hyperparameters: num_heads=8, num_transformer_blocks=32, learning_rate=0.00167039924591795, optimizer=Adam, weight_decay=1.8696214179322713e-05, batch_size=16,factor=1
Divergence detected. Stopping training after 10 epochs.
Early stopping at epoch 13
[I 2025-06-03 19:07:51,902] Trial 30 finished with value: 0.3333333333333333 and parameters: {'ff_dim': 512, 'dropout_rate': 0.4055456629761428, 'embed_dim': 128, 'learning_rate': 0.00027951500401996425, 'optimizer': 'Adam', 'weight_decay': 5.48089923804259e-06, 'batch_size': 32, 'num_heads': 8, 'num_transformer_blocks': 32}. Best is trial 26 with value: 0.6503238949630876.
Trial 30, Fold 1: Test Accuracy = 0.3333
Hyperparameters: num_heads=8, num_transformer_blocks=8, learning_rate=1.20114594047942e-05, optimizer=Adam, weight_decay=1.691727670649004e-05, batch_size=32,factor=1
Divergence detected. Stopping training after 10 epochs.
Early stopping at epoch 11
[I 2025-06-03 19:08:17,841] Trial 31 finished with value: 0.3333333333333333 and parameters: {'ff_dim': 1024, 'dropout_rate': 0.4169491407232981, 'embed_dim': 32, 'learning_rate': 0.00167039924591795, 'optimizer': 'Adam', 'weight_decay': 1.8696214179322713e-05, 'batch_size': 16, 'num_heads': 8, 'num_transformer_blocks': 32}. Best is trial 26 with value: 0.6503238949630876.
Trial 31, Fold 1: Test Accuracy = 0.3333
Hyperparameters: num_heads=8, num_transformer_blocks=1, learning_rate=1.0832884746780947e-05, optimizer=Adam, weight_decay=3.9571476864810075e-05, batch_size=32,factor=1
