[I 2025-06-03 20:40:01,989] Trial 100 finished with value: 0.493420054200542 and parameters: {'ff_dim': 64, 'dropout_rate': 0.1944823608458024, 'embed_dim': 1024, 'learning_rate': 8.652170306623112e-05, 'optimizer': 'AdamW', 'weight_decay': 9.844435443508463e-06, 'batch_size': 32, 'num_heads': 2, 'num_transformer_blocks': 4}. Best is trial 26 with value: 0.6503238949630876.
Trial 100, Fold 1: Test Accuracy = 0.4934
Hyperparameters: num_heads=4, num_transformer_blocks=4, learning_rate=4.134936997259088e-07, optimizer=Adam, weight_decay=4.176979786066645e-06, batch_size=10,factor=1
[I 2025-06-03 20:40:40,501] Trial 99 finished with value: 0.5600055135034109 and parameters: {'ff_dim': 32, 'dropout_rate': 0.39798693153486536, 'embed_dim': 1024, 'learning_rate': 4.220257651007652e-07, 'optimizer': 'Adam', 'weight_decay': 5.933431314784156e-05, 'batch_size': 32, 'num_heads': 8, 'num_transformer_blocks': 2}. Best is trial 26 with value: 0.6503238949630876.
Trial 99, Fold 1: Test Accuracy = 0.5600
Hyperparameters: num_heads=8, num_transformer_blocks=4, learning_rate=2.3734924654899906e-05, optimizer=Adam, weight_decay=4.082969181562746e-06, batch_size=10,factor=1
Divergence detected. Stopping training after 10 epochs.
Early stopping at epoch 16
[I 2025-06-03 20:42:26,517] Trial 102 finished with value: 0.5931323240818615 and parameters: {'ff_dim': 64, 'dropout_rate': 0.16991379692889416, 'embed_dim': 1024, 'learning_rate': 2.3734924654899906e-05, 'optimizer': 'Adam', 'weight_decay': 4.082969181562746e-06, 'batch_size': 10, 'num_heads': 8, 'num_transformer_blocks': 4}. Best is trial 26 with value: 0.6503238949630876.
Trial 102, Fold 1: Test Accuracy = 0.5931
Hyperparameters: num_heads=8, num_transformer_blocks=4, learning_rate=4.362933818907669e-05, optimizer=Adam, weight_decay=4.198763631740321e-06, batch_size=10,factor=1
Divergence detected. Stopping training after 10 epochs.
Early stopping at epoch 26
Trial 101, Fold 1: Test Accuracy = 0.5714
[I 2025-06-03 20:42:42,852] Trial 101 finished with value: 0.5714336977852538 and parameters: {'ff_dim': 64, 'dropout_rate': 0.1703265164725561, 'embed_dim': 1024, 'learning_rate': 4.134936997259088e-07, 'optimizer': 'Adam', 'weight_decay': 4.176979786066645e-06, 'batch_size': 10, 'num_heads': 4, 'num_transformer_blocks': 4}. Best is trial 26 with value: 0.6503238949630876.
Hyperparameters: num_heads=8, num_transformer_blocks=4, learning_rate=2.3232630487364508e-07, optimizer=Adam, weight_decay=2.9089414955502543e-06, batch_size=10,factor=1
Divergence detected. Stopping training after 10 epochs.
Early stopping at epoch 17
[I 2025-06-03 20:44:14,976] Trial 103 finished with value: 0.6305775161199888 and parameters: {'ff_dim': 64, 'dropout_rate': 0.17115605751990334, 'embed_dim': 1024, 'learning_rate': 4.362933818907669e-05, 'optimizer': 'Adam', 'weight_decay': 4.198763631740321e-06, 'batch_size': 10, 'num_heads': 8, 'num_transformer_blocks': 4}. Best is trial 26 with value: 0.6503238949630876.
Trial 103, Fold 1: Test Accuracy = 0.6306
Hyperparameters: num_heads=8, num_transformer_blocks=4, learning_rate=4.843113857557776e-05, optimizer=Adam, weight_decay=3.0977446042539642e-06, batch_size=10,factor=1
[I 2025-06-03 20:45:33,748] Trial 104 finished with value: 0.5839644893000654 and parameters: {'ff_dim': 64, 'dropout_rate': 0.21624688186694718, 'embed_dim': 1024, 'learning_rate': 2.3232630487364508e-07, 'optimizer': 'Adam', 'weight_decay': 2.9089414955502543e-06, 'batch_size': 10, 'num_heads': 8, 'num_transformer_blocks': 4}. Best is trial 26 with value: 0.6503238949630876.
Trial 104, Fold 1: Test Accuracy = 0.5840
Hyperparameters: num_heads=8, num_transformer_blocks=4, learning_rate=4.4135483707715073e-05, optimizer=Adam, weight_decay=4.686405193891303e-06, batch_size=10,factor=1
Divergence detected. Stopping training after 10 epochs.
Early stopping at epoch 17
Trial 105, Fold 1: Test Accuracy = 0.5971
[I 2025-06-03 20:46:01,447] Trial 105 finished with value: 0.597098402018503 and parameters: {'ff_dim': 64, 'dropout_rate': 0.20819991236134966, 'embed_dim': 1024, 'learning_rate': 4.843113857557776e-05, 'optimizer': 'Adam', 'weight_decay': 3.0977446042539642e-06, 'batch_size': 10, 'num_heads': 8, 'num_transformer_blocks': 4}. Best is trial 26 with value: 0.6503238949630876.
Hyperparameters: num_heads=8, num_transformer_blocks=4, learning_rate=4.6069476117846655e-05, optimizer=Adam, weight_decay=4.674581703438227e-06, batch_size=10,factor=1
Divergence detected. Stopping training after 10 epochs.
Early stopping at epoch 18
[I 2025-06-03 20:47:23,932] Trial 106 finished with value: 0.5838951499859827 and parameters: {'ff_dim': 64, 'dropout_rate': 0.14877661426808522, 'embed_dim': 1024, 'learning_rate': 4.4135483707715073e-05, 'optimizer': 'Adam', 'weight_decay': 4.686405193891303e-06, 'batch_size': 10, 'num_heads': 8, 'num_transformer_blocks': 4}. Best is trial 26 with value: 0.6503238949630876.
Trial 106, Fold 1: Test Accuracy = 0.5839
Hyperparameters: num_heads=8, num_transformer_blocks=4, learning_rate=0.00014758760125284145, optimizer=Adam, weight_decay=2.346531853882423e-06, batch_size=10,factor=1
Divergence detected. Stopping training after 10 epochs.
Early stopping at epoch 17
Trial 107, Fold 1: Test Accuracy = 0.6061
[I 2025-06-03 20:47:45,266] Trial 107 finished with value: 0.6061321371834408 and parameters: {'ff_dim': 64, 'dropout_rate': 0.22371631747518722, 'embed_dim': 1024, 'learning_rate': 4.6069476117846655e-05, 'optimizer': 'Adam', 'weight_decay': 4.674581703438227e-06, 'batch_size': 10, 'num_heads': 8, 'num_transformer_blocks': 4}. Best is trial 26 with value: 0.6503238949630876.
Hyperparameters: num_heads=16, num_transformer_blocks=4, learning_rate=2.501083482979508e-05, optimizer=Adam, weight_decay=2.1943613491474405e-06, batch_size=10,factor=1
Divergence detected. Stopping training after 10 epochs.
Early stopping at epoch 19
[I 2025-06-03 20:49:37,123] Trial 109 finished with value: 0.5668913185683581 and parameters: {'ff_dim': 64, 'dropout_rate': 0.22677741424208778, 'embed_dim': 1024, 'learning_rate': 2.501083482979508e-05, 'optimizer': 'Adam', 'weight_decay': 2.1943613491474405e-06, 'batch_size': 10, 'num_heads': 16, 'num_transformer_blocks': 4}. Best is trial 26 with value: 0.6503238949630876.
Trial 109, Fold 1: Test Accuracy = 0.5669
Hyperparameters: num_heads=8, num_transformer_blocks=4, learning_rate=0.00014111294231307884, optimizer=Adam, weight_decay=1.8300793227188553e-06, batch_size=10,factor=1
Divergence detected. Stopping training after 10 epochs.
Early stopping at epoch 23
[I 2025-06-03 20:49:41,419] Trial 108 finished with value: 0.376780487804878 and parameters: {'ff_dim': 64, 'dropout_rate': 0.22556270690994695, 'embed_dim': 1024, 'learning_rate': 0.00014758760125284145, 'optimizer': 'Adam', 'weight_decay': 2.346531853882423e-06, 'batch_size': 10, 'num_heads': 8, 'num_transformer_blocks': 4}. Best is trial 26 with value: 0.6503238949630876.
Trial 108, Fold 1: Test Accuracy = 0.3768
Hyperparameters: num_heads=8, num_transformer_blocks=4, learning_rate=5.8767899094426814e-05, optimizer=Adam, weight_decay=2.813519512707786e-06, batch_size=10,factor=1
Divergence detected. Stopping training after 10 epochs.
Early stopping at epoch 24
[I 2025-06-03 20:51:57,107] Trial 110 finished with value: 0.5959728997289973 and parameters: {'ff_dim': 64, 'dropout_rate': 0.2557554449229918, 'embed_dim': 1024, 'learning_rate': 0.00014111294231307884, 'optimizer': 'Adam', 'weight_decay': 1.8300793227188553e-06, 'batch_size': 10, 'num_heads': 8, 'num_transformer_blocks': 4}. Best is trial 26 with value: 0.6503238949630876.
Trial 110, Fold 1: Test Accuracy = 0.5960
Hyperparameters: num_heads=8, num_transformer_blocks=4, learning_rate=0.0001048588105861127, optimizer=Adam, weight_decay=1.3679940659435814e-06, batch_size=10,factor=1
Divergence detected. Stopping training after 10 epochs.
Early stopping at epoch 26
[I 2025-06-03 20:52:13,183] Trial 111 finished with value: 0.5734784599570134 and parameters: {'ff_dim': 64, 'dropout_rate': 0.2562490210414766, 'embed_dim': 1024, 'learning_rate': 5.8767899094426814e-05, 'optimizer': 'Adam', 'weight_decay': 2.813519512707786e-06, 'batch_size': 10, 'num_heads': 8, 'num_transformer_blocks': 4}. Best is trial 26 with value: 0.6503238949630876.
Trial 111, Fold 1: Test Accuracy = 0.5735
Hyperparameters: num_heads=8, num_transformer_blocks=4, learning_rate=9.815826299731989e-05, optimizer=Adam, weight_decay=4.48934688928994e-06, batch_size=10,factor=1
Divergence detected. Stopping training after 10 epochs.
Early stopping at epoch 15
[I 2025-06-03 20:53:43,271] Trial 113 finished with value: 0.5473642650219606 and parameters: {'ff_dim': 64, 'dropout_rate': 0.23946263116565686, 'embed_dim': 1024, 'learning_rate': 9.815826299731989e-05, 'optimizer': 'Adam', 'weight_decay': 4.48934688928994e-06, 'batch_size': 10, 'num_heads': 8, 'num_transformer_blocks': 4}. Best is trial 26 with value: 0.6503238949630876.
Trial 113, Fold 1: Test Accuracy = 0.5474
Hyperparameters: num_heads=8, num_transformer_blocks=4, learning_rate=0.0003718875587453743, optimizer=Adam, weight_decay=1.8591593245505161e-06, batch_size=10,factor=1
Divergence detected. Stopping training after 10 epochs.
Early stopping at epoch 20
[I 2025-06-03 20:53:57,601] Trial 112 finished with value: 0.5733551069993458 and parameters: {'ff_dim': 64, 'dropout_rate': 0.21103740895909637, 'embed_dim': 1024, 'learning_rate': 0.0001048588105861127, 'optimizer': 'Adam', 'weight_decay': 1.3679940659435814e-06, 'batch_size': 10, 'num_heads': 8, 'num_transformer_blocks': 4}. Best is trial 26 with value: 0.6503238949630876.
Trial 112, Fold 1: Test Accuracy = 0.5734
Hyperparameters: num_heads=8, num_transformer_blocks=4, learning_rate=0.00030482986050367375, optimizer=Adam, weight_decay=1.7402160372640836e-06, batch_size=10,factor=1
Divergence detected. Stopping training after 10 epochs.
Early stopping at epoch 11
[I 2025-06-03 20:54:54,114] Trial 114 finished with value: 0.3333333333333333 and parameters: {'ff_dim': 64, 'dropout_rate': 0.2571387188921796, 'embed_dim': 1024, 'learning_rate': 0.0003718875587453743, 'optimizer': 'Adam', 'weight_decay': 1.8591593245505161e-06, 'batch_size': 10, 'num_heads': 8, 'num_transformer_blocks': 4}. Best is trial 26 with value: 0.6503238949630876.
Trial 114, Fold 1: Test Accuracy = 0.3333
Hyperparameters: num_heads=8, num_transformer_blocks=4, learning_rate=4.817249805907344e-05, optimizer=Adam, weight_decay=3.3722086882814303e-06, batch_size=10,factor=1
Divergence detected. Stopping training after 10 epochs.
Early stopping at epoch 14
Trial 115, Fold 1: Test Accuracy = 0.3333
[I 2025-06-03 20:55:30,251] Trial 115 finished with value: 0.3333333333333333 and parameters: {'ff_dim': 64, 'dropout_rate': 0.23468972421490247, 'embed_dim': 1024, 'learning_rate': 0.00030482986050367375, 'optimizer': 'Adam', 'weight_decay': 1.7402160372640836e-06, 'batch_size': 10, 'num_heads': 8, 'num_transformer_blocks': 4}. Best is trial 26 with value: 0.6503238949630876.
Hyperparameters: num_heads=4, num_transformer_blocks=4, learning_rate=3.2379059546989724e-05, optimizer=Adam, weight_decay=6.9361445802775845e-06, batch_size=10,factor=1
Divergence detected. Stopping training after 10 epochs.
Early stopping at epoch 10
[I 2025-06-03 20:56:03,961] Trial 116 finished with value: 0.5118311372768901 and parameters: {'ff_dim': 64, 'dropout_rate': 0.23242853426235768, 'embed_dim': 1024, 'learning_rate': 4.817249805907344e-05, 'optimizer': 'Adam', 'weight_decay': 3.3722086882814303e-06, 'batch_size': 10, 'num_heads': 8, 'num_transformer_blocks': 4}. Best is trial 26 with value: 0.6503238949630876.
Trial 116, Fold 1: Test Accuracy = 0.5118
Hyperparameters: num_heads=1, num_transformer_blocks=4, learning_rate=3.32933093135078e-05, optimizer=Adam, weight_decay=6.446244749915356e-06, batch_size=10,factor=1
Divergence detected. Stopping training after 10 epochs.
Early stopping at epoch 19
[I 2025-06-03 20:57:30,530] Trial 117 finished with value: 0.5846207831043828 and parameters: {'ff_dim': 64, 'dropout_rate': 0.2034551059868298, 'embed_dim': 1024, 'learning_rate': 3.2379059546989724e-05, 'optimizer': 'Adam', 'weight_decay': 6.9361445802775845e-06, 'batch_size': 10, 'num_heads': 4, 'num_transformer_blocks': 4}. Best is trial 26 with value: 0.6503238949630876.
Trial 117, Fold 1: Test Accuracy = 0.5846
Hyperparameters: num_heads=1, num_transformer_blocks=4, learning_rate=7.738398040711663e-05, optimizer=Adam, weight_decay=4.104502581350729e-06, batch_size=10,factor=1
Divergence detected. Stopping training after 10 epochs.
Early stopping at epoch 23
Trial 118, Fold 1: Test Accuracy = 0.5166
[I 2025-06-03 20:58:32,360] Trial 118 finished with value: 0.5166223717409588 and parameters: {'ff_dim': 64, 'dropout_rate': 0.19524448515413362, 'embed_dim': 1024, 'learning_rate': 3.32933093135078e-05, 'optimizer': 'Adam', 'weight_decay': 6.446244749915356e-06, 'batch_size': 10, 'num_heads': 1, 'num_transformer_blocks': 4}. Best is trial 26 with value: 0.6503238949630876.
Hyperparameters: num_heads=8, num_transformer_blocks=4, learning_rate=0.00020874773452135375, optimizer=Adam, weight_decay=4.895964337847104e-06, batch_size=10,factor=1
Divergence detected. Stopping training after 10 epochs.
Early stopping at epoch 28
Divergence detected. Stopping training after 10 epochs.
Early stopping at epoch 19
[I 2025-06-03 21:00:21,853] Trial 119 finished with value: 0.5467187178768339 and parameters: {'ff_dim': 64, 'dropout_rate': 0.27290196670780564, 'embed_dim': 1024, 'learning_rate': 7.738398040711663e-05, 'optimizer': 'Adam', 'weight_decay': 4.104502581350729e-06, 'batch_size': 10, 'num_heads': 1, 'num_transformer_blocks': 4}. Best is trial 26 with value: 0.6503238949630876.
Trial 119, Fold 1: Test Accuracy = 0.5467
Hyperparameters: num_heads=8, num_transformer_blocks=4, learning_rate=0.0002067395412030011, optimizer=AdamW, weight_decay=3.622622008194277e-06, batch_size=16,factor=1
[I 2025-06-03 21:00:23,478] Trial 120 finished with value: 0.4741463414634146 and parameters: {'ff_dim': 64, 'dropout_rate': 0.2506761832628175, 'embed_dim': 1024, 'learning_rate': 0.00020874773452135375, 'optimizer': 'Adam', 'weight_decay': 4.895964337847104e-06, 'batch_size': 10, 'num_heads': 8, 'num_transformer_blocks': 4}. Best is trial 26 with value: 0.6503238949630876.
Trial 120, Fold 1: Test Accuracy = 0.4741
Hyperparameters: num_heads=8, num_transformer_blocks=4, learning_rate=0.00012564574062294028, optimizer=Adam, weight_decay=3.6548834445308292e-06, batch_size=10,factor=1
Divergence detected. Stopping training after 10 epochs.
Early stopping at epoch 10
[I 2025-06-03 21:01:24,549] Trial 122 finished with value: 0.5208284272497897 and parameters: {'ff_dim': 64, 'dropout_rate': 0.1908525769541731, 'embed_dim': 1024, 'learning_rate': 0.00012564574062294028, 'optimizer': 'Adam', 'weight_decay': 3.6548834445308292e-06, 'batch_size': 10, 'num_heads': 8, 'num_transformer_blocks': 4}. Best is trial 26 with value: 0.6503238949630876.
Trial 122, Fold 1: Test Accuracy = 0.5208
Hyperparameters: num_heads=8, num_transformer_blocks=4, learning_rate=1.4068481564765744e-05, optimizer=Adam, weight_decay=7.699273114161537e-06, batch_size=10,factor=1
Divergence detected. Stopping training after 10 epochs.
Early stopping at epoch 25
[I 2025-06-03 21:02:43,487] Trial 121 finished with value: 0.5395872348378656 and parameters: {'ff_dim': 64, 'dropout_rate': 0.2170204999600088, 'embed_dim': 1024, 'learning_rate': 0.0002067395412030011, 'optimizer': 'AdamW', 'weight_decay': 3.622622008194277e-06, 'batch_size': 16, 'num_heads': 8, 'num_transformer_blocks': 4}. Best is trial 26 with value: 0.6503238949630876.
Trial 121, Fold 1: Test Accuracy = 0.5396
Hyperparameters: num_heads=8, num_transformer_blocks=4, learning_rate=1.79187777991584e-05, optimizer=Adam, weight_decay=7.718730546574958e-06, batch_size=10,factor=1
Divergence detected. Stopping training after 10 epochs.
Early stopping at epoch 27
[I 2025-06-03 21:04:02,438] Trial 123 finished with value: 0.5129342117559107 and parameters: {'ff_dim': 64, 'dropout_rate': 0.17208929167716647, 'embed_dim': 1024, 'learning_rate': 1.4068481564765744e-05, 'optimizer': 'Adam', 'weight_decay': 7.699273114161537e-06, 'batch_size': 10, 'num_heads': 8, 'num_transformer_blocks': 4}. Best is trial 26 with value: 0.6503238949630876.
Trial 123, Fold 1: Test Accuracy = 0.5129
Hyperparameters: num_heads=8, num_transformer_blocks=2, learning_rate=2.246364084135396e-05, optimizer=Adam, weight_decay=5.606792338236577e-06, batch_size=10,factor=1
Divergence detected. Stopping training after 10 epochs.
Early stopping at epoch 15
[I 2025-06-03 21:04:15,335] Trial 124 finished with value: 0.5752815624707971 and parameters: {'ff_dim': 256, 'dropout_rate': 0.1354339650828623, 'embed_dim': 1024, 'learning_rate': 1.79187777991584e-05, 'optimizer': 'Adam', 'weight_decay': 7.718730546574958e-06, 'batch_size': 10, 'num_heads': 8, 'num_transformer_blocks': 4}. Best is trial 26 with value: 0.6503238949630876.
Trial 124, Fold 1: Test Accuracy = 0.5753
Hyperparameters: num_heads=8, num_transformer_blocks=2, learning_rate=7.957023704475064e-06, optimizer=Adam, weight_decay=5.953237858921499e-06, batch_size=10,factor=1
Divergence detected. Stopping training after 10 epochs.
Early stopping at epoch 20
[I 2025-06-03 21:05:33,722] Trial 125 finished with value: 0.5371396131202691 and parameters: {'ff_dim': 256, 'dropout_rate': 0.20528243841673938, 'embed_dim': 32, 'learning_rate': 2.246364084135396e-05, 'optimizer': 'Adam', 'weight_decay': 5.606792338236577e-06, 'batch_size': 10, 'num_heads': 8, 'num_transformer_blocks': 2}. Best is trial 26 with value: 0.6503238949630876.
Trial 125, Fold 1: Test Accuracy = 0.5371
Hyperparameters: num_heads=8, num_transformer_blocks=16, learning_rate=6.32072537496072e-05, optimizer=Adam, weight_decay=9.474193323085672e-06, batch_size=10,factor=1
Divergence detected. Stopping training after 10 epochs.
Early stopping at epoch 18
[I 2025-06-03 21:05:37,947] Trial 126 finished with value: 0.532962807214279 and parameters: {'ff_dim': 512, 'dropout_rate': 0.20677364325094355, 'embed_dim': 32, 'learning_rate': 7.957023704475064e-06, 'optimizer': 'Adam', 'weight_decay': 5.953237858921499e-06, 'batch_size': 10, 'num_heads': 8, 'num_transformer_blocks': 2}. Best is trial 26 with value: 0.6503238949630876.
Trial 126, Fold 1: Test Accuracy = 0.5330
Hyperparameters: num_heads=4, num_transformer_blocks=16, learning_rate=6.312455845142566e-05, optimizer=Adam, weight_decay=2.9146911544783023e-06, batch_size=10,factor=1
Divergence detected. Stopping training after 10 epochs.
Early stopping at epoch 11
[I 2025-06-03 21:06:48,781] Trial 128 finished with value: 0.3413333333333333 and parameters: {'ff_dim': 2048, 'dropout_rate': 0.1668047145651277, 'embed_dim': 128, 'learning_rate': 6.312455845142566e-05, 'optimizer': 'Adam', 'weight_decay': 2.9146911544783023e-06, 'batch_size': 10, 'num_heads': 4, 'num_transformer_blocks': 16}. Best is trial 26 with value: 0.6503238949630876.
Trial 128, Fold 1: Test Accuracy = 0.3413
Hyperparameters: num_heads=8, num_transformer_blocks=32, learning_rate=5.392751848232855e-06, optimizer=Adam, weight_decay=8.89468386799069e-06, batch_size=10,factor=1
Divergence detected. Stopping training after 10 epochs.
Early stopping at epoch 14
[I 2025-06-03 21:07:01,504] Trial 127 finished with value: 0.5101283992150266 and parameters: {'ff_dim': 64, 'dropout_rate': 0.18348011554863505, 'embed_dim': 128, 'learning_rate': 6.32072537496072e-05, 'optimizer': 'Adam', 'weight_decay': 9.474193323085672e-06, 'batch_size': 10, 'num_heads': 8, 'num_transformer_blocks': 16}. Best is trial 26 with value: 0.6503238949630876.
Trial 127, Fold 1: Test Accuracy = 0.5101
Hyperparameters: num_heads=2, num_transformer_blocks=4, learning_rate=3.219718527975881e-07, optimizer=Adam, weight_decay=2.0185076754614875e-06, batch_size=10,factor=1
[I 2025-06-03 21:10:08,400] Trial 130 finished with value: 0.5852771703579105 and parameters: {'ff_dim': 64, 'dropout_rate': 0.4334128231211219, 'embed_dim': 1024, 'learning_rate': 3.219718527975881e-07, 'optimizer': 'Adam', 'weight_decay': 2.0185076754614875e-06, 'batch_size': 10, 'num_heads': 2, 'num_transformer_blocks': 4}. Best is trial 26 with value: 0.6503238949630876.
Trial 130, Fold 1: Test Accuracy = 0.5853
Hyperparameters: num_heads=8, num_transformer_blocks=32, learning_rate=1.1276971770881592e-05, optimizer=Adam, weight_decay=1.399375238718454e-05, batch_size=10,factor=1
Divergence detected. Stopping training after 10 epochs.
Early stopping at epoch 17
Trial 129, Fold 1: Test Accuracy = 0.5756
[I 2025-06-03 21:17:22,782] Trial 129 finished with value: 0.5755574245397627 and parameters: {'ff_dim': 1024, 'dropout_rate': 0.22154237532383392, 'embed_dim': 1024, 'learning_rate': 5.392751848232855e-06, 'optimizer': 'Adam', 'weight_decay': 8.89468386799069e-06, 'batch_size': 10, 'num_heads': 8, 'num_transformer_blocks': 32}. Best is trial 26 with value: 0.6503238949630876.
Hyperparameters: num_heads=8, num_transformer_blocks=8, learning_rate=1.1425597340896094e-05, optimizer=Adam, weight_decay=1.5216572193970366e-06, batch_size=32,factor=1
Divergence detected. Stopping training after 10 epochs.
Early stopping at epoch 15
Trial 132, Fold 1: Test Accuracy = 0.6094
[I 2025-06-03 21:18:41,579] Trial 132 finished with value: 0.6093536118119802 and parameters: {'ff_dim': 128, 'dropout_rate': 0.4211697666165787, 'embed_dim': 256, 'learning_rate': 1.1425597340896094e-05, 'optimizer': 'Adam', 'weight_decay': 1.5216572193970366e-06, 'batch_size': 32, 'num_heads': 8, 'num_transformer_blocks': 8}. Best is trial 26 with value: 0.6503238949630876.
Hyperparameters: num_heads=8, num_transformer_blocks=8, learning_rate=4.330574233886439e-05, optimizer=Adam, weight_decay=1.3509061303826148e-06, batch_size=32,factor=1
Divergence detected. Stopping training after 10 epochs.
Early stopping at epoch 14
