[I 2025-06-03 19:46:28,427] Trial 66 finished with value: 0.5648139426221849 and parameters: {'ff_dim': 1024, 'dropout_rate': 0.18463336543785225, 'embed_dim': 512, 'learning_rate': 1.738938466859771e-07, 'optimizer': 'Adam', 'weight_decay': 6.444609661100409e-06, 'batch_size': 10, 'num_heads': 1, 'num_transformer_blocks': 2}. Best is trial 26 with value: 0.6503238949630876.
Trial 66, Fold 1: Test Accuracy = 0.5648
Hyperparameters: num_heads=1, num_transformer_blocks=2, learning_rate=1.5705910551650474e-06, optimizer=Adam, weight_decay=2.460113454854987e-05, batch_size=10,factor=1
Divergence detected. Stopping training after 10 epochs.
Early stopping at epoch 10
[I 2025-06-03 19:47:17,316] Trial 68 finished with value: 0.5497986169516867 and parameters: {'ff_dim': 1024, 'dropout_rate': 0.15600228963548435, 'embed_dim': 32, 'learning_rate': 1.5705910551650474e-06, 'optimizer': 'Adam', 'weight_decay': 2.460113454854987e-05, 'batch_size': 10, 'num_heads': 1, 'num_transformer_blocks': 2}. Best is trial 26 with value: 0.6503238949630876.
Trial 68, Fold 1: Test Accuracy = 0.5498
Hyperparameters: num_heads=1, num_transformer_blocks=2, learning_rate=3.8066154906123707e-07, optimizer=Adam, weight_decay=2.1607519636068256e-05, batch_size=10,factor=1
Divergence detected. Stopping training after 10 epochs.
Early stopping at epoch 21
[I 2025-06-03 19:48:05,048] Trial 67 finished with value: 0.46980104663115596 and parameters: {'ff_dim': 1024, 'dropout_rate': 0.13080360279367703, 'embed_dim': 32, 'learning_rate': 3.3949307493517304e-07, 'optimizer': 'Adam', 'weight_decay': 5.671048086980873e-06, 'batch_size': 10, 'num_heads': 1, 'num_transformer_blocks': 2}. Best is trial 26 with value: 0.6503238949630876.
Trial 67, Fold 1: Test Accuracy = 0.4698
Hyperparameters: num_heads=1, num_transformer_blocks=2, learning_rate=1.8988986532584934e-07, optimizer=Adam, weight_decay=2.1575210101274153e-05, batch_size=10,factor=1
Divergence detected. Stopping training after 10 epochs.
Early stopping at epoch 24
Trial 69, Fold 1: Test Accuracy = 0.5109
[I 2025-06-03 19:49:37,204] Trial 69 finished with value: 0.5108570227081581 and parameters: {'ff_dim': 1024, 'dropout_rate': 0.12104121978112173, 'embed_dim': 1024, 'learning_rate': 3.8066154906123707e-07, 'optimizer': 'Adam', 'weight_decay': 2.1607519636068256e-05, 'batch_size': 10, 'num_heads': 1, 'num_transformer_blocks': 2}. Best is trial 26 with value: 0.6503238949630876.
Hyperparameters: num_heads=16, num_transformer_blocks=1, learning_rate=1.6944516326100323e-07, optimizer=Adam, weight_decay=3.3777879555769647e-05, batch_size=10,factor=1
Divergence detected. Stopping training after 10 epochs.
Early stopping at epoch 29
[I 2025-06-03 19:50:41,794] Trial 70 finished with value: 0.5885112606298477 and parameters: {'ff_dim': 512, 'dropout_rate': 0.12488269155640457, 'embed_dim': 512, 'learning_rate': 1.8988986532584934e-07, 'optimizer': 'Adam', 'weight_decay': 2.1575210101274153e-05, 'batch_size': 10, 'num_heads': 1, 'num_transformer_blocks': 2}. Best is trial 26 with value: 0.6503238949630876.
Trial 70, Fold 1: Test Accuracy = 0.5885
Hyperparameters: num_heads=8, num_transformer_blocks=1, learning_rate=2.2713059958322237e-05, optimizer=Adam, weight_decay=3.0704520101675116e-05, batch_size=10,factor=1
[I 2025-06-03 19:51:50,605] Trial 71 finished with value: 0.5153164190262592 and parameters: {'ff_dim': 512, 'dropout_rate': 0.26395975036678393, 'embed_dim': 512, 'learning_rate': 1.6944516326100323e-07, 'optimizer': 'Adam', 'weight_decay': 3.3777879555769647e-05, 'batch_size': 10, 'num_heads': 16, 'num_transformer_blocks': 1}. Best is trial 26 with value: 0.6503238949630876.
Trial 71, Fold 1: Test Accuracy = 0.5153
Hyperparameters: num_heads=8, num_transformer_blocks=8, learning_rate=0.00017521562259736195, optimizer=Adam, weight_decay=9.491173605103781e-05, batch_size=10,factor=1
Divergence detected. Stopping training after 10 epochs.
Early stopping at epoch 16
[I 2025-06-03 19:51:58,148] Trial 72 finished with value: 0.5903233342678255 and parameters: {'ff_dim': 32, 'dropout_rate': 0.16144930245784128, 'embed_dim': 512, 'learning_rate': 2.2713059958322237e-05, 'optimizer': 'Adam', 'weight_decay': 3.0704520101675116e-05, 'batch_size': 10, 'num_heads': 8, 'num_transformer_blocks': 1}. Best is trial 26 with value: 0.6503238949630876.
Trial 72, Fold 1: Test Accuracy = 0.5903
Hyperparameters: num_heads=8, num_transformer_blocks=8, learning_rate=0.00019622734839111033, optimizer=Adam, weight_decay=1.2102702408809436e-05, batch_size=10,factor=1
Divergence detected. Stopping training after 10 epochs.
Early stopping at epoch 11
Divergence detected. Stopping training after 10 epochs.
Early stopping at epoch 10
[I 2025-06-03 19:52:57,564] Trial 73 finished with value: 0.3333333333333333 and parameters: {'ff_dim': 32, 'dropout_rate': 0.3831535484906924, 'embed_dim': 512, 'learning_rate': 0.00017521562259736195, 'optimizer': 'Adam', 'weight_decay': 9.491173605103781e-05, 'batch_size': 10, 'num_heads': 8, 'num_transformer_blocks': 8}. Best is trial 26 with value: 0.6503238949630876.
Trial 73, Fold 1: Test Accuracy = 0.3333
Hyperparameters: num_heads=8, num_transformer_blocks=32, learning_rate=4.171663988772657e-05, optimizer=Adam, weight_decay=7.216875064799785e-05, batch_size=10,factor=1
[I 2025-06-03 19:52:59,289] Trial 74 finished with value: 0.3333333333333333 and parameters: {'ff_dim': 2048, 'dropout_rate': 0.38610563872324294, 'embed_dim': 512, 'learning_rate': 0.00019622734839111033, 'optimizer': 'Adam', 'weight_decay': 1.2102702408809436e-05, 'batch_size': 10, 'num_heads': 8, 'num_transformer_blocks': 8}. Best is trial 26 with value: 0.6503238949630876.
Trial 74, Fold 1: Test Accuracy = 0.3333
Hyperparameters: num_heads=8, num_transformer_blocks=32, learning_rate=3.451215557102573e-05, optimizer=Adam, weight_decay=1.650678888629788e-05, batch_size=16,factor=1
Divergence detected. Stopping training after 10 epochs.
Early stopping at epoch 11
Trial 76, Fold 1: Test Accuracy = 0.3333
[I 2025-06-03 20:14:22,841] Trial 76 finished with value: 0.3333333333333333 and parameters: {'ff_dim': 32, 'dropout_rate': 0.14035938411672724, 'embed_dim': 2048, 'learning_rate': 3.451215557102573e-05, 'optimizer': 'Adam', 'weight_decay': 1.650678888629788e-05, 'batch_size': 16, 'num_heads': 8, 'num_transformer_blocks': 32}. Best is trial 26 with value: 0.6503238949630876.
Hyperparameters: num_heads=4, num_transformer_blocks=16, learning_rate=7.563166897984704e-05, optimizer=Adam, weight_decay=6.379979425103414e-05, batch_size=10,factor=1
Divergence detected. Stopping training after 10 epochs.
Early stopping at epoch 20
Trial 75, Fold 1: Test Accuracy = 0.3333
[I 2025-06-03 20:16:47,996] Trial 75 finished with value: 0.3333333333333333 and parameters: {'ff_dim': 2048, 'dropout_rate': 0.35902762039026387, 'embed_dim': 512, 'learning_rate': 4.171663988772657e-05, 'optimizer': 'Adam', 'weight_decay': 7.216875064799785e-05, 'batch_size': 10, 'num_heads': 8, 'num_transformer_blocks': 32}. Best is trial 26 with value: 0.6503238949630876.
Hyperparameters: num_heads=4, num_transformer_blocks=16, learning_rate=6.472079970351775e-05, optimizer=AdamW, weight_decay=4.6883295380148534e-05, batch_size=10,factor=1
Divergence detected. Stopping training after 10 epochs.
Early stopping at epoch 29
[I 2025-06-03 20:18:27,212] Trial 77 finished with value: 0.5878024483693113 and parameters: {'ff_dim': 32, 'dropout_rate': 0.4086516953935701, 'embed_dim': 64, 'learning_rate': 7.563166897984704e-05, 'optimizer': 'Adam', 'weight_decay': 6.379979425103414e-05, 'batch_size': 10, 'num_heads': 4, 'num_transformer_blocks': 16}. Best is trial 26 with value: 0.6503238949630876.
Trial 77, Fold 1: Test Accuracy = 0.5878
Hyperparameters: num_heads=8, num_transformer_blocks=1, learning_rate=5.858041296904111e-06, optimizer=AdamW, weight_decay=3.7841260412373264e-05, batch_size=32,factor=1
Divergence detected. Stopping training after 10 epochs.
Early stopping at epoch 22
[I 2025-06-03 20:18:52,542] Trial 78 finished with value: 0.572986543313709 and parameters: {'ff_dim': 128, 'dropout_rate': 0.18821425607897033, 'embed_dim': 64, 'learning_rate': 6.472079970351775e-05, 'optimizer': 'AdamW', 'weight_decay': 4.6883295380148534e-05, 'batch_size': 10, 'num_heads': 4, 'num_transformer_blocks': 16}. Best is trial 26 with value: 0.6503238949630876.
Trial 78, Fold 1: Test Accuracy = 0.5730
Hyperparameters: num_heads=8, num_transformer_blocks=1, learning_rate=0.0006942061789980255, optimizer=Adam, weight_decay=0.00012933261394143845, batch_size=32,factor=1
[I 2025-06-03 20:20:23,074] Trial 79 finished with value: 0.5660356041491449 and parameters: {'ff_dim': 128, 'dropout_rate': 0.23444332314655164, 'embed_dim': 256, 'learning_rate': 5.858041296904111e-06, 'optimizer': 'AdamW', 'weight_decay': 3.7841260412373264e-05, 'batch_size': 32, 'num_heads': 8, 'num_transformer_blocks': 1}. Best is trial 26 with value: 0.6503238949630876.
Trial 79, Fold 1: Test Accuracy = 0.5660
Hyperparameters: num_heads=16, num_transformer_blocks=1, learning_rate=8.660185725523056e-07, optimizer=Adam, weight_decay=0.00012096255442915502, batch_size=32,factor=1
Divergence detected. Stopping training after 10 epochs.
Early stopping at epoch 27
[I 2025-06-03 20:20:42,579] Trial 80 finished with value: 0.5384949070180357 and parameters: {'ff_dim': 32, 'dropout_rate': 0.44987174711702843, 'embed_dim': 256, 'learning_rate': 0.0006942061789980255, 'optimizer': 'Adam', 'weight_decay': 0.00012933261394143845, 'batch_size': 32, 'num_heads': 8, 'num_transformer_blocks': 1}. Best is trial 26 with value: 0.6503238949630876.
Trial 80, Fold 1: Test Accuracy = 0.5385
Hyperparameters: num_heads=8, num_transformer_blocks=1, learning_rate=1.9713517753692227e-05, optimizer=Adam, weight_decay=2.9715367219463973e-05, batch_size=10,factor=1
Divergence detected. Stopping training after 10 epochs.
Early stopping at epoch 17
[I 2025-06-03 20:22:04,327] Trial 82 finished with value: 0.5553669750490609 and parameters: {'ff_dim': 32, 'dropout_rate': 0.16339158641131102, 'embed_dim': 512, 'learning_rate': 1.9713517753692227e-05, 'optimizer': 'Adam', 'weight_decay': 2.9715367219463973e-05, 'batch_size': 10, 'num_heads': 8, 'num_transformer_blocks': 1}. Best is trial 26 with value: 0.6503238949630876.
Trial 82, Fold 1: Test Accuracy = 0.5554
Hyperparameters: num_heads=8, num_transformer_blocks=1, learning_rate=1.441039975573583e-05, optimizer=Adam, weight_decay=2.07666545491387e-05, batch_size=10,factor=1
[I 2025-06-03 20:22:31,894] Trial 81 finished with value: 0.5853654798616952 and parameters: {'ff_dim': 32, 'dropout_rate': 0.4456896658177308, 'embed_dim': 1024, 'learning_rate': 8.660185725523056e-07, 'optimizer': 'Adam', 'weight_decay': 0.00012096255442915502, 'batch_size': 32, 'num_heads': 16, 'num_transformer_blocks': 1}. Best is trial 26 with value: 0.6503238949630876.
Trial 81, Fold 1: Test Accuracy = 0.5854
Hyperparameters: num_heads=8, num_transformer_blocks=1, learning_rate=1.6305483057801317e-05, optimizer=Adam, weight_decay=2.4301032666335606e-05, batch_size=10,factor=1
Divergence detected. Stopping training after 10 epochs.
Early stopping at epoch 11
[I 2025-06-03 20:23:00,375] Trial 83 finished with value: 0.5775108868330062 and parameters: {'ff_dim': 32, 'dropout_rate': 0.15673385612250934, 'embed_dim': 512, 'learning_rate': 1.441039975573583e-05, 'optimizer': 'Adam', 'weight_decay': 2.07666545491387e-05, 'batch_size': 10, 'num_heads': 8, 'num_transformer_blocks': 1}. Best is trial 26 with value: 0.6503238949630876.
Trial 83, Fold 1: Test Accuracy = 0.5775
Hyperparameters: num_heads=8, num_transformer_blocks=1, learning_rate=5.283609536266551e-07, optimizer=Adam, weight_decay=2.5809828001894262e-05, batch_size=10,factor=1
Divergence detected. Stopping training after 10 epochs.
Early stopping at epoch 26
[I 2025-06-03 20:24:32,513] Trial 84 finished with value: 0.5703965049995328 and parameters: {'ff_dim': 32, 'dropout_rate': 0.42688673533393834, 'embed_dim': 512, 'learning_rate': 1.6305483057801317e-05, 'optimizer': 'Adam', 'weight_decay': 2.4301032666335606e-05, 'batch_size': 10, 'num_heads': 8, 'num_transformer_blocks': 1}. Best is trial 26 with value: 0.6503238949630876.
Trial 84, Fold 1: Test Accuracy = 0.5704
Hyperparameters: num_heads=8, num_transformer_blocks=8, learning_rate=2.9145048627588646e-05, optimizer=Adam, weight_decay=3.4272775794538155e-05, batch_size=10,factor=1
[I 2025-06-03 20:25:13,053] Trial 85 finished with value: 0.591024296794692 and parameters: {'ff_dim': 32, 'dropout_rate': 0.18005148036113905, 'embed_dim': 512, 'learning_rate': 5.283609536266551e-07, 'optimizer': 'Adam', 'weight_decay': 2.5809828001894262e-05, 'batch_size': 10, 'num_heads': 8, 'num_transformer_blocks': 1}. Best is trial 26 with value: 0.6503238949630876.
Trial 85, Fold 1: Test Accuracy = 0.5910
Hyperparameters: num_heads=8, num_transformer_blocks=8, learning_rate=5.262526247153893e-07, optimizer=Adam, weight_decay=1.591999571023229e-05, batch_size=10,factor=1
Divergence detected. Stopping training after 10 epochs.
Early stopping at epoch 11
[I 2025-06-03 20:25:45,056] Trial 86 finished with value: 0.5145102326885338 and parameters: {'ff_dim': 32, 'dropout_rate': 0.3384841964626336, 'embed_dim': 512, 'learning_rate': 2.9145048627588646e-05, 'optimizer': 'Adam', 'weight_decay': 3.4272775794538155e-05, 'batch_size': 10, 'num_heads': 8, 'num_transformer_blocks': 8}. Best is trial 26 with value: 0.6503238949630876.
Trial 86, Fold 1: Test Accuracy = 0.5145
Hyperparameters: num_heads=2, num_transformer_blocks=4, learning_rate=5.181203311597681e-07, optimizer=Adam, weight_decay=0.000696500617860753, batch_size=10,factor=1
Divergence detected. Stopping training after 10 epochs.
Early stopping at epoch 17
[I 2025-06-03 20:28:05,695] Trial 88 finished with value: 0.5438599196336792 and parameters: {'ff_dim': 1024, 'dropout_rate': 0.17750017510965768, 'embed_dim': 1024, 'learning_rate': 5.181203311597681e-07, 'optimizer': 'Adam', 'weight_decay': 0.000696500617860753, 'batch_size': 10, 'num_heads': 2, 'num_transformer_blocks': 4}. Best is trial 26 with value: 0.6503238949630876.
Trial 88, Fold 1: Test Accuracy = 0.5439
Hyperparameters: num_heads=8, num_transformer_blocks=1, learning_rate=2.917425811971858e-07, optimizer=Adam, weight_decay=1.6437589532233074e-05, batch_size=10,factor=1
Divergence detected. Stopping training after 10 epochs.
Early stopping at epoch 27
[I 2025-06-03 20:28:44,137] Trial 87 finished with value: 0.5386074198673021 and parameters: {'ff_dim': 1024, 'dropout_rate': 0.20292045666496236, 'embed_dim': 1024, 'learning_rate': 5.262526247153893e-07, 'optimizer': 'Adam', 'weight_decay': 1.591999571023229e-05, 'batch_size': 10, 'num_heads': 8, 'num_transformer_blocks': 8}. Best is trial 26 with value: 0.6503238949630876.
Trial 87, Fold 1: Test Accuracy = 0.5386
Hyperparameters: num_heads=1, num_transformer_blocks=1, learning_rate=2.8557811986418536e-07, optimizer=Adam, weight_decay=4.1814981034118535e-05, batch_size=16,factor=1
Divergence detected. Stopping training after 10 epochs.
Early stopping at epoch 11
[I 2025-06-03 20:29:01,787] Trial 89 finished with value: 0.37145294832258663 and parameters: {'ff_dim': 64, 'dropout_rate': 0.1994086664927045, 'embed_dim': 128, 'learning_rate': 2.917425811971858e-07, 'optimizer': 'Adam', 'weight_decay': 1.6437589532233074e-05, 'batch_size': 10, 'num_heads': 8, 'num_transformer_blocks': 1}. Best is trial 26 with value: 0.6503238949630876.
Trial 89, Fold 1: Test Accuracy = 0.3715
Hyperparameters: num_heads=1, num_transformer_blocks=1, learning_rate=1.2613331870471923e-07, optimizer=Adam, weight_decay=1.1643503990982395e-05, batch_size=32,factor=1
Divergence detected. Stopping training after 10 epochs.
Early stopping at epoch 11
Divergence detected. Stopping training after 10 epochs.
Early stopping at epoch 16
[I 2025-06-03 20:29:51,058] Trial 91 finished with value: 0.4717769367348845 and parameters: {'ff_dim': 32, 'dropout_rate': 0.39184778093525413, 'embed_dim': 512, 'learning_rate': 1.2613331870471923e-07, 'optimizer': 'Adam', 'weight_decay': 1.1643503990982395e-05, 'batch_size': 32, 'num_heads': 1, 'num_transformer_blocks': 1}. Best is trial 26 with value: 0.6503238949630876.
Trial 91, Fold 1: Test Accuracy = 0.4718
Hyperparameters: num_heads=8, num_transformer_blocks=1, learning_rate=1.9146653814962154e-06, optimizer=Adam, weight_decay=2.525511501307685e-05, batch_size=10,factor=1
[I 2025-06-03 20:29:51,969] Trial 90 finished with value: 0.33318147836650785 and parameters: {'ff_dim': 32, 'dropout_rate': 0.14703709799904977, 'embed_dim': 128, 'learning_rate': 2.8557811986418536e-07, 'optimizer': 'Adam', 'weight_decay': 4.1814981034118535e-05, 'batch_size': 16, 'num_heads': 1, 'num_transformer_blocks': 1}. Best is trial 26 with value: 0.6503238949630876.
Trial 90, Fold 1: Test Accuracy = 0.3332
Hyperparameters: num_heads=8, num_transformer_blocks=1, learning_rate=9.122346854750486e-06, optimizer=Adam, weight_decay=2.647643637976971e-05, batch_size=10,factor=1
Divergence detected. Stopping training after 10 epochs.
Early stopping at epoch 21
[I 2025-06-03 20:31:31,207] Trial 93 finished with value: 0.5309644893000655 and parameters: {'ff_dim': 32, 'dropout_rate': 0.17849002721509705, 'embed_dim': 512, 'learning_rate': 9.122346854750486e-06, 'optimizer': 'Adam', 'weight_decay': 2.647643637976971e-05, 'batch_size': 10, 'num_heads': 8, 'num_transformer_blocks': 1}. Best is trial 26 with value: 0.6503238949630876.
Trial 93, Fold 1: Test Accuracy = 0.5310
Hyperparameters: num_heads=8, num_transformer_blocks=1, learning_rate=1.7514479266004605e-06, optimizer=Adam, weight_decay=1.93989528149809e-05, batch_size=10,factor=1
[I 2025-06-03 20:32:05,049] Trial 92 finished with value: 0.5619947668442201 and parameters: {'ff_dim': 32, 'dropout_rate': 0.1801099051615927, 'embed_dim': 512, 'learning_rate': 1.9146653814962154e-06, 'optimizer': 'Adam', 'weight_decay': 2.525511501307685e-05, 'batch_size': 10, 'num_heads': 8, 'num_transformer_blocks': 1}. Best is trial 26 with value: 0.6503238949630876.
Trial 92, Fold 1: Test Accuracy = 0.5620
Hyperparameters: num_heads=8, num_transformer_blocks=1, learning_rate=8.545739489393219e-07, optimizer=Adam, weight_decay=0.00016783358437614076, batch_size=10,factor=1
Divergence detected. Stopping training after 10 epochs.
Early stopping at epoch 27
[I 2025-06-03 20:33:40,040] Trial 94 finished with value: 0.5622879170171012 and parameters: {'ff_dim': 32, 'dropout_rate': 0.2889943323181326, 'embed_dim': 512, 'learning_rate': 1.7514479266004605e-06, 'optimizer': 'Adam', 'weight_decay': 1.93989528149809e-05, 'batch_size': 10, 'num_heads': 8, 'num_transformer_blocks': 1}. Best is trial 26 with value: 0.6503238949630876.
Trial 94, Fold 1: Test Accuracy = 0.5623
Hyperparameters: num_heads=8, num_transformer_blocks=16, learning_rate=8.025662902413745e-07, optimizer=Adam, weight_decay=0.0003775594864021996, batch_size=10,factor=1
[I 2025-06-03 20:34:23,963] Trial 95 finished with value: 0.5519217830109335 and parameters: {'ff_dim': 32, 'dropout_rate': 0.41628854790297887, 'embed_dim': 512, 'learning_rate': 8.545739489393219e-07, 'optimizer': 'Adam', 'weight_decay': 0.00016783358437614076, 'batch_size': 10, 'num_heads': 8, 'num_transformer_blocks': 1}. Best is trial 26 with value: 0.6503238949630876.
Trial 95, Fold 1: Test Accuracy = 0.5519
Hyperparameters: num_heads=8, num_transformer_blocks=4, learning_rate=1.5006182303146715e-07, optimizer=Adam, weight_decay=3.1305665557648896e-05, batch_size=10,factor=1
Divergence detected. Stopping training after 10 epochs.
Early stopping at epoch 26
[I 2025-06-03 20:37:03,175] Trial 96 finished with value: 0.5489378562751145 and parameters: {'ff_dim': 32, 'dropout_rate': 0.16023737757280906, 'embed_dim': 512, 'learning_rate': 8.025662902413745e-07, 'optimizer': 'Adam', 'weight_decay': 0.0003775594864021996, 'batch_size': 10, 'num_heads': 8, 'num_transformer_blocks': 16}. Best is trial 26 with value: 0.6503238949630876.
Trial 96, Fold 1: Test Accuracy = 0.5489
Hyperparameters: num_heads=8, num_transformer_blocks=4, learning_rate=2.257052344365397e-05, optimizer=Adam, weight_decay=9.047095423593396e-06, batch_size=10,factor=1
[I 2025-06-03 20:38:28,472] Trial 97 finished with value: 0.5444455658349687 and parameters: {'ff_dim': 32, 'dropout_rate': 0.3132256193069321, 'embed_dim': 2048, 'learning_rate': 1.5006182303146715e-07, 'optimizer': 'Adam', 'weight_decay': 3.1305665557648896e-05, 'batch_size': 10, 'num_heads': 8, 'num_transformer_blocks': 4}. Best is trial 26 with value: 0.6503238949630876.
Trial 97, Fold 1: Test Accuracy = 0.5444
Hyperparameters: num_heads=8, num_transformer_blocks=2, learning_rate=4.220257651007652e-07, optimizer=Adam, weight_decay=5.933431314784156e-05, batch_size=32,factor=1
Divergence detected. Stopping training after 10 epochs.
Early stopping at epoch 16
[I 2025-06-03 20:39:05,139] Trial 98 finished with value: 0.6364156620876554 and parameters: {'ff_dim': 64, 'dropout_rate': 0.19427441641328858, 'embed_dim': 1024, 'learning_rate': 2.257052344365397e-05, 'optimizer': 'Adam', 'weight_decay': 9.047095423593396e-06, 'batch_size': 10, 'num_heads': 8, 'num_transformer_blocks': 4}. Best is trial 26 with value: 0.6503238949630876.
Trial 98, Fold 1: Test Accuracy = 0.6364
Hyperparameters: num_heads=2, num_transformer_blocks=4, learning_rate=8.652170306623112e-05, optimizer=AdamW, weight_decay=9.844435443508463e-06, batch_size=32,factor=1
Divergence detected. Stopping training after 10 epochs.
Early stopping at epoch 12
