[I 2025-05-09 12:36:04,688] Trial 32 finished with value: 0.46346550406855336 and parameters: {'ff_dim': 32, 'dropout_rate': 0.22568076836902123, 'embed_dim': 2048, 'learning_rate': 3.191952377546225e-07, 'optimizer': 'Adam', 'weight_decay': 9.650670910772898e-06, 'batch_size': 16, 'num_heads': 8, 'num_transformer_blocks': 1}. Best is trial 18 with value: 0.4904910822876266.
Trial 32, Fold 5: Test Accuracy = 0.4969
Trial 32: Mean Accuracy = 0.4635, Fold Accuracies = [np.float64(0.4794372294372294), np.float64(0.43565706598177706), np.float64(0.41628847397419805), np.float64(0.4889971064718903), np.float64(0.496947644477672)]
Hyperparameters: num_heads=8, num_transformer_blocks=16, learning_rate=1.4860802510083972e-06, optimizer=Adam, weight_decay=6.379098644840817e-06, batch_size=16,factor=1
Divergence detected. Stopping training after 10 epochs.
Early stopping at epoch 16
Trial 33, Fold 5: Test Accuracy = 0.4511
[I 2025-05-09 12:43:44,298] Trial 33 finished with value: 0.49553429258193216 and parameters: {'ff_dim': 32, 'dropout_rate': 0.22443843372647287, 'embed_dim': 2048, 'learning_rate': 2.4511558646364287e-06, 'optimizer': 'Adam', 'weight_decay': 7.92277168064745e-06, 'batch_size': 16, 'num_heads': 8, 'num_transformer_blocks': 1}. Best is trial 33 with value: 0.49553429258193216.
Trial 33: Mean Accuracy = 0.4955, Fold Accuracies = [np.float64(0.5634632034632036), np.float64(0.4273466642206323), np.float64(0.4712862501719058), np.float64(0.5644740763262258), np.float64(0.4511012687276936)]
Hyperparameters: num_heads=8, num_transformer_blocks=1, learning_rate=5.631863378465107e-06, optimizer=Adam, weight_decay=5.662088870631402e-06, batch_size=16,factor=1
Divergence detected. Stopping training after 10 epochs.
Early stopping at epoch 18
Trial 35, Fold 1: Test Accuracy = 0.4888
Divergence detected. Stopping training after 10 epochs.
Early stopping at epoch 10
Trial 34, Fold 1: Test Accuracy = 0.4455
Divergence detected. Stopping training after 10 epochs.
Early stopping at epoch 24
Trial 35, Fold 2: Test Accuracy = 0.3442
Divergence detected. Stopping training after 10 epochs.
Early stopping at epoch 14
Trial 35, Fold 3: Test Accuracy = 0.4882
Divergence detected. Stopping training after 10 epochs.
Early stopping at epoch 25
Trial 35, Fold 4: Test Accuracy = 0.5247
Divergence detected. Stopping training after 10 epochs.
Early stopping at epoch 17
Trial 34, Fold 2: Test Accuracy = 0.3491
Divergence detected. Stopping training after 10 epochs.
Early stopping at epoch 27
Trial 35, Fold 5: Test Accuracy = 0.4968
[I 2025-05-09 14:26:08,446] Trial 35 finished with value: 0.46853575294407124 and parameters: {'ff_dim': 32, 'dropout_rate': 0.17463684617618194, 'embed_dim': 2048, 'learning_rate': 5.631863378465107e-06, 'optimizer': 'Adam', 'weight_decay': 5.662088870631402e-06, 'batch_size': 16, 'num_heads': 8, 'num_transformer_blocks': 1}. Best is trial 33 with value: 0.49553429258193216.
Trial 35: Mean Accuracy = 0.4685, Fold Accuracies = [np.float64(0.48883116883116884), np.float64(0.34418455329297376), np.float64(0.48823433024049256), np.float64(0.5246656650094937), np.float64(0.49676304734622745)]
Hyperparameters: num_heads=8, num_transformer_blocks=8, learning_rate=1.6884657931296817e-06, optimizer=Adam, weight_decay=5.6121112348405454e-05, batch_size=10,factor=1
Divergence detected. Stopping training after 10 epochs.
Early stopping at epoch 12
Trial 34, Fold 3: Test Accuracy = 0.4255
Divergence detected. Stopping training after 10 epochs.
Early stopping at epoch 13
Trial 36, Fold 1: Test Accuracy = 0.5056
Divergence detected. Stopping training after 10 epochs.
Early stopping at epoch 17
Trial 34, Fold 4: Test Accuracy = 0.4892
Divergence detected. Stopping training after 10 epochs.
Early stopping at epoch 12
Trial 36, Fold 2: Test Accuracy = 0.3735
Divergence detected. Stopping training after 10 epochs.
Early stopping at epoch 16
Trial 34, Fold 5: Test Accuracy = 0.4957
[I 2025-05-09 15:29:32,201] Trial 34 finished with value: 0.44101633435431997 and parameters: {'ff_dim': 32, 'dropout_rate': 0.173291427362385, 'embed_dim': 2048, 'learning_rate': 1.4860802510083972e-06, 'optimizer': 'Adam', 'weight_decay': 6.379098644840817e-06, 'batch_size': 16, 'num_heads': 8, 'num_transformer_blocks': 16}. Best is trial 33 with value: 0.49553429258193216.
Trial 34: Mean Accuracy = 0.4410, Fold Accuracies = [np.float64(0.4455411255411255), np.float64(0.3491316577997921), np.float64(0.42546129267286403), np.float64(0.48921745326981), np.float64(0.4957301424880085)]
Hyperparameters: num_heads=8, num_transformer_blocks=8, learning_rate=3.1066660371825837e-05, optimizer=Adam, weight_decay=5.80783158014497e-05, batch_size=10,factor=1
Divergence detected. Stopping training after 10 epochs.
Early stopping at epoch 17
Trial 36, Fold 3: Test Accuracy = 0.4045
Divergence detected. Stopping training after 10 epochs.
Early stopping at epoch 14
Trial 37, Fold 1: Test Accuracy = 0.4284
Divergence detected. Stopping training after 10 epochs.
Early stopping at epoch 19
Trial 36, Fold 4: Test Accuracy = 0.5362
Divergence detected. Stopping training after 10 epochs.
Early stopping at epoch 15
Trial 37, Fold 2: Test Accuracy = 0.3751
Divergence detected. Stopping training after 10 epochs.
Early stopping at epoch 19
Trial 36, Fold 5: Test Accuracy = 0.4696
[I 2025-05-09 16:29:56,457] Trial 36 finished with value: 0.4579076480443212 and parameters: {'ff_dim': 64, 'dropout_rate': 0.22918456129606093, 'embed_dim': 2048, 'learning_rate': 1.6884657931296817e-06, 'optimizer': 'Adam', 'weight_decay': 5.6121112348405454e-05, 'batch_size': 10, 'num_heads': 8, 'num_transformer_blocks': 8}. Best is trial 33 with value: 0.49553429258193216.
Trial 36: Mean Accuracy = 0.4579, Fold Accuracies = [np.float64(0.5056277056277055), np.float64(0.37353696569436795), np.float64(0.4045118315060116), np.float64(0.5362348879085679), np.float64(0.4696268494849531)]
Hyperparameters: num_heads=8, num_transformer_blocks=1, learning_rate=0.0016859252856168277, optimizer=AdamW, weight_decay=1.8161949291791775e-05, batch_size=16,factor=1
Divergence detected. Stopping training after 10 epochs.
Early stopping at epoch 20
Trial 37, Fold 3: Test Accuracy = 0.4103
Divergence detected. Stopping training after 10 epochs.
Early stopping at epoch 10
Trial 38, Fold 1: Test Accuracy = 0.3333
Divergence detected. Stopping training after 10 epochs.
Early stopping at epoch 21
Trial 37, Fold 4: Test Accuracy = 0.4114
Divergence detected. Stopping training after 10 epochs.
Early stopping at epoch 19
Trial 38, Fold 2: Test Accuracy = 0.3389
Divergence detected. Stopping training after 10 epochs.
Early stopping at epoch 18
Trial 38, Fold 3: Test Accuracy = 0.3333
Divergence detected. Stopping training after 10 epochs.
Early stopping at epoch 17
[I 2025-05-09 16:48:01,532] Trial 37 finished with value: 0.40698020152627806 and parameters: {'ff_dim': 64, 'dropout_rate': 0.12708128544620198, 'embed_dim': 2048, 'learning_rate': 3.1066660371825837e-05, 'optimizer': 'Adam', 'weight_decay': 5.80783158014497e-05, 'batch_size': 10, 'num_heads': 8, 'num_transformer_blocks': 8}. Best is trial 33 with value: 0.49553429258193216.
Trial 37, Fold 5: Test Accuracy = 0.4097
Trial 37: Mean Accuracy = 0.4070, Fold Accuracies = [np.float64(0.4283549783549783), np.float64(0.3751268880327769), np.float64(0.4103200519667483), np.float64(0.41141134791089334), np.float64(0.4096877413659936)]
Hyperparameters: num_heads=8, num_transformer_blocks=1, learning_rate=8.133767072493931e-06, optimizer=AdamW, weight_decay=1.9278438288657877e-05, batch_size=16,factor=1
Divergence detected. Stopping training after 10 epochs.
Early stopping at epoch 20
Trial 38, Fold 4: Test Accuracy = 0.3333
Divergence detected. Stopping training after 10 epochs.
Early stopping at epoch 21
Trial 39, Fold 1: Test Accuracy = 0.5210
Divergence detected. Stopping training after 10 epochs.
Early stopping at epoch 20
[I 2025-05-09 16:50:48,353] Trial 38 finished with value: 0.33444444444444443 and parameters: {'ff_dim': 1024, 'dropout_rate': 0.1291849227640748, 'embed_dim': 2048, 'learning_rate': 0.0016859252856168277, 'optimizer': 'AdamW', 'weight_decay': 1.8161949291791775e-05, 'batch_size': 16, 'num_heads': 8, 'num_transformer_blocks': 1}. Best is trial 33 with value: 0.49553429258193216.
Trial 38, Fold 5: Test Accuracy = 0.3333
Trial 38: Mean Accuracy = 0.3344, Fold Accuracies = [np.float64(0.3333333333333333), np.float64(0.33888888888888885), np.float64(0.3333333333333333), np.float64(0.3333333333333333), np.float64(0.3333333333333333)]
Hyperparameters: num_heads=2, num_transformer_blocks=4, learning_rate=6.9989140330022756e-06, optimizer=AdamW, weight_decay=0.00010563264250406262, batch_size=16,factor=1
Divergence detected. Stopping training after 10 epochs.
Early stopping at epoch 13
Trial 40, Fold 1: Test Accuracy = 0.4705
Divergence detected. Stopping training after 10 epochs.
Early stopping at epoch 29
Trial 39, Fold 2: Test Accuracy = 0.3968
Divergence detected. Stopping training after 10 epochs.
Early stopping at epoch 13
Trial 39, Fold 3: Test Accuracy = 0.4522
Divergence detected. Stopping training after 10 epochs.
Early stopping at epoch 21
Trial 40, Fold 2: Test Accuracy = 0.3787
Divergence detected. Stopping training after 10 epochs.
Early stopping at epoch 11
Trial 39, Fold 4: Test Accuracy = 0.5153
Divergence detected. Stopping training after 10 epochs.
Early stopping at epoch 14
Trial 40, Fold 3: Test Accuracy = 0.4085
Divergence detected. Stopping training after 10 epochs.
Early stopping at epoch 24
[I 2025-05-09 16:55:24,377] Trial 39 finished with value: 0.4758549662912116 and parameters: {'ff_dim': 1024, 'dropout_rate': 0.16253836627339444, 'embed_dim': 128, 'learning_rate': 8.133767072493931e-06, 'optimizer': 'AdamW', 'weight_decay': 1.9278438288657877e-05, 'batch_size': 16, 'num_heads': 8, 'num_transformer_blocks': 1}. Best is trial 33 with value: 0.49553429258193216.
Trial 39, Fold 5: Test Accuracy = 0.4939
Trial 39: Mean Accuracy = 0.4759, Fold Accuracies = [np.float64(0.5210389610389611), np.float64(0.39683544303797474), np.float64(0.45220068645265493), np.float64(0.5153151502139682), np.float64(0.49388459071249874)]
Hyperparameters: num_heads=2, num_transformer_blocks=4, learning_rate=0.00012065756696969491, optimizer=Adam, weight_decay=0.00011012823925233242, batch_size=16,factor=1
Divergence detected. Stopping training after 10 epochs.
Early stopping at epoch 18
Trial 40, Fold 4: Test Accuracy = 0.5243
Divergence detected. Stopping training after 10 epochs.
Early stopping at epoch 15
[I 2025-05-09 16:56:43,147] Trial 40 finished with value: 0.46294739952361896 and parameters: {'ff_dim': 256, 'dropout_rate': 0.16722003836812155, 'embed_dim': 128, 'learning_rate': 6.9989140330022756e-06, 'optimizer': 'AdamW', 'weight_decay': 0.00010563264250406262, 'batch_size': 16, 'num_heads': 2, 'num_transformer_blocks': 4}. Best is trial 33 with value: 0.49553429258193216.
Trial 40, Fold 5: Test Accuracy = 0.5328
Trial 40: Mean Accuracy = 0.4629, Fold Accuracies = [np.float64(0.47051948051948056), np.float64(0.37865529260686115), np.float64(0.4084839520478001), np.float64(0.5243213016996612), np.float64(0.5327569707442915)]
Hyperparameters: num_heads=4, num_transformer_blocks=1, learning_rate=7.499031147531724e-07, optimizer=Adam, weight_decay=9.017426418174215e-06, batch_size=16,factor=1
Divergence detected. Stopping training after 10 epochs.
Early stopping at epoch 24
Trial 41, Fold 1: Test Accuracy = 0.4643
Divergence detected. Stopping training after 10 epochs.
Early stopping at epoch 12
Trial 41, Fold 2: Test Accuracy = 0.3920
Divergence detected. Stopping training after 10 epochs.
Early stopping at epoch 23
Trial 42, Fold 1: Test Accuracy = 0.4567
Divergence detected. Stopping training after 10 epochs.
Early stopping at epoch 17
Trial 41, Fold 3: Test Accuracy = 0.3854
Trial 42, Fold 2: Test Accuracy = 0.3967
Divergence detected. Stopping training after 10 epochs.
Early stopping at epoch 18
Trial 41, Fold 4: Test Accuracy = 0.5038
Divergence detected. Stopping training after 10 epochs.
Early stopping at epoch 10
[I 2025-05-09 17:01:43,335] Trial 41 finished with value: 0.4231403072706307 and parameters: {'ff_dim': 256, 'dropout_rate': 0.19660193233270404, 'embed_dim': 512, 'learning_rate': 0.00012065756696969491, 'optimizer': 'Adam', 'weight_decay': 0.00011012823925233242, 'batch_size': 16, 'num_heads': 2, 'num_transformer_blocks': 4}. Best is trial 33 with value: 0.49553429258193216.
Trial 41, Fold 5: Test Accuracy = 0.3702
Trial 41: Mean Accuracy = 0.4231, Fold Accuracies = [np.float64(0.46428571428571425), np.float64(0.39199229499174465), np.float64(0.3854354117106599), np.float64(0.5037647234682612), np.float64(0.3702233918967733)]
Hyperparameters: num_heads=4, num_transformer_blocks=1, learning_rate=6.686685908069584e-07, optimizer=Adam, weight_decay=8.953824798122134e-06, batch_size=16,factor=1
Divergence detected. Stopping training after 10 epochs.
Early stopping at epoch 28
Trial 42, Fold 3: Test Accuracy = 0.4984
Divergence detected. Stopping training after 10 epochs.
Early stopping at epoch 12
Trial 43, Fold 1: Test Accuracy = 0.4978
Divergence detected. Stopping training after 10 epochs.
Early stopping at epoch 10
Trial 42, Fold 4: Test Accuracy = 0.4601
Divergence detected. Stopping training after 10 epochs.
Early stopping at epoch 15
Trial 42, Fold 5: Test Accuracy = 0.4489
Trial 42: Mean Accuracy = 0.4522, Fold Accuracies = [np.float64(0.4566666666666667), np.float64(0.3966947960618847), np.float64(0.49835116764250625), np.float64(0.46014736057238864), np.float64(0.44892763750493475)]
[I 2025-05-09 17:04:44,836] Trial 42 finished with value: 0.4521575256896762 and parameters: {'ff_dim': 32, 'dropout_rate': 0.32861590057841755, 'embed_dim': 512, 'learning_rate': 7.499031147531724e-07, 'optimizer': 'Adam', 'weight_decay': 9.017426418174215e-06, 'batch_size': 16, 'num_heads': 4, 'num_transformer_blocks': 1}. Best is trial 33 with value: 0.49553429258193216.
Hyperparameters: num_heads=4, num_transformer_blocks=16, learning_rate=2.2925363607107718e-07, optimizer=Adam, weight_decay=0.000998602277859039, batch_size=10,factor=1
Trial 43, Fold 2: Test Accuracy = 0.4144
Divergence detected. Stopping training after 10 epochs.
Early stopping at epoch 15
Trial 44, Fold 1: Test Accuracy = 0.4532
Trial 43, Fold 3: Test Accuracy = 0.4799
Trial 43, Fold 4: Test Accuracy = 0.5451
Divergence detected. Stopping training after 10 epochs.
Early stopping at epoch 21
Trial 44, Fold 2: Test Accuracy = 0.4243
Divergence detected. Stopping training after 10 epochs.
Early stopping at epoch 19
[I 2025-05-09 17:11:34,492] Trial 43 finished with value: 0.49366651826489943 and parameters: {'ff_dim': 32, 'dropout_rate': 0.3252336776552044, 'embed_dim': 1024, 'learning_rate': 6.686685908069584e-07, 'optimizer': 'Adam', 'weight_decay': 8.953824798122134e-06, 'batch_size': 16, 'num_heads': 4, 'num_transformer_blocks': 1}. Best is trial 33 with value: 0.49553429258193216.
Trial 43, Fold 5: Test Accuracy = 0.5311
Trial 43: Mean Accuracy = 0.4937, Fold Accuracies = [np.float64(0.4978354978354978), np.float64(0.4143765669907662), np.float64(0.4798628850323476), np.float64(0.5451129588491878), np.float64(0.5311446826166979)]
Hyperparameters: num_heads=16, num_transformer_blocks=1, learning_rate=1.786641506484801e-07, optimizer=Adam, weight_decay=3.652335371521148e-05, batch_size=16,factor=1
Divergence detected. Stopping training after 10 epochs.
Early stopping at epoch 19
Trial 45, Fold 1: Test Accuracy = 0.4332
Trial 44, Fold 3: Test Accuracy = 0.4507
Trial 45, Fold 2: Test Accuracy = 0.3439
Divergence detected. Stopping training after 10 epochs.
Early stopping at epoch 25
Trial 45, Fold 3: Test Accuracy = 0.3339
Divergence detected. Stopping training after 10 epochs.
Early stopping at epoch 24
Trial 44, Fold 4: Test Accuracy = 0.4887
Trial 45, Fold 4: Test Accuracy = 0.4333
Divergence detected. Stopping training after 10 epochs.
Early stopping at epoch 22
[I 2025-05-09 17:21:38,307] Trial 44 finished with value: 0.4646237417852799 and parameters: {'ff_dim': 32, 'dropout_rate': 0.2749878218353121, 'embed_dim': 1024, 'learning_rate': 2.2925363607107718e-07, 'optimizer': 'Adam', 'weight_decay': 0.000998602277859039, 'batch_size': 10, 'num_heads': 4, 'num_transformer_blocks': 16}. Best is trial 33 with value: 0.49553429258193216.
Trial 44, Fold 5: Test Accuracy = 0.5062
Trial 44: Mean Accuracy = 0.4646, Fold Accuracies = [np.float64(0.45324675324675323), np.float64(0.42430746651990464), np.float64(0.4507051062597109), np.float64(0.48865293366361223), np.float64(0.5062064492364181)]
Hyperparameters: num_heads=16, num_transformer_blocks=1, learning_rate=6.599523880369536e-07, optimizer=Adam, weight_decay=3.615405676468489e-05, batch_size=16,factor=1
Divergence detected. Stopping training after 10 epochs.
Early stopping at epoch 23
[I 2025-05-09 17:21:53,898] Trial 45 finished with value: 0.39792912814698433 and parameters: {'ff_dim': 32, 'dropout_rate': 0.33448527393014604, 'embed_dim': 1024, 'learning_rate': 1.786641506484801e-07, 'optimizer': 'Adam', 'weight_decay': 3.652335371521148e-05, 'batch_size': 16, 'num_heads': 16, 'num_transformer_blocks': 1}. Best is trial 33 with value: 0.49553429258193216.
Trial 45, Fold 5: Test Accuracy = 0.4454
Trial 45: Mean Accuracy = 0.3979, Fold Accuracies = [np.float64(0.4332034632034632), np.float64(0.3438849140830429), np.float64(0.3338519766968928), np.float64(0.43328079935468233), np.float64(0.44542448739684054)]
Hyperparameters: num_heads=8, num_transformer_blocks=1, learning_rate=2.3693772558805398e-06, optimizer=Adam, weight_decay=1.2318124589003632e-05, batch_size=16,factor=1
Divergence detected. Stopping training after 10 epochs.
Early stopping at epoch 22
Trial 47, Fold 1: Test Accuracy = 0.4650
Divergence detected. Stopping training after 10 epochs.
Early stopping at epoch 28
Trial 46, Fold 1: Test Accuracy = 0.4838
Divergence detected. Stopping training after 10 epochs.
Early stopping at epoch 21
Trial 47, Fold 2: Test Accuracy = 0.4590
Divergence detected. Stopping training after 10 epochs.
Early stopping at epoch 26
Trial 46, Fold 2: Test Accuracy = 0.4157
Divergence detected. Stopping training after 10 epochs.
Early stopping at epoch 16
Trial 47, Fold 3: Test Accuracy = 0.4547
Divergence detected. Stopping training after 10 epochs.
Early stopping at epoch 15
Trial 46, Fold 3: Test Accuracy = 0.3707
Divergence detected. Stopping training after 10 epochs.
Early stopping at epoch 11
Trial 47, Fold 4: Test Accuracy = 0.5179
Trial 46, Fold 4: Test Accuracy = 0.4786
Divergence detected. Stopping training after 10 epochs.
Early stopping at epoch 29
[I 2025-05-09 17:28:57,197] Trial 47 finished with value: 0.4711857566339397 and parameters: {'ff_dim': 32, 'dropout_rate': 0.3563802126968223, 'embed_dim': 256, 'learning_rate': 2.3693772558805398e-06, 'optimizer': 'Adam', 'weight_decay': 1.2318124589003632e-05, 'batch_size': 16, 'num_heads': 8, 'num_transformer_blocks': 1}. Best is trial 33 with value: 0.49553429258193216.
Trial 47, Fold 5: Test Accuracy = 0.4593
Trial 47: Mean Accuracy = 0.4712, Fold Accuracies = [np.float64(0.464978354978355), np.float64(0.45902280927047023), np.float64(0.4547280670183786), np.float64(0.5179055268501463), np.float64(0.459294025052348)]
Hyperparameters: num_heads=1, num_transformer_blocks=1, learning_rate=5.613351560740463e-07, optimizer=Adam, weight_decay=7.2396418156082805e-06, batch_size=16,factor=1
[I 2025-05-09 17:31:03,593] Trial 46 finished with value: 0.45357642075850285 and parameters: {'ff_dim': 32, 'dropout_rate': 0.28595219717421083, 'embed_dim': 256, 'learning_rate': 6.599523880369536e-07, 'optimizer': 'Adam', 'weight_decay': 3.615405676468489e-05, 'batch_size': 16, 'num_heads': 16, 'num_transformer_blocks': 1}. Best is trial 33 with value: 0.49553429258193216.
Trial 46, Fold 5: Test Accuracy = 0.5191
Trial 46: Mean Accuracy = 0.4536, Fold Accuracies = [np.float64(0.4837662337662338), np.float64(0.4157280009784137), np.float64(0.3706562703909502), np.float64(0.4786440454960892), np.float64(0.5190875531608273)]
Hyperparameters: num_heads=1, num_transformer_blocks=1, learning_rate=1.2326901874618455e-07, optimizer=Adam, weight_decay=3.528539287404821e-06, batch_size=16,factor=1
Trial 48, Fold 1: Test Accuracy = 0.5003
Divergence detected. Stopping training after 10 epochs.
Early stopping at epoch 12
Trial 49, Fold 1: Test Accuracy = 0.4082
Trial 48, Fold 2: Test Accuracy = 0.4134
Trial 49, Fold 2: Test Accuracy = 0.4029
Divergence detected. Stopping training after 10 epochs.
Early stopping at epoch 15
Trial 49, Fold 3: Test Accuracy = 0.4522
Divergence detected. Stopping training after 10 epochs.
Early stopping at epoch 25
Trial 48, Fold 3: Test Accuracy = 0.4353
Divergence detected. Stopping training after 10 epochs.
Early stopping at epoch 13
Trial 48, Fold 4: Test Accuracy = 0.5091
Divergence detected. Stopping training after 10 epochs.
Early stopping at epoch 27
Trial 49, Fold 4: Test Accuracy = 0.4872
Divergence detected. Stopping training after 10 epochs.
Early stopping at epoch 16
Trial 49, Fold 5: Test Accuracy = 0.4433
[I 2025-05-09 17:41:54,116] Trial 49 finished with value: 0.43876912678135954 and parameters: {'ff_dim': 128, 'dropout_rate': 0.23689546053481753, 'embed_dim': 2048, 'learning_rate': 1.2326901874618455e-07, 'optimizer': 'Adam', 'weight_decay': 3.528539287404821e-06, 'batch_size': 16, 'num_heads': 1, 'num_transformer_blocks': 1}. Best is trial 33 with value: 0.49553429258193216.
Trial 49: Mean Accuracy = 0.4388, Fold Accuracies = [np.float64(0.4082251082251082), np.float64(0.40287714792392837), np.float64(0.4522445772873709), np.float64(0.48715228941910554), np.float64(0.44334651105128486)]
Hyperparameters: num_heads=4, num_transformer_blocks=8, learning_rate=1.2228910383354978e-06, optimizer=AdamW, weight_decay=0.00018664586420108893, batch_size=10,factor=1
