[I 2025-05-09 11:04:49,516] Trial 16 finished with value: 0.3333333333333333 and parameters: {'ff_dim': 32, 'dropout_rate': 0.3662518157820155, 'embed_dim': 1024, 'learning_rate': 0.004704006366373762, 'optimizer': 'Adam', 'weight_decay': 1.3819737793145035e-06, 'batch_size': 16, 'num_heads': 16, 'num_transformer_blocks': 2}. Best is trial 2 with value: 0.4790788580852764.
Trial 16, Fold 5: Test Accuracy = 0.3333
Trial 16: Mean Accuracy = 0.3333, Fold Accuracies = [np.float64(0.3333333333333333), np.float64(0.3333333333333333), np.float64(0.3333333333333333), np.float64(0.3333333333333333), np.float64(0.3333333333333333)]
Hyperparameters: num_heads=8, num_transformer_blocks=2, learning_rate=0.049617384989039774, optimizer=Adam, weight_decay=2.9941601771210973e-05, batch_size=16,factor=1
Divergence detected. Stopping training after 10 epochs.
Early stopping at epoch 10
Trial 17, Fold 1: Test Accuracy = 0.3333
Divergence detected. Stopping training after 10 epochs.
Early stopping at epoch 29
[I 2025-05-09 11:06:09,032] Trial 15 finished with value: 0.45160004085513217 and parameters: {'ff_dim': 32, 'dropout_rate': 0.2518826648859174, 'embed_dim': 1024, 'learning_rate': 1.0402392651089812e-05, 'optimizer': 'Adam', 'weight_decay': 2.290251058153077e-05, 'batch_size': 32, 'num_heads': 16, 'num_transformer_blocks': 2}. Best is trial 2 with value: 0.4790788580852764.
Trial 15, Fold 5: Test Accuracy = 0.4972
Trial 15: Mean Accuracy = 0.4516, Fold Accuracies = [np.float64(0.4821212121212121), np.float64(0.421396685623433), np.float64(0.42597444968208403), np.float64(0.43130555223765343), np.float64(0.4972023046112783)]
Hyperparameters: num_heads=8, num_transformer_blocks=1, learning_rate=2.5821821760623193e-06, optimizer=Adam, weight_decay=6.253454290522161e-05, batch_size=16,factor=1
Divergence detected. Stopping training after 10 epochs.
Early stopping at epoch 16
Trial 17, Fold 2: Test Accuracy = 0.3333
Divergence detected. Stopping training after 10 epochs.
Early stopping at epoch 10
Trial 18, Fold 1: Test Accuracy = 0.4813
Divergence detected. Stopping training after 10 epochs.
Early stopping at epoch 10
Trial 17, Fold 3: Test Accuracy = 0.3333
Divergence detected. Stopping training after 10 epochs.
Early stopping at epoch 12
Trial 17, Fold 4: Test Accuracy = 0.3333
Divergence detected. Stopping training after 10 epochs.
Early stopping at epoch 26
Trial 18, Fold 2: Test Accuracy = 0.4536
Divergence detected. Stopping training after 10 epochs.
Early stopping at epoch 10
[I 2025-05-09 11:09:18,021] Trial 17 finished with value: 0.3333333333333333 and parameters: {'ff_dim': 64, 'dropout_rate': 0.10410635927777931, 'embed_dim': 256, 'learning_rate': 0.049617384989039774, 'optimizer': 'Adam', 'weight_decay': 2.9941601771210973e-05, 'batch_size': 16, 'num_heads': 8, 'num_transformer_blocks': 2}. Best is trial 2 with value: 0.4790788580852764.
Trial 17, Fold 5: Test Accuracy = 0.3333
Trial 17: Mean Accuracy = 0.3333, Fold Accuracies = [np.float64(0.3333333333333333), np.float64(0.3333333333333333), np.float64(0.3333333333333333), np.float64(0.3333333333333333), np.float64(0.3333333333333333)]
Hyperparameters: num_heads=1, num_transformer_blocks=16, learning_rate=5.264168273349705e-05, optimizer=Adam, weight_decay=8.697275800811252e-05, batch_size=32,factor=1
Divergence detected. Stopping training after 10 epochs.
Early stopping at epoch 18
Trial 19, Fold 1: Test Accuracy = 0.3364
Trial 18, Fold 3: Test Accuracy = 0.4400
Divergence detected. Stopping training after 10 epochs.
Early stopping at epoch 16
Trial 19, Fold 2: Test Accuracy = 0.4761
Divergence detected. Stopping training after 10 epochs.
Early stopping at epoch 28
Trial 18, Fold 4: Test Accuracy = 0.5843
Divergence detected. Stopping training after 10 epochs.
Early stopping at epoch 17
Trial 19, Fold 3: Test Accuracy = 0.3333
[I 2025-05-09 11:14:42,586] Trial 18 finished with value: 0.4904910822876266 and parameters: {'ff_dim': 128, 'dropout_rate': 0.1223412597644731, 'embed_dim': 256, 'learning_rate': 2.5821821760623193e-06, 'optimizer': 'Adam', 'weight_decay': 6.253454290522161e-05, 'batch_size': 16, 'num_heads': 8, 'num_transformer_blocks': 1}. Best is trial 18 with value: 0.4904910822876266.
Trial 18, Fold 5: Test Accuracy = 0.4933
Trial 18: Mean Accuracy = 0.4905, Fold Accuracies = [np.float64(0.48125541125541127), np.float64(0.4536231884057971), np.float64(0.4399895247207812), np.float64(0.5842506141928866), np.float64(0.4933366728632567)]
Hyperparameters: num_heads=8, num_transformer_blocks=1, learning_rate=2.1792141362193585e-06, optimizer=Adam, weight_decay=9.89985337818974e-05, batch_size=16,factor=1
Trial 19, Fold 4: Test Accuracy = 0.5184
Divergence detected. Stopping training after 10 epochs.
Early stopping at epoch 17
Trial 20, Fold 1: Test Accuracy = 0.4511
Divergence detected. Stopping training after 10 epochs.
Early stopping at epoch 11
[I 2025-05-09 11:16:01,639] Trial 19 finished with value: 0.4192748892716941 and parameters: {'ff_dim': 2048, 'dropout_rate': 0.3006166734252251, 'embed_dim': 32, 'learning_rate': 5.264168273349705e-05, 'optimizer': 'Adam', 'weight_decay': 8.697275800811252e-05, 'batch_size': 32, 'num_heads': 1, 'num_transformer_blocks': 16}. Best is trial 18 with value: 0.4904910822876266.
Trial 19, Fold 5: Test Accuracy = 0.4321
Trial 19: Mean Accuracy = 0.4193, Fold Accuracies = [np.float64(0.33640692640692643), np.float64(0.47611141686540703), np.float64(0.3333333333333333), np.float64(0.5184362641806975), np.float64(0.43208650557210637)]
Hyperparameters: num_heads=8, num_transformer_blocks=1, learning_rate=3.372141513375443e-06, optimizer=Adam, weight_decay=1.152522486061992e-06, batch_size=16,factor=1
Divergence detected. Stopping training after 10 epochs.
Early stopping at epoch 18
Trial 20, Fold 2: Test Accuracy = 0.4551
Divergence detected. Stopping training after 10 epochs.
Early stopping at epoch 19
Trial 21, Fold 1: Test Accuracy = 0.4416
Divergence detected. Stopping training after 10 epochs.
Early stopping at epoch 21
Trial 21, Fold 2: Test Accuracy = 0.4537
Trial 20, Fold 3: Test Accuracy = 0.4308
Divergence detected. Stopping training after 10 epochs.
Early stopping at epoch 24
Trial 21, Fold 3: Test Accuracy = 0.4351
Divergence detected. Stopping training after 10 epochs.
Early stopping at epoch 27
Trial 20, Fold 4: Test Accuracy = 0.5246
Trial 21, Fold 4: Test Accuracy = 0.5498
Divergence detected. Stopping training after 10 epochs.
Early stopping at epoch 25
[I 2025-05-09 11:22:52,770] Trial 20 finished with value: 0.4676155184503437 and parameters: {'ff_dim': 128, 'dropout_rate': 0.4280678515488287, 'embed_dim': 256, 'learning_rate': 2.1792141362193585e-06, 'optimizer': 'Adam', 'weight_decay': 9.89985337818974e-05, 'batch_size': 16, 'num_heads': 8, 'num_transformer_blocks': 1}. Best is trial 18 with value: 0.4904910822876266.
Trial 20, Fold 5: Test Accuracy = 0.4765
Trial 20: Mean Accuracy = 0.4676, Fold Accuracies = [np.float64(0.4511255411255411), np.float64(0.4550938665688253), np.float64(0.4307578191522046), np.float64(0.5245993704685633), np.float64(0.47650099493658454)]
Hyperparameters: num_heads=8, num_transformer_blocks=1, learning_rate=3.762077255854489e-06, optimizer=Adam, weight_decay=4.697875170756365e-05, batch_size=16,factor=1
Divergence detected. Stopping training after 10 epochs.
Early stopping at epoch 13
Trial 22, Fold 1: Test Accuracy = 0.5245
Divergence detected. Stopping training after 10 epochs.
Early stopping at epoch 22
[I 2025-05-09 11:24:34,215] Trial 21 finished with value: 0.4724319063880692 and parameters: {'ff_dim': 128, 'dropout_rate': 0.10119271787101194, 'embed_dim': 256, 'learning_rate': 3.372141513375443e-06, 'optimizer': 'Adam', 'weight_decay': 1.152522486061992e-06, 'batch_size': 16, 'num_heads': 8, 'num_transformer_blocks': 1}. Best is trial 18 with value: 0.4904910822876266.
Trial 21, Fold 5: Test Accuracy = 0.4820
Trial 21: Mean Accuracy = 0.4724, Fold Accuracies = [np.float64(0.44155844155844154), np.float64(0.4536598789212989), np.float64(0.4351319065885995), np.float64(0.5498396199163786), np.float64(0.4819696849556275)]
Hyperparameters: num_heads=8, num_transformer_blocks=1, learning_rate=4.540174557803003e-07, optimizer=Adam, weight_decay=1.2484761205052558e-06, batch_size=16,factor=1
Divergence detected. Stopping training after 10 epochs.
Early stopping at epoch 20
Trial 22, Fold 2: Test Accuracy = 0.3662
Divergence detected. Stopping training after 10 epochs.
Early stopping at epoch 21
Trial 23, Fold 1: Test Accuracy = 0.4664
Divergence detected. Stopping training after 10 epochs.
Early stopping at epoch 21
Trial 22, Fold 3: Test Accuracy = 0.4617
Trial 23, Fold 2: Test Accuracy = 0.3940
Divergence detected. Stopping training after 10 epochs.
Early stopping at epoch 19
Trial 22, Fold 4: Test Accuracy = 0.5267
Divergence detected. Stopping training after 10 epochs.
Early stopping at epoch 14
[I 2025-05-09 11:31:33,290] Trial 22 finished with value: 0.47670782286972396 and parameters: {'ff_dim': 128, 'dropout_rate': 0.10589302667414588, 'embed_dim': 2048, 'learning_rate': 3.762077255854489e-06, 'optimizer': 'Adam', 'weight_decay': 4.697875170756365e-05, 'batch_size': 16, 'num_heads': 8, 'num_transformer_blocks': 1}. Best is trial 18 with value: 0.4904910822876266.
Trial 22, Fold 5: Test Accuracy = 0.5044
Trial 22: Mean Accuracy = 0.4767, Fold Accuracies = [np.float64(0.5245021645021645), np.float64(0.36622638048064576), np.float64(0.4617209742594885), np.float64(0.5266896805244482), np.float64(0.5043999145818728)]
Hyperparameters: num_heads=8, num_transformer_blocks=1, learning_rate=3.4574917812589834e-07, optimizer=Adam, weight_decay=1.360877349977649e-05, batch_size=16,factor=1
Trial 23, Fold 3: Test Accuracy = 0.4048
Divergence detected. Stopping training after 10 epochs.
Early stopping at epoch 25
Trial 24, Fold 1: Test Accuracy = 0.4822
Trial 23, Fold 4: Test Accuracy = 0.5008
Trial 24, Fold 2: Test Accuracy = 0.4703
[I 2025-05-09 11:37:35,419] Trial 23 finished with value: 0.44899479419186294 and parameters: {'ff_dim': 128, 'dropout_rate': 0.10092988496406471, 'embed_dim': 256, 'learning_rate': 4.540174557803003e-07, 'optimizer': 'Adam', 'weight_decay': 1.2484761205052558e-06, 'batch_size': 16, 'num_heads': 8, 'num_transformer_blocks': 1}. Best is trial 18 with value: 0.4904910822876266.
Trial 23, Fold 5: Test Accuracy = 0.4790
Trial 23: Mean Accuracy = 0.4490, Fold Accuracies = [np.float64(0.4663636363636363), np.float64(0.39397664037179725), np.float64(0.4048424757942047), np.float64(0.5007809611222522), np.float64(0.47901025730742425)]
Hyperparameters: num_heads=8, num_transformer_blocks=1, learning_rate=5.225017888974928e-06, optimizer=Adam, weight_decay=1.344520581061046e-05, batch_size=16,factor=1
Divergence detected. Stopping training after 10 epochs.
Early stopping at epoch 11
Trial 25, Fold 1: Test Accuracy = 0.4735
Trial 24, Fold 3: Test Accuracy = 0.4087
Divergence detected. Stopping training after 10 epochs.
Early stopping at epoch 14
Trial 25, Fold 2: Test Accuracy = 0.3573
Divergence detected. Stopping training after 10 epochs.
Early stopping at epoch 18
Trial 25, Fold 3: Test Accuracy = 0.4395
Divergence detected. Stopping training after 10 epochs.
Early stopping at epoch 24
Trial 24, Fold 4: Test Accuracy = 0.5382
Divergence detected. Stopping training after 10 epochs.
Early stopping at epoch 23
Trial 25, Fold 4: Test Accuracy = 0.4866
[I 2025-05-09 11:45:54,430] Trial 24 finished with value: 0.48310536183137637 and parameters: {'ff_dim': 128, 'dropout_rate': 0.14350736709418738, 'embed_dim': 2048, 'learning_rate': 3.4574917812589834e-07, 'optimizer': 'Adam', 'weight_decay': 1.360877349977649e-05, 'batch_size': 16, 'num_heads': 8, 'num_transformer_blocks': 1}. Best is trial 18 with value: 0.4904910822876266.
Trial 24, Fold 5: Test Accuracy = 0.5162
Trial 24: Mean Accuracy = 0.4831, Fold Accuracies = [np.float64(0.48220779220779225), np.float64(0.47026233718583743), np.float64(0.40865805235883973), np.float64(0.5382306456929535), np.float64(0.5161679817114587)]
Hyperparameters: num_heads=8, num_transformer_blocks=1, learning_rate=2.1086500827838022e-07, optimizer=Adam, weight_decay=1.6643539326686226e-05, batch_size=16,factor=1
Divergence detected. Stopping training after 10 epochs.
Early stopping at epoch 21
[I 2025-05-09 11:47:42,100] Trial 25 finished with value: 0.4438296093299153 and parameters: {'ff_dim': 128, 'dropout_rate': 0.1437650104284779, 'embed_dim': 2048, 'learning_rate': 5.225017888974928e-06, 'optimizer': 'Adam', 'weight_decay': 1.344520581061046e-05, 'batch_size': 16, 'num_heads': 8, 'num_transformer_blocks': 1}. Best is trial 18 with value: 0.4904910822876266.
Trial 25, Fold 5: Test Accuracy = 0.4623
Trial 25: Mean Accuracy = 0.4438, Fold Accuracies = [np.float64(0.4735064935064935), np.float64(0.35732587292851464), np.float64(0.43949319253153557), np.float64(0.48657113267715707), np.float64(0.4622513550058756)]
Hyperparameters: num_heads=4, num_transformer_blocks=1, learning_rate=3.1440113618731716e-07, optimizer=AdamW, weight_decay=5.208859919798618e-06, batch_size=16,factor=1
Trial 26, Fold 1: Test Accuracy = 0.4821
Divergence detected. Stopping training after 10 epochs.
Early stopping at epoch 20
Trial 27, Fold 1: Test Accuracy = 0.4832
Trial 26, Fold 2: Test Accuracy = 0.4025
Trial 27, Fold 2: Test Accuracy = 0.4540
Trial 26, Fold 3: Test Accuracy = 0.4445
Trial 27, Fold 3: Test Accuracy = 0.4005
Divergence detected. Stopping training after 10 epochs.
Early stopping at epoch 10
Trial 27, Fold 4: Test Accuracy = 0.4001
Trial 26, Fold 4: Test Accuracy = 0.5010
Divergence detected. Stopping training after 10 epochs.
Early stopping at epoch 18
[I 2025-05-09 11:59:39,990] Trial 27 finished with value: 0.4401310756733947 and parameters: {'ff_dim': 128, 'dropout_rate': 0.21532851174778705, 'embed_dim': 2048, 'learning_rate': 3.1440113618731716e-07, 'optimizer': 'AdamW', 'weight_decay': 5.208859919798618e-06, 'batch_size': 16, 'num_heads': 4, 'num_transformer_blocks': 1}. Best is trial 18 with value: 0.4904910822876266.
Trial 27, Fold 5: Test Accuracy = 0.4630
Trial 27: Mean Accuracy = 0.4401, Fold Accuracies = [np.float64(0.4831601731601731), np.float64(0.45397174830306364), np.float64(0.4004833843930044), np.float64(0.4000885070221731), np.float64(0.4629515654885594)]
Hyperparameters: num_heads=8, num_transformer_blocks=1, learning_rate=1.0796649749079528e-06, optimizer=Adam, weight_decay=1.7975839086129747e-05, batch_size=16,factor=1
Divergence detected. Stopping training after 10 epochs.
Early stopping at epoch 13
Trial 28, Fold 1: Test Accuracy = 0.5403
Trial 26, Fold 5: Test Accuracy = 0.4910
[I 2025-05-09 12:02:25,617] Trial 26 finished with value: 0.4642115987336375 and parameters: {'ff_dim': 128, 'dropout_rate': 0.2057416981284149, 'embed_dim': 2048, 'learning_rate': 2.1086500827838022e-07, 'optimizer': 'Adam', 'weight_decay': 1.6643539326686226e-05, 'batch_size': 16, 'num_heads': 8, 'num_transformer_blocks': 1}. Best is trial 18 with value: 0.4904910822876266.
Trial 26: Mean Accuracy = 0.4642, Fold Accuracies = [np.float64(0.4820779220779221), np.float64(0.4024857824252431), np.float64(0.44451174372434216), np.float64(0.5009806067512608), np.float64(0.49100193868941916)]
Hyperparameters: num_heads=4, num_transformer_blocks=32, learning_rate=1.1530312363994997e-06, optimizer=Adam, weight_decay=2.88760585811824e-06, batch_size=16,factor=1
Trial 28, Fold 2: Test Accuracy = 0.4433
Divergence detected. Stopping training after 10 epochs.
Early stopping at epoch 16
Trial 29, Fold 1: Test Accuracy = 0.4963
Divergence detected. Stopping training after 10 epochs.
Early stopping at epoch 21
Trial 28, Fold 3: Test Accuracy = 0.4140
Divergence detected. Stopping training after 10 epochs.
Early stopping at epoch 14
Trial 29, Fold 2: Test Accuracy = 0.4139
Trial 28, Fold 4: Test Accuracy = 0.5272
Trial 28, Fold 5: Test Accuracy = 0.5068
Trial 28: Mean Accuracy = 0.4863, Fold Accuracies = [np.float64(0.5402597402597403), np.float64(0.44325200269063786), np.float64(0.4140423605076122), np.float64(0.5272370549907502), np.float64(0.5067635969422324)]
[I 2025-05-09 12:13:53,940] Trial 28 finished with value: 0.4863109510781946 and parameters: {'ff_dim': 32, 'dropout_rate': 0.14076357351667868, 'embed_dim': 2048, 'learning_rate': 1.0796649749079528e-06, 'optimizer': 'Adam', 'weight_decay': 1.7975839086129747e-05, 'batch_size': 16, 'num_heads': 8, 'num_transformer_blocks': 1}. Best is trial 18 with value: 0.4904910822876266.
Hyperparameters: num_heads=8, num_transformer_blocks=1, learning_rate=8.499508418306741e-07, optimizer=Adam, weight_decay=2.4953589373673907e-06, batch_size=16,factor=1
Divergence detected. Stopping training after 10 epochs.
Early stopping at epoch 18
Trial 29, Fold 3: Test Accuracy = 0.4764
Divergence detected. Stopping training after 10 epochs.
Early stopping at epoch 26
Trial 30, Fold 1: Test Accuracy = 0.3200
Divergence detected. Stopping training after 10 epochs.
Early stopping at epoch 15
Trial 29, Fold 4: Test Accuracy = 0.5328
Divergence detected. Stopping training after 10 epochs.
Early stopping at epoch 13
Trial 30, Fold 2: Test Accuracy = 0.3808
Divergence detected. Stopping training after 10 epochs.
Early stopping at epoch 14
[I 2025-05-09 12:18:29,140] Trial 29 finished with value: 0.47835704971082815 and parameters: {'ff_dim': 32, 'dropout_rate': 0.15180952857197247, 'embed_dim': 1024, 'learning_rate': 1.1530312363994997e-06, 'optimizer': 'Adam', 'weight_decay': 2.88760585811824e-06, 'batch_size': 16, 'num_heads': 4, 'num_transformer_blocks': 32}. Best is trial 18 with value: 0.4904910822876266.
Trial 29, Fold 5: Test Accuracy = 0.4724
Trial 29: Mean Accuracy = 0.4784, Fold Accuracies = [np.float64(0.49627705627705626), np.float64(0.4138598422307833), np.float64(0.47641050512498645), np.float64(0.5328214810568747), np.float64(0.4724163638644403)]
Hyperparameters: num_heads=8, num_transformer_blocks=1, learning_rate=4.2826590912178575e-07, optimizer=Adam, weight_decay=2.5138296991874028e-05, batch_size=16,factor=1
Trial 30, Fold 3: Test Accuracy = 0.3395
Trial 31, Fold 1: Test Accuracy = 0.3816
Trial 30, Fold 4: Test Accuracy = 0.3838
Divergence detected. Stopping training after 10 epochs.
Early stopping at epoch 12
[I 2025-05-09 12:21:26,471] Trial 30 finished with value: 0.36307948024019854 and parameters: {'ff_dim': 2048, 'dropout_rate': 0.13523754036379418, 'embed_dim': 32, 'learning_rate': 8.499508418306741e-07, 'optimizer': 'Adam', 'weight_decay': 2.4953589373673907e-06, 'batch_size': 16, 'num_heads': 8, 'num_transformer_blocks': 1}. Best is trial 18 with value: 0.4904910822876266.
Trial 30, Fold 5: Test Accuracy = 0.3914
Trial 30: Mean Accuracy = 0.3631, Fold Accuracies = [np.float64(0.31995670995670994), np.float64(0.3807588821622944), np.float64(0.33946341991532), np.float64(0.3838217062932125), np.float64(0.3913966828734557)]
Hyperparameters: num_heads=8, num_transformer_blocks=1, learning_rate=3.191952377546225e-07, optimizer=Adam, weight_decay=9.650670910772898e-06, batch_size=16,factor=1
Divergence detected. Stopping training after 10 epochs.
Early stopping at epoch 20
Trial 31, Fold 2: Test Accuracy = 0.2794
Divergence detected. Stopping training after 10 epochs.
Early stopping at epoch 24
Trial 32, Fold 1: Test Accuracy = 0.4794
Divergence detected. Stopping training after 10 epochs.
Early stopping at epoch 25
Trial 31, Fold 3: Test Accuracy = 0.3572
Divergence detected. Stopping training after 10 epochs.
Early stopping at epoch 13
Trial 31, Fold 4: Test Accuracy = 0.3741
Trial 32, Fold 2: Test Accuracy = 0.4357
Divergence detected. Stopping training after 10 epochs.
Early stopping at epoch 14
[I 2025-05-09 12:27:08,291] Trial 31 finished with value: 0.35400645381584683 and parameters: {'ff_dim': 2048, 'dropout_rate': 0.1339406016137002, 'embed_dim': 32, 'learning_rate': 4.2826590912178575e-07, 'optimizer': 'Adam', 'weight_decay': 2.5138296991874028e-05, 'batch_size': 16, 'num_heads': 8, 'num_transformer_blocks': 1}. Best is trial 18 with value: 0.4904910822876266.
Trial 31, Fold 5: Test Accuracy = 0.3777
Trial 31: Mean Accuracy = 0.3540, Fold Accuracies = [np.float64(0.38160173160173166), np.float64(0.27944413869014856), np.float64(0.35716495931319625), np.float64(0.3741206051370776), np.float64(0.37770083433708024)]
Hyperparameters: num_heads=8, num_transformer_blocks=1, learning_rate=2.4511558646364287e-06, optimizer=Adam, weight_decay=7.92277168064745e-06, batch_size=16,factor=1
Divergence detected. Stopping training after 10 epochs.
Early stopping at epoch 19
Trial 33, Fold 1: Test Accuracy = 0.5635
Divergence detected. Stopping training after 10 epochs.
Early stopping at epoch 26
Trial 32, Fold 3: Test Accuracy = 0.4163
Divergence detected. Stopping training after 10 epochs.
Early stopping at epoch 12
Trial 33, Fold 2: Test Accuracy = 0.4273
Trial 32, Fold 4: Test Accuracy = 0.4890
Divergence detected. Stopping training after 10 epochs.
Early stopping at epoch 22
Trial 33, Fold 3: Test Accuracy = 0.4713
Divergence detected. Stopping training after 10 epochs.
Early stopping at epoch 22
Trial 33, Fold 4: Test Accuracy = 0.5645
