[I 2025-05-09 17:42:17,227] Trial 48 finished with value: 0.4726977719808613 and parameters: {'ff_dim': 128, 'dropout_rate': 0.293794253803453, 'embed_dim': 2048, 'learning_rate': 5.613351560740463e-07, 'optimizer': 'Adam', 'weight_decay': 7.2396418156082805e-06, 'batch_size': 16, 'num_heads': 1, 'num_transformer_blocks': 1}. Best is trial 33 with value: 0.49553429258193216.
Trial 48, Fold 5: Test Accuracy = 0.5054
Trial 48: Mean Accuracy = 0.4727, Fold Accuracies = [np.float64(0.5002597402597403), np.float64(0.41340426832997007), np.float64(0.43529064510748866), np.float64(0.5091101970846531), np.float64(0.5054240091224546)]
Hyperparameters: num_heads=4, num_transformer_blocks=32, learning_rate=1.4553714073281512e-06, optimizer=AdamW, weight_decay=4.214118031709585e-06, batch_size=10,factor=1
[W 2025-05-09 17:46:14,150] Trial 50 failed with parameters: {'ff_dim': 32, 'dropout_rate': 0.12066243087829602, 'embed_dim': 2048, 'learning_rate': 1.2228910383354978e-06, 'optimizer': 'AdamW', 'weight_decay': 0.00018664586420108893, 'batch_size': 10, 'num_heads': 4, 'num_transformer_blocks': 8} because of the following error: RuntimeError('DataLoader worker (pid(s) 16516) exited unexpectedly').
Traceback (most recent call last):
  File "c:\Users\Gabriel\anaconda3\envs\cudaenv\Lib\site-packages\torch\utils\data\dataloader.py", line 1251, in _try_get_data
    data = self._data_queue.get(timeout=timeout)
  File "c:\Users\Gabriel\anaconda3\envs\cudaenv\Lib\queue.py", line 212, in get
    raise Empty
_queue.Empty

The above exception was the direct cause of the following exception:

Traceback (most recent call last):
  File "c:\Users\Gabriel\anaconda3\envs\cudaenv\Lib\site-packages\optuna\study\_optimize.py", line 197, in _run_trial
    value_or_values = func(trial)
  File "C:\Users\Gabriel\AppData\Local\Temp\ipykernel_2068\2990928662.py", line 93, in objective
    for val_inputs, val_labels in val_loader:
                                  ^^^^^^^^^^
  File "c:\Users\Gabriel\anaconda3\envs\cudaenv\Lib\site-packages\torch\utils\data\dataloader.py", line 708, in __next__
    data = self._next_data()
  File "c:\Users\Gabriel\anaconda3\envs\cudaenv\Lib\site-packages\torch\utils\data\dataloader.py", line 1458, in _next_data
    idx, data = self._get_data()
                ~~~~~~~~~~~~~~^^
  File "c:\Users\Gabriel\anaconda3\envs\cudaenv\Lib\site-packages\torch\utils\data\dataloader.py", line 1410, in _get_data
    success, data = self._try_get_data()
                    ~~~~~~~~~~~~~~~~~~^^
  File "c:\Users\Gabriel\anaconda3\envs\cudaenv\Lib\site-packages\torch\utils\data\dataloader.py", line 1264, in _try_get_data
    raise RuntimeError(
        f"DataLoader worker (pid(s) {pids_str}) exited unexpectedly"
    ) from e
RuntimeError: DataLoader worker (pid(s) 16516) exited unexpectedly
[W 2025-05-09 17:46:14,162] Trial 50 failed with value None.
Divergence detected. Stopping training after 10 epochs.
Early stopping at epoch 13
Trial 51, Fold 1: Test Accuracy = 0.5072
Divergence detected. Stopping training after 10 epochs.
Early stopping at epoch 15
Trial 51, Fold 2: Test Accuracy = 0.4144
Divergence detected. Stopping training after 10 epochs.
Early stopping at epoch 15
Trial 51, Fold 3: Test Accuracy = 0.4546
Divergence detected. Stopping training after 10 epochs.
Early stopping at epoch 18
Trial 51, Fold 4: Test Accuracy = 0.5070
Divergence detected. Stopping training after 10 epochs.
Early stopping at epoch 14
[I 2025-05-09 18:02:56,365] Trial 51 finished with value: 0.4651167621314281 and parameters: {'ff_dim': 32, 'dropout_rate': 0.12382811746676455, 'embed_dim': 1024, 'learning_rate': 1.4553714073281512e-06, 'optimizer': 'AdamW', 'weight_decay': 4.214118031709585e-06, 'batch_size': 10, 'num_heads': 4, 'num_transformer_blocks': 32}. Best is trial 33 with value: 0.49553429258193216.
Trial 51, Fold 5: Test Accuracy = 0.4425
Trial 51: Mean Accuracy = 0.4651, Fold Accuracies = [np.float64(0.5071861471861472), np.float64(0.4143826820766832), np.float64(0.45459017664597945), np.float64(0.5069542909935373), np.float64(0.44247051375479374)]