[I 2025-06-03 19:10:02,661] Trial 32 finished with value: 0.5051187739463602 and parameters: {'ff_dim': 32, 'dropout_rate': 0.3085809134278773, 'embed_dim': 512, 'learning_rate': 1.20114594047942e-05, 'optimizer': 'Adam', 'weight_decay': 1.691727670649004e-05, 'batch_size': 32, 'num_heads': 8, 'num_transformer_blocks': 8}. Best is trial 26 with value: 0.6503238949630876.
Trial 32, Fold 1: Test Accuracy = 0.5051
Hyperparameters: num_heads=8, num_transformer_blocks=8, learning_rate=2.8234511617658198e-06, optimizer=Adam, weight_decay=0.00017212732399228282, batch_size=32,factor=1
Divergence detected. Stopping training after 10 epochs.
Early stopping at epoch 28
[I 2025-06-03 19:10:17,986] Trial 33 finished with value: 0.589484440706476 and parameters: {'ff_dim': 32, 'dropout_rate': 0.4420138205390315, 'embed_dim': 512, 'learning_rate': 1.0832884746780947e-05, 'optimizer': 'Adam', 'weight_decay': 3.9571476864810075e-05, 'batch_size': 32, 'num_heads': 8, 'num_transformer_blocks': 1}. Best is trial 26 with value: 0.6503238949630876.
Trial 33, Fold 1: Test Accuracy = 0.5895
Hyperparameters: num_heads=8, num_transformer_blocks=1, learning_rate=2.3251809269924285e-06, optimizer=Adam, weight_decay=2.3727545265504024e-06, batch_size=32,factor=1
Divergence detected. Stopping training after 10 epochs.
Early stopping at epoch 18
Divergence detected. Stopping training after 10 epochs.
Early stopping at epoch 15
[I 2025-06-03 19:11:30,237] Trial 34 finished with value: 0.5415654611718531 and parameters: {'ff_dim': 2048, 'dropout_rate': 0.45154090602438723, 'embed_dim': 512, 'learning_rate': 2.8234511617658198e-06, 'optimizer': 'Adam', 'weight_decay': 0.00017212732399228282, 'batch_size': 32, 'num_heads': 8, 'num_transformer_blocks': 8}. Best is trial 26 with value: 0.6503238949630876.
Trial 34, Fold 1: Test Accuracy = 0.5416
Hyperparameters: num_heads=8, num_transformer_blocks=1, learning_rate=1.2138972626989682e-06, optimizer=Adam, weight_decay=4.275895045137623e-05, batch_size=32,factor=1
[I 2025-06-03 19:11:31,647] Trial 35 finished with value: 0.57123483786562 and parameters: {'ff_dim': 2048, 'dropout_rate': 0.4566001048602476, 'embed_dim': 2048, 'learning_rate': 2.3251809269924285e-06, 'optimizer': 'Adam', 'weight_decay': 2.3727545265504024e-06, 'batch_size': 32, 'num_heads': 8, 'num_transformer_blocks': 1}. Best is trial 26 with value: 0.6503238949630876.
Trial 35, Fold 1: Test Accuracy = 0.5712
Hyperparameters: num_heads=16, num_transformer_blocks=1, learning_rate=5.611915525237646e-05, optimizer=AdamW, weight_decay=3.583660228762311e-05, batch_size=32,factor=1
Divergence detected. Stopping training after 10 epochs.
Early stopping at epoch 17
[I 2025-06-03 19:12:52,372] Trial 37 finished with value: 0.4992127838519765 and parameters: {'ff_dim': 256, 'dropout_rate': 0.39798523932290236, 'embed_dim': 2048, 'learning_rate': 5.611915525237646e-05, 'optimizer': 'AdamW', 'weight_decay': 3.583660228762311e-05, 'batch_size': 32, 'num_heads': 16, 'num_transformer_blocks': 1}. Best is trial 26 with value: 0.6503238949630876.
Trial 37, Fold 1: Test Accuracy = 0.4992
Hyperparameters: num_heads=4, num_transformer_blocks=1, learning_rate=1.1161912843931452e-06, optimizer=Adam, weight_decay=0.000414233460777398, batch_size=10,factor=1
Divergence detected. Stopping training after 10 epochs.
Early stopping at epoch 25
[I 2025-06-03 19:13:26,357] Trial 36 finished with value: 0.5768641248481451 and parameters: {'ff_dim': 256, 'dropout_rate': 0.4662807857082775, 'embed_dim': 2048, 'learning_rate': 1.2138972626989682e-06, 'optimizer': 'Adam', 'weight_decay': 4.275895045137623e-05, 'batch_size': 32, 'num_heads': 8, 'num_transformer_blocks': 1}. Best is trial 26 with value: 0.6503238949630876.
Trial 36, Fold 1: Test Accuracy = 0.5769
Hyperparameters: num_heads=8, num_transformer_blocks=1, learning_rate=4.342119573967396e-07, optimizer=Adam, weight_decay=1.055988602980755e-05, batch_size=10,factor=1
Trial 38, Fold 1: Test Accuracy = 0.5655
[I 2025-06-03 19:15:24,244] Trial 38 finished with value: 0.5654959349593496 and parameters: {'ff_dim': 32, 'dropout_rate': 0.10166195663993813, 'embed_dim': 256, 'learning_rate': 1.1161912843931452e-06, 'optimizer': 'Adam', 'weight_decay': 0.000414233460777398, 'batch_size': 10, 'num_heads': 4, 'num_transformer_blocks': 1}. Best is trial 26 with value: 0.6503238949630876.
Hyperparameters: num_heads=1, num_transformer_blocks=1, learning_rate=0.003404100809208248, optimizer=AdamW, weight_decay=1.0365345849494139e-05, batch_size=32,factor=1
[I 2025-06-03 19:16:04,174] Trial 39 finished with value: 0.5933844500513971 and parameters: {'ff_dim': 32, 'dropout_rate': 0.4334423186210287, 'embed_dim': 1024, 'learning_rate': 4.342119573967396e-07, 'optimizer': 'Adam', 'weight_decay': 1.055988602980755e-05, 'batch_size': 10, 'num_heads': 8, 'num_transformer_blocks': 1}. Best is trial 26 with value: 0.6503238949630876.
Trial 39, Fold 1: Test Accuracy = 0.5934
Hyperparameters: num_heads=1, num_transformer_blocks=1, learning_rate=5.827358066427951e-07, optimizer=Adam, weight_decay=3.1703449730300798e-06, batch_size=10,factor=1
Divergence detected. Stopping training after 10 epochs.
Early stopping at epoch 17
[I 2025-06-03 19:16:49,675] Trial 40 finished with value: 0.3333333333333333 and parameters: {'ff_dim': 32, 'dropout_rate': 0.4356615826519961, 'embed_dim': 1024, 'learning_rate': 0.003404100809208248, 'optimizer': 'AdamW', 'weight_decay': 1.0365345849494139e-05, 'batch_size': 32, 'num_heads': 1, 'num_transformer_blocks': 1}. Best is trial 26 with value: 0.6503238949630876.
Trial 40, Fold 1: Test Accuracy = 0.3333
Hyperparameters: num_heads=8, num_transformer_blocks=1, learning_rate=4.553325086585026e-07, optimizer=Adam, weight_decay=2.3880727047067904e-05, batch_size=10,factor=1
Divergence detected. Stopping training after 10 epochs.
Early stopping at epoch 28
[I 2025-06-03 19:18:28,035] Trial 41 finished with value: 0.5140932623119334 and parameters: {'ff_dim': 32, 'dropout_rate': 0.4378412177633219, 'embed_dim': 1024, 'learning_rate': 5.827358066427951e-07, 'optimizer': 'Adam', 'weight_decay': 3.1703449730300798e-06, 'batch_size': 10, 'num_heads': 1, 'num_transformer_blocks': 1}. Best is trial 26 with value: 0.6503238949630876.
Trial 41, Fold 1: Test Accuracy = 0.5141
Hyperparameters: num_heads=8, num_transformer_blocks=1, learning_rate=3.625518171447465e-07, optimizer=Adam, weight_decay=2.2825359494028837e-05, batch_size=10,factor=1
Divergence detected. Stopping training after 10 epochs.
Early stopping at epoch 20
[I 2025-06-03 19:18:34,638] Trial 42 finished with value: 0.5461626016260163 and parameters: {'ff_dim': 32, 'dropout_rate': 0.425881064436517, 'embed_dim': 1024, 'learning_rate': 4.553325086585026e-07, 'optimizer': 'Adam', 'weight_decay': 2.3880727047067904e-05, 'batch_size': 10, 'num_heads': 8, 'num_transformer_blocks': 1}. Best is trial 26 with value: 0.6503238949630876.
Trial 42, Fold 1: Test Accuracy = 0.5462
Hyperparameters: num_heads=8, num_transformer_blocks=1, learning_rate=1.1533543249169794e-07, optimizer=Adam, weight_decay=8.141500549058788e-06, batch_size=10,factor=1
[I 2025-06-03 19:20:55,382] Trial 43 finished with value: 0.6279325296701243 and parameters: {'ff_dim': 32, 'dropout_rate': 0.41853152648379743, 'embed_dim': 1024, 'learning_rate': 3.625518171447465e-07, 'optimizer': 'Adam', 'weight_decay': 2.2825359494028837e-05, 'batch_size': 10, 'num_heads': 8, 'num_transformer_blocks': 1}. Best is trial 26 with value: 0.6503238949630876.
Trial 43, Fold 1: Test Accuracy = 0.6279
Hyperparameters: num_heads=8, num_transformer_blocks=1, learning_rate=2.2642327719247237e-07, optimizer=Adam, weight_decay=7.782325917807199e-06, batch_size=10,factor=1
[I 2025-06-03 19:21:02,026] Trial 44 finished with value: 0.5382738996355481 and parameters: {'ff_dim': 32, 'dropout_rate': 0.32993800819965863, 'embed_dim': 1024, 'learning_rate': 1.1533543249169794e-07, 'optimizer': 'Adam', 'weight_decay': 8.141500549058788e-06, 'batch_size': 10, 'num_heads': 8, 'num_transformer_blocks': 1}. Best is trial 26 with value: 0.6503238949630876.
Trial 44, Fold 1: Test Accuracy = 0.5383
Hyperparameters: num_heads=16, num_transformer_blocks=1, learning_rate=1.9341478330529375e-07, optimizer=Adam, weight_decay=5.379037611203741e-06, batch_size=10,factor=1
[I 2025-06-03 19:23:23,113] Trial 45 finished with value: 0.5602399775721896 and parameters: {'ff_dim': 32, 'dropout_rate': 0.47655697323436064, 'embed_dim': 1024, 'learning_rate': 2.2642327719247237e-07, 'optimizer': 'Adam', 'weight_decay': 7.782325917807199e-06, 'batch_size': 10, 'num_heads': 8, 'num_transformer_blocks': 1}. Best is trial 26 with value: 0.6503238949630876.
Trial 45, Fold 1: Test Accuracy = 0.5602
Hyperparameters: num_heads=8, num_transformer_blocks=1, learning_rate=3.4398216475610645e-07, optimizer=Adam, weight_decay=4.3924727014694645e-06, batch_size=10,factor=1
[I 2025-06-03 19:23:29,691] Trial 46 finished with value: 0.5666112512849266 and parameters: {'ff_dim': 32, 'dropout_rate': 0.4726099936009171, 'embed_dim': 1024, 'learning_rate': 1.9341478330529375e-07, 'optimizer': 'Adam', 'weight_decay': 5.379037611203741e-06, 'batch_size': 10, 'num_heads': 16, 'num_transformer_blocks': 1}. Best is trial 26 with value: 0.6503238949630876.
Trial 46, Fold 1: Test Accuracy = 0.5666
Hyperparameters: num_heads=8, num_transformer_blocks=1, learning_rate=3.5287372684269858e-06, optimizer=Adam, weight_decay=1.3677150368012854e-05, batch_size=10,factor=1
Divergence detected. Stopping training after 10 epochs.
Early stopping at epoch 13
[I 2025-06-03 19:24:40,058] Trial 48 finished with value: 0.5822595084571535 and parameters: {'ff_dim': 1024, 'dropout_rate': 0.41576433577066946, 'embed_dim': 1024, 'learning_rate': 3.5287372684269858e-06, 'optimizer': 'Adam', 'weight_decay': 1.3677150368012854e-05, 'batch_size': 10, 'num_heads': 8, 'num_transformer_blocks': 1}. Best is trial 26 with value: 0.6503238949630876.
Trial 48, Fold 1: Test Accuracy = 0.5823
Hyperparameters: num_heads=8, num_transformer_blocks=16, learning_rate=4.14795649448384e-07, optimizer=Adam, weight_decay=1.9985968023079202e-05, batch_size=10,factor=1
Divergence detected. Stopping training after 10 epochs.
Early stopping at epoch 28
[I 2025-06-03 19:25:46,612] Trial 47 finished with value: 0.6157637603962246 and parameters: {'ff_dim': 32, 'dropout_rate': 0.18991275507279126, 'embed_dim': 1024, 'learning_rate': 3.4398216475610645e-07, 'optimizer': 'Adam', 'weight_decay': 4.3924727014694645e-06, 'batch_size': 10, 'num_heads': 8, 'num_transformer_blocks': 1}. Best is trial 26 with value: 0.6503238949630876.
Trial 47, Fold 1: Test Accuracy = 0.6158
Hyperparameters: num_heads=2, num_transformer_blocks=16, learning_rate=3.739499550402986e-07, optimizer=Adam, weight_decay=1.0077895513902973e-06, batch_size=10,factor=1
Divergence detected. Stopping training after 10 epochs.
Early stopping at epoch 27
[I 2025-06-03 19:28:29,676] Trial 49 finished with value: 0.5930750397159145 and parameters: {'ff_dim': 32, 'dropout_rate': 0.18850310956085298, 'embed_dim': 512, 'learning_rate': 4.14795649448384e-07, 'optimizer': 'Adam', 'weight_decay': 1.9985968023079202e-05, 'batch_size': 10, 'num_heads': 8, 'num_transformer_blocks': 16}. Best is trial 26 with value: 0.6503238949630876.
Trial 49, Fold 1: Test Accuracy = 0.5931
Hyperparameters: num_heads=2, num_transformer_blocks=16, learning_rate=4.2083934470617656e-07, optimizer=Adam, weight_decay=1.0356845590549609e-06, batch_size=10,factor=1
Divergence detected. Stopping training after 10 epochs.
Early stopping at epoch 24
[I 2025-06-03 19:29:26,212] Trial 50 finished with value: 0.45633632370806465 and parameters: {'ff_dim': 32, 'dropout_rate': 0.17302053032340522, 'embed_dim': 1024, 'learning_rate': 3.739499550402986e-07, 'optimizer': 'Adam', 'weight_decay': 1.0077895513902973e-06, 'batch_size': 10, 'num_heads': 2, 'num_transformer_blocks': 16}. Best is trial 26 with value: 0.6503238949630876.
Trial 50, Fold 1: Test Accuracy = 0.4563
Hyperparameters: num_heads=8, num_transformer_blocks=16, learning_rate=6.617178019962192e-07, optimizer=Adam, weight_decay=3.7200997074946538e-06, batch_size=10,factor=1
Divergence detected. Stopping training after 10 epochs.
Early stopping at epoch 14
[I 2025-06-03 19:31:44,888] Trial 52 finished with value: 0.532384450051397 and parameters: {'ff_dim': 32, 'dropout_rate': 0.19032028142593085, 'embed_dim': 1024, 'learning_rate': 6.617178019962192e-07, 'optimizer': 'Adam', 'weight_decay': 3.7200997074946538e-06, 'batch_size': 10, 'num_heads': 8, 'num_transformer_blocks': 16}. Best is trial 26 with value: 0.6503238949630876.
Trial 52, Fold 1: Test Accuracy = 0.5324
Hyperparameters: num_heads=8, num_transformer_blocks=16, learning_rate=1.0213711046317437e-07, optimizer=Adam, weight_decay=1.8089038765256737e-05, batch_size=10,factor=1
Divergence detected. Stopping training after 10 epochs.
Early stopping at epoch 27
[I 2025-06-03 19:32:54,577] Trial 51 finished with value: 0.5278336604055696 and parameters: {'ff_dim': 32, 'dropout_rate': 0.1676923443266727, 'embed_dim': 1024, 'learning_rate': 4.2083934470617656e-07, 'optimizer': 'Adam', 'weight_decay': 1.0356845590549609e-06, 'batch_size': 10, 'num_heads': 2, 'num_transformer_blocks': 16}. Best is trial 26 with value: 0.6503238949630876.
Trial 51, Fold 1: Test Accuracy = 0.5278
Hyperparameters: num_heads=8, num_transformer_blocks=16, learning_rate=1.0821198519733549e-07, optimizer=Adam, weight_decay=1.8749543463885696e-05, batch_size=10,factor=1
Divergence detected. Stopping training after 10 epochs.
Early stopping at epoch 10
[I 2025-06-03 19:34:26,591] Trial 54 finished with value: 0.4704742547425475 and parameters: {'ff_dim': 32, 'dropout_rate': 0.20824101522508315, 'embed_dim': 512, 'learning_rate': 1.0821198519733549e-07, 'optimizer': 'Adam', 'weight_decay': 1.8749543463885696e-05, 'batch_size': 10, 'num_heads': 8, 'num_transformer_blocks': 16}. Best is trial 26 with value: 0.6503238949630876.
Trial 54, Fold 1: Test Accuracy = 0.4705
Hyperparameters: num_heads=8, num_transformer_blocks=2, learning_rate=1.2625061741701271e-06, optimizer=Adam, weight_decay=2.401513996993152e-06, batch_size=10,factor=1
Divergence detected. Stopping training after 10 epochs.
Early stopping at epoch 12
[I 2025-06-03 19:35:28,608] Trial 55 finished with value: 0.47289309410335484 and parameters: {'ff_dim': 32, 'dropout_rate': 0.14787752956419836, 'embed_dim': 32, 'learning_rate': 1.2625061741701271e-06, 'optimizer': 'Adam', 'weight_decay': 2.401513996993152e-06, 'batch_size': 10, 'num_heads': 8, 'num_transformer_blocks': 2}. Best is trial 26 with value: 0.6503238949630876.
Trial 55, Fold 1: Test Accuracy = 0.4729
Hyperparameters: num_heads=4, num_transformer_blocks=4, learning_rate=1.6663032825634256e-06, optimizer=Adam, weight_decay=2.853862767129088e-05, batch_size=10,factor=1
[I 2025-06-03 19:35:52,123] Trial 53 finished with value: 0.5629708438463695 and parameters: {'ff_dim': 32, 'dropout_rate': 0.199530710048429, 'embed_dim': 1024, 'learning_rate': 1.0213711046317437e-07, 'optimizer': 'Adam', 'weight_decay': 1.8089038765256737e-05, 'batch_size': 10, 'num_heads': 8, 'num_transformer_blocks': 16}. Best is trial 26 with value: 0.6503238949630876.
Trial 53, Fold 1: Test Accuracy = 0.5630
Hyperparameters: num_heads=4, num_transformer_blocks=32, learning_rate=0.015153032751670879, optimizer=Adam, weight_decay=2.952502661327173e-05, batch_size=10,factor=1
Divergence detected. Stopping training after 10 epochs.
Early stopping at epoch 20
[I 2025-06-03 19:37:02,337] Trial 56 finished with value: 0.6046225586393795 and parameters: {'ff_dim': 64, 'dropout_rate': 0.25055779759014646, 'embed_dim': 128, 'learning_rate': 1.6663032825634256e-06, 'optimizer': 'Adam', 'weight_decay': 2.853862767129088e-05, 'batch_size': 10, 'num_heads': 4, 'num_transformer_blocks': 4}. Best is trial 26 with value: 0.6503238949630876.
Trial 56, Fold 1: Test Accuracy = 0.6046
Hyperparameters: num_heads=4, num_transformer_blocks=4, learning_rate=1.8690547136723197e-06, optimizer=Adam, weight_decay=2.8630830655423218e-05, batch_size=10,factor=1
[I 2025-06-03 19:39:09,978] Trial 58 finished with value: 0.5486459209419681 and parameters: {'ff_dim': 64, 'dropout_rate': 0.26660911931759146, 'embed_dim': 128, 'learning_rate': 1.8690547136723197e-06, 'optimizer': 'Adam', 'weight_decay': 2.8630830655423218e-05, 'batch_size': 10, 'num_heads': 4, 'num_transformer_blocks': 4}. Best is trial 26 with value: 0.6503238949630876.
Trial 58, Fold 1: Test Accuracy = 0.5486
Hyperparameters: num_heads=4, num_transformer_blocks=4, learning_rate=2.581504202302649e-07, optimizer=Adam, weight_decay=1.0153192415747231e-05, batch_size=10,factor=1
[I 2025-06-03 19:39:30,357] Trial 57 finished with value: 0.3333333333333333 and parameters: {'ff_dim': 64, 'dropout_rate': 0.11363580890658802, 'embed_dim': 128, 'learning_rate': 0.015153032751670879, 'optimizer': 'Adam', 'weight_decay': 2.952502661327173e-05, 'batch_size': 10, 'num_heads': 4, 'num_transformer_blocks': 32}. Best is trial 26 with value: 0.6503238949630876.
Trial 57, Fold 1: Test Accuracy = 0.3333
Hyperparameters: num_heads=4, num_transformer_blocks=4, learning_rate=4.40649301523081e-06, optimizer=Adam, weight_decay=1.0594513213225922e-05, batch_size=10,factor=1
Divergence detected. Stopping training after 10 epochs.
Early stopping at epoch 24
[I 2025-06-03 19:41:18,476] Trial 60 finished with value: 0.5152482011027008 and parameters: {'ff_dim': 64, 'dropout_rate': 0.2426213165456769, 'embed_dim': 128, 'learning_rate': 4.40649301523081e-06, 'optimizer': 'Adam', 'weight_decay': 1.0594513213225922e-05, 'batch_size': 10, 'num_heads': 4, 'num_transformer_blocks': 4}. Best is trial 26 with value: 0.6503238949630876.
Trial 60, Fold 1: Test Accuracy = 0.5152
Hyperparameters: num_heads=4, num_transformer_blocks=4, learning_rate=2.459777055158588e-07, optimizer=Adam, weight_decay=5.3815643039539686e-05, batch_size=10,factor=1
[I 2025-06-03 19:41:19,358] Trial 59 finished with value: 0.49253882814690214 and parameters: {'ff_dim': 64, 'dropout_rate': 0.24492987801230306, 'embed_dim': 128, 'learning_rate': 2.581504202302649e-07, 'optimizer': 'Adam', 'weight_decay': 1.0153192415747231e-05, 'batch_size': 10, 'num_heads': 4, 'num_transformer_blocks': 4}. Best is trial 26 with value: 0.6503238949630876.
Trial 59, Fold 1: Test Accuracy = 0.4925
Hyperparameters: num_heads=8, num_transformer_blocks=4, learning_rate=7.731106374922111e-07, optimizer=Adam, weight_decay=5.078661020233088e-05, batch_size=10,factor=1
Divergence detected. Stopping training after 10 epochs.
Early stopping at epoch 10
[I 2025-06-03 19:42:10,683] Trial 61 finished with value: 0.44040164470610216 and parameters: {'ff_dim': 64, 'dropout_rate': 0.21375582831259232, 'embed_dim': 128, 'learning_rate': 2.459777055158588e-07, 'optimizer': 'Adam', 'weight_decay': 5.3815643039539686e-05, 'batch_size': 10, 'num_heads': 4, 'num_transformer_blocks': 4}. Best is trial 26 with value: 0.6503238949630876.
Trial 61, Fold 1: Test Accuracy = 0.4404
Hyperparameters: num_heads=8, num_transformer_blocks=8, learning_rate=6.182086795526218e-07, optimizer=Adam, weight_decay=1.4490168817168576e-05, batch_size=16,factor=1
Divergence detected. Stopping training after 10 epochs.
Early stopping at epoch 21
[I 2025-06-03 19:43:05,153] Trial 62 finished with value: 0.5088796374170639 and parameters: {'ff_dim': 256, 'dropout_rate': 0.21804568481358025, 'embed_dim': 512, 'learning_rate': 7.731106374922111e-07, 'optimizer': 'Adam', 'weight_decay': 5.078661020233088e-05, 'batch_size': 10, 'num_heads': 8, 'num_transformer_blocks': 4}. Best is trial 26 with value: 0.6503238949630876.
Trial 62, Fold 1: Test Accuracy = 0.5089
Hyperparameters: num_heads=8, num_transformer_blocks=8, learning_rate=1.0245579354630048e-06, optimizer=Adam, weight_decay=1.4211807696911252e-05, batch_size=16,factor=1
Divergence detected. Stopping training after 10 epochs.
Early stopping at epoch 10
[I 2025-06-03 19:43:59,143] Trial 64 finished with value: 0.5124765909728063 and parameters: {'ff_dim': 32, 'dropout_rate': 0.2816025257651576, 'embed_dim': 64, 'learning_rate': 1.0245579354630048e-06, 'optimizer': 'Adam', 'weight_decay': 1.4211807696911252e-05, 'batch_size': 16, 'num_heads': 8, 'num_transformer_blocks': 8}. Best is trial 26 with value: 0.6503238949630876.
Trial 64, Fold 1: Test Accuracy = 0.5125
Hyperparameters: num_heads=1, num_transformer_blocks=2, learning_rate=1.6491436740924953e-07, optimizer=Adam, weight_decay=2.4132496610128134e-05, batch_size=10,factor=1
Divergence detected. Stopping training after 10 epochs.
Early stopping at epoch 24
[I 2025-06-03 19:44:07,700] Trial 63 finished with value: 0.5673505279880385 and parameters: {'ff_dim': 256, 'dropout_rate': 0.22479139857831773, 'embed_dim': 512, 'learning_rate': 6.182086795526218e-07, 'optimizer': 'Adam', 'weight_decay': 1.4490168817168576e-05, 'batch_size': 16, 'num_heads': 8, 'num_transformer_blocks': 8}. Best is trial 26 with value: 0.6503238949630876.
Trial 63, Fold 1: Test Accuracy = 0.5674
Hyperparameters: num_heads=1, num_transformer_blocks=2, learning_rate=1.738938466859771e-07, optimizer=Adam, weight_decay=6.444609661100409e-06, batch_size=10,factor=1
[I 2025-06-03 19:46:20,089] Trial 65 finished with value: 0.5961892346509673 and parameters: {'ff_dim': 1024, 'dropout_rate': 0.14879695603286605, 'embed_dim': 512, 'learning_rate': 1.6491436740924953e-07, 'optimizer': 'Adam', 'weight_decay': 2.4132496610128134e-05, 'batch_size': 10, 'num_heads': 1, 'num_transformer_blocks': 2}. Best is trial 26 with value: 0.6503238949630876.
Trial 65, Fold 1: Test Accuracy = 0.5962
Hyperparameters: num_heads=1, num_transformer_blocks=2, learning_rate=3.3949307493517304e-07, optimizer=Adam, weight_decay=5.671048086980873e-06, batch_size=10,factor=1
