[I 2025-06-03 22:07:43,874] Trial 165 finished with value: 0.5399836463881881 and parameters: {'ff_dim': 32, 'dropout_rate': 0.31795544475952453, 'embed_dim': 1024, 'learning_rate': 1.9920942893806854e-07, 'optimizer': 'Adam', 'weight_decay': 1.1449960715460778e-06, 'batch_size': 10, 'num_heads': 8, 'num_transformer_blocks': 1}. Best is trial 26 with value: 0.6503238949630876.
Trial 165, Fold 1: Test Accuracy = 0.5400
Hyperparameters: num_heads=2, num_transformer_blocks=16, learning_rate=3.4359747412649513e-07, optimizer=Adam, weight_decay=1.7160290174677884e-05, batch_size=32,factor=1
[I 2025-06-03 22:08:23,696] Trial 166 finished with value: 0.5597480609288851 and parameters: {'ff_dim': 64, 'dropout_rate': 0.32178876331435324, 'embed_dim': 256, 'learning_rate': 3.1827455783877265e-07, 'optimizer': 'Adam', 'weight_decay': 1.403337752543182e-06, 'batch_size': 10, 'num_heads': 2, 'num_transformer_blocks': 1}. Best is trial 26 with value: 0.6503238949630876.
Trial 166, Fold 1: Test Accuracy = 0.5597
Hyperparameters: num_heads=16, num_transformer_blocks=16, learning_rate=1.067126930552919e-06, optimizer=Adam, weight_decay=2.596233762056418e-05, batch_size=32,factor=1
[I 2025-06-03 22:10:09,031] Trial 167 finished with value: 0.5553164190262593 and parameters: {'ff_dim': 64, 'dropout_rate': 0.19371435747801813, 'embed_dim': 256, 'learning_rate': 3.4359747412649513e-07, 'optimizer': 'Adam', 'weight_decay': 1.7160290174677884e-05, 'batch_size': 32, 'num_heads': 2, 'num_transformer_blocks': 16}. Best is trial 26 with value: 0.6503238949630876.
Trial 167, Fold 1: Test Accuracy = 0.5553
Hyperparameters: num_heads=16, num_transformer_blocks=4, learning_rate=1.5732872508115607e-05, optimizer=Adam, weight_decay=2.8906048800720474e-05, batch_size=10,factor=1
Divergence detected. Stopping training after 10 epochs.
Early stopping at epoch 29
[I 2025-06-03 22:10:57,820] Trial 168 finished with value: 0.5483231473694047 and parameters: {'ff_dim': 128, 'dropout_rate': 0.19809202316267613, 'embed_dim': 1024, 'learning_rate': 1.067126930552919e-06, 'optimizer': 'Adam', 'weight_decay': 2.596233762056418e-05, 'batch_size': 32, 'num_heads': 16, 'num_transformer_blocks': 16}. Best is trial 26 with value: 0.6503238949630876.
Trial 168, Fold 1: Test Accuracy = 0.5483
Hyperparameters: num_heads=8, num_transformer_blocks=4, learning_rate=5.655214148404367e-07, optimizer=Adam, weight_decay=5.178787382665183e-06, batch_size=10,factor=1
Divergence detected. Stopping training after 10 epochs.
Early stopping at epoch 11
[I 2025-06-03 22:11:17,656] Trial 169 finished with value: 0.5944978039435567 and parameters: {'ff_dim': 128, 'dropout_rate': 0.16264250964450036, 'embed_dim': 1024, 'learning_rate': 1.5732872508115607e-05, 'optimizer': 'Adam', 'weight_decay': 2.8906048800720474e-05, 'batch_size': 10, 'num_heads': 16, 'num_transformer_blocks': 4}. Best is trial 26 with value: 0.6503238949630876.
Trial 169, Fold 1: Test Accuracy = 0.5945
Hyperparameters: num_heads=8, num_transformer_blocks=4, learning_rate=1.4744044792478613e-05, optimizer=Adam, weight_decay=2.8027997042674867e-05, batch_size=10,factor=1
Divergence detected. Stopping training after 10 epochs.
Early stopping at epoch 16
[I 2025-06-03 22:12:53,796] Trial 171 finished with value: 0.47311503597794596 and parameters: {'ff_dim': 128, 'dropout_rate': 0.1659294662789501, 'embed_dim': 1024, 'learning_rate': 1.4744044792478613e-05, 'optimizer': 'Adam', 'weight_decay': 2.8027997042674867e-05, 'batch_size': 10, 'num_heads': 8, 'num_transformer_blocks': 4}. Best is trial 26 with value: 0.6503238949630876.
Trial 171, Fold 1: Test Accuracy = 0.4731
Hyperparameters: num_heads=16, num_transformer_blocks=4, learning_rate=1.741018337792561e-05, optimizer=Adam, weight_decay=3.700864210113766e-05, batch_size=10,factor=1
Divergence detected. Stopping training after 10 epochs.
Early stopping at epoch 28
[I 2025-06-03 22:13:43,509] Trial 170 finished with value: 0.5111184935987291 and parameters: {'ff_dim': 256, 'dropout_rate': 0.22244848053616642, 'embed_dim': 1024, 'learning_rate': 5.655214148404367e-07, 'optimizer': 'Adam', 'weight_decay': 5.178787382665183e-06, 'batch_size': 10, 'num_heads': 8, 'num_transformer_blocks': 4}. Best is trial 26 with value: 0.6503238949630876.
Trial 170, Fold 1: Test Accuracy = 0.5111
Hyperparameters: num_heads=16, num_transformer_blocks=4, learning_rate=3.557583958363434e-05, optimizer=Adam, weight_decay=3.6235757846397387e-05, batch_size=10,factor=1
Divergence detected. Stopping training after 10 epochs.
Early stopping at epoch 13
[I 2025-06-03 22:14:15,780] Trial 172 finished with value: 0.5323520231754042 and parameters: {'ff_dim': 128, 'dropout_rate': 0.14203446648075033, 'embed_dim': 1024, 'learning_rate': 1.741018337792561e-05, 'optimizer': 'Adam', 'weight_decay': 3.700864210113766e-05, 'batch_size': 10, 'num_heads': 16, 'num_transformer_blocks': 4}. Best is trial 26 with value: 0.6503238949630876.
Trial 172, Fold 1: Test Accuracy = 0.5324
Hyperparameters: num_heads=16, num_transformer_blocks=4, learning_rate=3.439514274342068e-05, optimizer=Adam, weight_decay=2.422489642667661e-05, batch_size=10,factor=1
Divergence detected. Stopping training after 10 epochs.
Early stopping at epoch 12
Trial 173, Fold 1: Test Accuracy = 0.5914
[I 2025-06-03 22:15:02,301] Trial 173 finished with value: 0.5913545463040838 and parameters: {'ff_dim': 128, 'dropout_rate': 0.15590002993070082, 'embed_dim': 1024, 'learning_rate': 3.557583958363434e-05, 'optimizer': 'Adam', 'weight_decay': 3.6235757846397387e-05, 'batch_size': 10, 'num_heads': 16, 'num_transformer_blocks': 4}. Best is trial 26 with value: 0.6503238949630876.
Hyperparameters: num_heads=8, num_transformer_blocks=8, learning_rate=1.2277013047912185e-05, optimizer=Adam, weight_decay=3.196579827425196e-05, batch_size=10,factor=1
[W 2025-06-03 22:15:15,109] Trial 174 failed with parameters: {'ff_dim': 128, 'dropout_rate': 0.17474688657303888, 'embed_dim': 1024, 'learning_rate': 3.439514274342068e-05, 'optimizer': 'Adam', 'weight_decay': 2.422489642667661e-05, 'batch_size': 10, 'num_heads': 16, 'num_transformer_blocks': 4} because of the following error: RuntimeError('DataLoader worker (pid(s) 5088) exited unexpectedly').
Traceback (most recent call last):
  File "c:\Users\Gabriel\anaconda3\envs\cudaenv\Lib\site-packages\torch\utils\data\dataloader.py", line 1251, in _try_get_data
    data = self._data_queue.get(timeout=timeout)
  File "c:\Users\Gabriel\anaconda3\envs\cudaenv\Lib\queue.py", line 212, in get
    raise Empty
_queue.Empty

The above exception was the direct cause of the following exception:

Traceback (most recent call last):
  File "c:\Users\Gabriel\anaconda3\envs\cudaenv\Lib\site-packages\optuna\study\_optimize.py", line 197, in _run_trial
    value_or_values = func(trial)
  File "C:\Users\Gabriel\AppData\Local\Temp\ipykernel_25904\3722803089.py", line 79, in objective
    for val_inputs, val_labels in val_loader:
                                  ^^^^^^^^^^
  File "c:\Users\Gabriel\anaconda3\envs\cudaenv\Lib\site-packages\torch\utils\data\dataloader.py", line 708, in __next__
    data = self._next_data()
  File "c:\Users\Gabriel\anaconda3\envs\cudaenv\Lib\site-packages\torch\utils\data\dataloader.py", line 1458, in _next_data
    idx, data = self._get_data()
                ~~~~~~~~~~~~~~^^
  File "c:\Users\Gabriel\anaconda3\envs\cudaenv\Lib\site-packages\torch\utils\data\dataloader.py", line 1410, in _get_data
    success, data = self._try_get_data()
                    ~~~~~~~~~~~~~~~~~~^^
  File "c:\Users\Gabriel\anaconda3\envs\cudaenv\Lib\site-packages\torch\utils\data\dataloader.py", line 1264, in _try_get_data
    raise RuntimeError(
        f"DataLoader worker (pid(s) {pids_str}) exited unexpectedly"
    ) from e
RuntimeError: DataLoader worker (pid(s) 5088) exited unexpectedly
[W 2025-06-03 22:15:15,115] Trial 174 failed with value None.
Divergence detected. Stopping training after 10 epochs.
Early stopping at epoch 12
[I 2025-06-03 22:16:02,122] Trial 175 finished with value: 0.6067218017007756 and parameters: {'ff_dim': 32, 'dropout_rate': 0.17545572485870525, 'embed_dim': 512, 'learning_rate': 1.2277013047912185e-05, 'optimizer': 'Adam', 'weight_decay': 3.196579827425196e-05, 'batch_size': 10, 'num_heads': 8, 'num_transformer_blocks': 8}. Best is trial 26 with value: 0.6503238949630876.
Trial 175, Fold 1: Test Accuracy = 0.6067