[I 2025-05-02 05:46:49,958] Trial 30 finished with value: 0.5276860823756573 and parameters: {'num_heads': 8, 'num_transformer_blocks': 2, 'learning_rate': 2.2482536663267403e-05, 'optimizer': 'Adam', 'weight_decay': 0.0003458008094786126, 'batch_size': 16, 'label_smoothing': 0.06}. Best is trial 22 with value: 0.5543773281975666.
Hyperparameters: num_heads=16, num_transformer_blocks=4, learning_rate=8.843946128048995e-08, optimizer=SGD, weight_decay=8.569994148477874e-05, batch_size=32,factor=1
Trial 29, Fold 5: Test Accuracy = 0.5514
Trial 29: Mean Accuracy = 0.5355, Fold Accuracies = [np.float64(0.5420432192094095), np.float64(0.4827300345740661), np.float64(0.5753654970760235), np.float64(0.525803290652982), np.float64(0.5513876327250703)]
[I 2025-05-02 05:47:16,308] Trial 29 finished with value: 0.5354659348475101 and parameters: {'num_heads': 32, 'num_transformer_blocks': 2, 'learning_rate': 1.74006045498564e-05, 'optimizer': 'AdamW', 'weight_decay': 0.0003496624190219605, 'batch_size': 16, 'label_smoothing': 0.01}. Best is trial 22 with value: 0.5543773281975666.
Hyperparameters: num_heads=32, num_transformer_blocks=2, learning_rate=0.00011302148049500744, optimizer=AdamW, weight_decay=0.00022438828928361514, batch_size=16,factor=1
Divergence detected. Stopping training after 10 epochs.
Early stopping at epoch 10
Trial 32, Fold 1: Test Accuracy = 0.3312
Trial 31, Fold 2: Test Accuracy = 0.3916
Divergence detected. Stopping training after 10 epochs.
Early stopping at epoch 17
Trial 33, Fold 1: Test Accuracy = 0.5397
Divergence detected. Stopping training after 10 epochs.
Early stopping at epoch 11
Trial 31, Fold 3: Test Accuracy = 0.3109
Divergence detected. Stopping training after 10 epochs.
Early stopping at epoch 21
Trial 32, Fold 2: Test Accuracy = 0.3376
Divergence detected. Stopping training after 10 epochs.
Early stopping at epoch 17
Trial 33, Fold 2: Test Accuracy = 0.4802
Divergence detected. Stopping training after 10 epochs.
Early stopping at epoch 24
Trial 32, Fold 3: Test Accuracy = 0.2125
Trial 31, Fold 4: Test Accuracy = 0.3424
Divergence detected. Stopping training after 10 epochs.
Early stopping at epoch 12
Trial 33, Fold 3: Test Accuracy = 0.5670
Divergence detected. Stopping training after 10 epochs.
Early stopping at epoch 10
Trial 32, Fold 4: Test Accuracy = 0.3297
Divergence detected. Stopping training after 10 epochs.
Early stopping at epoch 11
Trial 31, Fold 5: Test Accuracy = 0.3333
Trial 31: Mean Accuracy = 0.3407, Fold Accuracies = [np.float64(0.3251972102768346), np.float64(0.39161482724074465), np.float64(0.3108562166285278), np.float64(0.34244083520949725), np.float64(0.3333333333333333)]
[I 2025-05-02 06:05:41,200] Trial 31 finished with value: 0.3406884845377875 and parameters: {'num_heads': 16, 'num_transformer_blocks': 4, 'learning_rate': 6.194475015996272e-08, 'optimizer': 'Adam', 'weight_decay': 3.988526389661432e-05, 'batch_size': 32, 'label_smoothing': 0.0}. Best is trial 22 with value: 0.5543773281975666.
Hyperparameters: num_heads=32, num_transformer_blocks=2, learning_rate=0.00011353654943071378, optimizer=AdamW, weight_decay=0.00022840934649062794, batch_size=16,factor=1
Divergence detected. Stopping training after 10 epochs.
Early stopping at epoch 21
Trial 33, Fold 4: Test Accuracy = 0.5311
Divergence detected. Stopping training after 10 epochs.
Early stopping at epoch 17
Trial 34, Fold 1: Test Accuracy = 0.5009
Trial 32, Fold 5: Test Accuracy = 0.3338
Trial 32: Mean Accuracy = 0.3090, Fold Accuracies = [np.float64(0.33122362869198313), np.float64(0.3375824865911033), np.float64(0.21251779811848462), np.float64(0.3297224423220865), np.float64(0.333832602260975)]
[I 2025-05-02 06:12:38,048] Trial 32 finished with value: 0.3089757915969265 and parameters: {'num_heads': 16, 'num_transformer_blocks': 4, 'learning_rate': 8.843946128048995e-08, 'optimizer': 'SGD', 'weight_decay': 8.569994148477874e-05, 'batch_size': 32, 'label_smoothing': 0.0}. Best is trial 22 with value: 0.5543773281975666.
Hyperparameters: num_heads=32, num_transformer_blocks=2, learning_rate=0.00012020013453606439, optimizer=AdamW, weight_decay=0.00024171039941394817, batch_size=16,factor=1
Divergence detected. Stopping training after 10 epochs.
Early stopping at epoch 18
Trial 33, Fold 5: Test Accuracy = 0.4975
Trial 33: Mean Accuracy = 0.5231, Fold Accuracies = [np.float64(0.539718877718061), np.float64(0.4802189311569172), np.float64(0.5669952962115433), np.float64(0.5311037250654381), np.float64(0.49746085713626415)]
[I 2025-05-02 06:15:15,703] Trial 33 finished with value: 0.5230995374576447 and parameters: {'num_heads': 32, 'num_transformer_blocks': 2, 'learning_rate': 0.00011302148049500744, 'optimizer': 'AdamW', 'weight_decay': 0.00022438828928361514, 'batch_size': 16, 'label_smoothing': 0.03}. Best is trial 22 with value: 0.5543773281975666.
Hyperparameters: num_heads=32, num_transformer_blocks=2, learning_rate=3.6256487640515216e-06, optimizer=AdamW, weight_decay=9.479591540703902e-05, batch_size=16,factor=1
Divergence detected. Stopping training after 10 epochs.
Early stopping at epoch 16
Trial 35, Fold 1: Test Accuracy = 0.4828
Divergence detected. Stopping training after 10 epochs.
Early stopping at epoch 10
Trial 36, Fold 1: Test Accuracy = 0.4033
Divergence detected. Stopping training after 10 epochs.
Early stopping at epoch 27
Trial 34, Fold 2: Test Accuracy = 0.4921
Divergence detected. Stopping training after 10 epochs.
Early stopping at epoch 12
Trial 35, Fold 2: Test Accuracy = 0.5327
Divergence detected. Stopping training after 10 epochs.
Early stopping at epoch 15
Trial 34, Fold 3: Test Accuracy = 0.4086
Divergence detected. Stopping training after 10 epochs.
Early stopping at epoch 19
Trial 35, Fold 3: Test Accuracy = 0.5017
Trial 36, Fold 2: Test Accuracy = 0.4314
Divergence detected. Stopping training after 10 epochs.
Early stopping at epoch 20
Trial 34, Fold 4: Test Accuracy = 0.5188
Divergence detected. Stopping training after 10 epochs.
Early stopping at epoch 10
Trial 36, Fold 3: Test Accuracy = 0.5489
Divergence detected. Stopping training after 10 epochs.
Early stopping at epoch 17
Trial 35, Fold 4: Test Accuracy = 0.5839
Divergence detected. Stopping training after 10 epochs.
Early stopping at epoch 16
Trial 34, Fold 5: Test Accuracy = 0.5532
Trial 34: Mean Accuracy = 0.4947, Fold Accuracies = [np.float64(0.5008585147008994), np.float64(0.4920918122694859), np.float64(0.40855580981439105), np.float64(0.518778266943292), np.float64(0.5532128787109152)]
[I 2025-05-02 06:34:07,701] Trial 34 finished with value: 0.4946994564877967 and parameters: {'num_heads': 32, 'num_transformer_blocks': 2, 'learning_rate': 0.00011353654943071378, 'optimizer': 'AdamW', 'weight_decay': 0.00022840934649062794, 'batch_size': 16, 'label_smoothing': 0.12}. Best is trial 22 with value: 0.5543773281975666.
Hyperparameters: num_heads=2, num_transformer_blocks=2, learning_rate=3.166832371648429e-06, optimizer=AdamW, weight_decay=8.859928976975231e-05, batch_size=16,factor=1
Divergence detected. Stopping training after 10 epochs.
Early stopping at epoch 21
Trial 35, Fold 5: Test Accuracy = 0.5070
Trial 35: Mean Accuracy = 0.5216, Fold Accuracies = [np.float64(0.4827919548785209), np.float64(0.5327036746255831), np.float64(0.5017334096109839), np.float64(0.5838903191463697), np.float64(0.5070249775313999)]
[I 2025-05-02 06:37:30,543] Trial 35 finished with value: 0.5216288671585715 and parameters: {'num_heads': 32, 'num_transformer_blocks': 2, 'learning_rate': 0.00012020013453606439, 'optimizer': 'AdamW', 'weight_decay': 0.00024171039941394817, 'batch_size': 16, 'label_smoothing': 0.12}. Best is trial 22 with value: 0.5543773281975666.
Hyperparameters: num_heads=2, num_transformer_blocks=8, learning_rate=2.5015533130730704e-05, optimizer=SGD, weight_decay=7.94576061746213e-05, batch_size=16,factor=1
Trial 36, Fold 4: Test Accuracy = 0.5618
Trial 37, Fold 1: Test Accuracy = 0.4410
Divergence detected. Stopping training after 10 epochs.
Early stopping at epoch 10
Trial 37, Fold 2: Test Accuracy = 0.2781
Trial 38, Fold 1: Test Accuracy = 0.3032
Trial 36, Fold 5: Test Accuracy = 0.4948
Trial 36: Mean Accuracy = 0.4880, Fold Accuracies = [np.float64(0.40327207566897244), np.float64(0.43136965262843635), np.float64(0.5489429188914315), np.float64(0.5618194611785241), np.float64(0.4948334019603348)]
[I 2025-05-02 06:47:06,220] Trial 36 finished with value: 0.4880475020655398 and parameters: {'num_heads': 32, 'num_transformer_blocks': 2, 'learning_rate': 3.6256487640515216e-06, 'optimizer': 'AdamW', 'weight_decay': 9.479591540703902e-05, 'batch_size': 16, 'label_smoothing': 0.13}. Best is trial 22 with value: 0.5543773281975666.
Hyperparameters: num_heads=2, num_transformer_blocks=8, learning_rate=4.076755230774734e-05, optimizer=SGD, weight_decay=0.0004539848685551421, batch_size=32,factor=1
Divergence detected. Stopping training after 10 epochs.
Early stopping at epoch 10
Trial 38, Fold 2: Test Accuracy = 0.3030
Divergence detected. Stopping training after 10 epochs.
Early stopping at epoch 10
Trial 39, Fold 1: Test Accuracy = 0.3155
Trial 37, Fold 3: Test Accuracy = 0.4778
Trial 39, Fold 2: Test Accuracy = 0.3619



LOG 2


c:\Users\Gabriel\anaconda3\envs\cudaenv\Lib\site-packages\tqdm\auto.py:21: TqdmWarning: IProgress not found. Please update jupyter and ipywidgets. See https://ipywidgets.readthedocs.io/en/stable/user_install.html
  from .autonotebook import tqdm as notebook_tqdm
[I 2025-05-02 15:44:43,723] A new study created in memory with name: no-name-5c71fe26-6e25-43b7-87f0-f14c2b642e02
Hyperparameters: num_heads=2, num_transformer_blocks=32, learning_rate=1.6226818125041195e-07, optimizer=Adam, weight_decay=1.130428003171421e-06, batch_size=10,factor=1
Hyperparameters: num_heads=2, num_transformer_blocks=16, learning_rate=9.141710801635213e-08, optimizer=Adam, weight_decay=2.2210374951044208e-05, batch_size=32,factor=1
Divergence detected. Stopping training after 10 epochs.
Early stopping at epoch 10
Trial 0, Fold 1: Test Accuracy = 0.3465
Trial 1, Fold 1: Test Accuracy = 0.3037
Trial 1, Fold 2: Test Accuracy = 0.3342
Trial 0, Fold 2: Test Accuracy = 0.3258
Trial 1, Fold 3: Test Accuracy = 0.3187
Divergence detected. Stopping training after 10 epochs.
Early stopping at epoch 10
Trial 1, Fold 4: Test Accuracy = 0.3546
Divergence detected. Stopping training after 10 epochs.
Early stopping at epoch 10
Trial 0, Fold 3: Test Accuracy = 0.3477
Divergence detected. Stopping training after 10 epochs.
Early stopping at epoch 25
Trial 1, Fold 5: Test Accuracy = 0.2869
Trial 1: Mean Accuracy = 0.3196, Fold Accuracies = [np.float64(0.303702570379437), np.float64(0.3341580186155986), np.float64(0.3187242562929062), np.float64(0.3545907197520101), np.float64(0.28687236683018286)]
[I 2025-05-02 16:06:44,024] Trial 1 finished with value: 0.319609586374027 and parameters: {'num_heads': 2, 'num_transformer_blocks': 16, 'learning_rate': 9.141710801635213e-08, 'weight_decay': 2.2210374951044208e-05, 'batch_size': 32}. Best is trial 1 with value: 0.319609586374027.
Hyperparameters: num_heads=16, num_transformer_blocks=16, learning_rate=9.217747260961902e-08, optimizer=Adam, weight_decay=5.374510743181859e-06, batch_size=16,factor=1
Divergence detected. Stopping training after 10 epochs.
Early stopping at epoch 10
Trial 2, Fold 1: Test Accuracy = 0.3090
Trial 0, Fold 4: Test Accuracy = 0.3406
Divergence detected. Stopping training after 10 epochs.
Early stopping at epoch 19
Trial 2, Fold 2: Test Accuracy = 0.3878
Divergence detected. Stopping training after 10 epochs.
Early stopping at epoch 10
Trial 2, Fold 3: Test Accuracy = 0.3352
Divergence detected. Stopping training after 10 epochs.
Early stopping at epoch 20
Trial 0, Fold 5: Test Accuracy = 0.3310
Trial 0: Mean Accuracy = 0.3383, Fold Accuracies = [np.float64(0.3464824233597366), np.float64(0.3258472213106918), np.float64(0.3477065853038393), np.float64(0.3405807849499152), np.float64(0.3309782759755549)]
[I 2025-05-02 16:19:16,392] Trial 0 finished with value: 0.33831905817994756 and parameters: {'num_heads': 2, 'num_transformer_blocks': 32, 'learning_rate': 1.6226818125041195e-07, 'weight_decay': 1.130428003171421e-06, 'batch_size': 10}. Best is trial 0 with value: 0.33831905817994756.
Hyperparameters: num_heads=8, num_transformer_blocks=16, learning_rate=1.5751924911617186e-06, optimizer=Adam, weight_decay=2.509906197582111e-05, batch_size=32,factor=1
Trial 2, Fold 4: Test Accuracy = 0.3516
Trial 3, Fold 1: Test Accuracy = 0.3481
Trial 3, Fold 2: Test Accuracy = 0.4066
Trial 2, Fold 5: Test Accuracy = 0.3147
Trial 2: Mean Accuracy = 0.3397, Fold Accuracies = [np.float64(0.3089733409622763), np.float64(0.38784205240885267), np.float64(0.33520340706839563), np.float64(0.3515717759409062), np.float64(0.3147344360302963)]
[I 2025-05-02 16:30:57,224] Trial 2 finished with value: 0.33966500248214543 and parameters: {'num_heads': 16, 'num_transformer_blocks': 16, 'learning_rate': 9.217747260961902e-08, 'weight_decay': 5.374510743181859e-06, 'batch_size': 16}. Best is trial 2 with value: 0.33966500248214543.
Hyperparameters: num_heads=8, num_transformer_blocks=8, learning_rate=2.5822436972906645e-06, optimizer=Adam, weight_decay=2.506014907843724e-06, batch_size=10,factor=1
Divergence detected. Stopping training after 10 epochs.
Early stopping at epoch 10
Trial 3, Fold 3: Test Accuracy = 0.4694
Divergence detected. Stopping training after 10 epochs.
Early stopping at epoch 10
Trial 4, Fold 1: Test Accuracy = 0.3470
Divergence detected. Stopping training after 10 epochs.
Early stopping at epoch 10
Trial 3, Fold 4: Test Accuracy = 0.3755
Divergence detected. Stopping training after 10 epochs.
Early stopping at epoch 10
Trial 3, Fold 5: Test Accuracy = 0.3184
Trial 3: Mean Accuracy = 0.3836, Fold Accuracies = [np.float64(0.3480697094662286), np.float64(0.40662095853640484), np.float64(0.4693866005593694), np.float64(0.3755355600598557), np.float64(0.3183718240663793)]
[I 2025-05-02 16:36:27,988] Trial 3 finished with value: 0.3835969305376476 and parameters: {'num_heads': 8, 'num_transformer_blocks': 16, 'learning_rate': 1.5751924911617186e-06, 'weight_decay': 2.509906197582111e-05, 'batch_size': 32}. Best is trial 3 with value: 0.3835969305376476.
Hyperparameters: num_heads=8, num_transformer_blocks=2, learning_rate=0.00016646694541849971, optimizer=Adam, weight_decay=3.3145248147291097e-06, batch_size=16,factor=1
Divergence detected. Stopping training after 10 epochs.
Early stopping at epoch 18
Trial 5, Fold 1: Test Accuracy = 0.4179
Trial 4, Fold 2: Test Accuracy = 0.5365
Divergence detected. Stopping training after 10 epochs.
Early stopping at epoch 12
Trial 5, Fold 2: Test Accuracy = 0.5526
Divergence detected. Stopping training after 10 epochs.
Early stopping at epoch 14
Trial 5, Fold 3: Test Accuracy = 0.4893
Divergence detected. Stopping training after 10 epochs.
Early stopping at epoch 19
Trial 5, Fold 4: Test Accuracy = 0.5164
Trial 4, Fold 3: Test Accuracy = 0.4602
Divergence detected. Stopping training after 10 epochs.
Early stopping at epoch 14
Trial 5, Fold 5: Test Accuracy = 0.5716
Trial 5: Mean Accuracy = 0.5096, Fold Accuracies = [np.float64(0.417856995789452), np.float64(0.5525606225158298), np.float64(0.4893401983218917), np.float64(0.5164275177586733), np.float64(0.571646634781615)]
[I 2025-05-02 16:49:44,499] Trial 5 finished with value: 0.5095663938334924 and parameters: {'num_heads': 8, 'num_transformer_blocks': 2, 'learning_rate': 0.00016646694541849971, 'weight_decay': 3.3145248147291097e-06, 'batch_size': 16}. Best is trial 5 with value: 0.5095663938334924.
Hyperparameters: num_heads=16, num_transformer_blocks=2, learning_rate=1.0299303600768504e-05, optimizer=Adam, weight_decay=0.0006900846305446895, batch_size=10,factor=1
Trial 6, Fold 1: Test Accuracy = 0.4670
Trial 4, Fold 4: Test Accuracy = 0.4898
Trial 6, Fold 2: Test Accuracy = 0.5464
Trial 4, Fold 5: Test Accuracy = 0.5501
Trial 4: Mean Accuracy = 0.4767, Fold Accuracies = [np.float64(0.3469553040388426), np.float64(0.5365276018399229), np.float64(0.46017480294940255), np.float64(0.48981657034739934), np.float64(0.5501147137665606)]
[I 2025-05-02 17:02:23,457] Trial 4 finished with value: 0.4767177985884256 and parameters: {'num_heads': 8, 'num_transformer_blocks': 8, 'learning_rate': 2.5822436972906645e-06, 'weight_decay': 2.506014907843724e-06, 'batch_size': 10}. Best is trial 5 with value: 0.5095663938334924.
Hyperparameters: num_heads=8, num_transformer_blocks=16, learning_rate=0.0008385782909945929, optimizer=Adam, weight_decay=0.00010889698801610895, batch_size=32,factor=1
Trial 6, Fold 3: Test Accuracy = 0.4841
Trial 7, Fold 1: Test Accuracy = 0.5102
Trial 6, Fold 4: Test Accuracy = 0.5460
Divergence detected. Stopping training after 10 epochs.
Early stopping at epoch 28
Trial 7, Fold 2: Test Accuracy = 0.5439
Divergence detected. Stopping training after 10 epochs.
Early stopping at epoch 16
Trial 7, Fold 3: Test Accuracy = 0.3333
Trial 6, Fold 5: Test Accuracy = 0.5324
Trial 6: Mean Accuracy = 0.5152, Fold Accuracies = [np.float64(0.46698341951113), np.float64(0.5464048329292132), np.float64(0.4841463259598271), np.float64(0.5460395634507517), np.float64(0.5324116128403329)]
[I 2025-05-02 17:17:50,428] Trial 6 finished with value: 0.515197150938251 and parameters: {'num_heads': 16, 'num_transformer_blocks': 2, 'learning_rate': 1.0299303600768504e-05, 'weight_decay': 0.0006900846305446895, 'batch_size': 10}. Best is trial 6 with value: 0.515197150938251.
Hyperparameters: num_heads=32, num_transformer_blocks=2, learning_rate=4.337438601921003e-08, optimizer=Adam, weight_decay=2.8456638444925105e-05, batch_size=16,factor=1
Divergence detected. Stopping training after 10 epochs.
Early stopping at epoch 17
Trial 7, Fold 4: Test Accuracy = 0.3343
Trial 8, Fold 1: Test Accuracy = 0.3347
Divergence detected. Stopping training after 10 epochs.
Early stopping at epoch 21
Trial 7, Fold 5: Test Accuracy = 0.3329
Trial 7: Mean Accuracy = 0.4109, Fold Accuracies = [np.float64(0.5102352726994918), np.float64(0.5439093686046153), np.float64(0.3333333333333333), np.float64(0.3343160473662719), np.float64(0.33291255878859544)]
[I 2025-05-02 17:26:57,352] Trial 7 finished with value: 0.4109413161584615 and parameters: {'num_heads': 8, 'num_transformer_blocks': 16, 'learning_rate': 0.0008385782909945929, 'weight_decay': 0.00010889698801610895, 'batch_size': 32}. Best is trial 6 with value: 0.515197150938251.
Hyperparameters: num_heads=32, num_transformer_blocks=4, learning_rate=6.424019532646754e-07, optimizer=Adam, weight_decay=2.033712228107347e-05, batch_size=32,factor=1
Trial 8, Fold 2: Test Accuracy = 0.2925
Divergence detected. Stopping training after 10 epochs.
Early stopping at epoch 13
Trial 8, Fold 3: Test Accuracy = 0.3574
Trial 9, Fold 1: Test Accuracy = 0.2917
Divergence detected. Stopping training after 10 epochs.
Early stopping at epoch 10
Trial 9, Fold 2: Test Accuracy = 0.2619
Trial 8, Fold 4: Test Accuracy = 0.2167
Trial 9, Fold 3: Test Accuracy = 0.4705
Trial 8, Fold 5: Test Accuracy = 0.3543
Trial 8: Mean Accuracy = 0.3111, Fold Accuracies = [np.float64(0.3346960315950938), np.float64(0.29245672003689677), np.float64(0.3574377065853038), np.float64(0.21670073503474893), np.float64(0.35428084277189137)]
[I 2025-05-02 17:43:35,798] Trial 8 finished with value: 0.31111440720478695 and parameters: {'num_heads': 32, 'num_transformer_blocks': 2, 'learning_rate': 4.337438601921003e-08, 'weight_decay': 2.8456638444925105e-05, 'batch_size': 16}. Best is trial 6 with value: 0.515197150938251.
Hyperparameters: num_heads=8, num_transformer_blocks=4, learning_rate=6.306265781279087e-08, optimizer=Adam, weight_decay=4.6669157456943815e-06, batch_size=10,factor=1
Trial 9, Fold 4: Test Accuracy = 0.4004
Divergence detected. Stopping training after 10 epochs.
Early stopping at epoch 10
Trial 9, Fold 5: Test Accuracy = 0.4180
Trial 9: Mean Accuracy = 0.3685, Fold Accuracies = [np.float64(0.29174184534810577), np.float64(0.2618806188357444), np.float64(0.47047037884566495), np.float64(0.4004237966018285), np.float64(0.4179936551262724)]
[I 2025-05-02 17:47:41,130] Trial 9 finished with value: 0.3685020589515232 and parameters: {'num_heads': 32, 'num_transformer_blocks': 4, 'learning_rate': 6.424019532646754e-07, 'weight_decay': 2.033712228107347e-05, 'batch_size': 32}. Best is trial 6 with value: 0.515197150938251.
Hyperparameters: num_heads=16, num_transformer_blocks=2, learning_rate=3.708462569776459e-05, optimizer=Adam, weight_decay=0.0005453180081021676, batch_size=10,factor=1
Trial 10, Fold 1: Test Accuracy = 0.3026
Divergence detected. Stopping training after 10 epochs.
Early stopping at epoch 10
Trial 10, Fold 2: Test Accuracy = 0.3324
Divergence detected. Stopping training after 10 epochs.
Early stopping at epoch 25
Trial 11, Fold 1: Test Accuracy = 0.4663
Divergence detected. Stopping training after 10 epochs.
Early stopping at epoch 26
Trial 11, Fold 2: Test Accuracy = 0.6199
Trial 10, Fold 3: Test Accuracy = 0.3585
Divergence detected. Stopping training after 10 epochs.
Early stopping at epoch 10
Trial 10, Fold 4: Test Accuracy = 0.3180
Divergence detected. Stopping training after 10 epochs.
Early stopping at epoch 21
Trial 11, Fold 3: Test Accuracy = 0.4961
Divergence detected. Stopping training after 10 epochs.
Early stopping at epoch 10
Trial 10, Fold 5: Test Accuracy = 0.2758
Trial 10: Mean Accuracy = 0.3175, Fold Accuracies = [np.float64(0.30263543947425314), np.float64(0.33240611961057026), np.float64(0.35852466310704295), np.float64(0.3179668439366275), np.float64(0.2758004596786224)]
