[I 2025-05-02 18:02:01,283] Trial 10 finished with value: 0.3174667051614232 and parameters: {'num_heads': 8, 'num_transformer_blocks': 4, 'learning_rate': 6.306265781279087e-08, 'weight_decay': 4.6669157456943815e-06, 'batch_size': 10}. Best is trial 6 with value: 0.515197150938251.
Hyperparameters: num_heads=4, num_transformer_blocks=2, learning_rate=0.00010680347329042984, optimizer=Adam, weight_decay=0.0009396339864431085, batch_size=16,factor=1
Divergence detected. Stopping training after 10 epochs.
Early stopping at epoch 21
Trial 12, Fold 1: Test Accuracy = 0.4758
Divergence detected. Stopping training after 10 epochs.
Early stopping at epoch 24
Trial 11, Fold 4: Test Accuracy = 0.5458
Divergence detected. Stopping training after 10 epochs.
Early stopping at epoch 13
Trial 12, Fold 2: Test Accuracy = 0.5327
Divergence detected. Stopping training after 10 epochs.
Early stopping at epoch 17
Trial 11, Fold 5: Test Accuracy = 0.5798
Trial 11: Mean Accuracy = 0.5416, Fold Accuracies = [np.float64(0.46626339738286077), np.float64(0.6198555221810561), np.float64(0.4961168319349098), np.float64(0.5458473418293753), np.float64(0.5797712402635183)]
[I 2025-05-02 18:09:55,195] Trial 11 finished with value: 0.5415708667183441 and parameters: {'num_heads': 16, 'num_transformer_blocks': 2, 'learning_rate': 3.708462569776459e-05, 'weight_decay': 0.0005453180081021676, 'batch_size': 10}. Best is trial 11 with value: 0.5415708667183441.
Hyperparameters: num_heads=16, num_transformer_blocks=2, learning_rate=3.2956162020308236e-05, optimizer=Adam, weight_decay=0.0008709679486067379, batch_size=10,factor=1
Divergence detected. Stopping training after 10 epochs.
Early stopping at epoch 26
Trial 12, Fold 3: Test Accuracy = 0.4340
Trial 13, Fold 1: Test Accuracy = 0.4828
Divergence detected. Stopping training after 10 epochs.
Early stopping at epoch 20
Trial 12, Fold 4: Test Accuracy = 0.5290
Divergence detected. Stopping training after 10 epochs.
Early stopping at epoch 20
Trial 13, Fold 2: Test Accuracy = 0.5760
Divergence detected. Stopping training after 10 epochs.
Early stopping at epoch 24
Trial 12, Fold 5: Test Accuracy = 0.5089
Trial 12: Mean Accuracy = 0.4961, Fold Accuracies = [np.float64(0.4757900263491119), np.float64(0.5326977131924772), np.float64(0.4340096618357488), np.float64(0.5289859070994228), np.float64(0.5088661864886568)]
[I 2025-05-02 18:21:13,917] Trial 12 finished with value: 0.4960698989930835 and parameters: {'num_heads': 4, 'num_transformer_blocks': 2, 'learning_rate': 0.00010680347329042984, 'weight_decay': 0.0009396339864431085, 'batch_size': 16}. Best is trial 11 with value: 0.5415708667183441.
Hyperparameters: num_heads=16, num_transformer_blocks=2, learning_rate=2.5972023971506666e-05, optimizer=Adam, weight_decay=0.0009056926882072129, batch_size=10,factor=1
Trial 13, Fold 3: Test Accuracy = 0.5132
Divergence detected. Stopping training after 10 epochs.
Early stopping at epoch 29
Trial 14, Fold 1: Test Accuracy = 0.4903
Divergence detected. Stopping training after 10 epochs.
Early stopping at epoch 18
Trial 13, Fold 4: Test Accuracy = 0.5353
Divergence detected. Stopping training after 10 epochs.
Early stopping at epoch 29
Trial 14, Fold 2: Test Accuracy = 0.6250
Divergence detected. Stopping training after 10 epochs.
Early stopping at epoch 28
Trial 13, Fold 5: Test Accuracy = 0.5303
Trial 13: Mean Accuracy = 0.5275, Fold Accuracies = [np.float64(0.4828260736463909), np.float64(0.5760430068036629), np.float64(0.5131642512077295), np.float64(0.5352537919708193), np.float64(0.530283078189811)]
[I 2025-05-02 18:34:44,864] Trial 13 finished with value: 0.5275140403636828 and parameters: {'num_heads': 16, 'num_transformer_blocks': 2, 'learning_rate': 3.2956162020308236e-05, 'weight_decay': 0.0008709679486067379, 'batch_size': 10}. Best is trial 11 with value: 0.5415708667183441.
Hyperparameters: num_heads=16, num_transformer_blocks=2, learning_rate=0.009989557515373997, optimizer=Adam, weight_decay=0.00025563459484606604, batch_size=10,factor=1
Divergence detected. Stopping training after 10 epochs.
Early stopping at epoch 23
Trial 14, Fold 3: Test Accuracy = 0.4924
Divergence detected. Stopping training after 10 epochs.
Early stopping at epoch 14
Trial 15, Fold 1: Test Accuracy = 0.3333
Divergence detected. Stopping training after 10 epochs.
Early stopping at epoch 10
Trial 15, Fold 2: Test Accuracy = 0.3333
Divergence detected. Stopping training after 10 epochs.
Early stopping at epoch 19
Trial 14, Fold 4: Test Accuracy = 0.5540
Divergence detected. Stopping training after 10 epochs.
Early stopping at epoch 10
Trial 15, Fold 3: Test Accuracy = 0.3333
Divergence detected. Stopping training after 10 epochs.
Early stopping at epoch 12
Trial 15, Fold 4: Test Accuracy = 0.3333
Divergence detected. Stopping training after 10 epochs.
Early stopping at epoch 23
Trial 14, Fold 5: Test Accuracy = 0.5553
Trial 14: Mean Accuracy = 0.5434, Fold Accuracies = [np.float64(0.49031055161917264), np.float64(0.6250430979067566), np.float64(0.49236270022883294), np.float64(0.5540264723686529), np.float64(0.5553332849046494)]
[I 2025-05-02 18:45:19,017] Trial 14 finished with value: 0.5434152214056128 and parameters: {'num_heads': 16, 'num_transformer_blocks': 2, 'learning_rate': 2.5972023971506666e-05, 'weight_decay': 0.0009056926882072129, 'batch_size': 10}. Best is trial 14 with value: 0.5434152214056128.
Hyperparameters: num_heads=16, num_transformer_blocks=32, learning_rate=0.009863391108338929, optimizer=Adam, weight_decay=0.00022698964520383795, batch_size=10,factor=1
Divergence detected. Stopping training after 10 epochs.
Early stopping at epoch 13
Trial 15, Fold 5: Test Accuracy = 0.3333
Trial 15: Mean Accuracy = 0.3333, Fold Accuracies = [np.float64(0.3333333333333333), np.float64(0.3333333333333333), np.float64(0.3333333333333333), np.float64(0.3333333333333333), np.float64(0.3333333333333333)]
[I 2025-05-02 18:46:43,957] Trial 15 finished with value: 0.3333333333333333 and parameters: {'num_heads': 16, 'num_transformer_blocks': 2, 'learning_rate': 0.009989557515373997, 'weight_decay': 0.00025563459484606604, 'batch_size': 10}. Best is trial 14 with value: 0.5434152214056128.
Hyperparameters: num_heads=16, num_transformer_blocks=32, learning_rate=0.000734538240607978, optimizer=Adam, weight_decay=0.00019545647308208188, batch_size=10,factor=1
Divergence detected. Stopping training after 10 epochs.
Early stopping at epoch 10
Trial 16, Fold 1: Test Accuracy = 0.3333
Divergence detected. Stopping training after 10 epochs.
Early stopping at epoch 14
Trial 17, Fold 1: Test Accuracy = 0.3333
Divergence detected. Stopping training after 10 epochs.
Early stopping at epoch 12
Trial 16, Fold 2: Test Accuracy = 0.3333
Divergence detected. Stopping training after 10 epochs.
Early stopping at epoch 11
Trial 17, Fold 2: Test Accuracy = 0.3333
Divergence detected. Stopping training after 10 epochs.
Early stopping at epoch 20
Trial 16, Fold 3: Test Accuracy = 0.3333
Divergence detected. Stopping training after 10 epochs.
Early stopping at epoch 23
Trial 17, Fold 3: Test Accuracy = 0.3333
Divergence detected. Stopping training after 10 epochs.
Early stopping at epoch 14
Trial 16, Fold 4: Test Accuracy = 0.3333
Divergence detected. Stopping training after 10 epochs.
Early stopping at epoch 11
Trial 16, Fold 5: Test Accuracy = 0.3333
Trial 16: Mean Accuracy = 0.3333, Fold Accuracies = [np.float64(0.3333333333333333), np.float64(0.3333333333333333), np.float64(0.3333333333333333), np.float64(0.3333333333333333), np.float64(0.3333333333333333)]
[I 2025-05-02 19:06:00,086] Trial 16 finished with value: 0.3333333333333333 and parameters: {'num_heads': 16, 'num_transformer_blocks': 32, 'learning_rate': 0.009863391108338929, 'weight_decay': 0.00022698964520383795, 'batch_size': 10}. Best is trial 14 with value: 0.5434152214056128.
Hyperparameters: num_heads=4, num_transformer_blocks=8, learning_rate=0.00028752549947136787, optimizer=Adam, weight_decay=9.188393039661266e-05, batch_size=10,factor=1
Divergence detected. Stopping training after 10 epochs.
Early stopping at epoch 14
Trial 17, Fold 4: Test Accuracy = 0.3333
Divergence detected. Stopping training after 10 epochs.
Early stopping at epoch 12
Trial 18, Fold 1: Test Accuracy = 0.4746
Divergence detected. Stopping training after 10 epochs.
Early stopping at epoch 10
Trial 17, Fold 5: Test Accuracy = 0.3333
Trial 17: Mean Accuracy = 0.3333, Fold Accuracies = [np.float64(0.3333333333333333), np.float64(0.3333333333333333), np.float64(0.3333333333333333), np.float64(0.3333333333333333), np.float64(0.3333333333333333)]
[I 2025-05-02 19:11:00,950] Trial 17 finished with value: 0.3333333333333333 and parameters: {'num_heads': 16, 'num_transformer_blocks': 32, 'learning_rate': 0.000734538240607978, 'weight_decay': 0.00019545647308208188, 'batch_size': 10}. Best is trial 14 with value: 0.5434152214056128.
Hyperparameters: num_heads=4, num_transformer_blocks=8, learning_rate=1.1242050027497732e-05, optimizer=Adam, weight_decay=5.7530109729987256e-05, batch_size=10,factor=1
Divergence detected. Stopping training after 10 epochs.
Early stopping at epoch 15
Trial 18, Fold 2: Test Accuracy = 0.5363
Divergence detected. Stopping training after 10 epochs.
Early stopping at epoch 15
Trial 18, Fold 3: Test Accuracy = 0.5218
Trial 19, Fold 1: Test Accuracy = 0.4971
Divergence detected. Stopping training after 10 epochs.
Early stopping at epoch 14
Trial 18, Fold 4: Test Accuracy = 0.5222
Divergence detected. Stopping training after 10 epochs.
Early stopping at epoch 10
Trial 18, Fold 5: Test Accuracy = 0.5441
Trial 18: Mean Accuracy = 0.5198, Fold Accuracies = [np.float64(0.4745599405722683), np.float64(0.5362748581833504), np.float64(0.5217976099669462), np.float64(0.5222216990367256), np.float64(0.54410946744516)]
[I 2025-05-02 19:20:10,832] Trial 18 finished with value: 0.5197927150408901 and parameters: {'num_heads': 4, 'num_transformer_blocks': 8, 'learning_rate': 0.00028752549947136787, 'weight_decay': 9.188393039661266e-05, 'batch_size': 10}. Best is trial 14 with value: 0.5434152214056128.
Hyperparameters: num_heads=16, num_transformer_blocks=2, learning_rate=1.4996464618623795e-05, optimizer=Adam, weight_decay=0.0004104892950404676, batch_size=10,factor=1
Divergence detected. Stopping training after 10 epochs.
Early stopping at epoch 25
Trial 19, Fold 2: Test Accuracy = 0.6179
Trial 20, Fold 1: Test Accuracy = 0.4752
Trial 19, Fold 3: Test Accuracy = 0.4722
Trial 20, Fold 2: Test Accuracy = 0.6334
Divergence detected. Stopping training after 10 epochs.
Early stopping at epoch 23
Trial 19, Fold 4: Test Accuracy = 0.5045
Trial 20, Fold 3: Test Accuracy = 0.4664
Divergence detected. Stopping training after 10 epochs.
Early stopping at epoch 25
Trial 20, Fold 4: Test Accuracy = 0.5325
Divergence detected. Stopping training after 10 epochs.
Early stopping at epoch 26
Trial 19, Fold 5: Test Accuracy = 0.5481
Trial 19: Mean Accuracy = 0.5280, Fold Accuracies = [np.float64(0.4971262102413141), np.float64(0.6178879088813231), np.float64(0.47216946351385713), np.float64(0.5044930025983517), np.float64(0.5481026854600396)]
[I 2025-05-02 19:40:55,616] Trial 19 finished with value: 0.527955854138977 and parameters: {'num_heads': 4, 'num_transformer_blocks': 8, 'learning_rate': 1.1242050027497732e-05, 'weight_decay': 5.7530109729987256e-05, 'batch_size': 10}. Best is trial 14 with value: 0.5434152214056128.
Hyperparameters: num_heads=16, num_transformer_blocks=2, learning_rate=1.0263678879371138e-08, optimizer=Adam, weight_decay=0.00044308597287374317, batch_size=10,factor=1
Divergence detected. Stopping training after 10 epochs.
Early stopping at epoch 10
Trial 21, Fold 1: Test Accuracy = 0.3021
Divergence detected. Stopping training after 10 epochs.
Early stopping at epoch 22
Trial 20, Fold 5: Test Accuracy = 0.5262
Trial 20: Mean Accuracy = 0.5267, Fold Accuracies = [np.float64(0.47524542114420054), np.float64(0.6333777573295286), np.float64(0.4663723620645818), np.float64(0.5324894187776997), np.float64(0.5261995375463513)]
[I 2025-05-02 19:44:39,963] Trial 20 finished with value: 0.5267368993724725 and parameters: {'num_heads': 16, 'num_transformer_blocks': 2, 'learning_rate': 1.4996464618623795e-05, 'weight_decay': 0.0004104892950404676, 'batch_size': 10}. Best is trial 14 with value: 0.5434152214056128.
Hyperparameters: num_heads=4, num_transformer_blocks=8, learning_rate=4.1461535743771105e-05, optimizer=Adam, weight_decay=6.430375680204082e-05, batch_size=10,factor=1
Divergence detected. Stopping training after 10 epochs.
Early stopping at epoch 14
Trial 21, Fold 2: Test Accuracy = 0.3446
Divergence detected. Stopping training after 10 epochs.
Early stopping at epoch 14
Trial 22, Fold 1: Test Accuracy = 0.4462
Divergence detected. Stopping training after 10 epochs.
Early stopping at epoch 28
Trial 21, Fold 3: Test Accuracy = 0.2467
Divergence detected. Stopping training after 10 epochs.
Early stopping at epoch 17
Trial 22, Fold 2: Test Accuracy = 0.5395
Divergence detected. Stopping training after 10 epochs.
Early stopping at epoch 10
Trial 21, Fold 4: Test Accuracy = 0.3096
Divergence detected. Stopping training after 10 epochs.
Early stopping at epoch 15
Trial 22, Fold 3: Test Accuracy = 0.4880
Trial 21, Fold 5: Test Accuracy = 0.3333
Trial 21: Mean Accuracy = 0.3073, Fold Accuracies = [np.float64(0.3021280172388103), np.float64(0.34459625296572033), np.float64(0.24673404525807272), np.float64(0.3096214058076043), np.float64(0.3333333333333333)]
[I 2025-05-02 19:58:53,035] Trial 21 finished with value: 0.3072826109207082 and parameters: {'num_heads': 16, 'num_transformer_blocks': 2, 'learning_rate': 1.0263678879371138e-08, 'weight_decay': 0.00044308597287374317, 'batch_size': 10}. Best is trial 14 with value: 0.5434152214056128.
Hyperparameters: num_heads=4, num_transformer_blocks=8, learning_rate=4.9632393601790756e-05, optimizer=Adam, weight_decay=7.84905982695952e-05, batch_size=10,factor=1
Divergence detected. Stopping training after 10 epochs.
Early stopping at epoch 23
Trial 22, Fold 4: Test Accuracy = 0.5111
Divergence detected. Stopping training after 10 epochs.
Early stopping at epoch 20
Trial 23, Fold 1: Test Accuracy = 0.4347
Divergence detected. Stopping training after 10 epochs.
Early stopping at epoch 16
Trial 22, Fold 5: Test Accuracy = 0.5942
Trial 22: Mean Accuracy = 0.5158, Fold Accuracies = [np.float64(0.44619001215320947), np.float64(0.5394922171286403), np.float64(0.4880008899059242), np.float64(0.5110601332242819), np.float64(0.5942416146427573)]
[I 2025-05-02 20:03:52,274] Trial 22 finished with value: 0.5157969734109626 and parameters: {'num_heads': 4, 'num_transformer_blocks': 8, 'learning_rate': 4.1461535743771105e-05, 'weight_decay': 6.430375680204082e-05, 'batch_size': 10}. Best is trial 14 with value: 0.5434152214056128.
Hyperparameters: num_heads=4, num_transformer_blocks=8, learning_rate=2.0709265596550155e-06, optimizer=Adam, weight_decay=1.135171282506963e-05, batch_size=10,factor=1
Divergence detected. Stopping training after 10 epochs.
Early stopping at epoch 13
Trial 23, Fold 2: Test Accuracy = 0.5785
Trial 24, Fold 1: Test Accuracy = 0.4590
Divergence detected. Stopping training after 10 epochs.
Early stopping at epoch 17
Trial 23, Fold 3: Test Accuracy = 0.4441
Divergence detected. Stopping training after 10 epochs.
Early stopping at epoch 17
Trial 23, Fold 4: Test Accuracy = 0.5063
Trial 24, Fold 2: Test Accuracy = 0.4563
Divergence detected. Stopping training after 10 epochs.
Early stopping at epoch 14
Trial 23, Fold 5: Test Accuracy = 0.5744
Trial 23: Mean Accuracy = 0.5076, Fold Accuracies = [np.float64(0.43473352611585486), np.float64(0.5785492596525076), np.float64(0.4440706839562676), np.float64(0.506284561409102), np.float64(0.5743751569624221)]
[I 2025-05-02 20:16:19,432] Trial 23 finished with value: 0.5076026376192309 and parameters: {'num_heads': 4, 'num_transformer_blocks': 8, 'learning_rate': 4.9632393601790756e-05, 'weight_decay': 7.84905982695952e-05, 'batch_size': 10}. Best is trial 14 with value: 0.5434152214056128.
Hyperparameters: num_heads=4, num_transformer_blocks=8, learning_rate=4.10233883513962e-06, optimizer=Adam, weight_decay=1.0064137036080512e-05, batch_size=10,factor=1
Trial 24, Fold 3: Test Accuracy = 0.4808
Trial 25, Fold 1: Test Accuracy = 0.3900
Trial 24, Fold 4: Test Accuracy = 0.4867
Trial 25, Fold 2: Test Accuracy = 0.5103
Divergence detected. Stopping training after 10 epochs.
Early stopping at epoch 14
Trial 24, Fold 5: Test Accuracy = 0.4021
Trial 24: Mean Accuracy = 0.4570, Fold Accuracies = [np.float64(0.45898068273621145), np.float64(0.4563303014583388), np.float64(0.4807754894482583), np.float64(0.48665871261216304), np.float64(0.40212310097009096)]
[I 2025-05-02 20:30:17,626] Trial 24 finished with value: 0.45697365744501256 and parameters: {'num_heads': 4, 'num_transformer_blocks': 8, 'learning_rate': 2.0709265596550155e-06, 'weight_decay': 1.135171282506963e-05, 'batch_size': 10}. Best is trial 14 with value: 0.5434152214056128.
Hyperparameters: num_heads=32, num_transformer_blocks=4, learning_rate=4.678566744208165e-06, optimizer=Adam, weight_decay=0.000460718740382649, batch_size=10,factor=1
Trial 25, Fold 3: Test Accuracy = 0.5312
Trial 26, Fold 1: Test Accuracy = 0.4538
Trial 25, Fold 4: Test Accuracy = 0.5194
Trial 26, Fold 2: Test Accuracy = 0.5528
Trial 26, Fold 3: Test Accuracy = 0.5175
Trial 25, Fold 5: Test Accuracy = 0.5607
Trial 25: Mean Accuracy = 0.5023, Fold Accuracies = [np.float64(0.38996414721909317), np.float64(0.5102722671394438), np.float64(0.5312147215865751), np.float64(0.5193820280059561), np.float64(0.5606520255386561)]
[I 2025-05-02 20:48:04,755] Trial 25 finished with value: 0.5022970378979449 and parameters: {'num_heads': 4, 'num_transformer_blocks': 8, 'learning_rate': 4.10233883513962e-06, 'weight_decay': 1.0064137036080512e-05, 'batch_size': 10}. Best is trial 14 with value: 0.5434152214056128.
Hyperparameters: num_heads=2, num_transformer_blocks=4, learning_rate=5.43211038647271e-07, optimizer=Adam, weight_decay=0.00048290749032893016, batch_size=10,factor=1