Hyperparameters: num_heads=4, num_transformer_blocks=4, learning_rate=0.00025526314986166413, optimizer=AdamW, weight_decay=0.0007604114556329706, batch_size=32,factor=1
Divergence detected. Stopping training after 10 epochs.
Early stopping at epoch 14
Trial 14, Fold 1: Test Accuracy = 0.5047
Divergence detected. Stopping training after 10 epochs.
Early stopping at epoch 13
Trial 13, Fold 1: Test Accuracy = 0.5307
Divergence detected. Stopping training after 10 epochs.
Early stopping at epoch 10
Trial 11, Fold 3: Test Accuracy = 0.3333
Divergence detected. Stopping training after 10 epochs.
Early stopping at epoch 11
Trial 14, Fold 2: Test Accuracy = 0.4928
Divergence detected. Stopping training after 10 epochs.
Early stopping at epoch 11
Trial 13, Fold 2: Test Accuracy = 0.4562
Divergence detected. Stopping training after 10 epochs.
Early stopping at epoch 12
Trial 14, Fold 3: Test Accuracy = 0.5123
Divergence detected. Stopping training after 10 epochs.
Early stopping at epoch 14
Trial 14, Fold 4: Test Accuracy = 0.5147
Divergence detected. Stopping training after 10 epochs.
Early stopping at epoch 15
Trial 13, Fold 3: Test Accuracy = 0.4997
Divergence detected. Stopping training after 10 epochs.
Early stopping at epoch 11
Trial 14, Fold 5: Test Accuracy = 0.4885
Trial 14: Mean Accuracy = 0.5026, Fold Accuracies = [np.float64(0.5046682779145009), np.float64(0.4928099379985837), np.float64(0.5123105771675566), np.float64(0.5146808064100958), np.float64(0.48854050821141554)]
[I 2025-05-02 02:44:36,583] Trial 14 finished with value: 0.5026020215404305 and parameters: {'num_heads': 4, 'num_transformer_blocks': 4, 'learning_rate': 0.00025526314986166413, 'optimizer': 'AdamW', 'weight_decay': 0.0007604114556329706, 'batch_size': 32, 'label_smoothing': 0.1}. Best is trial 0 with value: 0.5457832834725701.
Hyperparameters: num_heads=2, num_transformer_blocks=8, learning_rate=8.432640395680454e-06, optimizer=AdamW, weight_decay=6.472847080072849e-05, batch_size=32,factor=1
Divergence detected. Stopping training after 10 epochs.
Early stopping at epoch 14
Trial 13, Fold 4: Test Accuracy = 0.4846
Trial 15, Fold 1: Test Accuracy = 0.5028
Trial 11, Fold 4: Test Accuracy = 0.3321
Divergence detected. Stopping training after 10 epochs.
Early stopping at epoch 17
Trial 13, Fold 5: Test Accuracy = 0.5320
Trial 13: Mean Accuracy = 0.5006, Fold Accuracies = [np.float64(0.5307034596867182), np.float64(0.45621661321530144), np.float64(0.4996732773963895), np.float64(0.4845949117387236), np.float64(0.5320441646220916)]
[I 2025-05-02 02:53:30,315] Trial 13 finished with value: 0.5006464853318449 and parameters: {'num_heads': 2, 'num_transformer_blocks': 4, 'learning_rate': 0.0001966875856528911, 'optimizer': 'AdamW', 'weight_decay': 1.1203478684176716e-06, 'batch_size': 16, 'label_smoothing': 0.08}. Best is trial 0 with value: 0.5457832834725701.
Hyperparameters: num_heads=4, num_transformer_blocks=8, learning_rate=7.340232128217052e-06, optimizer=AdamW, weight_decay=6.427565145997761e-05, batch_size=32,factor=1
Trial 15, Fold 2: Test Accuracy = 0.4901
Trial 16, Fold 1: Test Accuracy = 0.4778
Trial 15, Fold 3: Test Accuracy = 0.6000
Trial 11, Fold 5: Test Accuracy = 0.3491
Trial 11: Mean Accuracy = 0.3366, Fold Accuracies = [np.float64(0.3333333333333333), np.float64(0.33520595978658463), np.float64(0.3333333333333333), np.float64(0.3320748589290789), np.float64(0.3491076541882399)]
[I 2025-05-02 03:07:51,825] Trial 11 finished with value: 0.336611027914114 and parameters: {'num_heads': 4, 'num_transformer_blocks': 16, 'learning_rate': 1.9177761978407827e-06, 'optimizer': 'SGD', 'weight_decay': 0.0005166472422752309, 'batch_size': 10, 'label_smoothing': 0.25}. Best is trial 0 with value: 0.5457832834725701.
Hyperparameters: num_heads=2, num_transformer_blocks=8, learning_rate=1.939187445679444e-05, optimizer=AdamW, weight_decay=6.92277004062185e-05, batch_size=32,factor=1
Trial 16, Fold 2: Test Accuracy = 0.4220
Trial 15, Fold 4: Test Accuracy = 0.5266
Divergence detected. Stopping training after 10 epochs.
Early stopping at epoch 29
Trial 17, Fold 1: Test Accuracy = 0.5352
Trial 16, Fold 3: Test Accuracy = 0.5660
Trial 15, Fold 5: Test Accuracy = 0.5440
Trial 15: Mean Accuracy = 0.5327, Fold Accuracies = [np.float64(0.5027718694603137), np.float64(0.4901311387118465), np.float64(0.6000031782354437), np.float64(0.5265715700977673), np.float64(0.5439699229429656)]
[I 2025-05-02 03:19:19,822] Trial 15 finished with value: 0.5326895358896674 and parameters: {'num_heads': 2, 'num_transformer_blocks': 8, 'learning_rate': 8.432640395680454e-06, 'optimizer': 'AdamW', 'weight_decay': 6.472847080072849e-05, 'batch_size': 32, 'label_smoothing': 0.17}. Best is trial 0 with value: 0.5457832834725701.
Hyperparameters: num_heads=2, num_transformer_blocks=32, learning_rate=4.6127599240886235e-05, optimizer=AdamW, weight_decay=5.595400307736494e-05, batch_size=32,factor=1
Trial 17, Fold 2: Test Accuracy = 0.4801
Divergence detected. Stopping training after 10 epochs.
Early stopping at epoch 18
Trial 18, Fold 1: Test Accuracy = 0.5043
Trial 16, Fold 4: Test Accuracy = 0.5298
Divergence detected. Stopping training after 10 epochs.
Early stopping at epoch 26
Trial 17, Fold 3: Test Accuracy = 0.5717
Trial 16, Fold 5: Test Accuracy = 0.5563
Trial 16: Mean Accuracy = 0.5104, Fold Accuracies = [np.float64(0.4777658344338622), np.float64(0.421983560386497), np.float64(0.566000508517671), np.float64(0.5297548832741156), np.float64(0.5562569657155684)]
[I 2025-05-02 03:35:12,246] Trial 16 finished with value: 0.5103523504655428 and parameters: {'num_heads': 4, 'num_transformer_blocks': 8, 'learning_rate': 7.340232128217052e-06, 'optimizer': 'AdamW', 'weight_decay': 6.427565145997761e-05, 'batch_size': 32, 'label_smoothing': 0.17}. Best is trial 0 with value: 0.5457832834725701.
Hyperparameters: num_heads=2, num_transformer_blocks=32, learning_rate=3.8392978524139674e-05, optimizer=AdamW, weight_decay=3.9155412624759956e-05, batch_size=32,factor=1
Divergence detected. Stopping training after 10 epochs.
Early stopping at epoch 25
Trial 18, Fold 2: Test Accuracy = 0.4638
Trial 17, Fold 4: Test Accuracy = 0.5600
Divergence detected. Stopping training after 10 epochs.
Early stopping at epoch 19
Trial 19, Fold 1: Test Accuracy = 0.5078
Divergence detected. Stopping training after 10 epochs.
Early stopping at epoch 20
Trial 18, Fold 3: Test Accuracy = 0.4412
Divergence detected. Stopping training after 10 epochs.
Early stopping at epoch 24
Trial 17, Fold 5: Test Accuracy = 0.5715
Trial 17: Mean Accuracy = 0.5437, Fold Accuracies = [np.float64(0.5352411047225257), np.float64(0.48014144970505573), np.float64(0.5717372234935164), np.float64(0.5600452347182102), np.float64(0.5714605249396217)]
[I 2025-05-02 03:44:33,753] Trial 17 finished with value: 0.543725107515786 and parameters: {'num_heads': 2, 'num_transformer_blocks': 8, 'learning_rate': 1.939187445679444e-05, 'optimizer': 'AdamW', 'weight_decay': 6.92277004062185e-05, 'batch_size': 32, 'label_smoothing': 0.16}. Best is trial 0 with value: 0.5457832834725701.
Hyperparameters: num_heads=2, num_transformer_blocks=32, learning_rate=0.00010310893237025501, optimizer=AdamW, weight_decay=2.398368063631238e-05, batch_size=32,factor=1
Divergence detected. Stopping training after 10 epochs.
Early stopping at epoch 17
Trial 18, Fold 4: Test Accuracy = 0.5018
Divergence detected. Stopping training after 10 epochs.
Early stopping at epoch 19
Trial 20, Fold 1: Test Accuracy = 0.5177
Divergence detected. Stopping training after 10 epochs.
Early stopping at epoch 22
Trial 19, Fold 2: Test Accuracy = 0.4537
Divergence detected. Stopping training after 10 epochs.
Early stopping at epoch 17
Trial 18, Fold 5: Test Accuracy = 0.5100
Trial 18: Mean Accuracy = 0.4842, Fold Accuracies = [np.float64(0.5042565472781887), np.float64(0.4637975366316591), np.float64(0.44119883040935676), np.float64(0.5018108612826592), np.float64(0.5100074238532474)]
[I 2025-05-02 03:56:08,100] Trial 18 finished with value: 0.4842142398910222 and parameters: {'num_heads': 2, 'num_transformer_blocks': 32, 'learning_rate': 4.6127599240886235e-05, 'optimizer': 'AdamW', 'weight_decay': 5.595400307736494e-05, 'batch_size': 32, 'label_smoothing': 0.17}. Best is trial 0 with value: 0.5457832834725701.
Hyperparameters: num_heads=2, num_transformer_blocks=2, learning_rate=0.0016798262020497148, optimizer=AdamW, weight_decay=2.250011773475611e-05, batch_size=32,factor=1
Divergence detected. Stopping training after 10 epochs.
Early stopping at epoch 19
Trial 20, Fold 2: Test Accuracy = 0.4851
Divergence detected. Stopping training after 10 epochs.
Early stopping at epoch 12
Trial 21, Fold 1: Test Accuracy = 0.4817
Divergence detected. Stopping training after 10 epochs.
Early stopping at epoch 14
Trial 21, Fold 2: Test Accuracy = 0.5081
Divergence detected. Stopping training after 10 epochs.
Early stopping at epoch 17
Trial 19, Fold 3: Test Accuracy = 0.4817
Divergence detected. Stopping training after 10 epochs.
Early stopping at epoch 11
Trial 21, Fold 3: Test Accuracy = 0.4981
Divergence detected. Stopping training after 10 epochs.
Early stopping at epoch 15
Trial 21, Fold 4: Test Accuracy = 0.4893
Divergence detected. Stopping training after 10 epochs.
Early stopping at epoch 11
Trial 21, Fold 5: Test Accuracy = 0.5286
Trial 21: Mean Accuracy = 0.5012, Fold Accuracies = [np.float64(0.48173464603844346), np.float64(0.508125528621269), np.float64(0.49809242308670226), np.float64(0.48926004417394203), np.float64(0.5286428763224559)]
[I 2025-05-02 04:08:59,975] Trial 21 finished with value: 0.5011711036485625 and parameters: {'num_heads': 2, 'num_transformer_blocks': 2, 'learning_rate': 0.0016798262020497148, 'optimizer': 'AdamW', 'weight_decay': 2.250011773475611e-05, 'batch_size': 32, 'label_smoothing': 0.04}. Best is trial 0 with value: 0.5457832834725701.
Hyperparameters: num_heads=2, num_transformer_blocks=2, learning_rate=4.304666123970005e-05, optimizer=AdamW, weight_decay=0.00015485818844352672, batch_size=32,factor=1
Divergence detected. Stopping training after 10 epochs.
Early stopping at epoch 25
Trial 20, Fold 3: Test Accuracy = 0.5361
Divergence detected. Stopping training after 10 epochs.
Early stopping at epoch 16
Trial 19, Fold 4: Test Accuracy = 0.5059
Trial 22, Fold 1: Test Accuracy = 0.5287
Divergence detected. Stopping training after 10 epochs.
Early stopping at epoch 14
Trial 20, Fold 4: Test Accuracy = 0.4959
Trial 22, Fold 2: Test Accuracy = 0.5649
Divergence detected. Stopping training after 10 epochs.
Early stopping at epoch 24
Trial 19, Fold 5: Test Accuracy = 0.5659
Trial 19: Mean Accuracy = 0.5030, Fold Accuracies = [np.float64(0.5077740214694074), np.float64(0.4537097089677466), np.float64(0.48174866514111364), np.float64(0.5058542983209614), np.float64(0.5659470646073771)]
[I 2025-05-02 04:22:46,828] Trial 19 finished with value: 0.5030067517013213 and parameters: {'num_heads': 2, 'num_transformer_blocks': 32, 'learning_rate': 3.8392978524139674e-05, 'optimizer': 'AdamW', 'weight_decay': 3.9155412624759956e-05, 'batch_size': 32, 'label_smoothing': 0.17}. Best is trial 0 with value: 0.5457832834725701.
Hyperparameters: num_heads=2, num_transformer_blocks=8, learning_rate=1.6890457277384387e-06, optimizer=AdamW, weight_decay=0.0001339305625050684, batch_size=32,factor=1
Divergence detected. Stopping training after 10 epochs.
Early stopping at epoch 21
Trial 22, Fold 3: Test Accuracy = 0.5719
Divergence detected. Stopping training after 10 epochs.
Early stopping at epoch 20
Trial 20, Fold 5: Test Accuracy = 0.3844
Trial 20: Mean Accuracy = 0.4838, Fold Accuracies = [np.float64(0.5176650231284776), np.float64(0.48508217910352336), np.float64(0.5360596236969234), np.float64(0.49594378441340264), np.float64(0.38442379465962057)]
[I 2025-05-02 04:25:49,155] Trial 20 finished with value: 0.48383488100038957 and parameters: {'num_heads': 2, 'num_transformer_blocks': 32, 'learning_rate': 0.00010310893237025501, 'optimizer': 'AdamW', 'weight_decay': 2.398368063631238e-05, 'batch_size': 32, 'label_smoothing': 0.04}. Best is trial 0 with value: 0.5457832834725701.
Hyperparameters: num_heads=2, num_transformer_blocks=8, learning_rate=0.001255684898847758, optimizer=AdamW, weight_decay=0.0001460273048330674, batch_size=32,factor=1
Divergence detected. Stopping training after 10 epochs.
Early stopping at epoch 15
Trial 24, Fold 1: Test Accuracy = 0.3333
Trial 23, Fold 1: Test Accuracy = 0.4299
Trial 22, Fold 4: Test Accuracy = 0.5491
Divergence detected. Stopping training after 10 epochs.
Early stopping at epoch 10
Trial 23, Fold 2: Test Accuracy = 0.3263
Divergence detected. Stopping training after 10 epochs.
Early stopping at epoch 20
Trial 24, Fold 2: Test Accuracy = 0.3313
Divergence detected. Stopping training after 10 epochs.
Early stopping at epoch 10
Trial 23, Fold 3: Test Accuracy = 0.4364
Divergence detected. Stopping training after 10 epochs.
Early stopping at epoch 28
Trial 22, Fold 5: Test Accuracy = 0.5573
Trial 22: Mean Accuracy = 0.5544, Fold Accuracies = [np.float64(0.5286776854437124), np.float64(0.5648903772913243), np.float64(0.5718777015001272), np.float64(0.5491294451724412), np.float64(0.5573114315802281)]
[I 2025-05-02 04:39:09,654] Trial 22 finished with value: 0.5543773281975666 and parameters: {'num_heads': 2, 'num_transformer_blocks': 2, 'learning_rate': 4.304666123970005e-05, 'optimizer': 'AdamW', 'weight_decay': 0.00015485818844352672, 'batch_size': 32, 'label_smoothing': 0.1}. Best is trial 22 with value: 0.5543773281975666.
Hyperparameters: num_heads=2, num_transformer_blocks=2, learning_rate=0.0007911092501192728, optimizer=AdamW, weight_decay=0.00012790386700092612, batch_size=32,factor=1
Divergence detected. Stopping training after 10 epochs.
Early stopping at epoch 16
Trial 24, Fold 3: Test Accuracy = 0.3333
Divergence detected. Stopping training after 10 epochs.
Early stopping at epoch 11
Trial 23, Fold 4: Test Accuracy = 0.3406
Divergence detected. Stopping training after 10 epochs.
Early stopping at epoch 12
Trial 25, Fold 1: Test Accuracy = 0.4991
Divergence detected. Stopping training after 10 epochs.
Early stopping at epoch 10
Trial 23, Fold 5: Test Accuracy = 0.3639
Trial 23: Mean Accuracy = 0.3794, Fold Accuracies = [np.float64(0.4298810284355405), np.float64(0.3262502146994776), np.float64(0.43643401983218916), np.float64(0.34064995859168495), np.float64(0.36393811028209294)]
[I 2025-05-02 04:45:11,409] Trial 23 finished with value: 0.379430666368197 and parameters: {'num_heads': 2, 'num_transformer_blocks': 8, 'learning_rate': 1.6890457277384387e-06, 'optimizer': 'AdamW', 'weight_decay': 0.0001339305625050684, 'batch_size': 32, 'label_smoothing': 0.1}. Best is trial 22 with value: 0.5543773281975666.
Hyperparameters: num_heads=2, num_transformer_blocks=2, learning_rate=0.0009277499390841159, optimizer=AdamW, weight_decay=0.0001327603005836956, batch_size=32,factor=1
Divergence detected. Stopping training after 10 epochs.
Early stopping at epoch 11
Trial 25, Fold 2: Test Accuracy = 0.4951
Divergence detected. Stopping training after 10 epochs.
Early stopping at epoch 13
Trial 24, Fold 4: Test Accuracy = 0.3333
Divergence detected. Stopping training after 10 epochs.
Early stopping at epoch 10
Trial 26, Fold 1: Test Accuracy = 0.5081
Divergence detected. Stopping training after 10 epochs.
Early stopping at epoch 13
Trial 25, Fold 3: Test Accuracy = 0.5449
Divergence detected. Stopping training after 10 epochs.
Early stopping at epoch 14
Trial 24, Fold 5: Test Accuracy = 0.3551
Trial 24: Mean Accuracy = 0.3373, Fold Accuracies = [np.float64(0.3333333333333333), np.float64(0.3312923337250752), np.float64(0.3333333333333333), np.float64(0.3333333333333333), np.float64(0.35513759638872133)]
[I 2025-05-02 04:51:16,515] Trial 24 finished with value: 0.3372859860227593 and parameters: {'num_heads': 2, 'num_transformer_blocks': 8, 'learning_rate': 0.001255684898847758, 'optimizer': 'AdamW', 'weight_decay': 0.0001460273048330674, 'batch_size': 32, 'label_smoothing': 0.21}. Best is trial 22 with value: 0.5543773281975666.
Hyperparameters: num_heads=32, num_transformer_blocks=2, learning_rate=0.0008254183972368983, optimizer=AdamW, weight_decay=0.0003026475675983825, batch_size=32,factor=1
Divergence detected. Stopping training after 10 epochs.
Early stopping at epoch 12
Trial 26, Fold 2: Test Accuracy = 0.5066
Divergence detected. Stopping training after 10 epochs.
Early stopping at epoch 13
Trial 25, Fold 4: Test Accuracy = 0.4757
Divergence detected. Stopping training after 10 epochs.
Early stopping at epoch 12
Trial 27, Fold 1: Test Accuracy = 0.4878
Divergence detected. Stopping training after 10 epochs.
Early stopping at epoch 15
Trial 26, Fold 3: Test Accuracy = 0.4908
Divergence detected. Stopping training after 10 epochs.
Early stopping at epoch 12
Trial 25, Fold 5: Test Accuracy = 0.5604
Trial 25: Mean Accuracy = 0.5151, Fold Accuracies = [np.float64(0.49912969727587936), np.float64(0.49507410315219474), np.float64(0.5449313501144165), np.float64(0.47574239896811993), np.float64(0.5604042167846063)]
[I 2025-05-02 04:56:40,803] Trial 25 finished with value: 0.5150563532590434 and parameters: {'num_heads': 2, 'num_transformer_blocks': 2, 'learning_rate': 0.0007911092501192728, 'optimizer': 'AdamW', 'weight_decay': 0.00012790386700092612, 'batch_size': 32, 'label_smoothing': 0.1}. Best is trial 22 with value: 0.5543773281975666.
Hyperparameters: num_heads=32, num_transformer_blocks=2, learning_rate=3.4693506333536474e-05, optimizer=AdamW, weight_decay=0.00029656663173285, batch_size=16,factor=1
Divergence detected. Stopping training after 10 epochs.
Early stopping at epoch 15
Trial 27, Fold 2: Test Accuracy = 0.4568
Divergence detected. Stopping training after 10 epochs.
Early stopping at epoch 15
Trial 26, Fold 4: Test Accuracy = 0.5318
Divergence detected. Stopping training after 10 epochs.
Early stopping at epoch 10
Trial 27, Fold 3: Test Accuracy = 0.5098
Divergence detected. Stopping training after 10 epochs.
Early stopping at epoch 10
Trial 26, Fold 5: Test Accuracy = 0.5255
Trial 26: Mean Accuracy = 0.5126, Fold Accuracies = [np.float64(0.5081231415163633), np.float64(0.5066145725814273), np.float64(0.4907519705059751), np.float64(0.531798600590069), np.float64(0.5255035656072636)]
[I 2025-05-02 05:03:29,978] Trial 26 finished with value: 0.5125583701602197 and parameters: {'num_heads': 2, 'num_transformer_blocks': 2, 'learning_rate': 0.0009277499390841159, 'optimizer': 'AdamW', 'weight_decay': 0.0001327603005836956, 'batch_size': 32, 'label_smoothing': 0.08}. Best is trial 22 with value: 0.5543773281975666.
Hyperparameters: num_heads=32, num_transformer_blocks=2, learning_rate=1.74006045498564e-05, optimizer=AdamW, weight_decay=0.0003496624190219605, batch_size=16,factor=1
Divergence detected. Stopping training after 10 epochs.
Early stopping at epoch 20
Trial 28, Fold 1: Test Accuracy = 0.5292
Divergence detected. Stopping training after 10 epochs.
Early stopping at epoch 12
Trial 27, Fold 4: Test Accuracy = 0.4820
Divergence detected. Stopping training after 10 epochs.
Early stopping at epoch 11
Trial 27, Fold 5: Test Accuracy = 0.5024
Trial 27: Mean Accuracy = 0.4878, Fold Accuracies = [np.float64(0.48783285531345966), np.float64(0.4567900030504935), np.float64(0.509836003051106), np.float64(0.4819938169729647), np.float64(0.5024000533132907)]
[I 2025-05-02 05:07:17,404] Trial 27 finished with value: 0.4877705463402629 and parameters: {'num_heads': 32, 'num_transformer_blocks': 2, 'learning_rate': 0.0008254183972368983, 'optimizer': 'AdamW', 'weight_decay': 0.0003026475675983825, 'batch_size': 32, 'label_smoothing': 0.0}. Best is trial 22 with value: 0.5543773281975666.
Hyperparameters: num_heads=8, num_transformer_blocks=2, learning_rate=2.2482536663267403e-05, optimizer=Adam, weight_decay=0.0003458008094786126, batch_size=16,factor=1
Divergence detected. Stopping training after 10 epochs.
Early stopping at epoch 22
Trial 28, Fold 2: Test Accuracy = 0.5227
Trial 29, Fold 1: Test Accuracy = 0.5420
Divergence detected. Stopping training after 10 epochs.
Early stopping at epoch 22
Trial 30, Fold 1: Test Accuracy = 0.5167
Trial 28, Fold 3: Test Accuracy = 0.5389
Trial 29, Fold 2: Test Accuracy = 0.4827
Divergence detected. Stopping training after 10 epochs.
Early stopping at epoch 26
Trial 30, Fold 2: Test Accuracy = 0.4621
Trial 28, Fold 4: Test Accuracy = 0.5618
Trial 29, Fold 3: Test Accuracy = 0.5754
Trial 30, Fold 3: Test Accuracy = 0.5452
Trial 28, Fold 5: Test Accuracy = 0.5434
Trial 28: Mean Accuracy = 0.5392, Fold Accuracies = [np.float64(0.5292498705320265), np.float64(0.5226524881028044), np.float64(0.5389092295957284), np.float64(0.5618149405712464), np.float64(0.5434307214915495)]
[I 2025-05-02 05:36:34,733] Trial 28 finished with value: 0.539211450058671 and parameters: {'num_heads': 32, 'num_transformer_blocks': 2, 'learning_rate': 3.4693506333536474e-05, 'optimizer': 'AdamW', 'weight_decay': 0.00029656663173285, 'batch_size': 16, 'label_smoothing': 0.07}. Best is trial 22 with value: 0.5543773281975666.
Hyperparameters: num_heads=16, num_transformer_blocks=4, learning_rate=6.194475015996272e-08, optimizer=Adam, weight_decay=3.988526389661432e-05, batch_size=32,factor=1
Trial 29, Fold 4: Test Accuracy = 0.5258
Trial 30, Fold 4: Test Accuracy = 0.5675
Trial 31, Fold 1: Test Accuracy = 0.3252
Trial 30, Fold 5: Test Accuracy = 0.5469
Trial 30: Mean Accuracy = 0.5277, Fold Accuracies = [np.float64(0.5167414944548469), np.float64(0.4621364941431067), np.float64(0.5451665395372488), np.float64(0.5674603734084274), np.float64(0.5469255103346571)]
