[I 2025-05-01 18:15:00,707] Trial 107 finished with value: 0.527659335625964 and parameters: {'num_heads': 2, 'num_transformer_blocks': 2, 'learning_rate': 4.898155624993735e-05, 'optimizer': 'Adam', 'weight_decay': 3.224957111801335e-06, 'batch_size': 10, 'label_smoothing': 0.13}. Best is trial 86 with value: 0.5553539263859596.
Hyperparameters: num_heads=32, num_transformer_blocks=2, learning_rate=6.763306336456458e-06, optimizer=Adam, weight_decay=1.4153735222468084e-06, batch_size=10,factor=1
Trial 109, Fold 2: Test Accuracy = 0.6012
Divergence detected. Stopping training after 10 epochs.
Early stopping at epoch 24
Trial 108, Fold 3: Test Accuracy = 0.5368
Trial 110, Fold 1: Test Accuracy = 0.4980
Divergence detected. Stopping training after 10 epochs.
Early stopping at epoch 27
Trial 108, Fold 4: Test Accuracy = 0.4585
Trial 109, Fold 3: Test Accuracy = 0.4956
Trial 110, Fold 2: Test Accuracy = 0.5762
Divergence detected. Stopping training after 10 epochs.
Early stopping at epoch 23
Trial 108, Fold 5: Test Accuracy = 0.6315
Trial 108: Mean Accuracy = 0.5278, Fold Accuracies = [np.float64(0.44742993966942607), np.float64(0.5650381216703352), np.float64(0.536758159666066), np.float64(0.458468286099865), np.float64(0.6315412899865418)]
[I 2025-05-01 18:33:07,717] Trial 108 finished with value: 0.5278471594184468 and parameters: {'num_heads': 32, 'num_transformer_blocks': 2, 'learning_rate': 4.758768753539347e-05, 'optimizer': 'Adam', 'weight_decay': 1.4466554258521613e-06, 'batch_size': 10, 'label_smoothing': 0.13}. Best is trial 86 with value: 0.5553539263859596.
Hyperparameters: num_heads=32, num_transformer_blocks=2, learning_rate=6.624382240491889e-06, optimizer=Adam, weight_decay=1.9484326721033226e-06, batch_size=16,factor=1
Trial 109, Fold 4: Test Accuracy = 0.4195
Trial 111, Fold 1: Test Accuracy = 0.3700
Trial 110, Fold 3: Test Accuracy = 0.5213
Trial 109, Fold 5: Test Accuracy = 0.5540
Trial 109: Mean Accuracy = 0.5132, Fold Accuracies = [np.float64(0.4957769483015091), np.float64(0.6012125030571772), np.float64(0.49560787394297856), np.float64(0.4195344129554656), np.float64(0.5540388400348463)]
[I 2025-05-01 18:43:45,353] Trial 109 finished with value: 0.5132341156583953 and parameters: {'num_heads': 32, 'num_transformer_blocks': 2, 'learning_rate': 6.658457299134199e-06, 'optimizer': 'Adam', 'weight_decay': 1.974360654636552e-06, 'batch_size': 10, 'label_smoothing': 0.13}. Best is trial 86 with value: 0.5553539263859596.
Hyperparameters: num_heads=8, num_transformer_blocks=2, learning_rate=9.874005647126574e-05, optimizer=Adam, weight_decay=1.029743835545186e-06, batch_size=10,factor=1
Divergence detected. Stopping training after 10 epochs.
Early stopping at epoch 13
Trial 111, Fold 2: Test Accuracy = 0.6050
Trial 112, Fold 1: Test Accuracy = 0.4897
Trial 110, Fold 4: Test Accuracy = 0.4440
Divergence detected. Stopping training after 10 epochs.
Early stopping at epoch 18
Trial 112, Fold 2: Test Accuracy = 0.5587
Trial 111, Fold 3: Test Accuracy = 0.4806
Trial 110, Fold 5: Test Accuracy = 0.5919
Trial 110: Mean Accuracy = 0.5263, Fold Accuracies = [np.float64(0.497996980706382), np.float64(0.5762114396911985), np.float64(0.5213114766723658), np.float64(0.44396086369770577), np.float64(0.5919260428413952)]
[I 2025-05-01 18:58:45,243] Trial 110 finished with value: 0.5262813607218095 and parameters: {'num_heads': 32, 'num_transformer_blocks': 2, 'learning_rate': 6.763306336456458e-06, 'optimizer': 'Adam', 'weight_decay': 1.4153735222468084e-06, 'batch_size': 10, 'label_smoothing': 0.15}. Best is trial 86 with value: 0.5553539263859596.
Hyperparameters: num_heads=2, num_transformer_blocks=2, learning_rate=3.154267490327759e-05, optimizer=Adam, weight_decay=1.7362628584725401e-06, batch_size=10,factor=1
Divergence detected. Stopping training after 10 epochs.
Early stopping at epoch 18
Trial 112, Fold 3: Test Accuracy = 0.5334
Trial 111, Fold 4: Test Accuracy = 0.3365
Divergence detected. Stopping training after 10 epochs.
Early stopping at epoch 14
Trial 112, Fold 4: Test Accuracy = 0.4455
Divergence detected. Stopping training after 10 epochs.
Early stopping at epoch 14
Divergence detected. Stopping training after 10 epochs.
Early stopping at epoch 27
Trial 112, Fold 5: Test Accuracy = 0.5646
Trial 112: Mean Accuracy = 0.5184, Fold Accuracies = [np.float64(0.4896694371174041), np.float64(0.558669888665582), np.float64(0.533394251651957), np.float64(0.4454790823211876), np.float64(0.5646335983182696)]
[I 2025-05-01 19:07:08,216] Trial 112 finished with value: 0.5183692516148801 and parameters: {'num_heads': 8, 'num_transformer_blocks': 2, 'learning_rate': 9.874005647126574e-05, 'optimizer': 'Adam', 'weight_decay': 1.029743835545186e-06, 'batch_size': 10, 'label_smoothing': 0.15}. Best is trial 86 with value: 0.5553539263859596.
Hyperparameters: num_heads=2, num_transformer_blocks=2, learning_rate=2.9049197456746035e-05, optimizer=Adam, weight_decay=1.724598771824461e-06, batch_size=10,factor=1
Trial 113, Fold 1: Test Accuracy = 0.5128
Trial 111, Fold 5: Test Accuracy = 0.5456
Trial 111: Mean Accuracy = 0.4675, Fold Accuracies = [np.float64(0.3699603067956226), np.float64(0.6049954275262918), np.float64(0.48056805754509185), np.float64(0.3365384615384615), np.float64(0.5455974327096225)]
[I 2025-05-01 19:07:22,009] Trial 111 finished with value: 0.4675319372230181 and parameters: {'num_heads': 32, 'num_transformer_blocks': 2, 'learning_rate': 6.624382240491889e-06, 'optimizer': 'Adam', 'weight_decay': 1.9484326721033226e-06, 'batch_size': 16, 'label_smoothing': 0.15}. Best is trial 86 with value: 0.5553539263859596.
Hyperparameters: num_heads=2, num_transformer_blocks=2, learning_rate=1.9751966534263565e-05, optimizer=Adam, weight_decay=1.6537464520782325e-06, batch_size=10,factor=1
Divergence detected. Stopping training after 10 epochs.
Early stopping at epoch 17
Trial 113, Fold 2: Test Accuracy = 0.5580
Divergence detected. Stopping training after 10 epochs.
Early stopping at epoch 23
Divergence detected. Stopping training after 10 epochs.
Early stopping at epoch 23
Trial 115, Fold 1: Test Accuracy = 0.4711
Trial 114, Fold 1: Test Accuracy = 0.5025
Divergence detected. Stopping training after 10 epochs.
Early stopping at epoch 19
Trial 113, Fold 3: Test Accuracy = 0.5426
Divergence detected. Stopping training after 10 epochs.
Early stopping at epoch 26
Trial 114, Fold 2: Test Accuracy = 0.5541
Trial 115, Fold 2: Test Accuracy = 0.5949
Divergence detected. Stopping training after 10 epochs.
Early stopping at epoch 25
Trial 113, Fold 4: Test Accuracy = 0.4401
Divergence detected. Stopping training after 10 epochs.
Early stopping at epoch 20
Trial 114, Fold 3: Test Accuracy = 0.5147
Divergence detected. Stopping training after 10 epochs.
Early stopping at epoch 24
Trial 115, Fold 3: Test Accuracy = 0.5452
Divergence detected. Stopping training after 10 epochs.
Early stopping at epoch 20
Trial 113, Fold 5: Test Accuracy = 0.6268
Trial 113: Mean Accuracy = 0.5360, Fold Accuracies = [np.float64(0.5127905904212081), np.float64(0.5580066141363874), np.float64(0.5425799023458558), np.float64(0.440080971659919), np.float64(0.626755447263112)]
[I 2025-05-01 19:31:25,154] Trial 113 finished with value: 0.5360427051652964 and parameters: {'num_heads': 2, 'num_transformer_blocks': 2, 'learning_rate': 3.154267490327759e-05, 'optimizer': 'Adam', 'weight_decay': 1.7362628584725401e-06, 'batch_size': 10, 'label_smoothing': 0.16}. Best is trial 86 with value: 0.5553539263859596.
Hyperparameters: num_heads=2, num_transformer_blocks=2, learning_rate=1.9730413786944568e-05, optimizer=Adam, weight_decay=4.155931680937987e-06, batch_size=10,factor=1
Divergence detected. Stopping training after 10 epochs.
Early stopping at epoch 26
Trial 114, Fold 4: Test Accuracy = 0.5205
Divergence detected. Stopping training after 10 epochs.
Early stopping at epoch 28
Trial 115, Fold 4: Test Accuracy = 0.4378
Divergence detected. Stopping training after 10 epochs.
Early stopping at epoch 25
Trial 116, Fold 1: Test Accuracy = 0.5002
Divergence detected. Stopping training after 10 epochs.
Early stopping at epoch 24
Trial 114, Fold 5: Test Accuracy = 0.5979
Trial 114: Mean Accuracy = 0.5379, Fold Accuracies = [np.float64(0.5024791165524755), np.float64(0.5541279867291926), np.float64(0.5146866287756265), np.float64(0.5205128205128206), np.float64(0.5978679644030159)]
[I 2025-05-01 19:41:19,392] Trial 114 finished with value: 0.5379349033946262 and parameters: {'num_heads': 2, 'num_transformer_blocks': 2, 'learning_rate': 2.9049197456746035e-05, 'optimizer': 'Adam', 'weight_decay': 1.724598771824461e-06, 'batch_size': 10, 'label_smoothing': 0.16}. Best is trial 86 with value: 0.5553539263859596.
Hyperparameters: num_heads=2, num_transformer_blocks=2, learning_rate=2.1235279233929493e-05, optimizer=Adam, weight_decay=4.347328030585618e-06, batch_size=10,factor=1
Divergence detected. Stopping training after 10 epochs.
Early stopping at epoch 21
Trial 115, Fold 5: Test Accuracy = 0.6373
Trial 115: Mean Accuracy = 0.5372, Fold Accuracies = [np.float64(0.47107642794339655), np.float64(0.5948987675588308), np.float64(0.5451731281672135), np.float64(0.4377867746288799), np.float64(0.6372775252587775)]
[I 2025-05-01 19:44:05,570] Trial 115 finished with value: 0.5372425247114195 and parameters: {'num_heads': 2, 'num_transformer_blocks': 2, 'learning_rate': 1.9751966534263565e-05, 'optimizer': 'Adam', 'weight_decay': 1.6537464520782325e-06, 'batch_size': 10, 'label_smoothing': 0.16}. Best is trial 86 with value: 0.5553539263859596.
Hyperparameters: num_heads=2, num_transformer_blocks=2, learning_rate=1.329420166269361e-05, optimizer=SGD, weight_decay=2.4724192150529774e-06, batch_size=10,factor=1
Trial 116, Fold 2: Test Accuracy = 0.6020
Divergence detected. Stopping training after 10 epochs.
Early stopping at epoch 22
Trial 117, Fold 1: Test Accuracy = 0.4676
Trial 118, Fold 1: Test Accuracy = 0.3587
Trial 116, Fold 3: Test Accuracy = 0.5220
Divergence detected. Stopping training after 10 epochs.
Early stopping at epoch 25
Trial 117, Fold 2: Test Accuracy = 0.6232
Divergence detected. Stopping training after 10 epochs.
Early stopping at epoch 25
Trial 118, Fold 2: Test Accuracy = 0.3552
Trial 116, Fold 4: Test Accuracy = 0.4489
Trial 117, Fold 3: Test Accuracy = 0.5450
Trial 118, Fold 3: Test Accuracy = 0.3573
Trial 116, Fold 5: Test Accuracy = 0.5909
Trial 116: Mean Accuracy = 0.5328, Fold Accuracies = [np.float64(0.5002271880201508), np.float64(0.6019581884497187), np.float64(0.521977650447453), np.float64(0.4488866396761133), np.float64(0.590889945604647)]
[I 2025-05-01 20:07:23,479] Trial 116 finished with value: 0.5327879224396165 and parameters: {'num_heads': 2, 'num_transformer_blocks': 2, 'learning_rate': 1.9730413786944568e-05, 'optimizer': 'Adam', 'weight_decay': 4.155931680937987e-06, 'batch_size': 10, 'label_smoothing': 0.16}. Best is trial 86 with value: 0.5553539263859596.
Hyperparameters: num_heads=2, num_transformer_blocks=16, learning_rate=1.483635606876198e-05, optimizer=SGD, weight_decay=1.4305956483535e-06, batch_size=10,factor=1
Trial 117, Fold 4: Test Accuracy = 0.4669
Divergence detected. Stopping training after 10 epochs.
Early stopping at epoch 10
Trial 119, Fold 1: Test Accuracy = 0.3210
Trial 118, Fold 4: Test Accuracy = 0.3330
Divergence detected. Stopping training after 10 epochs.
Early stopping at epoch 11
Trial 118, Fold 5: Test Accuracy = 0.3570
Trial 118: Mean Accuracy = 0.3522, Fold Accuracies = [np.float64(0.3586832783114075), np.float64(0.3552081007220255), np.float64(0.35733099209833186), np.float64(0.3329622132253711), np.float64(0.35699589819877425)]
[I 2025-05-01 20:15:45,351] Trial 118 finished with value: 0.35223609651118204 and parameters: {'num_heads': 2, 'num_transformer_blocks': 2, 'learning_rate': 1.329420166269361e-05, 'optimizer': 'SGD', 'weight_decay': 2.4724192150529774e-06, 'batch_size': 10, 'label_smoothing': 0.18}. Best is trial 86 with value: 0.5553539263859596.
Hyperparameters: num_heads=2, num_transformer_blocks=16, learning_rate=1.6472566216252616e-05, optimizer=Adam, weight_decay=1.4863638676079143e-06, batch_size=10,factor=1
Trial 117, Fold 5: Test Accuracy = 0.5698
Trial 117: Mean Accuracy = 0.5345, Fold Accuracies = [np.float64(0.46758422225540125), np.float64(0.6231630352718495), np.float64(0.544978898079263), np.float64(0.4669028340080972), np.float64(0.569780130097467)]
[I 2025-05-01 20:16:34,409] Trial 117 finished with value: 0.5344818239424155 and parameters: {'num_heads': 2, 'num_transformer_blocks': 2, 'learning_rate': 2.1235279233929493e-05, 'optimizer': 'Adam', 'weight_decay': 4.347328030585618e-06, 'batch_size': 10, 'label_smoothing': 0.16}. Best is trial 86 with value: 0.5553539263859596.
Hyperparameters: num_heads=2, num_transformer_blocks=16, learning_rate=1.3880530011552487e-05, optimizer=Adam, weight_decay=1.4259066581701147e-06, batch_size=10,factor=1
Divergence detected. Stopping training after 10 epochs.
Early stopping at epoch 20
Trial 120, Fold 1: Test Accuracy = 0.5419
Divergence detected. Stopping training after 10 epochs.
Early stopping at epoch 28
Trial 119, Fold 2: Test Accuracy = 0.3202
Trial 121, Fold 1: Test Accuracy = 0.4789
Divergence detected. Stopping training after 10 epochs.
Early stopping at epoch 28
Trial 120, Fold 2: Test Accuracy = 0.5352
Divergence detected. Stopping training after 10 epochs.
Early stopping at epoch 21
Trial 119, Fold 3: Test Accuracy = 0.3543
Trial 121, Fold 2: Test Accuracy = 0.5958
Divergence detected. Stopping training after 10 epochs.
Early stopping at epoch 19
Trial 120, Fold 3: Test Accuracy = 0.5177
Divergence detected. Stopping training after 10 epochs.
Early stopping at epoch 10
Trial 119, Fold 4: Test Accuracy = 0.3329
Divergence detected. Stopping training after 10 epochs.
Early stopping at epoch 10
Trial 119, Fold 5: Test Accuracy = 0.3225
Trial 119: Mean Accuracy = 0.3302, Fold Accuracies = [np.float64(0.32100178613889857), np.float64(0.32021804319392605), np.float64(0.3542672858617131), np.float64(0.3328947368421053), np.float64(0.32249218647626665)]
[I 2025-05-01 20:41:46,508] Trial 119 finished with value: 0.33017480770258195 and parameters: {'num_heads': 2, 'num_transformer_blocks': 16, 'learning_rate': 1.483635606876198e-05, 'optimizer': 'SGD', 'weight_decay': 1.4305956483535e-06, 'batch_size': 10, 'label_smoothing': 0.18}. Best is trial 86 with value: 0.5553539263859596.
Hyperparameters: num_heads=2, num_transformer_blocks=4, learning_rate=1.6230210158896062e-06, optimizer=Adam, weight_decay=2.1085688960815073e-06, batch_size=16,factor=1
Divergence detected. Stopping training after 10 epochs.
Early stopping at epoch 21
Trial 120, Fold 4: Test Accuracy = 0.4220
Trial 121, Fold 3: Test Accuracy = 0.5637
Trial 122, Fold 1: Test Accuracy = 0.2765
Divergence detected. Stopping training after 10 epochs.
Early stopping at epoch 23
Trial 120, Fold 5: Test Accuracy = 0.5881
Trial 120: Mean Accuracy = 0.5210, Fold Accuracies = [np.float64(0.5419447126417712), np.float64(0.5351827926117331), np.float64(0.5177206845031807), np.float64(0.4219635627530365), np.float64(0.5881041463124236)]
[I 2025-05-01 20:51:08,515] Trial 120 finished with value: 0.520983179764429 and parameters: {'num_heads': 2, 'num_transformer_blocks': 16, 'learning_rate': 1.6472566216252616e-05, 'optimizer': 'Adam', 'weight_decay': 1.4863638676079143e-06, 'batch_size': 10, 'label_smoothing': 0.17}. Best is trial 86 with value: 0.5553539263859596.
Hyperparameters: num_heads=2, num_transformer_blocks=2, learning_rate=3.0018708146253204e-05, optimizer=Adam, weight_decay=1.900383992174991e-06, batch_size=10,factor=1
Trial 122, Fold 2: Test Accuracy = 0.3995
Divergence detected. Stopping training after 10 epochs.
Early stopping at epoch 22
Trial 123, Fold 1: Test Accuracy = 0.4980
Divergence detected. Stopping training after 10 epochs.
Early stopping at epoch 28
Trial 121, Fold 4: Test Accuracy = 0.4271
Divergence detected. Stopping training after 10 epochs.
Early stopping at epoch 17
Trial 123, Fold 2: Test Accuracy = 0.5680
Trial 122, Fold 3: Test Accuracy = 0.4438
Divergence detected. Stopping training after 10 epochs.
Early stopping at epoch 22
Trial 121, Fold 5: Test Accuracy = 0.6247
Trial 121: Mean Accuracy = 0.5380, Fold Accuracies = [np.float64(0.47888328162931254), np.float64(0.5957800321136525), np.float64(0.5636798977249974), np.float64(0.42705802968960865), np.float64(0.624669972036158)]
[I 2025-05-01 21:07:46,591] Trial 121 finished with value: 0.5380142426387459 and parameters: {'num_heads': 2, 'num_transformer_blocks': 16, 'learning_rate': 1.3880530011552487e-05, 'optimizer': 'Adam', 'weight_decay': 1.4259066581701147e-06, 'batch_size': 10, 'label_smoothing': 0.17}. Best is trial 86 with value: 0.5553539263859596.
Hyperparameters: num_heads=2, num_transformer_blocks=16, learning_rate=1.20344433030941e-05, optimizer=Adam, weight_decay=2.1583216572078846e-06, batch_size=10,factor=1
Divergence detected. Stopping training after 10 epochs.
Early stopping at epoch 24
Trial 123, Fold 3: Test Accuracy = 0.5329
Trial 122, Fold 4: Test Accuracy = 0.3374
Trial 123, Fold 4: Test Accuracy = 0.4511
Divergence detected. Stopping training after 10 epochs.
Early stopping at epoch 29
Trial 122, Fold 5: Test Accuracy = 0.3593
Trial 122: Mean Accuracy = 0.3633, Fold Accuracies = [np.float64(0.2764924434711923), np.float64(0.3995185610531577), np.float64(0.44378509927144466), np.float64(0.33741565452091765), np.float64(0.3593499324227962)]
[I 2025-05-01 21:17:56,304] Trial 122 finished with value: 0.3633123381479017 and parameters: {'num_heads': 2, 'num_transformer_blocks': 4, 'learning_rate': 1.6230210158896062e-06, 'optimizer': 'Adam', 'weight_decay': 2.1085688960815073e-06, 'batch_size': 16, 'label_smoothing': 0.17}. Best is trial 86 with value: 0.5553539263859596.
Hyperparameters: num_heads=2, num_transformer_blocks=16, learning_rate=1.2024252454829069e-05, optimizer=Adam, weight_decay=6.333946794043769e-06, batch_size=10,factor=1
Divergence detected. Stopping training after 10 epochs.
Early stopping at epoch 29
Trial 124, Fold 1: Test Accuracy = 0.5023
Divergence detected. Stopping training after 10 epochs.
Early stopping at epoch 20
Trial 123, Fold 5: Test Accuracy = 0.6188
Trial 123: Mean Accuracy = 0.5338, Fold Accuracies = [np.float64(0.4980237451406515), np.float64(0.5680434597675482), np.float64(0.5329196894783051), np.float64(0.4510796221322537), np.float64(0.6188299550354704)]
[I 2025-05-01 21:19:52,951] Trial 123 finished with value: 0.5337792943108458 and parameters: {'num_heads': 2, 'num_transformer_blocks': 2, 'learning_rate': 3.0018708146253204e-05, 'optimizer': 'Adam', 'weight_decay': 1.900383992174991e-06, 'batch_size': 10, 'label_smoothing': 0.16}. Best is trial 86 with value: 0.5553539263859596.
Hyperparameters: num_heads=2, num_transformer_blocks=16, learning_rate=8.589288898959194e-06, optimizer=Adam, weight_decay=1.0020971359692609e-06, batch_size=10,factor=1
Divergence detected. Stopping training after 10 epochs.
Early stopping at epoch 26
Trial 124, Fold 2: Test Accuracy = 0.5664
Divergence detected. Stopping training after 10 epochs.
Early stopping at epoch 25
Trial 126, Fold 1: Test Accuracy = 0.4986
Trial 125, Fold 1: Test Accuracy = 0.4934
Divergence detected. Stopping training after 10 epochs.
Early stopping at epoch 14
Trial 124, Fold 3: Test Accuracy = 0.5102
Divergence detected. Stopping training after 10 epochs.
Early stopping at epoch 21
Trial 126, Fold 2: Test Accuracy = 0.5828
Trial 124, Fold 4: Test Accuracy = 0.4866
Divergence detected. Stopping training after 10 epochs.
Early stopping at epoch 25
Trial 125, Fold 2: Test Accuracy = 0.5913
Divergence detected. Stopping training after 10 epochs.
Early stopping at epoch 19
Trial 126, Fold 3: Test Accuracy = 0.5182
Divergence detected. Stopping training after 10 epochs.
Early stopping at epoch 22
Trial 124, Fold 5: Test Accuracy = 0.5981
Trial 124: Mean Accuracy = 0.5327, Fold Accuracies = [np.float64(0.5022855720897825), np.float64(0.5664165098201849), np.float64(0.5101781340973153), np.float64(0.48657219973009447), np.float64(0.5981198190900064)]
[I 2025-05-01 21:45:57,716] Trial 124 finished with value: 0.5327144469654768 and parameters: {'num_heads': 2, 'num_transformer_blocks': 16, 'learning_rate': 1.20344433030941e-05, 'optimizer': 'Adam', 'weight_decay': 2.1583216572078846e-06, 'batch_size': 10, 'label_smoothing': 0.17}. Best is trial 86 with value: 0.5553539263859596.
Hyperparameters: num_heads=16, num_transformer_blocks=32, learning_rate=8.897150177110242e-06, optimizer=Adam, weight_decay=1.1676045364791909e-06, batch_size=10,factor=1
Divergence detected. Stopping training after 10 epochs.
Early stopping at epoch 20
Trial 125, Fold 3: Test Accuracy = 0.5277
Divergence detected. Stopping training after 10 epochs.
Early stopping at epoch 29
Trial 126, Fold 4: Test Accuracy = 0.4218
Divergence detected. Stopping training after 10 epochs.
Early stopping at epoch 20
Trial 126, Fold 5: Test Accuracy = 0.5511
Trial 126: Mean Accuracy = 0.5145, Fold Accuracies = [np.float64(0.49856310378960056), np.float64(0.5827763954020054), np.float64(0.5182262064291545), np.float64(0.4217948717948718), np.float64(0.5510585264942844)]
