[I 2025-05-01 08:11:21,416] Trial 53 finished with value: 0.5402712426562262 and parameters: {'num_heads': 32, 'num_transformer_blocks': 8, 'learning_rate': 2.5198448093373934e-05, 'optimizer': 'Adam', 'weight_decay': 0.0004641556896534395, 'batch_size': 32, 'label_smoothing': 0.16}. Best is trial 48 with value: 0.5408075591107805.
Hyperparameters: num_heads=32, num_transformer_blocks=8, learning_rate=3.3514963145013645e-05, optimizer=Adam, weight_decay=0.0005430868463338111, batch_size=32,factor=1
Divergence detected. Stopping training after 10 epochs.
Early stopping at epoch 16
Trial 54, Fold 5: Test Accuracy = 0.6420
Trial 54: Mean Accuracy = 0.5346, Fold Accuracies = [np.float64(0.5086215763367009), np.float64(0.6072816643804299), np.float64(0.4874495941345902), np.float64(0.4277665317139001), np.float64(0.6419595200980718)]
[I 2025-05-01 08:12:50,300] Trial 54 finished with value: 0.5346157773327385 and parameters: {'num_heads': 32, 'num_transformer_blocks': 8, 'learning_rate': 3.347315664279605e-05, 'optimizer': 'Adam', 'weight_decay': 0.0004830915921433187, 'batch_size': 32, 'label_smoothing': 0.15}. Best is trial 48 with value: 0.5408075591107805.
Hyperparameters: num_heads=32, num_transformer_blocks=8, learning_rate=3.719033074722906e-05, optimizer=Adam, weight_decay=0.0005467665438572343, batch_size=10,factor=1
Trial 52, Fold 4: Test Accuracy = 0.3199
Divergence detected. Stopping training after 10 epochs.
Early stopping at epoch 20
Trial 55, Fold 1: Test Accuracy = 0.4780
Divergence detected. Stopping training after 10 epochs.
Early stopping at epoch 15
Trial 56, Fold 1: Test Accuracy = 0.5031
Divergence detected. Stopping training after 10 epochs.
Early stopping at epoch 22
Trial 55, Fold 2: Test Accuracy = 0.5842
Divergence detected. Stopping training after 10 epochs.
Early stopping at epoch 20
Divergence detected. Stopping training after 10 epochs.
Early stopping at epoch 19
Trial 52, Fold 5: Test Accuracy = 0.2978
Trial 52: Mean Accuracy = 0.3348, Fold Accuracies = [np.float64(0.36645766076632547), np.float64(0.34651508384640745), np.float64(0.3432835820895523), np.float64(0.3199055330634278), np.float64(0.2977802105427781)]
[I 2025-05-01 08:27:06,621] Trial 52 finished with value: 0.33478841406169824 and parameters: {'num_heads': 32, 'num_transformer_blocks': 32, 'learning_rate': 8.596753716785412e-07, 'optimizer': 'Adam', 'weight_decay': 0.00012435297401749572, 'batch_size': 10, 'label_smoothing': 0.16}. Best is trial 48 with value: 0.5408075591107805.
Hyperparameters: num_heads=32, num_transformer_blocks=8, learning_rate=3.7401056457789475e-08, optimizer=Adam, weight_decay=0.0005343518684455463, batch_size=32,factor=1
Trial 55, Fold 3: Test Accuracy = 0.4854
Divergence detected. Stopping training after 10 epochs.
Early stopping at epoch 20
Trial 56, Fold 2: Test Accuracy = 0.5683
Divergence detected. Stopping training after 10 epochs.
Early stopping at epoch 10
Trial 57, Fold 1: Test Accuracy = 0.3234
Divergence detected. Stopping training after 10 epochs.
Early stopping at epoch 10
Trial 57, Fold 2: Test Accuracy = 0.3333
Divergence detected. Stopping training after 10 epochs.
Early stopping at epoch 23
Trial 55, Fold 4: Test Accuracy = 0.4293
Divergence detected. Stopping training after 10 epochs.
Early stopping at epoch 16
Trial 56, Fold 3: Test Accuracy = 0.5274
Divergence detected. Stopping training after 10 epochs.
Early stopping at epoch 22
Trial 55, Fold 5: Test Accuracy = 0.6152
Trial 55: Mean Accuracy = 0.5184, Fold Accuracies = [np.float64(0.4779964277222029), np.float64(0.5842052934358418), np.float64(0.4854080988247616), np.float64(0.42925101214574896), np.float64(0.6152275547948093)]
[I 2025-05-01 08:40:22,802] Trial 55 finished with value: 0.5184176773846729 and parameters: {'num_heads': 32, 'num_transformer_blocks': 8, 'learning_rate': 3.3514963145013645e-05, 'optimizer': 'Adam', 'weight_decay': 0.0005430868463338111, 'batch_size': 32, 'label_smoothing': 0.16}. Best is trial 48 with value: 0.5408075591107805.
Hyperparameters: num_heads=32, num_transformer_blocks=8, learning_rate=5.5818461769512103e-08, optimizer=Adam, weight_decay=0.0008163073710661637, batch_size=10,factor=1
Trial 57, Fold 3: Test Accuracy = 0.3333
Divergence detected. Stopping training after 10 epochs.
Early stopping at epoch 10
Trial 57, Fold 4: Test Accuracy = 0.3450
Divergence detected. Stopping training after 10 epochs.
Early stopping at epoch 20
Trial 56, Fold 4: Test Accuracy = 0.4485
Trial 57, Fold 5: Test Accuracy = 0.3300
Trial 57: Mean Accuracy = 0.3330, Fold Accuracies = [np.float64(0.32341832700166445), np.float64(0.3333333333333333), np.float64(0.3333333333333333), np.float64(0.3449730094466936), np.float64(0.3299621058591161)]
[I 2025-05-01 08:48:56,172] Trial 57 finished with value: 0.3330040217948282 and parameters: {'num_heads': 32, 'num_transformer_blocks': 8, 'learning_rate': 3.7401056457789475e-08, 'optimizer': 'Adam', 'weight_decay': 0.0005343518684455463, 'batch_size': 32, 'label_smoothing': 0.11}. Best is trial 48 with value: 0.5408075591107805.
Hyperparameters: num_heads=32, num_transformer_blocks=8, learning_rate=3.494528343337859e-05, optimizer=Adam, weight_decay=0.0008115136328617926, batch_size=10,factor=1
Divergence detected. Stopping training after 10 epochs.
Early stopping at epoch 18
Trial 56, Fold 5: Test Accuracy = 0.5731
Trial 56: Mean Accuracy = 0.5241, Fold Accuracies = [np.float64(0.5030559011706676), np.float64(0.5682787294903288), np.float64(0.5273875206013278), np.float64(0.4485492577597841), np.float64(0.5730783630444297)]
[I 2025-05-01 08:51:13,751] Trial 56 finished with value: 0.5240699544133076 and parameters: {'num_heads': 32, 'num_transformer_blocks': 8, 'learning_rate': 3.719033074722906e-05, 'optimizer': 'Adam', 'weight_decay': 0.0005467665438572343, 'batch_size': 10, 'label_smoothing': 0.16}. Best is trial 48 with value: 0.5408075591107805.
Hyperparameters: num_heads=32, num_transformer_blocks=8, learning_rate=4.589621409907898e-06, optimizer=Adam, weight_decay=0.0008298505092395885, batch_size=10,factor=1
Trial 58, Fold 1: Test Accuracy = 0.3147
Divergence detected. Stopping training after 10 epochs.
Early stopping at epoch 16
Trial 59, Fold 1: Test Accuracy = 0.5049
Divergence detected. Stopping training after 10 epochs.
Early stopping at epoch 21
Trial 58, Fold 2: Test Accuracy = 0.3501
Divergence detected. Stopping training after 10 epochs.
Early stopping at epoch 17
Trial 59, Fold 2: Test Accuracy = 0.5443
Trial 60, Fold 1: Test Accuracy = 0.4743
Divergence detected. Stopping training after 10 epochs.
Early stopping at epoch 25
Trial 59, Fold 3: Test Accuracy = 0.5512
Divergence detected. Stopping training after 10 epochs.
Early stopping at epoch 29
Trial 58, Fold 3: Test Accuracy = 0.3664
Trial 60, Fold 2: Test Accuracy = 0.5086
Divergence detected. Stopping training after 10 epochs.
Early stopping at epoch 10
Trial 58, Fold 4: Test Accuracy = 0.3149
Divergence detected. Stopping training after 10 epochs.
Early stopping at epoch 27
Trial 59, Fold 4: Test Accuracy = 0.4553
Divergence detected. Stopping training after 10 epochs.
Early stopping at epoch 25
Trial 60, Fold 3: Test Accuracy = 0.5073
Divergence detected. Stopping training after 10 epochs.
Early stopping at epoch 16
Trial 59, Fold 5: Test Accuracy = 0.5413
Trial 59: Mean Accuracy = 0.5194, Fold Accuracies = [np.float64(0.504880837439241), np.float64(0.5443264108208122), np.float64(0.5512384671071885), np.float64(0.4552631578947368), np.float64(0.5412520214489295)]
[I 2025-05-01 09:22:29,549] Trial 59 finished with value: 0.5193921789421816 and parameters: {'num_heads': 32, 'num_transformer_blocks': 8, 'learning_rate': 3.494528343337859e-05, 'optimizer': 'Adam', 'weight_decay': 0.0008115136328617926, 'batch_size': 10, 'label_smoothing': 0.14}. Best is trial 48 with value: 0.5408075591107805.
Hyperparameters: num_heads=32, num_transformer_blocks=8, learning_rate=3.726937697069053e-06, optimizer=Adam, weight_decay=0.00023455884519748126, batch_size=32,factor=1
Trial 58, Fold 5: Test Accuracy = 0.3296
Trial 58: Mean Accuracy = 0.3351, Fold Accuracies = [np.float64(0.3146807788229179), np.float64(0.3500707138375814), np.float64(0.36635291037074685), np.float64(0.31491228070175437), np.float64(0.32957608744603784)]
[I 2025-05-01 09:22:58,784] Trial 58 finished with value: 0.33511855423580766 and parameters: {'num_heads': 32, 'num_transformer_blocks': 8, 'learning_rate': 5.5818461769512103e-08, 'optimizer': 'Adam', 'weight_decay': 0.0008163073710661637, 'batch_size': 10, 'label_smoothing': 0.1}. Best is trial 48 with value: 0.5408075591107805.
Hyperparameters: num_heads=2, num_transformer_blocks=8, learning_rate=4.426700850402441e-06, optimizer=Adam, weight_decay=0.000398651670193739, batch_size=32,factor=1
Divergence detected. Stopping training after 10 epochs.
Early stopping at epoch 10
Trial 61, Fold 1: Test Accuracy = 0.3638
Divergence detected. Stopping training after 10 epochs.
Early stopping at epoch 10
Trial 61, Fold 2: Test Accuracy = 0.4019
Trial 60, Fold 4: Test Accuracy = 0.3837
Trial 62, Fold 1: Test Accuracy = 0.4535
Trial 61, Fold 3: Test Accuracy = 0.4951
Trial 62, Fold 2: Test Accuracy = 0.5202
Trial 61, Fold 4: Test Accuracy = 0.4273
Trial 60, Fold 5: Test Accuracy = 0.5864
Trial 60: Mean Accuracy = 0.4921, Fold Accuracies = [np.float64(0.4743072269502369), np.float64(0.5085747174104912), np.float64(0.5072712289943472), np.float64(0.3837044534412955), np.float64(0.5864483191717996)]
[I 2025-05-01 09:43:07,787] Trial 60 finished with value: 0.49206118919363406 and parameters: {'num_heads': 32, 'num_transformer_blocks': 8, 'learning_rate': 4.589621409907898e-06, 'optimizer': 'Adam', 'weight_decay': 0.0008298505092395885, 'batch_size': 10, 'label_smoothing': 0.14}. Best is trial 48 with value: 0.5408075591107805.
Hyperparameters: num_heads=2, num_transformer_blocks=2, learning_rate=8.342369264783816e-05, optimizer=Adam, weight_decay=0.00021456746116437387, batch_size=32,factor=1
Divergence detected. Stopping training after 10 epochs.
Early stopping at epoch 10
Trial 62, Fold 3: Test Accuracy = 0.4173
Divergence detected. Stopping training after 10 epochs.
Early stopping at epoch 15
Trial 63, Fold 1: Test Accuracy = 0.4911
Trial 61, Fold 5: Test Accuracy = 0.5337
Trial 61: Mean Accuracy = 0.4444, Fold Accuracies = [np.float64(0.36383452501423935), np.float64(0.40191246371263595), np.float64(0.49509518968624366), np.float64(0.42726045883940617), np.float64(0.533729218866602)]
[I 2025-05-01 09:50:15,194] Trial 61 finished with value: 0.4443663712238254 and parameters: {'num_heads': 32, 'num_transformer_blocks': 8, 'learning_rate': 3.726937697069053e-06, 'optimizer': 'Adam', 'weight_decay': 0.00023455884519748126, 'batch_size': 32, 'label_smoothing': 0.1}. Best is trial 48 with value: 0.5408075591107805.
Hyperparameters: num_heads=16, num_transformer_blocks=4, learning_rate=0.00016732111569474857, optimizer=Adam, weight_decay=0.00036584193600764227, batch_size=32,factor=1
Trial 62, Fold 4: Test Accuracy = 0.3580
Divergence detected. Stopping training after 10 epochs.
Early stopping at epoch 24
Trial 63, Fold 2: Test Accuracy = 0.5470
Divergence detected. Stopping training after 10 epochs.
Early stopping at epoch 16
Trial 64, Fold 1: Test Accuracy = 0.4954
Divergence detected. Stopping training after 10 epochs.
Early stopping at epoch 10
Trial 62, Fold 5: Test Accuracy = 0.3842
Trial 62: Mean Accuracy = 0.4266, Fold Accuracies = [np.float64(0.4535119693425571), np.float64(0.5201906615199753), np.float64(0.4173239067818801), np.float64(0.3579622132253711), np.float64(0.3842303572653338)]
[I 2025-05-01 09:55:48,641] Trial 62 finished with value: 0.42664382162702347 and parameters: {'num_heads': 2, 'num_transformer_blocks': 8, 'learning_rate': 4.426700850402441e-06, 'optimizer': 'Adam', 'weight_decay': 0.000398651670193739, 'batch_size': 32, 'label_smoothing': 0.14}. Best is trial 48 with value: 0.5408075591107805.
Hyperparameters: num_heads=16, num_transformer_blocks=2, learning_rate=0.0001588556387141944, optimizer=Adam, weight_decay=7.260229488993113e-05, batch_size=32,factor=1
Divergence detected. Stopping training after 10 epochs.
Early stopping at epoch 14
Trial 64, Fold 2: Test Accuracy = 0.5458
Divergence detected. Stopping training after 10 epochs.
Early stopping at epoch 20
Divergence detected. Stopping training after 10 epochs.
Early stopping at epoch 13
Trial 63, Fold 3: Test Accuracy = 0.5501
Trial 65, Fold 1: Test Accuracy = 0.4549
Divergence detected. Stopping training after 10 epochs.
Early stopping at epoch 14
Trial 64, Fold 3: Test Accuracy = 0.5377
Divergence detected. Stopping training after 10 epochs.
Early stopping at epoch 20
Trial 65, Fold 2: Test Accuracy = 0.4977
Divergence detected. Stopping training after 10 epochs.
Early stopping at epoch 28
Trial 63, Fold 4: Test Accuracy = 0.4718
Divergence detected. Stopping training after 10 epochs.
Early stopping at epoch 17
Divergence detected. Stopping training after 10 epochs.
Early stopping at epoch 11
Trial 64, Fold 4: Test Accuracy = 0.4545
Trial 65, Fold 3: Test Accuracy = 0.5217
Divergence detected. Stopping training after 10 epochs.
Early stopping at epoch 16
Trial 63, Fold 5: Test Accuracy = 0.5899
Trial 63: Mean Accuracy = 0.5300, Fold Accuracies = [np.float64(0.4911305982735834), np.float64(0.5470114099169511), np.float64(0.5500909538992346), np.float64(0.47176113360323885), np.float64(0.5898697257319329)]
[I 2025-05-01 10:12:09,689] Trial 63 finished with value: 0.5299727642849883 and parameters: {'num_heads': 2, 'num_transformer_blocks': 2, 'learning_rate': 8.342369264783816e-05, 'optimizer': 'Adam', 'weight_decay': 0.00021456746116437387, 'batch_size': 32, 'label_smoothing': 0.19}. Best is trial 48 with value: 0.5408075591107805.
Hyperparameters: num_heads=16, num_transformer_blocks=4, learning_rate=1.1359160681745147e-05, optimizer=Adam, weight_decay=1.5504709098853087e-06, batch_size=32,factor=1
Divergence detected. Stopping training after 10 epochs.
Early stopping at epoch 13
Trial 64, Fold 5: Test Accuracy = 0.5947
Trial 64: Mean Accuracy = 0.5256, Fold Accuracies = [np.float64(0.49540436968098334), np.float64(0.5458390489254686), np.float64(0.537691573094281), np.float64(0.4544871794871795), np.float64(0.5947318955751721)]
[I 2025-05-01 10:12:40,745] Trial 64 finished with value: 0.525630813352617 and parameters: {'num_heads': 16, 'num_transformer_blocks': 4, 'learning_rate': 0.00016732111569474857, 'optimizer': 'Adam', 'weight_decay': 0.00036584193600764227, 'batch_size': 32, 'label_smoothing': 0.19}. Best is trial 48 with value: 0.5408075591107805.
Hyperparameters: num_heads=8, num_transformer_blocks=8, learning_rate=0.0003646834140841682, optimizer=SGD, weight_decay=0.00014994779827544056, batch_size=32,factor=1
Divergence detected. Stopping training after 10 epochs.
Early stopping at epoch 16
Trial 65, Fold 4: Test Accuracy = 0.4495
Divergence detected. Stopping training after 10 epochs.
Early stopping at epoch 15
Trial 65, Fold 5: Test Accuracy = 0.6015
Trial 65: Mean Accuracy = 0.5051, Fold Accuracies = [np.float64(0.454853155051234), np.float64(0.4976871789963952), np.float64(0.521720961754694), np.float64(0.4494939271255061), np.float64(0.6015030951680765)]
[I 2025-05-01 10:17:50,727] Trial 65 finished with value: 0.5050516636191812 and parameters: {'num_heads': 16, 'num_transformer_blocks': 2, 'learning_rate': 0.0001588556387141944, 'optimizer': 'Adam', 'weight_decay': 7.260229488993113e-05, 'batch_size': 32, 'label_smoothing': 0.18}. Best is trial 48 with value: 0.5408075591107805.
Hyperparameters: num_heads=8, num_transformer_blocks=8, learning_rate=0.0003221746117994415, optimizer=SGD, weight_decay=3.839044160924209e-06, batch_size=32,factor=1
Trial 66, Fold 1: Test Accuracy = 0.4760
Divergence detected. Stopping training after 10 epochs.
Early stopping at epoch 29
Divergence detected. Stopping training after 10 epochs.
Early stopping at epoch 10
Trial 67, Fold 1: Test Accuracy = 0.3387
Trial 68, Fold 1: Test Accuracy = 0.3551
Divergence detected. Stopping training after 10 epochs.
Early stopping at epoch 10
Trial 67, Fold 2: Test Accuracy = 0.2920
Trial 66, Fold 2: Test Accuracy = 0.5712
Trial 68, Fold 2: Test Accuracy = 0.3365
Divergence detected. Stopping training after 10 epochs.
Early stopping at epoch 18
Trial 67, Fold 3: Test Accuracy = 0.3561
Divergence detected. Stopping training after 10 epochs.
Early stopping at epoch 10
Trial 67, Fold 4: Test Accuracy = 0.3386
Divergence detected. Stopping training after 10 epochs.
Early stopping at epoch 10
Trial 67, Fold 5: Test Accuracy = 0.3708
Trial 67: Mean Accuracy = 0.3392, Fold Accuracies = [np.float64(0.33874948157733203), np.float64(0.29197637200795395), np.float64(0.356089136361536), np.float64(0.3385964912280702), np.float64(0.3707614156965639)]
[I 2025-05-01 10:37:34,966] Trial 67 finished with value: 0.3392345793742912 and parameters: {'num_heads': 8, 'num_transformer_blocks': 8, 'learning_rate': 0.0003646834140841682, 'optimizer': 'SGD', 'weight_decay': 0.00014994779827544056, 'batch_size': 32, 'label_smoothing': 0.15}. Best is trial 48 with value: 0.5408075591107805.
Hyperparameters: num_heads=2, num_transformer_blocks=4, learning_rate=1.2292958406478385e-05, optimizer=Adam, weight_decay=5.221031733062504e-06, batch_size=32,factor=1
Trial 66, Fold 3: Test Accuracy = 0.5350
Trial 68, Fold 3: Test Accuracy = 0.3329
Divergence detected. Stopping training after 10 epochs.
Early stopping at epoch 10
Trial 66, Fold 4: Test Accuracy = 0.4226
Divergence detected. Stopping training after 10 epochs.
Early stopping at epoch 10
Trial 68, Fold 4: Test Accuracy = 0.2750
Trial 69, Fold 1: Test Accuracy = 0.4929
Divergence detected. Stopping training after 10 epochs.
Early stopping at epoch 17
Trial 66, Fold 5: Test Accuracy = 0.3543
Trial 66: Mean Accuracy = 0.4718, Fold Accuracies = [np.float64(0.4760060828259704), np.float64(0.571191023064408), np.float64(0.5350275711227146), np.float64(0.4226045883940621), np.float64(0.3542888489782676)]
[I 2025-05-01 10:45:57,300] Trial 66 finished with value: 0.4718236228770845 and parameters: {'num_heads': 16, 'num_transformer_blocks': 4, 'learning_rate': 1.1359160681745147e-05, 'optimizer': 'Adam', 'weight_decay': 1.5504709098853087e-06, 'batch_size': 32, 'label_smoothing': 0.19}. Best is trial 48 with value: 0.5408075591107805.
Hyperparameters: num_heads=2, num_transformer_blocks=8, learning_rate=7.701631712505597e-05, optimizer=SGD, weight_decay=5.234077705449512e-06, batch_size=32,factor=1
Divergence detected. Stopping training after 10 epochs.
Early stopping at epoch 18
Trial 68, Fold 5: Test Accuracy = 0.3067
Trial 68: Mean Accuracy = 0.3212, Fold Accuracies = [np.float64(0.35506826589691265), np.float64(0.33647823821524653), np.float64(0.3328650863330406), np.float64(0.27503373819163296), np.float64(0.3067459430068456)]
[I 2025-05-01 10:48:02,059] Trial 68 finished with value: 0.32123825432873565 and parameters: {'num_heads': 8, 'num_transformer_blocks': 8, 'learning_rate': 0.0003221746117994415, 'optimizer': 'SGD', 'weight_decay': 3.839044160924209e-06, 'batch_size': 32, 'label_smoothing': 0.15}. Best is trial 48 with value: 0.5408075591107805.
Hyperparameters: num_heads=2, num_transformer_blocks=32, learning_rate=0.0005649187449794972, optimizer=Adam, weight_decay=0.00010425284365765631, batch_size=32,factor=1
Divergence detected. Stopping training after 10 epochs.
Early stopping at epoch 10
Trial 70, Fold 1: Test Accuracy = 0.3385
Trial 69, Fold 2: Test Accuracy = 0.6450
Trial 70, Fold 2: Test Accuracy = 0.3474
Divergence detected. Stopping training after 10 epochs.
Early stopping at epoch 16
Trial 71, Fold 1: Test Accuracy = 0.3333
Trial 69, Fold 3: Test Accuracy = 0.5213
Divergence detected. Stopping training after 10 epochs.
Early stopping at epoch 10
Trial 70, Fold 3: Test Accuracy = 0.3355
Divergence detected. Stopping training after 10 epochs.
Early stopping at epoch 10
Trial 70, Fold 4: Test Accuracy = 0.4373
Divergence detected. Stopping training after 10 epochs.
Early stopping at epoch 10
Trial 70, Fold 5: Test Accuracy = 0.3424
Trial 70: Mean Accuracy = 0.3602, Fold Accuracies = [np.float64(0.33848674773414733), np.float64(0.34741761572080265), np.float64(0.33552816413289593), np.float64(0.437280701754386), np.float64(0.3423666024807687)]
[I 2025-05-01 11:05:26,765] Trial 70 finished with value: 0.3602159663646002 and parameters: {'num_heads': 2, 'num_transformer_blocks': 8, 'learning_rate': 7.701631712505597e-05, 'optimizer': 'SGD', 'weight_decay': 5.234077705449512e-06, 'batch_size': 32, 'label_smoothing': 0.04}. Best is trial 48 with value: 0.5408075591107805.
Hyperparameters: num_heads=32, num_transformer_blocks=32, learning_rate=0.0005260161561029145, optimizer=Adam, weight_decay=1.597586695911942e-05, batch_size=10,factor=1
Trial 69, Fold 4: Test Accuracy = 0.4156
Divergence detected. Stopping training after 10 epochs.
Early stopping at epoch 15
Trial 71, Fold 2: Test Accuracy = 0.3333
Trial 69, Fold 5: Test Accuracy = 0.6555
Trial 69: Mean Accuracy = 0.5460, Fold Accuracies = [np.float64(0.4928563955385236), np.float64(0.6449646962495081), np.float64(0.5212646519723365), np.float64(0.41562078272604586), np.float64(0.6554541879582532)]
