c:\Users\Gabriel\anaconda3\envs\cudaenv\Lib\site-packages\tqdm\auto.py:21: TqdmWarning: IProgress not found. Please update jupyter and ipywidgets. See https://ipywidgets.readthedocs.io/en/stable/user_install.html
  from .autonotebook import tqdm as notebook_tqdm
[I 2025-04-30 21:27:57,840] A new study created in memory with name: no-name-161658ce-6462-4cc2-8305-bd9f89253656
Hyperparameters: num_heads=32, num_transformer_blocks=16, learning_rate=6.498686732547997e-08, optimizer=AdamW, weight_decay=4.3860827139279903e-05, batch_size=16,factor=1
Hyperparameters: num_heads=2, num_transformer_blocks=32, learning_rate=0.0003817356210826404, optimizer=SGD, weight_decay=3.473507027614272e-05, batch_size=32,factor=1
Hyperparameters: num_heads=32, num_transformer_blocks=8, learning_rate=0.003827867538316409, optimizer=AdamW, weight_decay=5.124889337801125e-06, batch_size=16,factor=1
Divergence detected. Stopping training after 10 epochs.
Early stopping at epoch 10
Trial 2, Fold 1: Test Accuracy = 0.3333
Divergence detected. Stopping training after 10 epochs.
Early stopping at epoch 15
Trial 1, Fold 1: Test Accuracy = 0.3214
Divergence detected. Stopping training after 10 epochs.
Early stopping at epoch 13
Trial 2, Fold 2: Test Accuracy = 0.3333
Divergence detected. Stopping training after 10 epochs.
Early stopping at epoch 27
Trial 0, Fold 1: Test Accuracy = 0.3345
Divergence detected. Stopping training after 10 epochs.
Early stopping at epoch 19
Trial 1, Fold 2: Test Accuracy = 0.3333
Divergence detected. Stopping training after 10 epochs.
Early stopping at epoch 20
Trial 1, Fold 3: Test Accuracy = 0.3506
Divergence detected. Stopping training after 10 epochs.
Early stopping at epoch 21
Trial 2, Fold 3: Test Accuracy = 0.3333
Divergence detected. Stopping training after 10 epochs.
Early stopping at epoch 10
Trial 2, Fold 4: Test Accuracy = 0.3333
Trial 0, Fold 2: Test Accuracy = 0.3517
Divergence detected. Stopping training after 10 epochs.
Early stopping at epoch 25
Trial 1, Fold 4: Test Accuracy = 0.3333
Divergence detected. Stopping training after 10 epochs.
Early stopping at epoch 13
Trial 2, Fold 5: Test Accuracy = 0.3333
Trial 2: Mean Accuracy = 0.3333, Fold Accuracies = [np.float64(0.3333333333333333), np.float64(0.3333333333333333), np.float64(0.3333333333333333), np.float64(0.3333333333333333), np.float64(0.3333333333333333)]
[I 2025-04-30 21:55:32,260] Trial 2 finished with value: 0.3333333333333333 and parameters: {'num_heads': 32, 'num_transformer_blocks': 8, 'learning_rate': 0.003827867538316409, 'optimizer': 'AdamW', 'weight_decay': 5.124889337801125e-06, 'batch_size': 16, 'label_smoothing': 0.25}. Best is trial 2 with value: 0.3333333333333333.
Hyperparameters: num_heads=8, num_transformer_blocks=16, learning_rate=1.2071155153016448e-08, optimizer=SGD, weight_decay=3.65061488613633e-06, batch_size=16,factor=1
Divergence detected. Stopping training after 10 epochs.
Early stopping at epoch 17
Trial 1, Fold 5: Test Accuracy = 0.3258
Trial 1: Mean Accuracy = 0.3329, Fold Accuracies = [np.float64(0.32135397070289823), np.float64(0.3333333333333333), np.float64(0.35062990003542654), np.float64(0.3333333333333333), np.float64(0.32576427138933567)]
[I 2025-04-30 21:58:54,961] Trial 1 finished with value: 0.3328829617588654 and parameters: {'num_heads': 2, 'num_transformer_blocks': 32, 'learning_rate': 0.0003817356210826404, 'optimizer': 'SGD', 'weight_decay': 3.473507027614272e-05, 'batch_size': 32, 'label_smoothing': 0.27}. Best is trial 2 with value: 0.3333333333333333.
Hyperparameters: num_heads=8, num_transformer_blocks=8, learning_rate=4.107920367640701e-05, optimizer=SGD, weight_decay=0.000168712366040144, batch_size=10,factor=1
Divergence detected. Stopping training after 10 epochs.
Early stopping at epoch 10
Trial 3, Fold 1: Test Accuracy = 0.3264
Trial 0, Fold 3: Test Accuracy = 0.3333
Divergence detected. Stopping training after 10 epochs.
Early stopping at epoch 10
Trial 0, Fold 4: Test Accuracy = 0.3325
Trial 4, Fold 1: Test Accuracy = 0.3337
Divergence detected. Stopping training after 10 epochs.
Early stopping at epoch 10
Trial 0, Fold 5: Test Accuracy = 0.3325
Trial 0: Mean Accuracy = 0.3369, Fold Accuracies = [np.float64(0.33451118963486454), np.float64(0.3517441860465116), np.float64(0.3333333333333333), np.float64(0.33245614035087717), np.float64(0.33245468662325633)]
[I 2025-04-30 22:10:20,282] Trial 0 finished with value: 0.3368999071977686 and parameters: {'num_heads': 32, 'num_transformer_blocks': 16, 'learning_rate': 6.498686732547997e-08, 'optimizer': 'AdamW', 'weight_decay': 4.3860827139279903e-05, 'batch_size': 16, 'label_smoothing': 0.21}. Best is trial 0 with value: 0.3368999071977686.
Hyperparameters: num_heads=2, num_transformer_blocks=8, learning_rate=0.0018931662692351979, optimizer=SGD, weight_decay=3.7614889566838576e-06, batch_size=10,factor=1
Trial 3, Fold 2: Test Accuracy = 0.3333
Divergence detected. Stopping training after 10 epochs.
Early stopping at epoch 14
Trial 3, Fold 3: Test Accuracy = 0.3333
Trial 4, Fold 2: Test Accuracy = 0.2855
Trial 5, Fold 1: Test Accuracy = 0.5264
Divergence detected. Stopping training after 10 epochs.
Early stopping at epoch 17
Trial 3, Fold 4: Test Accuracy = 0.3329
Divergence detected. Stopping training after 10 epochs.
Early stopping at epoch 18
Trial 4, Fold 3: Test Accuracy = 0.3455
Divergence detected. Stopping training after 10 epochs.
Early stopping at epoch 10
Divergence detected. Stopping training after 10 epochs.
Early stopping at epoch 24
Trial 4, Fold 4: Test Accuracy = 0.3324
Trial 5, Fold 2: Test Accuracy = 0.5656
Divergence detected. Stopping training after 10 epochs.
Early stopping at epoch 23
Trial 3, Fold 5: Test Accuracy = 0.3333
Trial 3: Mean Accuracy = 0.3319, Fold Accuracies = [np.float64(0.32637245696400624), np.float64(0.3333333333333333), np.float64(0.3333333333333333), np.float64(0.3328947368421053), np.float64(0.3333333333333333)]
[I 2025-04-30 22:30:24,432] Trial 3 finished with value: 0.3318534387612223 and parameters: {'num_heads': 8, 'num_transformer_blocks': 16, 'learning_rate': 1.2071155153016448e-08, 'optimizer': 'SGD', 'weight_decay': 3.65061488613633e-06, 'batch_size': 16, 'label_smoothing': 0.2}. Best is trial 0 with value: 0.3368999071977686.
Hyperparameters: num_heads=2, num_transformer_blocks=4, learning_rate=3.168829376349224e-05, optimizer=SGD, weight_decay=1.1862008292243698e-06, batch_size=32,factor=1
Divergence detected. Stopping training after 10 epochs.
Early stopping at epoch 10
Trial 4, Fold 5: Test Accuracy = 0.3348
Trial 4: Mean Accuracy = 0.3264, Fold Accuracies = [np.float64(0.3336592843278754), np.float64(0.2855443370444806), np.float64(0.34549543305146097), np.float64(0.3323886639676113), np.float64(0.3347874435255806)]
[I 2025-04-30 22:31:40,380] Trial 4 finished with value: 0.32637503238340176 and parameters: {'num_heads': 8, 'num_transformer_blocks': 8, 'learning_rate': 4.107920367640701e-05, 'optimizer': 'SGD', 'weight_decay': 0.000168712366040144, 'batch_size': 10, 'label_smoothing': 0.04}. Best is trial 0 with value: 0.3368999071977686.
Hyperparameters: num_heads=2, num_transformer_blocks=2, learning_rate=2.9941911979473215e-05, optimizer=Adam, weight_decay=0.0006233186263273591, batch_size=10,factor=1
Divergence detected. Stopping training after 10 epochs.
Early stopping at epoch 11
Trial 6, Fold 1: Test Accuracy = 0.3199
Divergence detected. Stopping training after 10 epochs.
Early stopping at epoch 21
Trial 7, Fold 1: Test Accuracy = 0.4727
Divergence detected. Stopping training after 10 epochs.
Early stopping at epoch 26
Trial 5, Fold 3: Test Accuracy = 0.4474
Trial 6, Fold 2: Test Accuracy = 0.3498
Divergence detected. Stopping training after 10 epochs.
Early stopping at epoch 26
Trial 7, Fold 2: Test Accuracy = 0.5670
Trial 6, Fold 3: Test Accuracy = 0.3263
Divergence detected. Stopping training after 10 epochs.
Early stopping at epoch 10
Trial 6, Fold 4: Test Accuracy = 0.3285
Trial 5, Fold 4: Test Accuracy = 0.4318
Divergence detected. Stopping training after 10 epochs.
Early stopping at epoch 20
Trial 7, Fold 3: Test Accuracy = 0.5461
Trial 6, Fold 5: Test Accuracy = 0.3276
Trial 6: Mean Accuracy = 0.3304, Fold Accuracies = [np.float64(0.31986263872990595), np.float64(0.3497517040439808), np.float64(0.3263312693498452), np.float64(0.3285087719298246), np.float64(0.3275655831473821)]
[I 2025-04-30 22:56:33,426] Trial 6 finished with value: 0.3304039934401877 and parameters: {'num_heads': 2, 'num_transformer_blocks': 4, 'learning_rate': 3.168829376349224e-05, 'optimizer': 'SGD', 'weight_decay': 1.1862008292243698e-06, 'batch_size': 32, 'label_smoothing': 0.08}. Best is trial 0 with value: 0.3368999071977686.
Hyperparameters: num_heads=4, num_transformer_blocks=8, learning_rate=0.0002722963051083165, optimizer=AdamW, weight_decay=9.426789817625876e-05, batch_size=32,factor=1
Divergence detected. Stopping training after 10 epochs.
Early stopping at epoch 19
Trial 5, Fold 5: Test Accuracy = 0.5528
Trial 5: Mean Accuracy = 0.5048, Fold Accuracies = [np.float64(0.5264028932132252), np.float64(0.5656349358258632), np.float64(0.4473954530751814), np.float64(0.4318488529014845), np.float64(0.5527724796723018)]
[I 2025-04-30 22:58:06,854] Trial 5 finished with value: 0.5048109229376112 and parameters: {'num_heads': 2, 'num_transformer_blocks': 8, 'learning_rate': 0.0018931662692351979, 'optimizer': 'SGD', 'weight_decay': 3.7614889566838576e-06, 'batch_size': 10, 'label_smoothing': 0.13}. Best is trial 5 with value: 0.5048109229376112.
Hyperparameters: num_heads=32, num_transformer_blocks=4, learning_rate=1.696925709928159e-07, optimizer=Adam, weight_decay=1.0686534433045452e-06, batch_size=32,factor=1
Divergence detected. Stopping training after 10 epochs.
Early stopping at epoch 17
Trial 7, Fold 4: Test Accuracy = 0.4621
Divergence detected. Stopping training after 10 epochs.
Early stopping at epoch 16
Trial 8, Fold 1: Test Accuracy = 0.4568
Trial 9, Fold 1: Test Accuracy = 0.3651
Trial 7, Fold 5: Test Accuracy = 0.6241
Trial 7: Mean Accuracy = 0.5344, Fold Accuracies = [np.float64(0.47271790618070414), np.float64(0.566970789336566), np.float64(0.5461360380758745), np.float64(0.4620782726045884), np.float64(0.624128702772884)]
[I 2025-04-30 23:10:13,099] Trial 7 finished with value: 0.5344063417941234 and parameters: {'num_heads': 2, 'num_transformer_blocks': 2, 'learning_rate': 2.9941911979473215e-05, 'optimizer': 'Adam', 'weight_decay': 0.0006233186263273591, 'batch_size': 10, 'label_smoothing': 0.17}. Best is trial 7 with value: 0.5344063417941234.
Hyperparameters: num_heads=8, num_transformer_blocks=2, learning_rate=0.003056586122628245, optimizer=Adam, weight_decay=7.10523762864986e-06, batch_size=10,factor=1
Divergence detected. Stopping training after 10 epochs.
Early stopping at epoch 26
Trial 8, Fold 2: Test Accuracy = 0.5425
Trial 9, Fold 2: Test Accuracy = 0.3450
Divergence detected. Stopping training after 10 epochs.
Early stopping at epoch 10
Trial 8, Fold 3: Test Accuracy = 0.5367
Divergence detected. Stopping training after 10 epochs.
Early stopping at epoch 14
Trial 10, Fold 1: Test Accuracy = 0.3333
Divergence detected. Stopping training after 10 epochs.
Early stopping at epoch 11
Trial 9, Fold 3: Test Accuracy = 0.3262
Divergence detected. Stopping training after 10 epochs.
Early stopping at epoch 12
Trial 8, Fold 4: Test Accuracy = 0.4149
Divergence detected. Stopping training after 10 epochs.
Early stopping at epoch 13
Trial 8, Fold 5: Test Accuracy = 0.5635
Trial 8: Mean Accuracy = 0.5029, Fold Accuracies = [np.float64(0.45682867997146603), np.float64(0.5424814708478216), np.float64(0.5367097176655423), np.float64(0.4148785425101214), np.float64(0.5634656941516574)]
[I 2025-04-30 23:22:08,760] Trial 8 finished with value: 0.5028728210293216 and parameters: {'num_heads': 4, 'num_transformer_blocks': 8, 'learning_rate': 0.0002722963051083165, 'optimizer': 'AdamW', 'weight_decay': 9.426789817625876e-05, 'batch_size': 32, 'label_smoothing': 0.21}. Best is trial 7 with value: 0.5344063417941234.
Hyperparameters: num_heads=8, num_transformer_blocks=16, learning_rate=1.989492863360699e-07, optimizer=SGD, weight_decay=8.336991800236238e-05, batch_size=16,factor=1
Divergence detected. Stopping training after 10 epochs.
Early stopping at epoch 16
Trial 9, Fold 4: Test Accuracy = 0.3269
Trial 10, Fold 2: Test Accuracy = 0.3484
Divergence detected. Stopping training after 10 epochs.
Early stopping at epoch 13
Trial 10, Fold 3: Test Accuracy = 0.3333
Trial 9, Fold 5: Test Accuracy = 0.3235
Trial 9: Mean Accuracy = 0.3373, Fold Accuracies = [np.float64(0.3650855521823521), np.float64(0.3450130794015376), np.float64(0.32624770882429954), np.float64(0.32685560053981105), np.float64(0.32353555256873673)]
[I 2025-04-30 23:28:57,519] Trial 9 finished with value: 0.3373474987033474 and parameters: {'num_heads': 32, 'num_transformer_blocks': 4, 'learning_rate': 1.696925709928159e-07, 'optimizer': 'Adam', 'weight_decay': 1.0686534433045452e-06, 'batch_size': 32, 'label_smoothing': 0.1}. Best is trial 7 with value: 0.5344063417941234.
Hyperparameters: num_heads=16, num_transformer_blocks=2, learning_rate=1.8229450908749177e-06, optimizer=Adam, weight_decay=0.000970440110339154, batch_size=10,factor=1
Divergence detected. Stopping training after 10 epochs.
Early stopping at epoch 10
Trial 12, Fold 1: Test Accuracy = 0.4030
Trial 11, Fold 1: Test Accuracy = 0.3333
Divergence detected. Stopping training after 10 epochs.
Early stopping at epoch 19
Trial 10, Fold 4: Test Accuracy = 0.3333
Divergence detected. Stopping training after 10 epochs.
Early stopping at epoch 11
Trial 10, Fold 5: Test Accuracy = 0.4401
Trial 10: Mean Accuracy = 0.3577, Fold Accuracies = [np.float64(0.3333333333333333), np.float64(0.34842249657064467), np.float64(0.3333333333333333), np.float64(0.3333333333333333), np.float64(0.4401044965406118)]
[I 2025-04-30 23:37:10,656] Trial 10 finished with value: 0.35770539862225126 and parameters: {'num_heads': 8, 'num_transformer_blocks': 2, 'learning_rate': 0.003056586122628245, 'optimizer': 'Adam', 'weight_decay': 7.10523762864986e-06, 'batch_size': 10, 'label_smoothing': 0.25}. Best is trial 7 with value: 0.5344063417941234.
Hyperparameters: num_heads=2, num_transformer_blocks=2, learning_rate=1.3655588237011103e-06, optimizer=Adam, weight_decay=0.0009778855640130981, batch_size=10,factor=1
Divergence detected. Stopping training after 10 epochs.
Early stopping at epoch 10
Trial 11, Fold 2: Test Accuracy = 0.3333
Divergence detected. Stopping training after 10 epochs.
Early stopping at epoch 10
Trial 12, Fold 2: Test Accuracy = 0.4124
Trial 13, Fold 1: Test Accuracy = 0.3733
Divergence detected. Stopping training after 10 epochs.
Early stopping at epoch 10
Trial 11, Fold 3: Test Accuracy = 0.3333
Divergence detected. Stopping training after 10 epochs.
Early stopping at epoch 22
Trial 12, Fold 3: Test Accuracy = 0.3976
Divergence detected. Stopping training after 10 epochs.
Early stopping at epoch 16
Trial 11, Fold 4: Test Accuracy = 0.3333
Trial 13, Fold 2: Test Accuracy = 0.4704
Divergence detected. Stopping training after 10 epochs.
Early stopping at epoch 10
Trial 12, Fold 4: Test Accuracy = 0.3259
Divergence detected. Stopping training after 10 epochs.
Early stopping at epoch 10
Trial 12, Fold 5: Test Accuracy = 0.3805
Trial 12: Mean Accuracy = 0.3839, Fold Accuracies = [np.float64(0.4029635085740197), np.float64(0.4123746557352644), np.float64(0.3976381251636554), np.float64(0.32587719298245615), np.float64(0.3804717303781457)]
[I 2025-04-30 23:52:51,381] Trial 12 finished with value: 0.3838650425667083 and parameters: {'num_heads': 16, 'num_transformer_blocks': 2, 'learning_rate': 1.8229450908749177e-06, 'optimizer': 'Adam', 'weight_decay': 0.000970440110339154, 'batch_size': 10, 'label_smoothing': 0.0}. Best is trial 7 with value: 0.5344063417941234.
Hyperparameters: num_heads=2, num_transformer_blocks=2, learning_rate=2.741220038408454e-06, optimizer=Adam, weight_decay=0.0006618504088010355, batch_size=10,factor=1
Divergence detected. Stopping training after 10 epochs.
Early stopping at epoch 28
Trial 11, Fold 5: Test Accuracy = 0.3333
Trial 11: Mean Accuracy = 0.3333, Fold Accuracies = [np.float64(0.3333333333333333), np.float64(0.3333333333333333), np.float64(0.3333333333333333), np.float64(0.3333333333333333), np.float64(0.3333333333333333)]
[I 2025-04-30 23:57:36,649] Trial 11 finished with value: 0.3333333333333333 and parameters: {'num_heads': 8, 'num_transformer_blocks': 16, 'learning_rate': 1.989492863360699e-07, 'optimizer': 'SGD', 'weight_decay': 8.336991800236238e-05, 'batch_size': 16, 'label_smoothing': 0.09}. Best is trial 7 with value: 0.5344063417941234.
Hyperparameters: num_heads=2, num_transformer_blocks=2, learning_rate=2.032617206017311e-06, optimizer=Adam, weight_decay=0.0009016303463666882, batch_size=10,factor=1
Trial 13, Fold 3: Test Accuracy = 0.4256
Trial 14, Fold 1: Test Accuracy = 0.4491
Divergence detected. Stopping training after 10 epochs.
Early stopping at epoch 10
Trial 14, Fold 2: Test Accuracy = 0.3829
Trial 15, Fold 1: Test Accuracy = 0.3999
Trial 13, Fold 4: Test Accuracy = 0.3950
Divergence detected. Stopping training after 10 epochs.
Early stopping at epoch 11
Trial 14, Fold 3: Test Accuracy = 0.3708
Trial 15, Fold 2: Test Accuracy = 0.4054
Trial 14, Fold 4: Test Accuracy = 0.3941
Trial 13, Fold 5: Test Accuracy = 0.4832
Trial 13: Mean Accuracy = 0.4295, Fold Accuracies = [np.float64(0.37329688061624555), np.float64(0.47037994066417843), np.float64(0.42556990588851407), np.float64(0.3950067476383266), np.float64(0.4831517351552477)]
[I 2025-05-01 00:15:33,234] Trial 13 finished with value: 0.4294810419925025 and parameters: {'num_heads': 2, 'num_transformer_blocks': 2, 'learning_rate': 1.3655588237011103e-06, 'optimizer': 'Adam', 'weight_decay': 0.0009778855640130981, 'batch_size': 10, 'label_smoothing': 0.15}. Best is trial 7 with value: 0.5344063417941234.
Hyperparameters: num_heads=2, num_transformer_blocks=32, learning_rate=0.0004372051002757779, optimizer=Adam, weight_decay=1.2293426807358074e-05, batch_size=10,factor=1
Divergence detected. Stopping training after 10 epochs.
Early stopping at epoch 10
Trial 14, Fold 5: Test Accuracy = 0.4427
Trial 14: Mean Accuracy = 0.4079, Fold Accuracies = [np.float64(0.4490906617561672), np.float64(0.3828768834869897), np.float64(0.37077738243765695), np.float64(0.39409581646423747), np.float64(0.4427217807681029)]
[I 2025-05-01 00:17:57,288] Trial 14 finished with value: 0.4079125049826309 and parameters: {'num_heads': 2, 'num_transformer_blocks': 2, 'learning_rate': 2.741220038408454e-06, 'optimizer': 'Adam', 'weight_decay': 0.0006618504088010355, 'batch_size': 10, 'label_smoothing': 0.14}. Best is trial 7 with value: 0.5344063417941234.
Hyperparameters: num_heads=2, num_transformer_blocks=32, learning_rate=0.00041485436078539357, optimizer=SGD, weight_decay=1.301980895226147e-05, batch_size=10,factor=1
Trial 15, Fold 3: Test Accuracy = 0.3826
Divergence detected. Stopping training after 10 epochs.
Early stopping at epoch 11
Trial 16, Fold 1: Test Accuracy = 0.3333
Divergence detected. Stopping training after 10 epochs.
Early stopping at epoch 10
Trial 15, Fold 4: Test Accuracy = 0.3328
Divergence detected. Stopping training after 10 epochs.
Early stopping at epoch 17
Trial 17, Fold 1: Test Accuracy = 0.3360
Divergence detected. Stopping training after 10 epochs.
Early stopping at epoch 10
Trial 17, Fold 2: Test Accuracy = 0.3348
Trial 15, Fold 5: Test Accuracy = 0.4021
Trial 15: Mean Accuracy = 0.3846, Fold Accuracies = [np.float64(0.39987852043553035), np.float64(0.4054003041226699), np.float64(0.38258521633319464), np.float64(0.33279352226720643), np.float64(0.40211125444291235)]
[I 2025-05-01 00:30:20,754] Trial 15 finished with value: 0.3845537635203028 and parameters: {'num_heads': 2, 'num_transformer_blocks': 2, 'learning_rate': 2.032617206017311e-06, 'optimizer': 'Adam', 'weight_decay': 0.0009016303463666882, 'batch_size': 10, 'label_smoothing': 0.15}. Best is trial 7 with value: 0.5344063417941234.
Hyperparameters: num_heads=16, num_transformer_blocks=32, learning_rate=0.0008434667508691908, optimizer=SGD, weight_decay=1.3270590777152315e-05, batch_size=10,factor=1
Divergence detected. Stopping training after 10 epochs.
Early stopping at epoch 24
Trial 16, Fold 2: Test Accuracy = 0.3333
Divergence detected. Stopping training after 10 epochs.
Early stopping at epoch 19
Trial 17, Fold 3: Test Accuracy = 0.3448
Divergence detected. Stopping training after 10 epochs.
Early stopping at epoch 14
Trial 18, Fold 1: Test Accuracy = 0.3341
Divergence detected. Stopping training after 10 epochs.
Early stopping at epoch 11
Trial 17, Fold 4: Test Accuracy = 0.3337
Divergence detected. Stopping training after 10 epochs.
Early stopping at epoch 20
Trial 16, Fold 3: Test Accuracy = 0.3333
Divergence detected. Stopping training after 10 epochs.
Early stopping at epoch 13
Trial 17, Fold 5: Test Accuracy = 0.3100
Trial 17: Mean Accuracy = 0.3318, Fold Accuracies = [np.float64(0.336), np.float64(0.334759572952223), np.float64(0.34478343576236464), np.float64(0.3336707152496626), np.float64(0.3099886961437538)]
