[I 2025-05-01 14:56:26,650] Trial 89 finished with value: 0.5138051406249902 and parameters: {'num_heads': 2, 'num_transformer_blocks': 2, 'learning_rate': 9.564096200521738e-06, 'optimizer': 'Adam', 'weight_decay': 1.8199740137210633e-06, 'batch_size': 10, 'label_smoothing': 0.18}. Best is trial 86 with value: 0.5553539263859596.
Hyperparameters: num_heads=2, num_transformer_blocks=2, learning_rate=3.63236763928152e-05, optimizer=Adam, weight_decay=2.695050719529811e-06, batch_size=10,factor=1
Trial 90, Fold 2: Test Accuracy = 0.5766
Divergence detected. Stopping training after 10 epochs.
Early stopping at epoch 20
Trial 92, Fold 1: Test Accuracy = 0.4974
Trial 91, Fold 2: Test Accuracy = 0.5128
Trial 90, Fold 3: Test Accuracy = 0.5052
Divergence detected. Stopping training after 10 epochs.
Early stopping at epoch 23
Trial 92, Fold 2: Test Accuracy = 0.5123
Trial 91, Fold 3: Test Accuracy = 0.4282
Divergence detected. Stopping training after 10 epochs.
Early stopping at epoch 18
Trial 92, Fold 3: Test Accuracy = 0.5030
Trial 90, Fold 4: Test Accuracy = 0.4362
Divergence detected. Stopping training after 10 epochs.
Early stopping at epoch 10
Trial 90, Fold 5: Test Accuracy = 0.3836
Trial 90: Mean Accuracy = 0.4716, Fold Accuracies = [np.float64(0.4563644829321433), np.float64(0.5765769717463659), np.float64(0.5051711257951728), np.float64(0.4362010796221323), np.float64(0.3836306808030116)]
[I 2025-05-01 15:19:02,402] Trial 90 finished with value: 0.4715888681797652 and parameters: {'num_heads': 2, 'num_transformer_blocks': 2, 'learning_rate': 5.326289317197433e-06, 'optimizer': 'Adam', 'weight_decay': 2.76169716293357e-06, 'batch_size': 10, 'label_smoothing': 0.2}. Best is trial 86 with value: 0.5553539263859596.
Hyperparameters: num_heads=2, num_transformer_blocks=2, learning_rate=3.983753858138908e-05, optimizer=Adam, weight_decay=1.175387684364768e-06, batch_size=10,factor=1
Trial 91, Fold 4: Test Accuracy = 0.4976
Trial 92, Fold 4: Test Accuracy = 0.4844
Divergence detected. Stopping training after 10 epochs.
Early stopping at epoch 10
Trial 91, Fold 5: Test Accuracy = 0.3855
Trial 91: Mean Accuracy = 0.4537, Fold Accuracies = [np.float64(0.4443630451732776), np.float64(0.5128162184579067), np.float64(0.42818762226021595), np.float64(0.4976045883940621), np.float64(0.385519690188965)]
[I 2025-05-01 15:22:54,002] Trial 91 finished with value: 0.4536982328948855 and parameters: {'num_heads': 2, 'num_transformer_blocks': 2, 'learning_rate': 5.274461535147382e-06, 'optimizer': 'Adam', 'weight_decay': 2.779376813650823e-06, 'batch_size': 10, 'label_smoothing': 0.21}. Best is trial 86 with value: 0.5553539263859596.
Hyperparameters: num_heads=2, num_transformer_blocks=2, learning_rate=4.301904846542686e-05, optimizer=Adam, weight_decay=4.387048694597285e-06, batch_size=10,factor=1
Divergence detected. Stopping training after 10 epochs.
Early stopping at epoch 18
Trial 92, Fold 5: Test Accuracy = 0.5938
Trial 92: Mean Accuracy = 0.5182, Fold Accuracies = [np.float64(0.4973551209099907), np.float64(0.5123416913899257), np.float64(0.5029731374089306), np.float64(0.4843792172739541), np.float64(0.5937677261052824)]
[I 2025-05-01 15:26:11,073] Trial 92 finished with value: 0.5181633786176166 and parameters: {'num_heads': 2, 'num_transformer_blocks': 2, 'learning_rate': 3.63236763928152e-05, 'optimizer': 'Adam', 'weight_decay': 2.695050719529811e-06, 'batch_size': 10, 'label_smoothing': 0.0}. Best is trial 86 with value: 0.5553539263859596.
Hyperparameters: num_heads=32, num_transformer_blocks=2, learning_rate=2.6407175053286313e-05, optimizer=Adam, weight_decay=1.244954029740668e-06, batch_size=10,factor=1
Trial 93, Fold 1: Test Accuracy = 0.5257
Divergence detected. Stopping training after 10 epochs.
Early stopping at epoch 14
Trial 94, Fold 1: Test Accuracy = 0.5125
Divergence detected. Stopping training after 10 epochs.
Early stopping at epoch 18
Trial 95, Fold 1: Test Accuracy = 0.4640
Divergence detected. Stopping training after 10 epochs.
Early stopping at epoch 20
Trial 94, Fold 2: Test Accuracy = 0.5394
Divergence detected. Stopping training after 10 epochs.
Early stopping at epoch 24
Trial 93, Fold 2: Test Accuracy = 0.5737
Divergence detected. Stopping training after 10 epochs.
Early stopping at epoch 19
Trial 95, Fold 2: Test Accuracy = 0.6187
Divergence detected. Stopping training after 10 epochs.
Early stopping at epoch 22
Trial 93, Fold 3: Test Accuracy = 0.5380
Trial 94, Fold 3: Test Accuracy = 0.5598
Divergence detected. Stopping training after 10 epochs.
Early stopping at epoch 22
Trial 95, Fold 3: Test Accuracy = 0.5447
Divergence detected. Stopping training after 10 epochs.
Early stopping at epoch 24
Trial 93, Fold 4: Test Accuracy = 0.4791
Divergence detected. Stopping training after 10 epochs.
Early stopping at epoch 18
Trial 94, Fold 4: Test Accuracy = 0.3978
Divergence detected. Stopping training after 10 epochs.
Early stopping at epoch 28
Trial 95, Fold 4: Test Accuracy = 0.4591
Divergence detected. Stopping training after 10 epochs.
Early stopping at epoch 18
Divergence detected. Stopping training after 10 epochs.
Early stopping at epoch 17
Trial 93, Fold 5: Test Accuracy = 0.6566
Trial 93: Mean Accuracy = 0.5546, Fold Accuracies = [np.float64(0.5256649468858696), np.float64(0.5736979083591199), np.float64(0.53803967777213), np.float64(0.47908232118758437), np.float64(0.6566254247174205)]
[I 2025-05-01 15:51:49,741] Trial 93 finished with value: 0.5546220557844249 and parameters: {'num_heads': 2, 'num_transformer_blocks': 2, 'learning_rate': 3.983753858138908e-05, 'optimizer': 'Adam', 'weight_decay': 1.175387684364768e-06, 'batch_size': 10, 'label_smoothing': 0.14}. Best is trial 86 with value: 0.5553539263859596.
Hyperparameters: num_heads=32, num_transformer_blocks=2, learning_rate=6.499381144288622e-05, optimizer=Adam, weight_decay=1.0481088834526924e-06, batch_size=10,factor=1
Trial 94, Fold 5: Test Accuracy = 0.5590
Trial 94: Mean Accuracy = 0.5137, Fold Accuracies = [np.float64(0.5124826003528039), np.float64(0.5394482193936687), np.float64(0.5597527840672797), np.float64(0.3978407557354926), np.float64(0.5589843577698038)]
[I 2025-05-01 15:51:53,549] Trial 94 finished with value: 0.5137017434638096 and parameters: {'num_heads': 2, 'num_transformer_blocks': 2, 'learning_rate': 4.301904846542686e-05, 'optimizer': 'Adam', 'weight_decay': 4.387048694597285e-06, 'batch_size': 10, 'label_smoothing': 0.14}. Best is trial 86 with value: 0.5553539263859596.
Hyperparameters: num_heads=32, num_transformer_blocks=16, learning_rate=6.873096129692719e-05, optimizer=Adam, weight_decay=1.1456329395361291e-06, batch_size=10,factor=1
Divergence detected. Stopping training after 10 epochs.
Early stopping at epoch 15
Trial 96, Fold 1: Test Accuracy = 0.4952
Divergence detected. Stopping training after 10 epochs.
Early stopping at epoch 26
Trial 95, Fold 5: Test Accuracy = 0.5915
Trial 95: Mean Accuracy = 0.5356, Fold Accuracies = [np.float64(0.4640063261390092), np.float64(0.6186756308418668), np.float64(0.5446800055450303), np.float64(0.4591093117408907), np.float64(0.5914911601866101)]
[I 2025-05-01 15:57:51,450] Trial 95 finished with value: 0.5355924868906815 and parameters: {'num_heads': 32, 'num_transformer_blocks': 2, 'learning_rate': 2.6407175053286313e-05, 'optimizer': 'Adam', 'weight_decay': 1.244954029740668e-06, 'batch_size': 10, 'label_smoothing': 0.14}. Best is trial 86 with value: 0.5553539263859596.
Hyperparameters: num_heads=2, num_transformer_blocks=2, learning_rate=8.04347198423726e-05, optimizer=Adam, weight_decay=1.2068485444422388e-06, batch_size=10,factor=1
Divergence detected. Stopping training after 10 epochs.
Early stopping at epoch 13
Trial 97, Fold 1: Test Accuracy = 0.4734
Divergence detected. Stopping training after 10 epochs.
Early stopping at epoch 16
Trial 98, Fold 1: Test Accuracy = 0.4883
Divergence detected. Stopping training after 10 epochs.
Early stopping at epoch 25
Trial 96, Fold 2: Test Accuracy = 0.5771
Divergence detected. Stopping training after 10 epochs.
Early stopping at epoch 13
Trial 96, Fold 3: Test Accuracy = 0.5320
Divergence detected. Stopping training after 10 epochs.
Early stopping at epoch 19
Trial 98, Fold 2: Test Accuracy = 0.5854
Divergence detected. Stopping training after 10 epochs.
Early stopping at epoch 17
Trial 97, Fold 2: Test Accuracy = 0.5323
Divergence detected. Stopping training after 10 epochs.
Early stopping at epoch 23
Trial 96, Fold 4: Test Accuracy = 0.4458
Divergence detected. Stopping training after 10 epochs.
Early stopping at epoch 20
Trial 98, Fold 3: Test Accuracy = 0.5532
Divergence detected. Stopping training after 10 epochs.
Early stopping at epoch 17
Trial 97, Fold 3: Test Accuracy = 0.5537
Divergence detected. Stopping training after 10 epochs.
Early stopping at epoch 17
Trial 96, Fold 5: Test Accuracy = 0.5854
Trial 96: Mean Accuracy = 0.5271, Fold Accuracies = [np.float64(0.4951512798818826), np.float64(0.5771259344328538), np.float64(0.531989818708316), np.float64(0.4457827260458839), np.float64(0.5853523675804272)]
[I 2025-05-01 16:17:24,540] Trial 96 finished with value: 0.5270804253298726 and parameters: {'num_heads': 32, 'num_transformer_blocks': 2, 'learning_rate': 6.499381144288622e-05, 'optimizer': 'Adam', 'weight_decay': 1.0481088834526924e-06, 'batch_size': 10, 'label_smoothing': 0.13}. Best is trial 86 with value: 0.5553539263859596.
Hyperparameters: num_heads=2, num_transformer_blocks=2, learning_rate=2.2632748897720655e-05, optimizer=Adam, weight_decay=1.2845212624107576e-06, batch_size=10,factor=1
Divergence detected. Stopping training after 10 epochs.
Early stopping at epoch 25
Trial 98, Fold 4: Test Accuracy = 0.4597
Divergence detected. Stopping training after 10 epochs.
Early stopping at epoch 17
Trial 98, Fold 5: Test Accuracy = 0.6130
Trial 98: Mean Accuracy = 0.5399, Fold Accuracies = [np.float64(0.4882542842449277), np.float64(0.5853776544273243), np.float64(0.5532282088011953), np.float64(0.45968286099865047), np.float64(0.6130040291953631)]
[I 2025-05-01 16:23:29,726] Trial 98 finished with value: 0.5399094075334921 and parameters: {'num_heads': 2, 'num_transformer_blocks': 2, 'learning_rate': 8.04347198423726e-05, 'optimizer': 'Adam', 'weight_decay': 1.2068485444422388e-06, 'batch_size': 10, 'label_smoothing': 0.13}. Best is trial 86 with value: 0.5553539263859596.
Hyperparameters: num_heads=2, num_transformer_blocks=2, learning_rate=0.00010194141755995403, optimizer=Adam, weight_decay=1.2110904512515856e-06, batch_size=10,factor=1
Divergence detected. Stopping training after 10 epochs.
Early stopping at epoch 28
Trial 99, Fold 1: Test Accuracy = 0.4267
Divergence detected. Stopping training after 10 epochs.
Early stopping at epoch 21
Trial 97, Fold 4: Test Accuracy = 0.4904
Divergence detected. Stopping training after 10 epochs.
Early stopping at epoch 14
Trial 100, Fold 1: Test Accuracy = 0.5096
Divergence detected. Stopping training after 10 epochs.
Early stopping at epoch 12
Trial 97, Fold 5: Test Accuracy = 0.5755
Trial 97: Mean Accuracy = 0.5251, Fold Accuracies = [np.float64(0.4734419173067459), np.float64(0.5322758158675471), np.float64(0.5536832093402954), np.float64(0.4903846153846154), np.float64(0.5755043829215332)]
[I 2025-05-01 16:31:17,906] Trial 97 finished with value: 0.5250579881641474 and parameters: {'num_heads': 32, 'num_transformer_blocks': 16, 'learning_rate': 6.873096129692719e-05, 'optimizer': 'Adam', 'weight_decay': 1.1456329395361291e-06, 'batch_size': 10, 'label_smoothing': 0.13}. Best is trial 86 with value: 0.5553539263859596.
Hyperparameters: num_heads=2, num_transformer_blocks=2, learning_rate=1.475616204328865e-05, optimizer=Adam, weight_decay=1.2484353415166117e-06, batch_size=10,factor=1
Divergence detected. Stopping training after 10 epochs.
Early stopping at epoch 17
Trial 100, Fold 2: Test Accuracy = 0.5157
Trial 99, Fold 2: Test Accuracy = 0.5375
Divergence detected. Stopping training after 10 epochs.
Early stopping at epoch 20
Trial 100, Fold 3: Test Accuracy = 0.5838
Divergence detected. Stopping training after 10 epochs.
Early stopping at epoch 21
Trial 99, Fold 3: Test Accuracy = 0.5580
Trial 101, Fold 1: Test Accuracy = 0.5013
Divergence detected. Stopping training after 10 epochs.
Early stopping at epoch 13
Trial 100, Fold 4: Test Accuracy = 0.4407
Divergence detected. Stopping training after 10 epochs.
Early stopping at epoch 16
Trial 100, Fold 5: Test Accuracy = 0.5490
Trial 100: Mean Accuracy = 0.5198, Fold Accuracies = [np.float64(0.5096075692474438), np.float64(0.515748450144086), np.float64(0.583822143154198), np.float64(0.4406545209176788), np.float64(0.549035444346308)]
[I 2025-05-01 16:46:08,598] Trial 100 finished with value: 0.5197736255619428 and parameters: {'num_heads': 2, 'num_transformer_blocks': 2, 'learning_rate': 0.00010194141755995403, 'optimizer': 'Adam', 'weight_decay': 1.2110904512515856e-06, 'batch_size': 10, 'label_smoothing': 0.11}. Best is trial 86 with value: 0.5553539263859596.
Hyperparameters: num_heads=2, num_transformer_blocks=2, learning_rate=1.4762568214777568e-05, optimizer=Adam, weight_decay=2.266623320246937e-06, batch_size=10,factor=1
Divergence detected. Stopping training after 10 epochs.
Early stopping at epoch 24
Trial 101, Fold 2: Test Accuracy = 0.5385
Trial 99, Fold 4: Test Accuracy = 0.4466
Divergence detected. Stopping training after 10 epochs.
Early stopping at epoch 26
Divergence detected. Stopping training after 10 epochs.
Early stopping at epoch 23
Trial 102, Fold 1: Test Accuracy = 0.4564
Trial 101, Fold 3: Test Accuracy = 0.5275
Divergence detected. Stopping training after 10 epochs.
Early stopping at epoch 28
Trial 99, Fold 5: Test Accuracy = 0.6120
Trial 99: Mean Accuracy = 0.5162, Fold Accuracies = [np.float64(0.4267274949263702), np.float64(0.537527514594698), np.float64(0.5580400628436764), np.float64(0.4465587044534413), np.float64(0.6120261737684545)]
[I 2025-05-01 16:54:39,435] Trial 99 finished with value: 0.5161759901173281 and parameters: {'num_heads': 2, 'num_transformer_blocks': 2, 'learning_rate': 2.2632748897720655e-05, 'optimizer': 'Adam', 'weight_decay': 1.2845212624107576e-06, 'batch_size': 10, 'label_smoothing': 0.11}. Best is trial 86 with value: 0.5553539263859596.
Hyperparameters: num_heads=2, num_transformer_blocks=2, learning_rate=1.3724258889929559e-05, optimizer=Adam, weight_decay=2.371946395462843e-06, batch_size=10,factor=1
Trial 101, Fold 4: Test Accuracy = 0.4564
Trial 102, Fold 2: Test Accuracy = 0.5101
Trial 103, Fold 1: Test Accuracy = 0.5079
Trial 102, Fold 3: Test Accuracy = 0.5039
Trial 101, Fold 5: Test Accuracy = 0.5937
Trial 101: Mean Accuracy = 0.5235, Fold Accuracies = [np.float64(0.501314797303649), np.float64(0.53850049446518), np.float64(0.5274860989171789), np.float64(0.4564102564102564), np.float64(0.5936793503816199)]
[I 2025-05-01 17:09:41,195] Trial 101 finished with value: 0.523478199495577 and parameters: {'num_heads': 2, 'num_transformer_blocks': 2, 'learning_rate': 1.475616204328865e-05, 'optimizer': 'Adam', 'weight_decay': 1.2484353415166117e-06, 'batch_size': 10, 'label_smoothing': 0.16}. Best is trial 86 with value: 0.5553539263859596.
Hyperparameters: num_heads=2, num_transformer_blocks=2, learning_rate=2.4663688833197958e-05, optimizer=Adam, weight_decay=2.3558471449036248e-06, batch_size=10,factor=1
Trial 103, Fold 2: Test Accuracy = 0.5647
Divergence detected. Stopping training after 10 epochs.
Early stopping at epoch 22
Trial 104, Fold 1: Test Accuracy = 0.4674
Trial 102, Fold 4: Test Accuracy = 0.4473
Trial 103, Fold 3: Test Accuracy = 0.5301
Trial 104, Fold 2: Test Accuracy = 0.5724
Trial 102, Fold 5: Test Accuracy = 0.6298
Trial 102: Mean Accuracy = 0.5095, Fold Accuracies = [np.float64(0.4563981486089683), np.float64(0.510064758988101), np.float64(0.5039238790567288), np.float64(0.44726720647773277), np.float64(0.6298173886476218)]
[I 2025-05-01 17:25:01,190] Trial 102 finished with value: 0.5094942763558306 and parameters: {'num_heads': 2, 'num_transformer_blocks': 2, 'learning_rate': 1.4762568214777568e-05, 'optimizer': 'Adam', 'weight_decay': 2.266623320246937e-06, 'batch_size': 10, 'label_smoothing': 0.19}. Best is trial 86 with value: 0.5553539263859596.
Hyperparameters: num_heads=2, num_transformer_blocks=2, learning_rate=2.407401484162111e-05, optimizer=Adam, weight_decay=1.4526493520859708e-06, batch_size=10,factor=1
Trial 103, Fold 4: Test Accuracy = 0.4876
Divergence detected. Stopping training after 10 epochs.
Early stopping at epoch 23
Trial 105, Fold 1: Test Accuracy = 0.4881
Divergence detected. Stopping training after 10 epochs.
Early stopping at epoch 25
Trial 104, Fold 3: Test Accuracy = 0.5451
Trial 103, Fold 5: Test Accuracy = 0.6197
Trial 103: Mean Accuracy = 0.5420, Fold Accuracies = [np.float64(0.5079260107168334), np.float64(0.5647390499888346), np.float64(0.5301318484974508), np.float64(0.4875843454790823), np.float64(0.619715349625262)]
[I 2025-05-01 17:34:46,427] Trial 103 finished with value: 0.5420193208614925 and parameters: {'num_heads': 2, 'num_transformer_blocks': 2, 'learning_rate': 1.3724258889929559e-05, 'optimizer': 'Adam', 'weight_decay': 2.371946395462843e-06, 'batch_size': 10, 'label_smoothing': 0.14}. Best is trial 86 with value: 0.5553539263859596.
Hyperparameters: num_heads=2, num_transformer_blocks=2, learning_rate=5.11788998804414e-05, optimizer=Adam, weight_decay=3.2583414702343135e-06, batch_size=10,factor=1
Divergence detected. Stopping training after 10 epochs.
Early stopping at epoch 16
Trial 106, Fold 1: Test Accuracy = 0.5134
Trial 105, Fold 2: Test Accuracy = 0.6020
Trial 104, Fold 4: Test Accuracy = 0.4533
Divergence detected. Stopping training after 10 epochs.
Early stopping at epoch 20
Trial 105, Fold 3: Test Accuracy = 0.5499
Divergence detected. Stopping training after 10 epochs.
Early stopping at epoch 23
Trial 106, Fold 2: Test Accuracy = 0.5754
Divergence detected. Stopping training after 10 epochs.
Early stopping at epoch 23
Trial 104, Fold 5: Test Accuracy = 0.6102
Trial 104: Mean Accuracy = 0.5297, Fold Accuracies = [np.float64(0.46742801528448275), np.float64(0.5723527503961038), np.float64(0.5451257643670194), np.float64(0.453306342780027), np.float64(0.6102405409073917)]
[I 2025-05-01 17:46:35,612] Trial 104 finished with value: 0.5296906827470049 and parameters: {'num_heads': 2, 'num_transformer_blocks': 2, 'learning_rate': 2.4663688833197958e-05, 'optimizer': 'Adam', 'weight_decay': 2.3558471449036248e-06, 'batch_size': 10, 'label_smoothing': 0.14}. Best is trial 86 with value: 0.5553539263859596.
Hyperparameters: num_heads=2, num_transformer_blocks=2, learning_rate=4.898155624993735e-05, optimizer=Adam, weight_decay=3.224957111801335e-06, batch_size=10,factor=1
Divergence detected. Stopping training after 10 epochs.
Early stopping at epoch 18
Trial 106, Fold 3: Test Accuracy = 0.5416
Divergence detected. Stopping training after 10 epochs.
Early stopping at epoch 21
Trial 105, Fold 4: Test Accuracy = 0.4503
Divergence detected. Stopping training after 10 epochs.
Early stopping at epoch 20
Trial 107, Fold 1: Test Accuracy = 0.4700
Divergence detected. Stopping training after 10 epochs.
Early stopping at epoch 18
Trial 106, Fold 4: Test Accuracy = 0.4292
Divergence detected. Stopping training after 10 epochs.
Early stopping at epoch 18
Trial 107, Fold 2: Test Accuracy = 0.5389
Divergence detected. Stopping training after 10 epochs.
Early stopping at epoch 27
Trial 105, Fold 5: Test Accuracy = 0.6199
Trial 105: Mean Accuracy = 0.5420, Fold Accuracies = [np.float64(0.48811555157406944), np.float64(0.6019714805244522), np.float64(0.5498602190286955), np.float64(0.45033738191632927), np.float64(0.6198855103126207)]
[I 2025-05-01 17:58:10,447] Trial 105 finished with value: 0.5420340286712334 and parameters: {'num_heads': 2, 'num_transformer_blocks': 2, 'learning_rate': 2.407401484162111e-05, 'optimizer': 'Adam', 'weight_decay': 1.4526493520859708e-06, 'batch_size': 10, 'label_smoothing': 0.14}. Best is trial 86 with value: 0.5553539263859596.
Hyperparameters: num_heads=32, num_transformer_blocks=2, learning_rate=4.758768753539347e-05, optimizer=Adam, weight_decay=1.4466554258521613e-06, batch_size=10,factor=1
Divergence detected. Stopping training after 10 epochs.
Early stopping at epoch 20
Trial 106, Fold 5: Test Accuracy = 0.6018
Trial 106: Mean Accuracy = 0.5323, Fold Accuracies = [np.float64(0.5134052876347207), np.float64(0.5754351825267703), np.float64(0.5416046701477134), np.float64(0.42918353576248314), np.float64(0.601762450255681)]
[I 2025-05-01 18:01:33,434] Trial 106 finished with value: 0.5322782252654737 and parameters: {'num_heads': 2, 'num_transformer_blocks': 2, 'learning_rate': 5.11788998804414e-05, 'optimizer': 'Adam', 'weight_decay': 3.2583414702343135e-06, 'batch_size': 10, 'label_smoothing': 0.14}. Best is trial 86 with value: 0.5553539263859596.
Hyperparameters: num_heads=32, num_transformer_blocks=2, learning_rate=6.658457299134199e-06, optimizer=Adam, weight_decay=1.974360654636552e-06, batch_size=10,factor=1
Divergence detected. Stopping training after 10 epochs.
Early stopping at epoch 18
Trial 108, Fold 1: Test Accuracy = 0.4474
Divergence detected. Stopping training after 10 epochs.
Early stopping at epoch 26
Trial 107, Fold 3: Test Accuracy = 0.5652
Trial 109, Fold 1: Test Accuracy = 0.4958
Divergence detected. Stopping training after 10 epochs.
Early stopping at epoch 17
Trial 107, Fold 4: Test Accuracy = 0.4566
Divergence detected. Stopping training after 10 epochs.
Early stopping at epoch 29
Trial 108, Fold 2: Test Accuracy = 0.5650
Divergence detected. Stopping training after 10 epochs.
Early stopping at epoch 15
Trial 107, Fold 5: Test Accuracy = 0.6076
Trial 107: Mean Accuracy = 0.5277, Fold Accuracies = [np.float64(0.4700331458716966), np.float64(0.5388713433502409), np.float64(0.56519322890193), np.float64(0.45664642375168696), np.float64(0.6075525362542655)]
