[I 2025-05-01 00:44:57,424] Trial 17 finished with value: 0.3318404840216008 and parameters: {'num_heads': 2, 'num_transformer_blocks': 32, 'learning_rate': 0.00041485436078539357, 'optimizer': 'SGD', 'weight_decay': 1.301980895226147e-05, 'batch_size': 10, 'label_smoothing': 0.17}. Best is trial 7 with value: 0.5344063417941234.
Hyperparameters: num_heads=4, num_transformer_blocks=8, learning_rate=0.009995215728797675, optimizer=Adam, weight_decay=0.00020740185416929648, batch_size=10,factor=1
Divergence detected. Stopping training after 10 epochs.
Early stopping at epoch 13
Trial 18, Fold 2: Test Accuracy = 0.3328
Divergence detected. Stopping training after 10 epochs.
Early stopping at epoch 10
Trial 16, Fold 4: Test Accuracy = 0.3333
Divergence detected. Stopping training after 10 epochs.
Early stopping at epoch 14
Trial 19, Fold 1: Test Accuracy = 0.3333
Divergence detected. Stopping training after 10 epochs.
Early stopping at epoch 18
Trial 19, Fold 2: Test Accuracy = 0.3333
Divergence detected. Stopping training after 10 epochs.
Early stopping at epoch 12
Trial 16, Fold 5: Test Accuracy = 0.3333
Trial 16: Mean Accuracy = 0.3333, Fold Accuracies = [np.float64(0.3333333333333333), np.float64(0.3333333333333333), np.float64(0.3333333333333333), np.float64(0.3333333333333333), np.float64(0.3333333333333333)]
[I 2025-05-01 00:53:08,996] Trial 16 finished with value: 0.3333333333333333 and parameters: {'num_heads': 2, 'num_transformer_blocks': 32, 'learning_rate': 0.0004372051002757779, 'optimizer': 'Adam', 'weight_decay': 1.2293426807358074e-05, 'batch_size': 10, 'label_smoothing': 0.15}. Best is trial 7 with value: 0.5344063417941234.
Hyperparameters: num_heads=16, num_transformer_blocks=8, learning_rate=0.008319053020732235, optimizer=SGD, weight_decay=0.00034183898676053707, batch_size=10,factor=1
Divergence detected. Stopping training after 10 epochs.
Early stopping at epoch 10
Trial 18, Fold 3: Test Accuracy = 0.3519
Divergence detected. Stopping training after 10 epochs.
Early stopping at epoch 10
Trial 19, Fold 3: Test Accuracy = 0.3333
Divergence detected. Stopping training after 10 epochs.
Early stopping at epoch 19
Trial 20, Fold 1: Test Accuracy = 0.4673
Divergence detected. Stopping training after 10 epochs.
Early stopping at epoch 12
Trial 19, Fold 4: Test Accuracy = 0.3333
Divergence detected. Stopping training after 10 epochs.
Early stopping at epoch 11
Trial 18, Fold 4: Test Accuracy = 0.3333
Divergence detected. Stopping training after 10 epochs.
Early stopping at epoch 10
Trial 19, Fold 5: Test Accuracy = 0.3333
Trial 19: Mean Accuracy = 0.3333, Fold Accuracies = [np.float64(0.3333333333333333), np.float64(0.3333333333333333), np.float64(0.3333333333333333), np.float64(0.3333333333333333), np.float64(0.3333333333333333)]
[I 2025-05-01 01:01:36,695] Trial 19 finished with value: 0.3333333333333333 and parameters: {'num_heads': 4, 'num_transformer_blocks': 8, 'learning_rate': 0.009995215728797675, 'optimizer': 'Adam', 'weight_decay': 0.00020740185416929648, 'batch_size': 10, 'label_smoothing': 0.3}. Best is trial 7 with value: 0.5344063417941234.
Hyperparameters: num_heads=16, num_transformer_blocks=8, learning_rate=4.340435152830084e-05, optimizer=SGD, weight_decay=2.6712655546719673e-06, batch_size=10,factor=1
Trial 20, Fold 2: Test Accuracy = 0.5005
Trial 21, Fold 1: Test Accuracy = 0.3410
Divergence detected. Stopping training after 10 epochs.
Early stopping at epoch 13
Trial 20, Fold 3: Test Accuracy = 0.4968
Divergence detected. Stopping training after 10 epochs.
Early stopping at epoch 23
Trial 18, Fold 5: Test Accuracy = 0.3622
Trial 18: Mean Accuracy = 0.3429, Fold Accuracies = [np.float64(0.334107511184105), np.float64(0.33282158845609894), np.float64(0.35190363969625554), np.float64(0.3333333333333333), np.float64(0.36218948320784344)]
[I 2025-05-01 01:13:49,441] Trial 18 finished with value: 0.34287111117552727 and parameters: {'num_heads': 16, 'num_transformer_blocks': 32, 'learning_rate': 0.0008434667508691908, 'optimizer': 'SGD', 'weight_decay': 1.3270590777152315e-05, 'batch_size': 10, 'label_smoothing': 0.18}. Best is trial 7 with value: 0.5344063417941234.
Hyperparameters: num_heads=2, num_transformer_blocks=8, learning_rate=3.578588486008383e-05, optimizer=AdamW, weight_decay=2.460418945385307e-06, batch_size=10,factor=1
Divergence detected. Stopping training after 10 epochs.
Early stopping at epoch 12
Trial 21, Fold 2: Test Accuracy = 0.3569
Divergence detected. Stopping training after 10 epochs.
Early stopping at epoch 24
Trial 20, Fold 4: Test Accuracy = 0.4026
Divergence detected. Stopping training after 10 epochs.
Early stopping at epoch 22
Trial 22, Fold 1: Test Accuracy = 0.5079
Trial 21, Fold 3: Test Accuracy = 0.3386
Divergence detected. Stopping training after 10 epochs.
Early stopping at epoch 17
Trial 20, Fold 5: Test Accuracy = 0.5784
Trial 20: Mean Accuracy = 0.4891, Fold Accuracies = [np.float64(0.4672641992512594), np.float64(0.5004545889558809), np.float64(0.49683078415969684), np.float64(0.40256410256410263), np.float64(0.5784152412639063)]
[I 2025-05-01 01:23:50,010] Trial 20 finished with value: 0.48910578323896925 and parameters: {'num_heads': 16, 'num_transformer_blocks': 8, 'learning_rate': 0.008319053020732235, 'optimizer': 'SGD', 'weight_decay': 0.00034183898676053707, 'batch_size': 10, 'label_smoothing': 0.11}. Best is trial 7 with value: 0.5344063417941234.
Hyperparameters: num_heads=4, num_transformer_blocks=8, learning_rate=5.2267627767109705e-05, optimizer=AdamW, weight_decay=0.0001015237898324104, batch_size=32,factor=1
Divergence detected. Stopping training after 10 epochs.
Early stopping at epoch 11
Trial 21, Fold 4: Test Accuracy = 0.2615
Divergence detected. Stopping training after 10 epochs.
Early stopping at epoch 16
Trial 23, Fold 1: Test Accuracy = 0.5223
Divergence detected. Stopping training after 10 epochs.
Early stopping at epoch 10
Trial 21, Fold 5: Test Accuracy = 0.2611
Trial 21: Mean Accuracy = 0.3118, Fold Accuracies = [np.float64(0.3410084440684152), np.float64(0.3568722684786423), np.float64(0.33862175192150695), np.float64(0.2615047233468286), np.float64(0.26114837798585616)]
[I 2025-05-01 01:31:08,636] Trial 21 finished with value: 0.3118311131602498 and parameters: {'num_heads': 16, 'num_transformer_blocks': 8, 'learning_rate': 4.340435152830084e-05, 'optimizer': 'SGD', 'weight_decay': 2.6712655546719673e-06, 'batch_size': 10, 'label_smoothing': 0.12}. Best is trial 7 with value: 0.5344063417941234.
Hyperparameters: num_heads=4, num_transformer_blocks=8, learning_rate=0.00011090865334840052, optimizer=AdamW, weight_decay=8.25271607634704e-05, batch_size=32,factor=1
Divergence detected. Stopping training after 10 epochs.
Early stopping at epoch 23
Trial 22, Fold 2: Test Accuracy = 0.5396
Divergence detected. Stopping training after 10 epochs.
Early stopping at epoch 18
Trial 23, Fold 2: Test Accuracy = 0.5802
Divergence detected. Stopping training after 10 epochs.
Early stopping at epoch 19
Trial 24, Fold 1: Test Accuracy = 0.4825
Divergence detected. Stopping training after 10 epochs.
Early stopping at epoch 21
Trial 23, Fold 3: Test Accuracy = 0.5226
Divergence detected. Stopping training after 10 epochs.
Early stopping at epoch 12
Trial 24, Fold 2: Test Accuracy = 0.5598
Divergence detected. Stopping training after 10 epochs.
Early stopping at epoch 12
Trial 24, Fold 3: Test Accuracy = 0.5413
Divergence detected. Stopping training after 10 epochs.
Early stopping at epoch 23
Trial 23, Fold 4: Test Accuracy = 0.4157
Divergence detected. Stopping training after 10 epochs.
Early stopping at epoch 22
Trial 22, Fold 3: Test Accuracy = 0.5529
Divergence detected. Stopping training after 10 epochs.
Early stopping at epoch 13
Trial 24, Fold 4: Test Accuracy = 0.4370
Divergence detected. Stopping training after 10 epochs.
Early stopping at epoch 18
Trial 23, Fold 5: Test Accuracy = 0.6202
Trial 23: Mean Accuracy = 0.5322, Fold Accuracies = [np.float64(0.522305767072004), np.float64(0.5802362799204602), np.float64(0.5226180244289389), np.float64(0.41572199730094467), np.float64(0.6202461084043237)]
[I 2025-05-01 01:47:51,008] Trial 23 finished with value: 0.5322256354253343 and parameters: {'num_heads': 4, 'num_transformer_blocks': 8, 'learning_rate': 5.2267627767109705e-05, 'optimizer': 'AdamW', 'weight_decay': 0.0001015237898324104, 'batch_size': 32, 'label_smoothing': 0.21}. Best is trial 7 with value: 0.5344063417941234.
Hyperparameters: num_heads=4, num_transformer_blocks=8, learning_rate=1.0151340265762974e-05, optimizer=AdamW, weight_decay=0.00043518444583324307, batch_size=32,factor=1
Divergence detected. Stopping training after 10 epochs.
Early stopping at epoch 19
Trial 24, Fold 5: Test Accuracy = 0.5877
Trial 24: Mean Accuracy = 0.5217, Fold Accuracies = [np.float64(0.4825122292451212), np.float64(0.5598262991673845), np.float64(0.5412762811330345), np.float64(0.4369770580296895), np.float64(0.5876966934578992)]
[I 2025-05-01 01:50:36,727] Trial 24 finished with value: 0.5216577122066258 and parameters: {'num_heads': 4, 'num_transformer_blocks': 8, 'learning_rate': 0.00011090865334840052, 'optimizer': 'AdamW', 'weight_decay': 8.25271607634704e-05, 'batch_size': 32, 'label_smoothing': 0.22}. Best is trial 7 with value: 0.5344063417941234.
Hyperparameters: num_heads=4, num_transformer_blocks=8, learning_rate=1.3148345101561702e-05, optimizer=AdamW, weight_decay=0.00036975649958118057, batch_size=32,factor=1
Divergence detected. Stopping training after 10 epochs.
Early stopping at epoch 17
Trial 22, Fold 4: Test Accuracy = 0.4888
Trial 25, Fold 1: Test Accuracy = 0.4657
Trial 26, Fold 1: Test Accuracy = 0.5185
Trial 25, Fold 2: Test Accuracy = 0.6165
Divergence detected. Stopping training after 10 epochs.
Early stopping at epoch 17
Trial 22, Fold 5: Test Accuracy = 0.5853
Trial 22: Mean Accuracy = 0.5349, Fold Accuracies = [np.float64(0.5078583696920431), np.float64(0.5396210163652024), np.float64(0.5529086764320811), np.float64(0.48879892037786776), np.float64(0.5852917689743637)]
[I 2025-05-01 02:03:56,617] Trial 22 finished with value: 0.5348957503683117 and parameters: {'num_heads': 2, 'num_transformer_blocks': 8, 'learning_rate': 3.578588486008383e-05, 'optimizer': 'AdamW', 'weight_decay': 2.460418945385307e-06, 'batch_size': 10, 'label_smoothing': 0.12}. Best is trial 22 with value: 0.5348957503683117.
Hyperparameters: num_heads=4, num_transformer_blocks=4, learning_rate=8.058405683953688e-06, optimizer=AdamW, weight_decay=0.0004454995794666148, batch_size=32,factor=1
Trial 26, Fold 2: Test Accuracy = 0.6124
Trial 25, Fold 3: Test Accuracy = 0.5042
Trial 27, Fold 1: Test Accuracy = 0.4894
Trial 26, Fold 3: Test Accuracy = 0.4691
Trial 25, Fold 4: Test Accuracy = 0.4427
Trial 27, Fold 2: Test Accuracy = 0.5899
Trial 26, Fold 4: Test Accuracy = 0.4778
Divergence detected. Stopping training after 10 epochs.
Early stopping at epoch 10
Trial 25, Fold 5: Test Accuracy = 0.4854
Trial 25: Mean Accuracy = 0.5029, Fold Accuracies = [np.float64(0.4657065534155067), np.float64(0.616465158813709), np.float64(0.5042067526146358), np.float64(0.4426788124156545), np.float64(0.48542696142132974)]
[I 2025-05-01 02:27:51,129] Trial 25 finished with value: 0.5028968477361672 and parameters: {'num_heads': 4, 'num_transformer_blocks': 8, 'learning_rate': 1.0151340265762974e-05, 'optimizer': 'AdamW', 'weight_decay': 0.00043518444583324307, 'batch_size': 32, 'label_smoothing': 0.06}. Best is trial 22 with value: 0.5348957503683117.
Hyperparameters: num_heads=4, num_transformer_blocks=4, learning_rate=6.57740502504373e-06, optimizer=AdamW, weight_decay=0.0001900209472561317, batch_size=32,factor=1
Trial 27, Fold 3: Test Accuracy = 0.5004
Trial 26, Fold 5: Test Accuracy = 0.5657
Trial 26: Mean Accuracy = 0.5287, Fold Accuracies = [np.float64(0.5184603593291196), np.float64(0.6124496230367605), np.float64(0.4690946967946645), np.float64(0.477834008097166), np.float64(0.5657497604709438)]
[I 2025-05-01 02:36:11,193] Trial 26 finished with value: 0.5287176895457308 and parameters: {'num_heads': 4, 'num_transformer_blocks': 8, 'learning_rate': 1.3148345101561702e-05, 'optimizer': 'AdamW', 'weight_decay': 0.00036975649958118057, 'batch_size': 32, 'label_smoothing': 0.23}. Best is trial 22 with value: 0.5348957503683117.
Hyperparameters: num_heads=4, num_transformer_blocks=4, learning_rate=0.0001143953049161876, optimizer=AdamW, weight_decay=2.2118095485811648e-05, batch_size=32,factor=1
Trial 28, Fold 1: Test Accuracy = 0.4505
Divergence detected. Stopping training after 10 epochs.
Early stopping at epoch 13
Trial 29, Fold 1: Test Accuracy = 0.5068
Trial 27, Fold 4: Test Accuracy = 0.4690
Divergence detected. Stopping training after 10 epochs.
Early stopping at epoch 13
Trial 29, Fold 2: Test Accuracy = 0.5691
Trial 28, Fold 2: Test Accuracy = 0.5799
Divergence detected. Stopping training after 10 epochs.
Early stopping at epoch 14
Trial 29, Fold 3: Test Accuracy = 0.5657
Trial 27, Fold 5: Test Accuracy = 0.5856
Trial 27: Mean Accuracy = 0.5269, Fold Accuracies = [np.float64(0.48943085762316335), np.float64(0.5898996182516135), np.float64(0.5004263512160559), np.float64(0.4689946018893387), np.float64(0.5856426669889773)]
[I 2025-05-01 02:52:00,322] Trial 27 finished with value: 0.5268788191938298 and parameters: {'num_heads': 4, 'num_transformer_blocks': 4, 'learning_rate': 8.058405683953688e-06, 'optimizer': 'AdamW', 'weight_decay': 0.0004454995794666148, 'batch_size': 32, 'label_smoothing': 0.18}. Best is trial 22 with value: 0.5348957503683117.
Hyperparameters: num_heads=2, num_transformer_blocks=2, learning_rate=0.00014038949212035303, optimizer=AdamW, weight_decay=2.1280745248619434e-05, batch_size=16,factor=1
Trial 28, Fold 3: Test Accuracy = 0.4894
Divergence detected. Stopping training after 10 epochs.
Early stopping at epoch 23
Trial 29, Fold 4: Test Accuracy = 0.4230
Divergence detected. Stopping training after 10 epochs.
Early stopping at epoch 17
Trial 30, Fold 1: Test Accuracy = 0.5137
Divergence detected. Stopping training after 10 epochs.
Early stopping at epoch 16
Trial 29, Fold 5: Test Accuracy = 0.5899
Trial 29: Mean Accuracy = 0.5309, Fold Accuracies = [np.float64(0.5067524013337978), np.float64(0.5691334098956838), np.float64(0.5657335612956887), np.float64(0.4230094466936573), np.float64(0.5898755970488413)]
[I 2025-05-01 03:00:31,417] Trial 29 finished with value: 0.5309008832535338 and parameters: {'num_heads': 4, 'num_transformer_blocks': 4, 'learning_rate': 0.0001143953049161876, 'optimizer': 'AdamW', 'weight_decay': 2.2118095485811648e-05, 'batch_size': 32, 'label_smoothing': 0.18}. Best is trial 22 with value: 0.5348957503683117.
Hyperparameters: num_heads=32, num_transformer_blocks=16, learning_rate=0.00011574704437376741, optimizer=AdamW, weight_decay=4.456542835707629e-05, batch_size=16,factor=1
Divergence detected. Stopping training after 10 epochs.
Early stopping at epoch 16
Trial 30, Fold 2: Test Accuracy = 0.4700
Trial 28, Fold 4: Test Accuracy = 0.4512
Divergence detected. Stopping training after 10 epochs.
Early stopping at epoch 11
Trial 31, Fold 1: Test Accuracy = 0.4807
Divergence detected. Stopping training after 10 epochs.
Early stopping at epoch 19
Trial 30, Fold 3: Test Accuracy = 0.5910
Trial 28, Fold 5: Test Accuracy = 0.5688
Trial 28: Mean Accuracy = 0.5080, Fold Accuracies = [np.float64(0.450493958647843), np.float64(0.5799491711062196), np.float64(0.4894183109221693), np.float64(0.45124831309041835), np.float64(0.5687643757333875)]
[I 2025-05-01 03:09:44,916] Trial 28 finished with value: 0.5079748259000075 and parameters: {'num_heads': 4, 'num_transformer_blocks': 4, 'learning_rate': 6.57740502504373e-06, 'optimizer': 'AdamW', 'weight_decay': 0.0001900209472561317, 'batch_size': 32, 'label_smoothing': 0.18}. Best is trial 22 with value: 0.5348957503683117.
Hyperparameters: num_heads=32, num_transformer_blocks=16, learning_rate=4.3827154502351545e-07, optimizer=AdamW, weight_decay=5.505094401197587e-05, batch_size=16,factor=1
Divergence detected. Stopping training after 10 epochs.
Early stopping at epoch 14
Trial 31, Fold 2: Test Accuracy = 0.5043
Divergence detected. Stopping training after 10 epochs.
Early stopping at epoch 15
Trial 30, Fold 4: Test Accuracy = 0.4718
Divergence detected. Stopping training after 10 epochs.
Early stopping at epoch 17
Trial 30, Fold 5: Test Accuracy = 0.5622
Trial 30: Mean Accuracy = 0.5217, Fold Accuracies = [np.float64(0.5137200019907431), np.float64(0.46996124031007747), np.float64(0.5909699952251128), np.float64(0.4718286099865048), np.float64(0.5622400029955293)]
[I 2025-05-01 03:17:45,721] Trial 30 finished with value: 0.5217439701015935 and parameters: {'num_heads': 2, 'num_transformer_blocks': 2, 'learning_rate': 0.00014038949212035303, 'optimizer': 'AdamW', 'weight_decay': 2.1280745248619434e-05, 'batch_size': 16, 'label_smoothing': 0.17}. Best is trial 22 with value: 0.5348957503683117.
Hyperparameters: num_heads=4, num_transformer_blocks=4, learning_rate=8.646610374182682e-05, optimizer=AdamW, weight_decay=2.197701013609936e-05, batch_size=32,factor=1
Divergence detected. Stopping training after 10 epochs.
Early stopping at epoch 18
Trial 31, Fold 3: Test Accuracy = 0.5522
Divergence detected. Stopping training after 10 epochs.
Early stopping at epoch 15
Trial 33, Fold 1: Test Accuracy = 0.4913
Trial 32, Fold 1: Test Accuracy = 0.3124
Divergence detected. Stopping training after 10 epochs.
Early stopping at epoch 19
Trial 33, Fold 2: Test Accuracy = 0.5575
Divergence detected. Stopping training after 10 epochs.
Early stopping at epoch 15
Trial 31, Fold 4: Test Accuracy = 0.4946
Divergence detected. Stopping training after 10 epochs.
Early stopping at epoch 10
Trial 32, Fold 2: Test Accuracy = 0.3447
Divergence detected. Stopping training after 10 epochs.
Early stopping at epoch 13
Trial 33, Fold 3: Test Accuracy = 0.5420
Divergence detected. Stopping training after 10 epochs.
Early stopping at epoch 10
Trial 32, Fold 3: Test Accuracy = 0.3527
Divergence detected. Stopping training after 10 epochs.
Early stopping at epoch 17
Trial 31, Fold 5: Test Accuracy = 0.5540
Trial 31: Mean Accuracy = 0.5172, Fold Accuracies = [np.float64(0.4806933979218855), np.float64(0.5043239119107623), np.float64(0.5521595582459221), np.float64(0.49463562753036444), np.float64(0.5540099382706279)]
[I 2025-05-01 03:34:15,548] Trial 31 finished with value: 0.5171644867759124 and parameters: {'num_heads': 32, 'num_transformer_blocks': 16, 'learning_rate': 0.00011574704437376741, 'optimizer': 'AdamW', 'weight_decay': 4.456542835707629e-05, 'batch_size': 16, 'label_smoothing': 0.2}. Best is trial 22 with value: 0.5348957503683117.
Hyperparameters: num_heads=4, num_transformer_blocks=4, learning_rate=2.561696280259492e-05, optimizer=AdamW, weight_decay=5.059535193850758e-05, batch_size=32,factor=1
Divergence detected. Stopping training after 10 epochs.
Early stopping at epoch 20
Trial 33, Fold 4: Test Accuracy = 0.4602
Divergence detected. Stopping training after 10 epochs.
Early stopping at epoch 14
Trial 33, Fold 5: Test Accuracy = 0.5859
Trial 33: Mean Accuracy = 0.5274, Fold Accuracies = [np.float64(0.49134042259050964), np.float64(0.5574975276740997), np.float64(0.5419616314711273), np.float64(0.46015519568151153), np.float64(0.5859447007618835)]
[I 2025-05-01 03:38:47,979] Trial 33 finished with value: 0.5273798956358263 and parameters: {'num_heads': 4, 'num_transformer_blocks': 4, 'learning_rate': 8.646610374182682e-05, 'optimizer': 'AdamW', 'weight_decay': 2.197701013609936e-05, 'batch_size': 32, 'label_smoothing': 0.2}. Best is trial 22 with value: 0.5348957503683117.
Hyperparameters: num_heads=4, num_transformer_blocks=4, learning_rate=1.8744860492714645e-05, optimizer=AdamW, weight_decay=5.506733415692717e-05, batch_size=32,factor=1
Divergence detected. Stopping training after 10 epochs.
Early stopping at epoch 26
Trial 34, Fold 1: Test Accuracy = 0.4835
Trial 35, Fold 1: Test Accuracy = 0.4774
Trial 34, Fold 2: Test Accuracy = 0.5970
Trial 32, Fold 4: Test Accuracy = 0.2814
Trial 34, Fold 3: Test Accuracy = 0.5183
Trial 35, Fold 2: Test Accuracy = 0.5730
Divergence detected. Stopping training after 10 epochs.
Early stopping at epoch 20
Trial 35, Fold 3: Test Accuracy = 0.4849
Trial 34, Fold 4: Test Accuracy = 0.4157
Trial 32, Fold 5: Test Accuracy = 0.2814
Trial 32: Mean Accuracy = 0.3145, Fold Accuracies = [np.float64(0.3123503265371578), np.float64(0.3446767899107836), np.float64(0.35274494401059714), np.float64(0.2814102564102564), np.float64(0.28137948062727564)]
[I 2025-05-01 04:03:14,163] Trial 32 finished with value: 0.3145123594992141 and parameters: {'num_heads': 32, 'num_transformer_blocks': 16, 'learning_rate': 4.3827154502351545e-07, 'optimizer': 'AdamW', 'weight_decay': 5.505094401197587e-05, 'batch_size': 16, 'label_smoothing': 0.2}. Best is trial 22 with value: 0.5348957503683117.
Hyperparameters: num_heads=4, num_transformer_blocks=4, learning_rate=2.3877333129173686e-05, optimizer=AdamW, weight_decay=2.080941910752093e-06, batch_size=32,factor=1
Divergence detected. Stopping training after 10 epochs.
Early stopping at epoch 21
Trial 36, Fold 1: Test Accuracy = 0.4656
Trial 34, Fold 5: Test Accuracy = 0.5876
Trial 34: Mean Accuracy = 0.5204, Fold Accuracies = [np.float64(0.48345942478585685), np.float64(0.5969550515200817), np.float64(0.5183070714538761), np.float64(0.4156882591093118), np.float64(0.5875992792139818)]
