[I 2025-05-01 21:57:01,922] Trial 126 finished with value: 0.5144838207819833 and parameters: {'num_heads': 2, 'num_transformer_blocks': 16, 'learning_rate': 8.589288898959194e-06, 'optimizer': 'Adam', 'weight_decay': 1.0020971359692609e-06, 'batch_size': 10, 'label_smoothing': 0.19}. Best is trial 86 with value: 0.5553539263859596.
Hyperparameters: num_heads=16, num_transformer_blocks=32, learning_rate=3.259055034760565e-06, optimizer=Adam, weight_decay=1.6292535335065366e-06, batch_size=10,factor=1
Trial 127, Fold 1: Test Accuracy = 0.4857
Trial 125, Fold 4: Test Accuracy = 0.4188
Divergence detected. Stopping training after 10 epochs.
Early stopping at epoch 23
Trial 125, Fold 5: Test Accuracy = 0.6248
Trial 125: Mean Accuracy = 0.5312, Fold Accuracies = [np.float64(0.4934387099985069), np.float64(0.59132452866303), np.float64(0.5277018930117215), np.float64(0.41879217273954117), np.float64(0.6247911775177452)]
[I 2025-05-01 22:08:32,971] Trial 125 finished with value: 0.5312096963861089 and parameters: {'num_heads': 2, 'num_transformer_blocks': 16, 'learning_rate': 1.2024252454829069e-05, 'optimizer': 'Adam', 'weight_decay': 6.333946794043769e-06, 'batch_size': 10, 'label_smoothing': 0.18}. Best is trial 86 with value: 0.5553539263859596.
Hyperparameters: num_heads=16, num_transformer_blocks=4, learning_rate=4.029936860246839e-05, optimizer=Adam, weight_decay=1.146240811336436e-06, batch_size=10,factor=1
Trial 127, Fold 2: Test Accuracy = 0.5917
Trial 128, Fold 1: Test Accuracy = 0.4082
Divergence detected. Stopping training after 10 epochs.
Early stopping at epoch 18
Trial 129, Fold 1: Test Accuracy = 0.5217
Divergence detected. Stopping training after 10 epochs.
Early stopping at epoch 11
Divergence detected. Stopping training after 10 epochs.
Early stopping at epoch 13
Trial 128, Fold 2: Test Accuracy = 0.3349
Trial 129, Fold 2: Test Accuracy = 0.5907
Divergence detected. Stopping training after 10 epochs.
Early stopping at epoch 18
Trial 129, Fold 3: Test Accuracy = 0.5420
Divergence detected. Stopping training after 10 epochs.
Early stopping at epoch 28
Trial 127, Fold 3: Test Accuracy = 0.5142
Divergence detected. Stopping training after 10 epochs.
Early stopping at epoch 21
Trial 129, Fold 4: Test Accuracy = 0.4387
Trial 128, Fold 3: Test Accuracy = 0.4725
Divergence detected. Stopping training after 10 epochs.
Early stopping at epoch 19
Trial 129, Fold 5: Test Accuracy = 0.5938
Trial 129: Mean Accuracy = 0.5374, Fold Accuracies = [np.float64(0.5216918661557093), np.float64(0.590691825905722), np.float64(0.5419593980561589), np.float64(0.438697705802969), np.float64(0.5937647160216843)]
[I 2025-05-01 22:32:59,743] Trial 129 finished with value: 0.5373611023884487 and parameters: {'num_heads': 16, 'num_transformer_blocks': 4, 'learning_rate': 4.029936860246839e-05, 'optimizer': 'Adam', 'weight_decay': 1.146240811336436e-06, 'batch_size': 10, 'label_smoothing': 0.12}. Best is trial 86 with value: 0.5553539263859596.
Hyperparameters: num_heads=16, num_transformer_blocks=2, learning_rate=0.00013614178016474758, optimizer=Adam, weight_decay=1.1629609811905326e-06, batch_size=10,factor=1
Trial 127, Fold 4: Test Accuracy = 0.3466
Divergence detected. Stopping training after 10 epochs.
Early stopping at epoch 12
Trial 130, Fold 1: Test Accuracy = 0.5324
Divergence detected. Stopping training after 10 epochs.
Early stopping at epoch 14
Trial 130, Fold 2: Test Accuracy = 0.5554
Divergence detected. Stopping training after 10 epochs.
Early stopping at epoch 15
Trial 130, Fold 3: Test Accuracy = 0.5374
Divergence detected. Stopping training after 10 epochs.
Early stopping at epoch 24
Trial 127, Fold 5: Test Accuracy = 0.5987
Trial 127: Mean Accuracy = 0.5074, Fold Accuracies = [np.float64(0.4857454171436155), np.float64(0.5917139864527174), np.float64(0.5141691696317175), np.float64(0.34659244264507416), np.float64(0.5986614025927768)]
[I 2025-05-01 22:45:23,051] Trial 127 finished with value: 0.5073764836931802 and parameters: {'num_heads': 16, 'num_transformer_blocks': 32, 'learning_rate': 8.897150177110242e-06, 'optimizer': 'Adam', 'weight_decay': 1.1676045364791909e-06, 'batch_size': 10, 'label_smoothing': 0.12}. Best is trial 86 with value: 0.5553539263859596.
Hyperparameters: num_heads=16, num_transformer_blocks=2, learning_rate=0.00012529753340761099, optimizer=Adam, weight_decay=1.7576629947368491e-06, batch_size=10,factor=1
Trial 128, Fold 4: Test Accuracy = 0.3481
Divergence detected. Stopping training after 10 epochs.
Early stopping at epoch 15
Trial 130, Fold 4: Test Accuracy = 0.5144
Divergence detected. Stopping training after 10 epochs.
Early stopping at epoch 12
Trial 131, Fold 1: Test Accuracy = 0.4938
Divergence detected. Stopping training after 10 epochs.
Early stopping at epoch 12
Trial 130, Fold 5: Test Accuracy = 0.5828
Trial 130: Mean Accuracy = 0.5445, Fold Accuracies = [np.float64(0.5323874649546277), np.float64(0.5553761125466552), np.float64(0.5374059270212405), np.float64(0.5144062078272605), np.float64(0.582758858051685)]
[I 2025-05-01 22:49:46,283] Trial 130 finished with value: 0.5444669140802938 and parameters: {'num_heads': 16, 'num_transformer_blocks': 2, 'learning_rate': 0.00013614178016474758, 'optimizer': 'Adam', 'weight_decay': 1.1629609811905326e-06, 'batch_size': 10, 'label_smoothing': 0.12}. Best is trial 86 with value: 0.5553539263859596.
Hyperparameters: num_heads=16, num_transformer_blocks=2, learning_rate=0.000142228634537685, optimizer=Adam, weight_decay=1.3210296419016843e-06, batch_size=10,factor=1
Divergence detected. Stopping training after 10 epochs.
Early stopping at epoch 12
Trial 131, Fold 2: Test Accuracy = 0.5752
Divergence detected. Stopping training after 10 epochs.
Early stopping at epoch 16
Trial 132, Fold 1: Test Accuracy = 0.5036
Divergence detected. Stopping training after 10 epochs.
Early stopping at epoch 12
Trial 131, Fold 3: Test Accuracy = 0.5439
Divergence detected. Stopping training after 10 epochs.
Early stopping at epoch 14
Trial 132, Fold 2: Test Accuracy = 0.4911
Divergence detected. Stopping training after 10 epochs.
Early stopping at epoch 18
Trial 131, Fold 4: Test Accuracy = 0.4411
Trial 128, Fold 5: Test Accuracy = 0.5440
Trial 128: Mean Accuracy = 0.4216, Fold Accuracies = [np.float64(0.40821110724022186), np.float64(0.3349483204134367), np.float64(0.47250912619564717), np.float64(0.34814439946018894), np.float64(0.5439896759425039)]
[I 2025-05-01 22:59:21,193] Trial 128 finished with value: 0.4215605258503997 and parameters: {'num_heads': 16, 'num_transformer_blocks': 32, 'learning_rate': 3.259055034760565e-06, 'optimizer': 'Adam', 'weight_decay': 1.6292535335065366e-06, 'batch_size': 10, 'label_smoothing': 0.12}. Best is trial 86 with value: 0.5553539263859596.
Hyperparameters: num_heads=16, num_transformer_blocks=2, learning_rate=0.00012771315175564576, optimizer=Adam, weight_decay=1.3852738619108427e-06, batch_size=10,factor=1
Divergence detected. Stopping training after 10 epochs.
Early stopping at epoch 11
Trial 132, Fold 3: Test Accuracy = 0.5454
Divergence detected. Stopping training after 10 epochs.
Early stopping at epoch 13
Trial 131, Fold 5: Test Accuracy = 0.5713
Trial 131: Mean Accuracy = 0.5251, Fold Accuracies = [np.float64(0.4938393359765976), np.float64(0.5752464350655565), np.float64(0.5439277297721917), np.float64(0.44109311740890694), np.float64(0.5713442902691754)]
[I 2025-05-01 23:01:59,705] Trial 131 finished with value: 0.5250901816984858 and parameters: {'num_heads': 16, 'num_transformer_blocks': 2, 'learning_rate': 0.00012529753340761099, 'optimizer': 'Adam', 'weight_decay': 1.7576629947368491e-06, 'batch_size': 10, 'label_smoothing': 0.1}. Best is trial 86 with value: 0.5553539263859596.
Hyperparameters: num_heads=16, num_transformer_blocks=2, learning_rate=7.686573697574408e-05, optimizer=Adam, weight_decay=1.3203576152291836e-06, batch_size=10,factor=1
Divergence detected. Stopping training after 10 epochs.
Early stopping at epoch 13
Trial 133, Fold 1: Test Accuracy = 0.5261
Divergence detected. Stopping training after 10 epochs.
Early stopping at epoch 16
Trial 134, Fold 1: Test Accuracy = 0.4724
Divergence detected. Stopping training after 10 epochs.
Early stopping at epoch 19
Trial 132, Fold 4: Test Accuracy = 0.4864
Divergence detected. Stopping training after 10 epochs.
Early stopping at epoch 15
Trial 133, Fold 2: Test Accuracy = 0.5458
Divergence detected. Stopping training after 10 epochs.
Early stopping at epoch 12
Trial 132, Fold 5: Test Accuracy = 0.5705
Trial 132: Mean Accuracy = 0.5194, Fold Accuracies = [np.float64(0.5036072042778856), np.float64(0.491054433704448), np.float64(0.5454104862683486), np.float64(0.48640350877192984), np.float64(0.5705485614388742)]
[I 2025-05-01 23:10:53,407] Trial 132 finished with value: 0.5194048388922973 and parameters: {'num_heads': 16, 'num_transformer_blocks': 2, 'learning_rate': 0.000142228634537685, 'optimizer': 'Adam', 'weight_decay': 1.3210296419016843e-06, 'batch_size': 10, 'label_smoothing': 0.1}. Best is trial 86 with value: 0.5553539263859596.
Hyperparameters: num_heads=16, num_transformer_blocks=2, learning_rate=7.747277657326559e-05, optimizer=Adam, weight_decay=1.1266076895341462e-06, batch_size=10,factor=1
Divergence detected. Stopping training after 10 epochs.
Early stopping at epoch 17
Trial 134, Fold 2: Test Accuracy = 0.5753
Divergence detected. Stopping training after 10 epochs.
Early stopping at epoch 19
Trial 133, Fold 3: Test Accuracy = 0.6095
Divergence detected. Stopping training after 10 epochs.
Early stopping at epoch 13
Trial 135, Fold 1: Test Accuracy = 0.4876
Divergence detected. Stopping training after 10 epochs.
Early stopping at epoch 20
Trial 134, Fold 3: Test Accuracy = 0.4870
Divergence detected. Stopping training after 10 epochs.
Early stopping at epoch 16
Trial 133, Fold 4: Test Accuracy = 0.4287
Divergence detected. Stopping training after 10 epochs.
Early stopping at epoch 13
Trial 135, Fold 2: Test Accuracy = 0.5557
Divergence detected. Stopping training after 10 epochs.
Early stopping at epoch 15
Trial 133, Fold 5: Test Accuracy = 0.5924
Trial 133: Mean Accuracy = 0.5405, Fold Accuracies = [np.float64(0.5260673424133335), np.float64(0.5457872098340085), np.float64(0.6094632872787765), np.float64(0.42874493927125507), np.float64(0.5923559638199198)]
[I 2025-05-01 23:22:26,249] Trial 133 finished with value: 0.5404837485234587 and parameters: {'num_heads': 16, 'num_transformer_blocks': 2, 'learning_rate': 0.00012771315175564576, 'optimizer': 'Adam', 'weight_decay': 1.3852738619108427e-06, 'batch_size': 10, 'label_smoothing': 0.14}. Best is trial 86 with value: 0.5553539263859596.
Hyperparameters: num_heads=16, num_transformer_blocks=2, learning_rate=0.00021508398500403553, optimizer=Adam, weight_decay=1.1638099708851568e-06, batch_size=10,factor=1
Divergence detected. Stopping training after 10 epochs.
Early stopping at epoch 21
Trial 134, Fold 4: Test Accuracy = 0.4405
Divergence detected. Stopping training after 10 epochs.
Early stopping at epoch 22
Trial 135, Fold 3: Test Accuracy = 0.5521
Divergence detected. Stopping training after 10 epochs.
Early stopping at epoch 16
Trial 136, Fold 1: Test Accuracy = 0.5013
Divergence detected. Stopping training after 10 epochs.
Early stopping at epoch 20
Trial 134, Fold 5: Test Accuracy = 0.5655
Trial 134: Mean Accuracy = 0.5081, Fold Accuracies = [np.float64(0.4724129685849688), np.float64(0.5753381503812167), np.float64(0.4869632487716218), np.float64(0.4404520917678812), np.float64(0.5655334313859796)]
[I 2025-05-01 23:28:23,006] Trial 134 finished with value: 0.5081399781783336 and parameters: {'num_heads': 16, 'num_transformer_blocks': 2, 'learning_rate': 7.686573697574408e-05, 'optimizer': 'Adam', 'weight_decay': 1.3203576152291836e-06, 'batch_size': 10, 'label_smoothing': 0.11}. Best is trial 86 with value: 0.5553539263859596.
Hyperparameters: num_heads=16, num_transformer_blocks=2, learning_rate=0.00023045015629036885, optimizer=Adam, weight_decay=1.1523205860116413e-06, batch_size=10,factor=1
Divergence detected. Stopping training after 10 epochs.
Early stopping at epoch 20
Trial 135, Fold 4: Test Accuracy = 0.4495
Divergence detected. Stopping training after 10 epochs.
Early stopping at epoch 15
Trial 136, Fold 2: Test Accuracy = 0.5138
Divergence detected. Stopping training after 10 epochs.
Early stopping at epoch 12
Trial 137, Fold 1: Test Accuracy = 0.5277
Divergence detected. Stopping training after 10 epochs.
Early stopping at epoch 11
Trial 135, Fold 5: Test Accuracy = 0.6113
Trial 135: Mean Accuracy = 0.5312, Fold Accuracies = [np.float64(0.48755743570176463), np.float64(0.5556818302655225), np.float64(0.5521282134220538), np.float64(0.44949392712550607), np.float64(0.6112906383406553)]
[I 2025-05-01 23:34:14,761] Trial 135 finished with value: 0.5312304089711004 and parameters: {'num_heads': 16, 'num_transformer_blocks': 2, 'learning_rate': 7.747277657326559e-05, 'optimizer': 'Adam', 'weight_decay': 1.1266076895341462e-06, 'batch_size': 10, 'label_smoothing': 0.14}. Best is trial 86 with value: 0.5553539263859596.
Hyperparameters: num_heads=16, num_transformer_blocks=4, learning_rate=0.00020904212330170825, optimizer=Adam, weight_decay=1.0068861174231567e-06, batch_size=10,factor=1
Divergence detected. Stopping training after 10 epochs.
Early stopping at epoch 12
Trial 136, Fold 3: Test Accuracy = 0.5289
Divergence detected. Stopping training after 10 epochs.
Early stopping at epoch 14
Trial 137, Fold 2: Test Accuracy = 0.4536
Divergence detected. Stopping training after 10 epochs.
Early stopping at epoch 12
Trial 138, Fold 1: Test Accuracy = 0.5063
Divergence detected. Stopping training after 10 epochs.
Early stopping at epoch 14
Trial 136, Fold 4: Test Accuracy = 0.4761
Divergence detected. Stopping training after 10 epochs.
Early stopping at epoch 11
Trial 137, Fold 3: Test Accuracy = 0.5690
Divergence detected. Stopping training after 10 epochs.
Early stopping at epoch 15
Trial 138, Fold 2: Test Accuracy = 0.5159
Divergence detected. Stopping training after 10 epochs.
Early stopping at epoch 11
Trial 137, Fold 4: Test Accuracy = 0.5103
Divergence detected. Stopping training after 10 epochs.
Early stopping at epoch 16
Trial 136, Fold 5: Test Accuracy = 0.5488
Trial 136: Mean Accuracy = 0.5138, Fold Accuracies = [np.float64(0.5013132047092133), np.float64(0.5137785646686021), np.float64(0.5289122498960307), np.float64(0.4761133603238867), np.float64(0.5487894609762259)]
[I 2025-05-01 23:43:48,862] Trial 136 finished with value: 0.5137813681147916 and parameters: {'num_heads': 16, 'num_transformer_blocks': 2, 'learning_rate': 0.00021508398500403553, 'optimizer': 'Adam', 'weight_decay': 1.1638099708851568e-06, 'batch_size': 10, 'label_smoothing': 0.14}. Best is trial 86 with value: 0.5553539263859596.
Hyperparameters: num_heads=16, num_transformer_blocks=4, learning_rate=5.813158155810114e-05, optimizer=Adam, weight_decay=0.0007318031906742477, batch_size=10,factor=1
Divergence detected. Stopping training after 10 epochs.
Early stopping at epoch 15
Trial 138, Fold 3: Test Accuracy = 0.5499
Divergence detected. Stopping training after 10 epochs.
Early stopping at epoch 17
Trial 137, Fold 5: Test Accuracy = 0.5118
Trial 137: Mean Accuracy = 0.5145, Fold Accuracies = [np.float64(0.5276947969718587), np.float64(0.4535893918609968), np.float64(0.5690110592548095), np.float64(0.5102564102564103), np.float64(0.5118170176134711)]
[I 2025-05-01 23:47:34,265] Trial 137 finished with value: 0.5144737351915094 and parameters: {'num_heads': 16, 'num_transformer_blocks': 2, 'learning_rate': 0.00023045015629036885, 'optimizer': 'Adam', 'weight_decay': 1.1523205860116413e-06, 'batch_size': 10, 'label_smoothing': 0.13}. Best is trial 86 with value: 0.5553539263859596.
Hyperparameters: num_heads=16, num_transformer_blocks=4, learning_rate=3.791748745220864e-05, optimizer=Adam, weight_decay=1.4234382831671557e-06, batch_size=10,factor=1
[W 2025-05-01 23:48:42,613] Trial 140 failed with parameters: {'num_heads': 16, 'num_transformer_blocks': 4, 'learning_rate': 3.791748745220864e-05, 'optimizer': 'Adam', 'weight_decay': 1.4234382831671557e-06, 'batch_size': 10, 'label_smoothing': 0.15} because of the following error: RuntimeError('DataLoader worker (pid(s) 28076) exited unexpectedly').
Traceback (most recent call last):
  File "c:\Users\Gabriel\anaconda3\envs\cudaenv\Lib\site-packages\torch\utils\data\dataloader.py", line 1251, in _try_get_data
    data = self._data_queue.get(timeout=timeout)
  File "c:\Users\Gabriel\anaconda3\envs\cudaenv\Lib\queue.py", line 212, in get
    raise Empty
_queue.Empty

The above exception was the direct cause of the following exception:

Traceback (most recent call last):
  File "c:\Users\Gabriel\anaconda3\envs\cudaenv\Lib\site-packages\optuna\study\_optimize.py", line 197, in _run_trial
    value_or_values = func(trial)
  File "C:\Users\Gabriel\AppData\Local\Temp\ipykernel_29172\348537963.py", line 82, in objective
    for inputs, labels in train_loader:
                          ^^^^^^^^^^^^
  File "c:\Users\Gabriel\anaconda3\envs\cudaenv\Lib\site-packages\torch\utils\data\dataloader.py", line 708, in __next__
    data = self._next_data()
  File "c:\Users\Gabriel\anaconda3\envs\cudaenv\Lib\site-packages\torch\utils\data\dataloader.py", line 1458, in _next_data
    idx, data = self._get_data()
                ~~~~~~~~~~~~~~^^
  File "c:\Users\Gabriel\anaconda3\envs\cudaenv\Lib\site-packages\torch\utils\data\dataloader.py", line 1410, in _get_data
    success, data = self._try_get_data()
                    ~~~~~~~~~~~~~~~~~~^^
  File "c:\Users\Gabriel\anaconda3\envs\cudaenv\Lib\site-packages\torch\utils\data\dataloader.py", line 1264, in _try_get_data
    raise RuntimeError(
        f"DataLoader worker (pid(s) {pids_str}) exited unexpectedly"
    ) from e
RuntimeError: DataLoader worker (pid(s) 28076) exited unexpectedly
[W 2025-05-01 23:48:42,738] Trial 140 failed with value None.
Divergence detected. Stopping training after 10 epochs.
Early stopping at epoch 17
Trial 139, Fold 1: Test Accuracy = 0.5030
Divergence detected. Stopping training after 10 epochs.
Early stopping at epoch 16
Trial 138, Fold 4: Test Accuracy = 0.4558
Divergence detected. Stopping training after 10 epochs.
Early stopping at epoch 14
Trial 139, Fold 2: Test Accuracy = 0.5882
Divergence detected. Stopping training after 10 epochs.
Early stopping at epoch 12
Trial 138, Fold 5: Test Accuracy = 0.5218
Trial 138: Mean Accuracy = 0.5100, Fold Accuracies = [np.float64(0.506323727998142), np.float64(0.5159451728501399), np.float64(0.5499333826224913), np.float64(0.45580296896086364), np.float64(0.5217721827490555)]
[I 2025-05-01 23:54:01,709] Trial 138 finished with value: 0.5099554870361385 and parameters: {'num_heads': 16, 'num_transformer_blocks': 4, 'learning_rate': 0.00020904212330170825, 'optimizer': 'Adam', 'weight_decay': 1.0068861174231567e-06, 'batch_size': 10, 'label_smoothing': 0.13}. Best is trial 86 with value: 0.5553539263859596.
Divergence detected. Stopping training after 10 epochs.
Early stopping at epoch 12
Trial 139, Fold 3: Test Accuracy = 0.5589
Divergence detected. Stopping training after 10 epochs.
Early stopping at epoch 26
Trial 139, Fold 4: Test Accuracy = 0.4476
Divergence detected. Stopping training after 10 epochs.
Early stopping at epoch 17
Trial 139, Fold 5: Test Accuracy = 0.5494
Trial 139: Mean Accuracy = 0.5294, Fold Accuracies = [np.float64(0.5029877735197996), np.float64(0.5881503812167034), np.float64(0.5588571846649107), np.float64(0.44757085020242915), np.float64(0.5493960672463922)]
[I 2025-05-02 00:00:26,797] Trial 139 finished with value: 0.529392451370047 and parameters: {'num_heads': 16, 'num_transformer_blocks': 4, 'learning_rate': 5.813158155810114e-05, 'optimizer': 'Adam', 'weight_decay': 0.0007318031906742477, 'batch_size': 10, 'label_smoothing': 0.13}. Best is trial 86 with value: 0.5553539263859596.