[I 2025-05-01 11:10:26,187] Trial 69 finished with value: 0.5460321428889335 and parameters: {'num_heads': 2, 'num_transformer_blocks': 4, 'learning_rate': 1.2292958406478385e-05, 'optimizer': 'Adam', 'weight_decay': 5.221031733062504e-06, 'batch_size': 32, 'label_smoothing': 0.16}. Best is trial 69 with value: 0.5460321428889335.
Hyperparameters: num_heads=2, num_transformer_blocks=4, learning_rate=2.4078508508286425e-05, optimizer=Adam, weight_decay=1.3991181350094591e-06, batch_size=32,factor=1
Trial 73, Fold 1: Test Accuracy = 0.5356
Divergence detected. Stopping training after 10 epochs.
Early stopping at epoch 20
Trial 71, Fold 3: Test Accuracy = 0.3333
Divergence detected. Stopping training after 10 epochs.
Early stopping at epoch 15
Trial 72, Fold 1: Test Accuracy = 0.3333
Divergence detected. Stopping training after 10 epochs.
Early stopping at epoch 26
Trial 73, Fold 2: Test Accuracy = 0.5558
Divergence detected. Stopping training after 10 epochs.
Early stopping at epoch 22
Trial 71, Fold 4: Test Accuracy = 0.3333
Trial 73, Fold 3: Test Accuracy = 0.4810
Divergence detected. Stopping training after 10 epochs.
Early stopping at epoch 10
Trial 71, Fold 5: Test Accuracy = 0.3333
Trial 71: Mean Accuracy = 0.3333, Fold Accuracies = [np.float64(0.3333333333333333), np.float64(0.3333333333333333), np.float64(0.3333333333333333), np.float64(0.3333333333333333), np.float64(0.3333333333333333)]
[I 2025-05-01 11:29:13,504] Trial 71 finished with value: 0.3333333333333333 and parameters: {'num_heads': 2, 'num_transformer_blocks': 32, 'learning_rate': 0.0005649187449794972, 'optimizer': 'Adam', 'weight_decay': 0.00010425284365765631, 'batch_size': 32, 'label_smoothing': 0.12}. Best is trial 69 with value: 0.5460321428889335.
Hyperparameters: num_heads=2, num_transformer_blocks=4, learning_rate=1.909050216241631e-05, optimizer=Adam, weight_decay=1.6244012857684503e-06, batch_size=32,factor=1
Trial 73, Fold 4: Test Accuracy = 0.4595
Divergence detected. Stopping training after 10 epochs.
Early stopping at epoch 17
Trial 72, Fold 2: Test Accuracy = 0.3333
Divergence detected. Stopping training after 10 epochs.
Early stopping at epoch 28
Trial 74, Fold 1: Test Accuracy = 0.4623
Trial 73, Fold 5: Test Accuracy = 0.6206
Trial 73: Mean Accuracy = 0.5305, Fold Accuracies = [np.float64(0.5356373308559642), np.float64(0.5558200678427495), np.float64(0.48099725829059037), np.float64(0.45951417004048584), np.float64(0.6206413224574051)]
[I 2025-05-01 11:37:24,391] Trial 73 finished with value: 0.530522029897439 and parameters: {'num_heads': 2, 'num_transformer_blocks': 4, 'learning_rate': 2.4078508508286425e-05, 'optimizer': 'Adam', 'weight_decay': 1.3991181350094591e-06, 'batch_size': 32, 'label_smoothing': 0.12}. Best is trial 69 with value: 0.5460321428889335.
Hyperparameters: num_heads=2, num_transformer_blocks=4, learning_rate=1.8612580136166856e-05, optimizer=Adam, weight_decay=9.840346656954297e-06, batch_size=32,factor=1
Divergence detected. Stopping training after 10 epochs.
Early stopping at epoch 28
Trial 74, Fold 2: Test Accuracy = 0.6122
Trial 75, Fold 1: Test Accuracy = 0.4832
Divergence detected. Stopping training after 10 epochs.
Early stopping at epoch 13
Trial 72, Fold 3: Test Accuracy = 0.3333
Divergence detected. Stopping training after 10 epochs.
Early stopping at epoch 22
Trial 74, Fold 3: Test Accuracy = 0.5180
Trial 75, Fold 2: Test Accuracy = 0.5604
Divergence detected. Stopping training after 10 epochs.
Early stopping at epoch 19
Trial 75, Fold 3: Test Accuracy = 0.5008
Trial 74, Fold 4: Test Accuracy = 0.4833
Divergence detected. Stopping training after 10 epochs.
Early stopping at epoch 12
Trial 72, Fold 4: Test Accuracy = 0.3333
Trial 75, Fold 4: Test Accuracy = 0.4610
Trial 74, Fold 5: Test Accuracy = 0.5958
Trial 74: Mean Accuracy = 0.5343, Fold Accuracies = [np.float64(0.4622610638309637), np.float64(0.6122449250858668), np.float64(0.5179823791260416), np.float64(0.48333333333333334), np.float64(0.5958219096939527)]
[I 2025-05-01 12:02:20,724] Trial 74 finished with value: 0.5343287222140316 and parameters: {'num_heads': 2, 'num_transformer_blocks': 4, 'learning_rate': 1.909050216241631e-05, 'optimizer': 'Adam', 'weight_decay': 1.6244012857684503e-06, 'batch_size': 32, 'label_smoothing': 0.16}. Best is trial 69 with value: 0.5460321428889335.
Hyperparameters: num_heads=2, num_transformer_blocks=4, learning_rate=1.6019548422019688e-05, optimizer=Adam, weight_decay=3.471489469857592e-06, batch_size=32,factor=1
Trial 75, Fold 5: Test Accuracy = 0.6324
Trial 75: Mean Accuracy = 0.5276, Fold Accuracies = [np.float64(0.48323703666838097), np.float64(0.5604483682649057), np.float64(0.5008104215763289), np.float64(0.4609649122807018), np.float64(0.6323893066151697)]
[I 2025-05-01 12:06:36,325] Trial 75 finished with value: 0.5275700090810973 and parameters: {'num_heads': 2, 'num_transformer_blocks': 4, 'learning_rate': 1.8612580136166856e-05, 'optimizer': 'Adam', 'weight_decay': 9.840346656954297e-06, 'batch_size': 32, 'label_smoothing': 0.16}. Best is trial 69 with value: 0.5460321428889335.
Hyperparameters: num_heads=2, num_transformer_blocks=4, learning_rate=8.734462674314478e-06, optimizer=Adam, weight_decay=3.454464701825009e-06, batch_size=10,factor=1
Trial 76, Fold 1: Test Accuracy = 0.5086
Divergence detected. Stopping training after 10 epochs.
Early stopping at epoch 21
Trial 72, Fold 5: Test Accuracy = 0.3333
Trial 72: Mean Accuracy = 0.3333, Fold Accuracies = [np.float64(0.3333333333333333), np.float64(0.3333333333333333), np.float64(0.3333333333333333), np.float64(0.3333333333333333), np.float64(0.3333333333333333)]
[I 2025-05-01 12:11:54,460] Trial 72 finished with value: 0.3333333333333333 and parameters: {'num_heads': 32, 'num_transformer_blocks': 32, 'learning_rate': 0.0005260161561029145, 'optimizer': 'Adam', 'weight_decay': 1.597586695911942e-05, 'batch_size': 10, 'label_smoothing': 0.12}. Best is trial 69 with value: 0.5460321428889335.
Hyperparameters: num_heads=2, num_transformer_blocks=4, learning_rate=9.751851100150189e-06, optimizer=Adam, weight_decay=2.9261036765171518e-06, batch_size=32,factor=1
Divergence detected. Stopping training after 10 epochs.
Early stopping at epoch 22
Trial 76, Fold 2: Test Accuracy = 0.5651
Trial 77, Fold 1: Test Accuracy = 0.4852
Trial 78, Fold 1: Test Accuracy = 0.4516
Trial 76, Fold 3: Test Accuracy = 0.5333
Trial 78, Fold 2: Test Accuracy = 0.5827
Trial 76, Fold 4: Test Accuracy = 0.4491
Trial 77, Fold 2: Test Accuracy = 0.5748
Trial 78, Fold 3: Test Accuracy = 0.4892
Trial 76, Fold 5: Test Accuracy = 0.5976
Trial 76: Mean Accuracy = 0.5307, Fold Accuracies = [np.float64(0.5085709229858933), np.float64(0.5650873023468487), np.float64(0.5332886650339633), np.float64(0.449055330634278), np.float64(0.5975944271907666)]
[I 2025-05-01 12:35:00,046] Trial 76 finished with value: 0.5307193296383501 and parameters: {'num_heads': 2, 'num_transformer_blocks': 4, 'learning_rate': 1.6019548422019688e-05, 'optimizer': 'Adam', 'weight_decay': 3.471489469857592e-06, 'batch_size': 32, 'label_smoothing': 0.16}. Best is trial 69 with value: 0.5460321428889335.
Hyperparameters: num_heads=2, num_transformer_blocks=4, learning_rate=7.401036929348286e-06, optimizer=Adam, weight_decay=1.0387395714813444e-06, batch_size=32,factor=1
Trial 78, Fold 4: Test Accuracy = 0.4691
Trial 79, Fold 1: Test Accuracy = 0.4476
Trial 77, Fold 3: Test Accuracy = 0.5194
Trial 78, Fold 5: Test Accuracy = 0.6189
Trial 78: Mean Accuracy = 0.5223, Fold Accuracies = [np.float64(0.45157997533690564), np.float64(0.5827099350283387), np.float64(0.4891509172404233), np.float64(0.46906207827260454), np.float64(0.6188733614332906)]
[I 2025-05-01 12:46:06,043] Trial 78 finished with value: 0.5222752534623126 and parameters: {'num_heads': 2, 'num_transformer_blocks': 4, 'learning_rate': 9.751851100150189e-06, 'optimizer': 'Adam', 'weight_decay': 2.9261036765171518e-06, 'batch_size': 32, 'label_smoothing': 0.17}. Best is trial 69 with value: 0.5460321428889335.
Hyperparameters: num_heads=2, num_transformer_blocks=2, learning_rate=5.1600777967054974e-05, optimizer=Adam, weight_decay=1.094870001803517e-06, batch_size=10,factor=1
Trial 79, Fold 2: Test Accuracy = 0.6221
Divergence detected. Stopping training after 10 epochs.
Early stopping at epoch 14
Trial 80, Fold 1: Test Accuracy = 0.4758
Trial 77, Fold 4: Test Accuracy = 0.4871
Trial 79, Fold 3: Test Accuracy = 0.5245
Divergence detected. Stopping training after 10 epochs.
Early stopping at epoch 22
Trial 80, Fold 2: Test Accuracy = 0.5267
Divergence detected. Stopping training after 10 epochs.
Early stopping at epoch 10
Trial 79, Fold 4: Test Accuracy = 0.4126
Divergence detected. Stopping training after 10 epochs.
Early stopping at epoch 16
Trial 79, Fold 5: Test Accuracy = 0.4059
Trial 79: Mean Accuracy = 0.4825, Fold Accuracies = [np.float64(0.44761547692120524), np.float64(0.6221023277081273), np.float64(0.5245322150855629), np.float64(0.4125843454790823), np.float64(0.4058500842418204)]
[I 2025-05-01 13:01:40,778] Trial 79 finished with value: 0.4825368898871596 and parameters: {'num_heads': 2, 'num_transformer_blocks': 4, 'learning_rate': 7.401036929348286e-06, 'optimizer': 'Adam', 'weight_decay': 1.0387395714813444e-06, 'batch_size': 32, 'label_smoothing': 0.14}. Best is trial 69 with value: 0.5460321428889335.
Hyperparameters: num_heads=2, num_transformer_blocks=2, learning_rate=5.380157707158239e-05, optimizer=Adam, weight_decay=0.0009833215008215829, batch_size=10,factor=1
Divergence detected. Stopping training after 10 epochs.
Early stopping at epoch 18
Trial 80, Fold 3: Test Accuracy = 0.6058
Trial 77, Fold 5: Test Accuracy = 0.6190
Trial 77: Mean Accuracy = 0.5371, Fold Accuracies = [np.float64(0.4852494124543097), np.float64(0.5748024797694623), np.float64(0.5194474223310691), np.float64(0.4871120107962213), np.float64(0.6189960388788351)]
[I 2025-05-01 13:04:27,013] Trial 77 finished with value: 0.5371214728459796 and parameters: {'num_heads': 2, 'num_transformer_blocks': 4, 'learning_rate': 8.734462674314478e-06, 'optimizer': 'Adam', 'weight_decay': 3.454464701825009e-06, 'batch_size': 10, 'label_smoothing': 0.17}. Best is trial 69 with value: 0.5460321428889335.
Hyperparameters: num_heads=2, num_transformer_blocks=4, learning_rate=2.341357311510307e-06, optimizer=Adam, weight_decay=5.284994698615909e-06, batch_size=10,factor=1
Divergence detected. Stopping training after 10 epochs.
Early stopping at epoch 14
Trial 81, Fold 1: Test Accuracy = 0.4906
Divergence detected. Stopping training after 10 epochs.
Early stopping at epoch 24
Trial 80, Fold 4: Test Accuracy = 0.5218
Trial 82, Fold 1: Test Accuracy = 0.4245
Divergence detected. Stopping training after 10 epochs.
Early stopping at epoch 16
Trial 80, Fold 5: Test Accuracy = 0.5952
Trial 80: Mean Accuracy = 0.5451, Fold Accuracies = [np.float64(0.4757703788494611), np.float64(0.5267170702140556), np.float64(0.6057921691850345), np.float64(0.5217948717948718), np.float64(0.5951785125943139)]
[I 2025-05-01 13:12:42,171] Trial 80 finished with value: 0.5450506005275474 and parameters: {'num_heads': 2, 'num_transformer_blocks': 2, 'learning_rate': 5.1600777967054974e-05, 'optimizer': 'Adam', 'weight_decay': 1.094870001803517e-06, 'batch_size': 10, 'label_smoothing': 0.21}. Best is trial 69 with value: 0.5460321428889335.
Hyperparameters: num_heads=2, num_transformer_blocks=2, learning_rate=2.5648532646044315e-05, optimizer=Adam, weight_decay=1.6214656573609924e-06, batch_size=10,factor=1
Trial 81, Fold 2: Test Accuracy = 0.5973
Divergence detected. Stopping training after 10 epochs.
Early stopping at epoch 10
Trial 82, Fold 2: Test Accuracy = 0.3866
Divergence detected. Stopping training after 10 epochs.
Early stopping at epoch 18
Trial 83, Fold 1: Test Accuracy = 0.5084
Divergence detected. Stopping training after 10 epochs.
Early stopping at epoch 17
Trial 81, Fold 3: Test Accuracy = 0.5033
Divergence detected. Stopping training after 10 epochs.
Early stopping at epoch 19
Trial 81, Fold 4: Test Accuracy = 0.4413
Trial 83, Fold 2: Test Accuracy = 0.5369
Trial 82, Fold 3: Test Accuracy = 0.4859
Divergence detected. Stopping training after 10 epochs.
Early stopping at epoch 10
Trial 82, Fold 4: Test Accuracy = 0.3327
Divergence detected. Stopping training after 10 epochs.
Early stopping at epoch 21
Divergence detected. Stopping training after 10 epochs.
Early stopping at epoch 22
Trial 81, Fold 5: Test Accuracy = 0.6088
Trial 81: Mean Accuracy = 0.5283, Fold Accuracies = [np.float64(0.49059548654313007), np.float64(0.5973072915005158), np.float64(0.5033411117785684), np.float64(0.44129554655870445), np.float64(0.6087660464951735)]
[I 2025-05-01 13:30:38,552] Trial 81 finished with value: 0.5282610965752185 and parameters: {'num_heads': 2, 'num_transformer_blocks': 2, 'learning_rate': 5.380157707158239e-05, 'optimizer': 'Adam', 'weight_decay': 0.0009833215008215829, 'batch_size': 10, 'label_smoothing': 0.15}. Best is trial 69 with value: 0.5460321428889335.
Hyperparameters: num_heads=2, num_transformer_blocks=2, learning_rate=2.3607299710569063e-06, optimizer=Adam, weight_decay=1.5919650870588936e-06, batch_size=10,factor=1
Trial 83, Fold 3: Test Accuracy = 0.5682
Divergence detected. Stopping training after 10 epochs.
Early stopping at epoch 10
Trial 82, Fold 5: Test Accuracy = 0.3841
Trial 82: Mean Accuracy = 0.4028, Fold Accuracies = [np.float64(0.42448839562700114), np.float64(0.38659600599738414), np.float64(0.4858949832878949), np.float64(0.3326923076923077), np.float64(0.3840825985462917)]
[I 2025-05-01 13:31:18,526] Trial 82 finished with value: 0.40275085823017587 and parameters: {'num_heads': 2, 'num_transformer_blocks': 4, 'learning_rate': 2.341357311510307e-06, 'optimizer': 'Adam', 'weight_decay': 5.284994698615909e-06, 'batch_size': 10, 'label_smoothing': 0.15}. Best is trial 69 with value: 0.5460321428889335.
Hyperparameters: num_heads=2, num_transformer_blocks=2, learning_rate=2.6350527796646215e-05, optimizer=Adam, weight_decay=1.2916350029688115e-06, batch_size=10,factor=1
Divergence detected. Stopping training after 10 epochs.
Early stopping at epoch 16
Trial 85, Fold 1: Test Accuracy = 0.4927
Trial 83, Fold 4: Test Accuracy = 0.4405
Trial 84, Fold 1: Test Accuracy = 0.3550
Divergence detected. Stopping training after 10 epochs.
Early stopping at epoch 10
Trial 84, Fold 2: Test Accuracy = 0.3525
Trial 85, Fold 2: Test Accuracy = 0.4997
Divergence detected. Stopping training after 10 epochs.
Early stopping at epoch 29
Trial 83, Fold 5: Test Accuracy = 0.6229
Trial 83: Mean Accuracy = 0.5354, Fold Accuracies = [np.float64(0.5083892345040009), np.float64(0.5368961410448634), np.float64(0.5682164256118787), np.float64(0.4404520917678812), np.float64(0.6229198399687402)]
[I 2025-05-01 13:45:43,699] Trial 83 finished with value: 0.5353747465794729 and parameters: {'num_heads': 2, 'num_transformer_blocks': 2, 'learning_rate': 2.5648532646044315e-05, 'optimizer': 'Adam', 'weight_decay': 1.6214656573609924e-06, 'batch_size': 10, 'label_smoothing': 0.17}. Best is trial 69 with value: 0.5460321428889335.
Hyperparameters: num_heads=2, num_transformer_blocks=2, learning_rate=2.782228330205127e-05, optimizer=Adam, weight_decay=1.89223276202094e-06, batch_size=10,factor=1
Trial 84, Fold 3: Test Accuracy = 0.4411
Divergence detected. Stopping training after 10 epochs.
Early stopping at epoch 19
Trial 86, Fold 1: Test Accuracy = 0.4936
Divergence detected. Stopping training after 10 epochs.
Early stopping at epoch 25
Trial 85, Fold 3: Test Accuracy = 0.5162
Divergence detected. Stopping training after 10 epochs.
Early stopping at epoch 16
Trial 86, Fold 2: Test Accuracy = 0.6563
Divergence detected. Stopping training after 10 epochs.
Early stopping at epoch 21
Trial 85, Fold 4: Test Accuracy = 0.4557
Trial 84, Fold 4: Test Accuracy = 0.3055
Divergence detected. Stopping training after 10 epochs.
Early stopping at epoch 23
Trial 86, Fold 3: Test Accuracy = 0.5457
Divergence detected. Stopping training after 10 epochs.
Early stopping at epoch 25
Trial 85, Fold 5: Test Accuracy = 0.6036
Trial 85: Mean Accuracy = 0.5136, Fold Accuracies = [np.float64(0.4926908984333958), np.float64(0.49969959911102607), np.float64(0.5161797051892242), np.float64(0.455668016194332), np.float64(0.6035656887980086)]
[I 2025-05-01 14:03:54,873] Trial 85 finished with value: 0.5135607815451974 and parameters: {'num_heads': 2, 'num_transformer_blocks': 2, 'learning_rate': 2.6350527796646215e-05, 'optimizer': 'Adam', 'weight_decay': 1.2916350029688115e-06, 'batch_size': 10, 'label_smoothing': 0.17}. Best is trial 69 with value: 0.5460321428889335.
Hyperparameters: num_heads=2, num_transformer_blocks=2, learning_rate=1.018084103041024e-05, optimizer=Adam, weight_decay=1.991375009288026e-06, batch_size=10,factor=1
Trial 84, Fold 5: Test Accuracy = 0.4729
Trial 84: Mean Accuracy = 0.3854, Fold Accuracies = [np.float64(0.3550242041175202), np.float64(0.35253905211556663), np.float64(0.44113380466090596), np.float64(0.3054655870445344), np.float64(0.4729460053685006)]
[I 2025-05-01 14:05:37,625] Trial 84 finished with value: 0.38542173066140556 and parameters: {'num_heads': 2, 'num_transformer_blocks': 2, 'learning_rate': 2.3607299710569063e-06, 'optimizer': 'Adam', 'weight_decay': 1.5919650870588936e-06, 'batch_size': 10, 'label_smoothing': 0.17}. Best is trial 69 with value: 0.5460321428889335.
Hyperparameters: num_heads=2, num_transformer_blocks=2, learning_rate=1.0678980640595713e-05, optimizer=Adam, weight_decay=1.7619392112147252e-06, batch_size=10,factor=1
Trial 86, Fold 4: Test Accuracy = 0.4758
Trial 87, Fold 1: Test Accuracy = 0.5057
Trial 88, Fold 1: Test Accuracy = 0.4914
Trial 86, Fold 5: Test Accuracy = 0.6053
Trial 86: Mean Accuracy = 0.5554, Fold Accuracies = [np.float64(0.4936020394056526), np.float64(0.6563187864867451), np.float64(0.5457228563067017), np.float64(0.47584345479082324), np.float64(0.6052824949398757)]
[I 2025-05-01 14:16:44,263] Trial 86 finished with value: 0.5553539263859596 and parameters: {'num_heads': 2, 'num_transformer_blocks': 2, 'learning_rate': 2.782228330205127e-05, 'optimizer': 'Adam', 'weight_decay': 1.89223276202094e-06, 'batch_size': 10, 'label_smoothing': 0.17}. Best is trial 86 with value: 0.5553539263859596.
Hyperparameters: num_heads=2, num_transformer_blocks=2, learning_rate=9.564096200521738e-06, optimizer=Adam, weight_decay=1.8199740137210633e-06, batch_size=10,factor=1
Divergence detected. Stopping training after 10 epochs.
Early stopping at epoch 28
Trial 87, Fold 2: Test Accuracy = 0.5746
Trial 88, Fold 2: Test Accuracy = 0.5656
Trial 89, Fold 1: Test Accuracy = 0.4818
Divergence detected. Stopping training after 10 epochs.
Early stopping at epoch 29
Trial 87, Fold 3: Test Accuracy = 0.4852
Trial 88, Fold 3: Test Accuracy = 0.4789
Trial 89, Fold 2: Test Accuracy = 0.6037
Trial 87, Fold 4: Test Accuracy = 0.4280
Trial 88, Fold 4: Test Accuracy = 0.4357
Trial 89, Fold 3: Test Accuracy = 0.4755
Trial 87, Fold 5: Test Accuracy = 0.6102
Trial 87: Mean Accuracy = 0.5207, Fold Accuracies = [np.float64(0.5056596603571172), np.float64(0.5746270243829819), np.float64(0.48518144571261335), np.float64(0.4279689608636977), np.float64(0.6102251349026023)]
[I 2025-05-01 14:43:29,890] Trial 87 finished with value: 0.5207324452438025 and parameters: {'num_heads': 2, 'num_transformer_blocks': 2, 'learning_rate': 1.018084103041024e-05, 'optimizer': 'Adam', 'weight_decay': 1.991375009288026e-06, 'batch_size': 10, 'label_smoothing': 0.18}. Best is trial 86 with value: 0.5553539263859596.
Hyperparameters: num_heads=2, num_transformer_blocks=2, learning_rate=5.326289317197433e-06, optimizer=Adam, weight_decay=2.76169716293357e-06, batch_size=10,factor=1
Trial 88, Fold 5: Test Accuracy = 0.5773
Trial 88: Mean Accuracy = 0.5098, Fold Accuracies = [np.float64(0.49137134546580624), np.float64(0.5655977180166097), np.float64(0.47890377832201225), np.float64(0.4356950067476384), np.float64(0.5773204887442968)]
[I 2025-05-01 14:46:51,472] Trial 88 finished with value: 0.5097776674592727 and parameters: {'num_heads': 2, 'num_transformer_blocks': 2, 'learning_rate': 1.0678980640595713e-05, 'optimizer': 'Adam', 'weight_decay': 1.7619392112147252e-06, 'batch_size': 10, 'label_smoothing': 0.2}. Best is trial 86 with value: 0.5553539263859596.
Hyperparameters: num_heads=2, num_transformer_blocks=2, learning_rate=5.274461535147382e-06, optimizer=Adam, weight_decay=2.779376813650823e-06, batch_size=10,factor=1
Trial 89, Fold 4: Test Accuracy = 0.4215
Trial 90, Fold 1: Test Accuracy = 0.4564
Trial 91, Fold 1: Test Accuracy = 0.4444
Trial 89, Fold 5: Test Accuracy = 0.5864
Trial 89: Mean Accuracy = 0.5138, Fold Accuracies = [np.float64(0.48182564408832257), np.float64(0.6037419848789357), np.float64(0.4755037505968609), np.float64(0.42152496626180835), np.float64(0.5864293572990236)]
