[I 2025-05-01 04:09:56,170] Trial 34 finished with value: 0.5204018172166216 and parameters: {'num_heads': 4, 'num_transformer_blocks': 4, 'learning_rate': 2.561696280259492e-05, 'optimizer': 'AdamW', 'weight_decay': 5.059535193850758e-05, 'batch_size': 32, 'label_smoothing': 0.24}. Best is trial 22 with value: 0.5348957503683117.
Hyperparameters: num_heads=2, num_transformer_blocks=8, learning_rate=1.753357183238428e-05, optimizer=AdamW, weight_decay=2.2178781288808603e-06, batch_size=32,factor=1
Trial 35, Fold 4: Test Accuracy = 0.4800
Trial 36, Fold 2: Test Accuracy = 0.5816
Trial 37, Fold 1: Test Accuracy = 0.4921
Trial 35, Fold 5: Test Accuracy = 0.6227
Trial 35: Mean Accuracy = 0.5276, Fold Accuracies = [np.float64(0.4774242881711153), np.float64(0.5729508937591051), np.float64(0.48492583522018395), np.float64(0.48002699055330633), np.float64(0.622655523204875)]
[I 2025-05-01 04:22:07,118] Trial 35 finished with value: 0.5275967061817172 and parameters: {'num_heads': 4, 'num_transformer_blocks': 4, 'learning_rate': 1.8744860492714645e-05, 'optimizer': 'AdamW', 'weight_decay': 5.506733415692717e-05, 'batch_size': 32, 'label_smoothing': 0.24}. Best is trial 22 with value: 0.5348957503683117.
Hyperparameters: num_heads=2, num_transformer_blocks=8, learning_rate=0.0010075999569536134, optimizer=AdamW, weight_decay=2.17341166951845e-06, batch_size=32,factor=1
Divergence detected. Stopping training after 10 epochs.
Early stopping at epoch 15
Trial 38, Fold 1: Test Accuracy = 0.3629
Trial 36, Fold 3: Test Accuracy = 0.5330
Divergence detected. Stopping training after 10 epochs.
Early stopping at epoch 12
Trial 38, Fold 2: Test Accuracy = 0.3691
Trial 37, Fold 2: Test Accuracy = 0.5807
Divergence detected. Stopping training after 10 epochs.
Early stopping at epoch 19
Divergence detected. Stopping training after 10 epochs.
Early stopping at epoch 20
Trial 37, Fold 3: Test Accuracy = 0.4891
Trial 38, Fold 3: Test Accuracy = 0.3333
Divergence detected. Stopping training after 10 epochs.
Early stopping at epoch 28
Trial 36, Fold 4: Test Accuracy = 0.3893
Divergence detected. Stopping training after 10 epochs.
Early stopping at epoch 20
Trial 38, Fold 4: Test Accuracy = 0.4736
Trial 37, Fold 4: Test Accuracy = 0.4414
Trial 36, Fold 5: Test Accuracy = 0.6072
Trial 36: Mean Accuracy = 0.5153, Fold Accuracies = [np.float64(0.46560878581263787), np.float64(0.5816053636179964), np.float64(0.5330330545415337), np.float64(0.3893049932523616), np.float64(0.6071684942422311)]
[I 2025-05-01 04:46:43,122] Trial 36 finished with value: 0.5153441382933521 and parameters: {'num_heads': 4, 'num_transformer_blocks': 4, 'learning_rate': 2.3877333129173686e-05, 'optimizer': 'AdamW', 'weight_decay': 2.080941910752093e-06, 'batch_size': 32, 'label_smoothing': 0.26}. Best is trial 22 with value: 0.5348957503683117.
Hyperparameters: num_heads=2, num_transformer_blocks=8, learning_rate=0.0011012476502249265, optimizer=AdamW, weight_decay=0.0001262868854363495, batch_size=32,factor=1
Divergence detected. Stopping training after 10 epochs.
Early stopping at epoch 15
Trial 38, Fold 5: Test Accuracy = 0.5787
Trial 38: Mean Accuracy = 0.4235, Fold Accuracies = [np.float64(0.3629091391695283), np.float64(0.36910762327070107), np.float64(0.3333333333333333), np.float64(0.473582995951417), np.float64(0.5787104361930334)]
[I 2025-05-01 04:48:37,447] Trial 38 finished with value: 0.4235287055836026 and parameters: {'num_heads': 2, 'num_transformer_blocks': 8, 'learning_rate': 0.0010075999569536134, 'optimizer': 'AdamW', 'weight_decay': 2.17341166951845e-06, 'batch_size': 32, 'label_smoothing': 0.28}. Best is trial 22 with value: 0.5348957503683117.
Hyperparameters: num_heads=2, num_transformer_blocks=2, learning_rate=6.283851841955046e-05, optimizer=AdamW, weight_decay=7.570465825050045e-06, batch_size=10,factor=1
Divergence detected. Stopping training after 10 epochs.
Early stopping at epoch 25
Trial 39, Fold 1: Test Accuracy = 0.3333
Trial 37, Fold 5: Test Accuracy = 0.6029
Trial 37: Mean Accuracy = 0.5212, Fold Accuracies = [np.float64(0.4921057084556811), np.float64(0.5806988441211812), np.float64(0.4890580379834573), np.float64(0.4413967611336032), np.float64(0.6028893709763804)]
[I 2025-05-01 04:53:31,827] Trial 37 finished with value: 0.5212297445340607 and parameters: {'num_heads': 2, 'num_transformer_blocks': 8, 'learning_rate': 1.753357183238428e-05, 'optimizer': 'AdamW', 'weight_decay': 2.2178781288808603e-06, 'batch_size': 32, 'label_smoothing': 0.28}. Best is trial 22 with value: 0.5348957503683117.
Hyperparameters: num_heads=8, num_transformer_blocks=2, learning_rate=4.80299654348983e-05, optimizer=AdamW, weight_decay=0.00013085971158328916, batch_size=10,factor=1
Divergence detected. Stopping training after 10 epochs.
Early stopping at epoch 19
Divergence detected. Stopping training after 10 epochs.
Early stopping at epoch 13
Trial 40, Fold 1: Test Accuracy = 0.4843
Trial 39, Fold 2: Test Accuracy = 0.3333
Divergence detected. Stopping training after 10 epochs.
Early stopping at epoch 18
Trial 41, Fold 1: Test Accuracy = 0.5028
Divergence detected. Stopping training after 10 epochs.
Early stopping at epoch 13
Trial 39, Fold 3: Test Accuracy = 0.3333
Divergence detected. Stopping training after 10 epochs.
Early stopping at epoch 12
Trial 40, Fold 2: Test Accuracy = 0.5679
Divergence detected. Stopping training after 10 epochs.
Early stopping at epoch 17
Trial 41, Fold 2: Test Accuracy = 0.5419
Divergence detected. Stopping training after 10 epochs.
Early stopping at epoch 18
Trial 39, Fold 4: Test Accuracy = 0.3400
Divergence detected. Stopping training after 10 epochs.
Early stopping at epoch 13
Trial 39, Fold 5: Test Accuracy = 0.3333
Trial 39: Mean Accuracy = 0.3347, Fold Accuracies = [np.float64(0.3333333333333333), np.float64(0.3333333333333333), np.float64(0.3333333333333333), np.float64(0.34001349527665314), np.float64(0.3333333333333333)]
[I 2025-05-01 05:09:10,200] Trial 39 finished with value: 0.3346693657219973 and parameters: {'num_heads': 2, 'num_transformer_blocks': 8, 'learning_rate': 0.0011012476502249265, 'optimizer': 'AdamW', 'weight_decay': 0.0001262868854363495, 'batch_size': 32, 'label_smoothing': 0.28}. Best is trial 22 with value: 0.5348957503683117.
Hyperparameters: num_heads=8, num_transformer_blocks=2, learning_rate=5.8049357555621815e-05, optimizer=Adam, weight_decay=6.987874137512187e-06, batch_size=10,factor=1
Divergence detected. Stopping training after 10 epochs.
Early stopping at epoch 22
Trial 40, Fold 3: Test Accuracy = 0.5666
Divergence detected. Stopping training after 10 epochs.
Early stopping at epoch 19
Trial 41, Fold 3: Test Accuracy = 0.5208
Divergence detected. Stopping training after 10 epochs.
Early stopping at epoch 17
Trial 42, Fold 1: Test Accuracy = 0.4580
Divergence detected. Stopping training after 10 epochs.
Early stopping at epoch 17
Trial 40, Fold 4: Test Accuracy = 0.4376
Trial 41, Fold 4: Test Accuracy = 0.4862
Divergence detected. Stopping training after 10 epochs.
Early stopping at epoch 18
Trial 42, Fold 2: Test Accuracy = 0.5876
Divergence detected. Stopping training after 10 epochs.
Early stopping at epoch 19
Trial 40, Fold 5: Test Accuracy = 0.5162
Trial 40: Mean Accuracy = 0.5145, Fold Accuracies = [np.float64(0.4842545275579666), np.float64(0.5679225018874745), np.float64(0.5666496465043204), np.float64(0.43761808367071525), np.float64(0.5161931251112967)]
[I 2025-05-01 05:20:20,899] Trial 40 finished with value: 0.5145275769463546 and parameters: {'num_heads': 2, 'num_transformer_blocks': 2, 'learning_rate': 6.283851841955046e-05, 'optimizer': 'AdamW', 'weight_decay': 7.570465825050045e-06, 'batch_size': 10, 'label_smoothing': 0.13}. Best is trial 22 with value: 0.5348957503683117.
Hyperparameters: num_heads=4, num_transformer_blocks=8, learning_rate=0.00021074068667085614, optimizer=AdamW, weight_decay=0.000290420836101534, batch_size=32,factor=1
Divergence detected. Stopping training after 10 epochs.
Early stopping at epoch 21
Trial 41, Fold 5: Test Accuracy = 0.5289
Trial 41: Mean Accuracy = 0.5161, Fold Accuracies = [np.float64(0.5027939193859664), np.float64(0.5418819982773472), np.float64(0.5208302912681176), np.float64(0.48620107962213227), np.float64(0.5288815784653459)]
[I 2025-05-01 05:24:46,296] Trial 41 finished with value: 0.516117773403782 and parameters: {'num_heads': 8, 'num_transformer_blocks': 2, 'learning_rate': 4.80299654348983e-05, 'optimizer': 'AdamW', 'weight_decay': 0.00013085971158328916, 'batch_size': 10, 'label_smoothing': 0.13}. Best is trial 22 with value: 0.5348957503683117.
Hyperparameters: num_heads=4, num_transformer_blocks=8, learning_rate=6.956048834544209e-06, optimizer=AdamW, weight_decay=0.00026493383619109056, batch_size=32,factor=1
Divergence detected. Stopping training after 10 epochs.
Early stopping at epoch 17
Trial 43, Fold 1: Test Accuracy = 0.4885
Divergence detected. Stopping training after 10 epochs.
Early stopping at epoch 10
Trial 44, Fold 1: Test Accuracy = 0.3397
Divergence detected. Stopping training after 10 epochs.
Early stopping at epoch 24
Trial 42, Fold 3: Test Accuracy = 0.5110
Divergence detected. Stopping training after 10 epochs.
Early stopping at epoch 11
Trial 43, Fold 2: Test Accuracy = 0.5771
Divergence detected. Stopping training after 10 epochs.
Early stopping at epoch 15
Trial 43, Fold 3: Test Accuracy = 0.5402
Trial 44, Fold 2: Test Accuracy = 0.5768
Divergence detected. Stopping training after 10 epochs.
Early stopping at epoch 24
Trial 42, Fold 4: Test Accuracy = 0.4395
Divergence detected. Stopping training after 10 epochs.
Early stopping at epoch 18
Trial 43, Fold 4: Test Accuracy = 0.4719
Divergence detected. Stopping training after 10 epochs.
Early stopping at epoch 18
Trial 42, Fold 5: Test Accuracy = 0.6093
Trial 42: Mean Accuracy = 0.5211, Fold Accuracies = [np.float64(0.45801503010998856), np.float64(0.5875695175508554), np.float64(0.5110057298646088), np.float64(0.4394736842105263), np.float64(0.6092560699121354)]
[I 2025-05-01 05:42:37,596] Trial 42 finished with value: 0.5210640063296228 and parameters: {'num_heads': 8, 'num_transformer_blocks': 2, 'learning_rate': 5.8049357555621815e-05, 'optimizer': 'Adam', 'weight_decay': 6.987874137512187e-06, 'batch_size': 10, 'label_smoothing': 0.13}. Best is trial 22 with value: 0.5348957503683117.
Hyperparameters: num_heads=4, num_transformer_blocks=8, learning_rate=0.00024727450230046865, optimizer=AdamW, weight_decay=0.0002927795748870205, batch_size=32,factor=1
Trial 44, Fold 3: Test Accuracy = 0.5129
Divergence detected. Stopping training after 10 epochs.
Early stopping at epoch 16
Trial 43, Fold 5: Test Accuracy = 0.5421
Trial 43: Mean Accuracy = 0.5239, Fold Accuracies = [np.float64(0.48847636269126343), np.float64(0.5770794121712871), np.float64(0.5402044729910818), np.float64(0.4718960863697706), np.float64(0.5420929511499653)]
[I 2025-05-01 05:44:57,043] Trial 43 finished with value: 0.5239498570746737 and parameters: {'num_heads': 4, 'num_transformer_blocks': 8, 'learning_rate': 0.00021074068667085614, 'optimizer': 'AdamW', 'weight_decay': 0.000290420836101534, 'batch_size': 32, 'label_smoothing': 0.22}. Best is trial 22 with value: 0.5348957503683117.
Hyperparameters: num_heads=4, num_transformer_blocks=8, learning_rate=4.477761728575685e-06, optimizer=AdamW, weight_decay=0.0006396319331659041, batch_size=32,factor=1
Divergence detected. Stopping training after 10 epochs.
Early stopping at epoch 15
Trial 45, Fold 1: Test Accuracy = 0.4828
Divergence detected. Stopping training after 10 epochs.
Early stopping at epoch 14
Trial 45, Fold 2: Test Accuracy = 0.5604
Trial 44, Fold 4: Test Accuracy = 0.4196
Trial 46, Fold 1: Test Accuracy = 0.4293
Divergence detected. Stopping training after 10 epochs.
Early stopping at epoch 10
Trial 45, Fold 3: Test Accuracy = 0.5994
Divergence detected. Stopping training after 10 epochs.
Early stopping at epoch 12
Trial 45, Fold 4: Test Accuracy = 0.4425
Trial 44, Fold 5: Test Accuracy = 0.5858
Trial 44: Mean Accuracy = 0.4870, Fold Accuracies = [np.float64(0.3396941112714765), np.float64(0.576782998904733), np.float64(0.5129326278822606), np.float64(0.41960188933873144), np.float64(0.5858347334770267)]
[I 2025-05-01 06:03:34,666] Trial 44 finished with value: 0.48696927217484565 and parameters: {'num_heads': 4, 'num_transformer_blocks': 8, 'learning_rate': 6.956048834544209e-06, 'optimizer': 'AdamW', 'weight_decay': 0.00026493383619109056, 'batch_size': 32, 'label_smoothing': 0.22}. Best is trial 22 with value: 0.5348957503683117.
Hyperparameters: num_heads=4, num_transformer_blocks=8, learning_rate=3.2217804699296593e-06, optimizer=AdamW, weight_decay=0.0006208459060514864, batch_size=32,factor=1
Trial 46, Fold 2: Test Accuracy = 0.5129
Divergence detected. Stopping training after 10 epochs.
Early stopping at epoch 13
Trial 45, Fold 5: Test Accuracy = 0.5340
Trial 45: Mean Accuracy = 0.5238, Fold Accuracies = [np.float64(0.4827994713471248), np.float64(0.5604164672855457), np.float64(0.5994299400828674), np.float64(0.44254385964912285), np.float64(0.5340307812802637)]
[I 2025-05-01 06:05:14,464] Trial 45 finished with value: 0.5238441039289848 and parameters: {'num_heads': 4, 'num_transformer_blocks': 8, 'learning_rate': 0.00024727450230046865, 'optimizer': 'AdamW', 'weight_decay': 0.0002927795748870205, 'batch_size': 32, 'label_smoothing': 0.21}. Best is trial 22 with value: 0.5348957503683117.
Hyperparameters: num_heads=32, num_transformer_blocks=8, learning_rate=1.4338089312657102e-05, optimizer=Adam, weight_decay=0.0006154361290634533, batch_size=32,factor=1
Divergence detected. Stopping training after 10 epochs.
Early stopping at epoch 20
Trial 47, Fold 1: Test Accuracy = 0.3036
Trial 46, Fold 3: Test Accuracy = 0.4575
Trial 48, Fold 1: Test Accuracy = 0.5149
Divergence detected. Stopping training after 10 epochs.
Early stopping at epoch 14
Trial 46, Fold 4: Test Accuracy = 0.3243
Trial 47, Fold 2: Test Accuracy = 0.5044
Trial 48, Fold 2: Test Accuracy = 0.6004
Divergence detected. Stopping training after 10 epochs.
Early stopping at epoch 24
Trial 46, Fold 5: Test Accuracy = 0.3549
Trial 46: Mean Accuracy = 0.4158, Fold Accuracies = [np.float64(0.4292682581551342), np.float64(0.5128879956614668), np.float64(0.45746730742571967), np.float64(0.3242914979757085), np.float64(0.3548710768790732)]
[I 2025-05-01 06:27:03,869] Trial 46 finished with value: 0.4157572272194205 and parameters: {'num_heads': 4, 'num_transformer_blocks': 8, 'learning_rate': 4.477761728575685e-06, 'optimizer': 'AdamW', 'weight_decay': 0.0006396319331659041, 'batch_size': 32, 'label_smoothing': 0.23}. Best is trial 22 with value: 0.5348957503683117.
Hyperparameters: num_heads=32, num_transformer_blocks=16, learning_rate=1.3387799875203094e-05, optimizer=Adam, weight_decay=2.9290212526135622e-05, batch_size=16,factor=1
Trial 47, Fold 3: Test Accuracy = 0.4757
Divergence detected. Stopping training after 10 epochs.
Early stopping at epoch 22
Trial 48, Fold 3: Test Accuracy = 0.5145
Trial 47, Fold 4: Test Accuracy = 0.4062
Trial 48, Fold 4: Test Accuracy = 0.4583
Divergence detected. Stopping training after 10 epochs.
Early stopping at epoch 12
Trial 47, Fold 5: Test Accuracy = 0.4051
Trial 47: Mean Accuracy = 0.4190, Fold Accuracies = [np.float64(0.30362056437565316), np.float64(0.5044142980189492), np.float64(0.4756891240392465), np.float64(0.4062415654520917), np.float64(0.40514078781197965)]
[I 2025-05-01 06:40:15,196] Trial 47 finished with value: 0.419021267939584 and parameters: {'num_heads': 4, 'num_transformer_blocks': 8, 'learning_rate': 3.2217804699296593e-06, 'optimizer': 'AdamW', 'weight_decay': 0.0006208459060514864, 'batch_size': 32, 'label_smoothing': 0.17}. Best is trial 22 with value: 0.5348957503683117.
Hyperparameters: num_heads=32, num_transformer_blocks=16, learning_rate=1.0372748018962798e-08, optimizer=Adam, weight_decay=3.1608000523714935e-05, batch_size=16,factor=1
Divergence detected. Stopping training after 10 epochs.
Early stopping at epoch 26
Trial 49, Fold 1: Test Accuracy = 0.4729
Divergence detected. Stopping training after 10 epochs.
Early stopping at epoch 10
Trial 50, Fold 1: Test Accuracy = 0.3333
Divergence detected. Stopping training after 10 epochs.
Early stopping at epoch 29
Trial 48, Fold 5: Test Accuracy = 0.6159
Trial 48: Mean Accuracy = 0.5408, Fold Accuracies = [np.float64(0.5148948942970742), np.float64(0.6004402335151688), np.float64(0.5145406866595814), np.float64(0.45826585695006744), np.float64(0.6158961241320106)]
[I 2025-05-01 06:46:33,939] Trial 48 finished with value: 0.5408075591107805 and parameters: {'num_heads': 32, 'num_transformer_blocks': 8, 'learning_rate': 1.4338089312657102e-05, 'optimizer': 'Adam', 'weight_decay': 0.0006154361290634533, 'batch_size': 32, 'label_smoothing': 0.17}. Best is trial 48 with value: 0.5408075591107805.
Hyperparameters: num_heads=32, num_transformer_blocks=32, learning_rate=7.915684840706254e-07, optimizer=Adam, weight_decay=2.8780173594989446e-05, batch_size=16,factor=1
Divergence detected. Stopping training after 10 epochs.
Early stopping at epoch 14
Divergence detected. Stopping training after 10 epochs.
Early stopping at epoch 23
Trial 49, Fold 2: Test Accuracy = 0.5687
Trial 51, Fold 1: Test Accuracy = 0.3289
Trial 50, Fold 2: Test Accuracy = 0.3333
Trial 50, Fold 3: Test Accuracy = 0.3309
Divergence detected. Stopping training after 10 epochs.
Early stopping at epoch 10
Trial 50, Fold 4: Test Accuracy = 0.3272
Trial 49, Fold 3: Test Accuracy = 0.4945
Trial 51, Fold 2: Test Accuracy = 0.3718
Trial 50, Fold 5: Test Accuracy = 0.3333
Trial 50: Mean Accuracy = 0.3316, Fold Accuracies = [np.float64(0.3333333333333333), np.float64(0.3333333333333333), np.float64(0.3309189347380743), np.float64(0.32719298245614037), np.float64(0.3333333333333333)]
[I 2025-05-01 07:16:53,791] Trial 50 finished with value: 0.33162238343884287 and parameters: {'num_heads': 32, 'num_transformer_blocks': 16, 'learning_rate': 1.0372748018962798e-08, 'optimizer': 'Adam', 'weight_decay': 3.1608000523714935e-05, 'batch_size': 16, 'label_smoothing': 0.19}. Best is trial 48 with value: 0.5408075591107805.
Hyperparameters: num_heads=32, num_transformer_blocks=32, learning_rate=8.596753716785412e-07, optimizer=Adam, weight_decay=0.00012435297401749572, batch_size=10,factor=1
Divergence detected. Stopping training after 10 epochs.
Early stopping at epoch 15
Trial 51, Fold 3: Test Accuracy = 0.3336
Trial 49, Fold 4: Test Accuracy = 0.4500
Divergence detected. Stopping training after 10 epochs.
Early stopping at epoch 22
Trial 51, Fold 4: Test Accuracy = 0.3311
Divergence detected. Stopping training after 10 epochs.
Early stopping at epoch 28
Trial 52, Fold 1: Test Accuracy = 0.3665
Trial 49, Fold 5: Test Accuracy = 0.6321
Trial 49: Mean Accuracy = 0.5236, Fold Accuracies = [np.float64(0.472932375564735), np.float64(0.568652236790336), np.float64(0.4944789211835559), np.float64(0.4499662618083671), np.float64(0.632105597966586)]
[I 2025-05-01 07:32:54,265] Trial 49 finished with value: 0.523627078662716 and parameters: {'num_heads': 32, 'num_transformer_blocks': 16, 'learning_rate': 1.3387799875203094e-05, 'optimizer': 'Adam', 'weight_decay': 2.9290212526135622e-05, 'batch_size': 16, 'label_smoothing': 0.17}. Best is trial 48 with value: 0.5408075591107805.
Hyperparameters: num_heads=32, num_transformer_blocks=8, learning_rate=2.5198448093373934e-05, optimizer=Adam, weight_decay=0.0004641556896534395, batch_size=32,factor=1
Divergence detected. Stopping training after 10 epochs.
Early stopping at epoch 22
Trial 53, Fold 1: Test Accuracy = 0.4555
Divergence detected. Stopping training after 10 epochs.
Early stopping at epoch 10
Trial 52, Fold 2: Test Accuracy = 0.3465
Trial 51, Fold 5: Test Accuracy = 0.3333
Trial 51: Mean Accuracy = 0.3397, Fold Accuracies = [np.float64(0.3289275977814275), np.float64(0.37177667187715996), np.float64(0.3336171310629515), np.float64(0.33107287449392714), np.float64(0.3333333333333333)]
[I 2025-05-01 07:44:25,934] Trial 51 finished with value: 0.33974552170975986 and parameters: {'num_heads': 32, 'num_transformer_blocks': 32, 'learning_rate': 7.915684840706254e-07, 'optimizer': 'Adam', 'weight_decay': 2.8780173594989446e-05, 'batch_size': 16, 'label_smoothing': 0.08}. Best is trial 48 with value: 0.5408075591107805.
Hyperparameters: num_heads=32, num_transformer_blocks=8, learning_rate=3.347315664279605e-05, optimizer=Adam, weight_decay=0.0004830915921433187, batch_size=32,factor=1
Divergence detected. Stopping training after 10 epochs.
Early stopping at epoch 27
Trial 53, Fold 2: Test Accuracy = 0.6103
Divergence detected. Stopping training after 10 epochs.
Early stopping at epoch 21
Trial 54, Fold 1: Test Accuracy = 0.5086
Divergence detected. Stopping training after 10 epochs.
Early stopping at epoch 14
Trial 52, Fold 3: Test Accuracy = 0.3433
Trial 53, Fold 3: Test Accuracy = 0.5617
Divergence detected. Stopping training after 10 epochs.
Early stopping at epoch 18
Trial 54, Fold 2: Test Accuracy = 0.6073
Divergence detected. Stopping training after 10 epochs.
Early stopping at epoch 18
Trial 54, Fold 3: Test Accuracy = 0.4874
Trial 53, Fold 4: Test Accuracy = 0.4530
Divergence detected. Stopping training after 10 epochs.
Early stopping at epoch 28
Trial 54, Fold 4: Test Accuracy = 0.4278
Trial 53, Fold 5: Test Accuracy = 0.6209
Trial 53: Mean Accuracy = 0.5403, Fold Accuracies = [np.float64(0.4554750631784425), np.float64(0.6103029529673227), np.float64(0.5617229641267346), np.float64(0.45296896086369776), np.float64(0.6208862721449327)]
