[I 2025-04-24 15:34:27,926] Trial 93 finished with value: 0.47505086944148883 and parameters: {'embed_dim': 128, 'depths': [2, 2, 6, 2], 'num_heads': [4, 8, 16, 32], 'window_size': 14, 'mlp_ratio': 2.967366872463397, 'drop_rate': 0.1567330797097972, 'attn_drop_rate': 0.2502543411466608, 'drop_path_rate': 0.10948593006467039, 'learning_rate': 2.3030271341068793e-05, 'weight_decay': 3.1151035823189673e-06, 'batch_size': 32, 'optimizer': 'Adam', 'label_smoothing': 0.15733114318057237, 'factor': 1}. Best is trial 68 with value: 0.5026770677464627.
C:\Users\hp\anaconda3\Lib\site-packages\optuna\distributions.py:515: UserWarning: Choices for a categorical distribution should be a tuple of None, bool, int, float and str for persistent storage but contains [2, 2, 6, 2] which is of type list.
warnings.warn(message)
C:\Users\hp\anaconda3\Lib\site-packages\optuna\distributions.py:515: UserWarning: Choices for a categorical distribution should be a tuple of None, bool, int, float and str for persistent storage but contains [2, 2, 18, 2] which is of type list.
warnings.warn(message)
C:\Users\hp\anaconda3\Lib\site-packages\optuna\distributions.py:515: UserWarning: Choices for a categorical distribution should be a tuple of None, bool, int, float and str for persistent storage but contains [3, 6, 12, 24] which is of type list.
warnings.warn(message)
C:\Users\hp\anaconda3\Lib\site-packages\optuna\distributions.py:515: UserWarning: Choices for a categorical distribution should be a tuple of None, bool, int, float and str for persistent storage but contains [4, 8, 16, 32] which is of type list.
warnings.warn(message)
Trial 94 hyperparameters:
embed_dim: 128
depths: [2, 2, 6, 2]
num_heads: [4, 8, 16, 32]
window_size: 14
mlp_ratio: 3.035231010350054
drop_rate: 0.12548484343876518
attn_drop_rate: 0.18647270526706786
drop_path_rate: 0.057497129710725785
learning_rate: 1.5832500313530592e-05
weight_decay: 4.991130846443306e-06
batch_size: 32
optimizer: Adam
label_smoothing: 0.12297164553758053
factor: 1
EarlyStopping counter: 1 out of 10
EarlyStopping counter: 2 out of 10
EarlyStopping counter: 3 out of 10
EarlyStopping counter: 4 out of 10
EarlyStopping counter: 5 out of 10
EarlyStopping counter: 6 out of 10
EarlyStopping counter: 1 out of 10
EarlyStopping counter: 2 out of 10
EarlyStopping counter: 3 out of 10
EarlyStopping counter: 4 out of 10
EarlyStopping counter: 5 out of 10
EarlyStopping counter: 6 out of 10
EarlyStopping counter: 7 out of 10
EarlyStopping counter: 8 out of 10
EarlyStopping counter: 9 out of 10
EarlyStopping counter: 10 out of 10
Early stopping at epoch 18
Trial 94, Fold 1: Test Accuracy = 0.4130
EarlyStopping counter: 1 out of 10
EarlyStopping counter: 2 out of 10
EarlyStopping counter: 1 out of 10
EarlyStopping counter: 2 out of 10
EarlyStopping counter: 3 out of 10
EarlyStopping counter: 4 out of 10
EarlyStopping counter: 5 out of 10
EarlyStopping counter: 6 out of 10
EarlyStopping counter: 7 out of 10
EarlyStopping counter: 1 out of 10
EarlyStopping counter: 2 out of 10
EarlyStopping counter: 3 out of 10
EarlyStopping counter: 4 out of 10
EarlyStopping counter: 5 out of 10
EarlyStopping counter: 6 out of 10
EarlyStopping counter: 7 out of 10
EarlyStopping counter: 8 out of 10
EarlyStopping counter: 9 out of 10
EarlyStopping counter: 10 out of 10
Early stopping at epoch 21
Trial 94, Fold 2: Test Accuracy = 0.5011
EarlyStopping counter: 1 out of 10
EarlyStopping counter: 2 out of 10
EarlyStopping counter: 1 out of 10
EarlyStopping counter: 1 out of 10
EarlyStopping counter: 2 out of 10
EarlyStopping counter: 3 out of 10
EarlyStopping counter: 4 out of 10
EarlyStopping counter: 5 out of 10
EarlyStopping counter: 6 out of 10
EarlyStopping counter: 7 out of 10
EarlyStopping counter: 8 out of 10
EarlyStopping counter: 9 out of 10
EarlyStopping counter: 10 out of 10
Early stopping at epoch 17
Trial 94, Fold 3: Test Accuracy = 0.5049
EarlyStopping counter: 1 out of 10
EarlyStopping counter: 2 out of 10
EarlyStopping counter: 3 out of 10
EarlyStopping counter: 1 out of 10
EarlyStopping counter: 2 out of 10
EarlyStopping counter: 3 out of 10
EarlyStopping counter: 4 out of 10
EarlyStopping counter: 5 out of 10
EarlyStopping counter: 6 out of 10
EarlyStopping counter: 7 out of 10
EarlyStopping counter: 8 out of 10
EarlyStopping counter: 9 out of 10
EarlyStopping counter: 10 out of 10
Early stopping at epoch 14
Trial 94, Fold 4: Test Accuracy = 0.4676
EarlyStopping counter: 1 out of 10
EarlyStopping counter: 1 out of 10
EarlyStopping counter: 2 out of 10
EarlyStopping counter: 3 out of 10
EarlyStopping counter: 1 out of 10
EarlyStopping counter: 2 out of 10
EarlyStopping counter: 3 out of 10
EarlyStopping counter: 4 out of 10
EarlyStopping counter: 5 out of 10
EarlyStopping counter: 6 out of 10
EarlyStopping counter: 7 out of 10
EarlyStopping counter: 8 out of 10
EarlyStopping counter: 9 out of 10
EarlyStopping counter: 10 out of 10
Early stopping at epoch 18
Trial 94, Fold 5: Test Accuracy = 0.3901
Trial 94 completed: Mean Accuracy = 0.4553
[I 2025-04-24 16:08:36,267] Trial 94 finished with value: 0.45534692929642917 and parameters: {'embed_dim': 128, 'depths': [2, 2, 6, 2], 'num_heads': [4, 8, 16, 32], 'window_size': 14, 'mlp_ratio': 3.035231010350054, 'drop_rate': 0.12548484343876518, 'attn_drop_rate': 0.18647270526706786, 'drop_path_rate': 0.057497129710725785, 'learning_rate': 1.5832500313530592e-05, 'weight_decay': 4.991130846443306e-06, 'batch_size': 32, 'optimizer': 'Adam', 'label_smoothing': 0.12297164553758053, 'factor': 1}. Best is trial 68 with value: 0.5026770677464627.
C:\Users\hp\anaconda3\Lib\site-packages\optuna\distributions.py:515: UserWarning: Choices for a categorical distribution should be a tuple of None, bool, int, float and str for persistent storage but contains [2, 2, 6, 2] which is of type list.
warnings.warn(message)
C:\Users\hp\anaconda3\Lib\site-packages\optuna\distributions.py:515: UserWarning: Choices for a categorical distribution should be a tuple of None, bool, int, float and str for persistent storage but contains [2, 2, 18, 2] which is of type list.
warnings.warn(message)
C:\Users\hp\anaconda3\Lib\site-packages\optuna\distributions.py:515: UserWarning: Choices for a categorical distribution should be a tuple of None, bool, int, float and str for persistent storage but contains [3, 6, 12, 24] which is of type list.
warnings.warn(message)
C:\Users\hp\anaconda3\Lib\site-packages\optuna\distributions.py:515: UserWarning: Choices for a categorical distribution should be a tuple of None, bool, int, float and str for persistent storage but contains [4, 8, 16, 32] which is of type list.
warnings.warn(message)
Trial 95 hyperparameters:
embed_dim: 128
depths: [2, 2, 6, 2]
num_heads: [4, 8, 16, 32]
window_size: 14
mlp_ratio: 2.7504941924226416
drop_rate: 0.10288532537307024
attn_drop_rate: 0.21081892031423854
drop_path_rate: 0.12328514259448209
learning_rate: 1.8797320403361638e-05
weight_decay: 2.9619175146497812e-05
batch_size: 32
optimizer: AdamW
label_smoothing: 0.17690453353468974
factor: 1
EarlyStopping counter: 1 out of 10
EarlyStopping counter: 2 out of 10
EarlyStopping counter: 3 out of 10
EarlyStopping counter: 1 out of 10
EarlyStopping counter: 1 out of 10
EarlyStopping counter: 2 out of 10
EarlyStopping counter: 3 out of 10
EarlyStopping counter: 4 out of 10
EarlyStopping counter: 5 out of 10
EarlyStopping counter: 6 out of 10
EarlyStopping counter: 7 out of 10
EarlyStopping counter: 8 out of 10
EarlyStopping counter: 9 out of 10
EarlyStopping counter: 10 out of 10
Early stopping at epoch 16
Trial 95, Fold 1: Test Accuracy = 0.4687
EarlyStopping counter: 1 out of 10
EarlyStopping counter: 2 out of 10
EarlyStopping counter: 1 out of 10
EarlyStopping counter: 1 out of 10
EarlyStopping counter: 2 out of 10
EarlyStopping counter: 3 out of 10
EarlyStopping counter: 4 out of 10
EarlyStopping counter: 5 out of 10
EarlyStopping counter: 6 out of 10
EarlyStopping counter: 7 out of 10
EarlyStopping counter: 8 out of 10
EarlyStopping counter: 9 out of 10
EarlyStopping counter: 10 out of 10
Early stopping at epoch 17
Trial 95, Fold 2: Test Accuracy = 0.5021
EarlyStopping counter: 1 out of 10
EarlyStopping counter: 2 out of 10
EarlyStopping counter: 3 out of 10
EarlyStopping counter: 4 out of 10
EarlyStopping counter: 1 out of 10
EarlyStopping counter: 2 out of 10
EarlyStopping counter: 3 out of 10
EarlyStopping counter: 4 out of 10
EarlyStopping counter: 5 out of 10
EarlyStopping counter: 6 out of 10
EarlyStopping counter: 7 out of 10
EarlyStopping counter: 8 out of 10
EarlyStopping counter: 9 out of 10
EarlyStopping counter: 10 out of 10
Early stopping at epoch 17
Trial 95, Fold 3: Test Accuracy = 0.5076
EarlyStopping counter: 1 out of 10
EarlyStopping counter: 2 out of 10
EarlyStopping counter: 3 out of 10
EarlyStopping counter: 4 out of 10
EarlyStopping counter: 5 out of 10
EarlyStopping counter: 6 out of 10
EarlyStopping counter: 1 out of 10
EarlyStopping counter: 2 out of 10
EarlyStopping counter: 3 out of 10
EarlyStopping counter: 4 out of 10
EarlyStopping counter: 5 out of 10
EarlyStopping counter: 6 out of 10
EarlyStopping counter: 7 out of 10
EarlyStopping counter: 8 out of 10
EarlyStopping counter: 9 out of 10
EarlyStopping counter: 10 out of 10
Early stopping at epoch 19
Trial 95, Fold 4: Test Accuracy = 0.4431
EarlyStopping counter: 1 out of 10
EarlyStopping counter: 2 out of 10
EarlyStopping counter: 3 out of 10
EarlyStopping counter: 4 out of 10
EarlyStopping counter: 5 out of 10
EarlyStopping counter: 6 out of 10
EarlyStopping counter: 1 out of 10
EarlyStopping counter: 1 out of 10
EarlyStopping counter: 1 out of 10
EarlyStopping counter: 2 out of 10
EarlyStopping counter: 3 out of 10
EarlyStopping counter: 4 out of 10
EarlyStopping counter: 5 out of 10
EarlyStopping counter: 6 out of 10
EarlyStopping counter: 7 out of 10
EarlyStopping counter: 8 out of 10
EarlyStopping counter: 9 out of 10
EarlyStopping counter: 10 out of 10
Early stopping at epoch 21
Trial 95, Fold 5: Test Accuracy = 0.4510
Trial 95 completed: Mean Accuracy = 0.4745
[I 2025-04-24 16:42:32,722] Trial 95 finished with value: 0.47447842629775144 and parameters: {'embed_dim': 128, 'depths': [2, 2, 6, 2], 'num_heads': [4, 8, 16, 32], 'window_size': 14, 'mlp_ratio': 2.7504941924226416, 'drop_rate': 0.10288532537307024, 'attn_drop_rate': 0.21081892031423854, 'drop_path_rate': 0.12328514259448209, 'learning_rate': 1.8797320403361638e-05, 'weight_decay': 2.9619175146497812e-05, 'batch_size': 32, 'optimizer': 'AdamW', 'label_smoothing': 0.17690453353468974, 'factor': 1}. Best is trial 68 with value: 0.5026770677464627.
C:\Users\hp\anaconda3\Lib\site-packages\optuna\distributions.py:515: UserWarning: Choices for a categorical distribution should be a tuple of None, bool, int, float and str for persistent storage but contains [2, 2, 6, 2] which is of type list.
warnings.warn(message)
C:\Users\hp\anaconda3\Lib\site-packages\optuna\distributions.py:515: UserWarning: Choices for a categorical distribution should be a tuple of None, bool, int, float and str for persistent storage but contains [2, 2, 18, 2] which is of type list.
warnings.warn(message)
C:\Users\hp\anaconda3\Lib\site-packages\optuna\distributions.py:515: UserWarning: Choices for a categorical distribution should be a tuple of None, bool, int, float and str for persistent storage but contains [3, 6, 12, 24] which is of type list.
warnings.warn(message)
C:\Users\hp\anaconda3\Lib\site-packages\optuna\distributions.py:515: UserWarning: Choices for a categorical distribution should be a tuple of None, bool, int, float and str for persistent storage but contains [4, 8, 16, 32] which is of type list.
warnings.warn(message)
Trial 96 hyperparameters:
embed_dim: 96
depths: [2, 2, 6, 2]
num_heads: [3, 6, 12, 24]
window_size: 7
mlp_ratio: 2.8534150928609883
drop_rate: 0.06756362111794201
attn_drop_rate: 0.15453755326524343
drop_path_rate: 0.07861599401288757
learning_rate: 3.7192940633480766e-05
weight_decay: 5.950842749679602e-05
batch_size: 32
optimizer: SGD
label_smoothing: 0.16803916078058984
factor: 1
EarlyStopping counter: 1 out of 10
EarlyStopping counter: 2 out of 10
EarlyStopping counter: 3 out of 10
EarlyStopping counter: 4 out of 10
EarlyStopping counter: 5 out of 10
EarlyStopping counter: 6 out of 10
EarlyStopping counter: 7 out of 10
EarlyStopping counter: 8 out of 10
EarlyStopping counter: 9 out of 10
EarlyStopping counter: 10 out of 10
Early stopping at epoch 10
Trial 96, Fold 1: Test Accuracy = 0.3853
EarlyStopping counter: 1 out of 10
EarlyStopping counter: 1 out of 10
EarlyStopping counter: 2 out of 10
EarlyStopping counter: 3 out of 10
EarlyStopping counter: 4 out of 10
EarlyStopping counter: 5 out of 10
EarlyStopping counter: 1 out of 10
EarlyStopping counter: 2 out of 10
EarlyStopping counter: 3 out of 10
EarlyStopping counter: 4 out of 10
EarlyStopping counter: 1 out of 10
EarlyStopping counter: 1 out of 10
EarlyStopping counter: 2 out of 10
EarlyStopping counter: 1 out of 10
EarlyStopping counter: 2 out of 10
EarlyStopping counter: 3 out of 10
EarlyStopping counter: 4 out of 10
EarlyStopping counter: 5 out of 10
EarlyStopping counter: 1 out of 10
EarlyStopping counter: 2 out of 10
EarlyStopping counter: 3 out of 10
EarlyStopping counter: 4 out of 10
EarlyStopping counter: 5 out of 10
EarlyStopping counter: 6 out of 10
EarlyStopping counter: 7 out of 10
EarlyStopping counter: 8 out of 10
EarlyStopping counter: 9 out of 10
EarlyStopping counter: 10 out of 10
Early stopping at epoch 35
Trial 96, Fold 2: Test Accuracy = 0.4533
EarlyStopping counter: 1 out of 10
EarlyStopping counter: 2 out of 10
EarlyStopping counter: 3 out of 10
EarlyStopping counter: 4 out of 10
EarlyStopping counter: 5 out of 10
EarlyStopping counter: 1 out of 10
EarlyStopping counter: 2 out of 10
EarlyStopping counter: 3 out of 10
EarlyStopping counter: 4 out of 10
EarlyStopping counter: 5 out of 10
EarlyStopping counter: 6 out of 10
EarlyStopping counter: 7 out of 10
EarlyStopping counter: 8 out of 10
EarlyStopping counter: 9 out of 10
EarlyStopping counter: 10 out of 10
Early stopping at epoch 20
Trial 96, Fold 3: Test Accuracy = 0.3666
EarlyStopping counter: 1 out of 10
EarlyStopping counter: 2 out of 10
EarlyStopping counter: 3 out of 10
EarlyStopping counter: 4 out of 10
EarlyStopping counter: 5 out of 10
EarlyStopping counter: 6 out of 10
EarlyStopping counter: 7 out of 10
EarlyStopping counter: 8 out of 10
EarlyStopping counter: 9 out of 10
EarlyStopping counter: 10 out of 10
Early stopping at epoch 10
Trial 96, Fold 4: Test Accuracy = 0.3699
EarlyStopping counter: 1 out of 10
EarlyStopping counter: 2 out of 10
EarlyStopping counter: 3 out of 10
EarlyStopping counter: 4 out of 10
EarlyStopping counter: 1 out of 10
EarlyStopping counter: 1 out of 10
EarlyStopping counter: 1 out of 10
EarlyStopping counter: 2 out of 10
EarlyStopping counter: 3 out of 10
EarlyStopping counter: 4 out of 10
EarlyStopping counter: 5 out of 10
EarlyStopping counter: 6 out of 10
EarlyStopping counter: 7 out of 10
EarlyStopping counter: 8 out of 10
EarlyStopping counter: 9 out of 10
EarlyStopping counter: 10 out of 10
Early stopping at epoch 19
Trial 96, Fold 5: Test Accuracy = 0.3710
Trial 96 completed: Mean Accuracy = 0.3892
[I 2025-04-24 17:04:02,849] Trial 96 finished with value: 0.38920756369221193 and parameters: {'embed_dim': 96, 'depths': [2, 2, 6, 2], 'num_heads': [3, 6, 12, 24], 'window_size': 7, 'mlp_ratio': 2.8534150928609883, 'drop_rate': 0.06756362111794201, 'attn_drop_rate': 0.15453755326524343, 'drop_path_rate': 0.07861599401288757, 'learning_rate': 3.7192940633480766e-05, 'weight_decay': 5.950842749679602e-05, 'batch_size': 32, 'optimizer': 'SGD', 'label_smoothing': 0.16803916078058984, 'factor': 1}. Best is trial 68 with value: 0.5026770677464627.
C:\Users\hp\anaconda3\Lib\site-packages\optuna\distributions.py:515: UserWarning: Choices for a categorical distribution should be a tuple of None, bool, int, float and str for persistent storage but contains [2, 2, 6, 2] which is of type list.
warnings.warn(message)
C:\Users\hp\anaconda3\Lib\site-packages\optuna\distributions.py:515: UserWarning: Choices for a categorical distribution should be a tuple of None, bool, int, float and str for persistent storage but contains [2, 2, 18, 2] which is of type list.
warnings.warn(message)
C:\Users\hp\anaconda3\Lib\site-packages\optuna\distributions.py:515: UserWarning: Choices for a categorical distribution should be a tuple of None, bool, int, float and str for persistent storage but contains [3, 6, 12, 24] which is of type list.
warnings.warn(message)
C:\Users\hp\anaconda3\Lib\site-packages\optuna\distributions.py:515: UserWarning: Choices for a categorical distribution should be a tuple of None, bool, int, float and str for persistent storage but contains [4, 8, 16, 32] which is of type list.
warnings.warn(message)
Trial 97 hyperparameters:
embed_dim: 128
depths: [2, 2, 6, 2]
num_heads: [4, 8, 16, 32]
window_size: 7
mlp_ratio: 3.21715291032504
drop_rate: 0.1774267542594385
attn_drop_rate: 0.16801173200519892
drop_path_rate: 0.101724377719208
learning_rate: 5.331959770549367e-05
weight_decay: 8.182103303900524e-05
batch_size: 32
optimizer: AdamW
label_smoothing: 0.14052735862593774
factor: 1
EarlyStopping counter: 1 out of 10
EarlyStopping counter: 2 out of 10
EarlyStopping counter: 3 out of 10
EarlyStopping counter: 4 out of 10
EarlyStopping counter: 5 out of 10
EarlyStopping counter: 6 out of 10
EarlyStopping counter: 7 out of 10
EarlyStopping counter: 8 out of 10
EarlyStopping counter: 9 out of 10
EarlyStopping counter: 1 out of 10
EarlyStopping counter: 2 out of 10
EarlyStopping counter: 3 out of 10
EarlyStopping counter: 4 out of 10
EarlyStopping counter: 5 out of 10
EarlyStopping counter: 6 out of 10
EarlyStopping counter: 7 out of 10
EarlyStopping counter: 8 out of 10
EarlyStopping counter: 9 out of 10
EarlyStopping counter: 10 out of 10
Early stopping at epoch 20
Trial 97, Fold 1: Test Accuracy = 0.4043
EarlyStopping counter: 1 out of 10
EarlyStopping counter: 2 out of 10
EarlyStopping counter: 3 out of 10
EarlyStopping counter: 4 out of 10
EarlyStopping counter: 5 out of 10
EarlyStopping counter: 1 out of 10
EarlyStopping counter: 1 out of 10
EarlyStopping counter: 2 out of 10
EarlyStopping counter: 1 out of 10
EarlyStopping counter: 2 out of 10
EarlyStopping counter: 3 out of 10
EarlyStopping counter: 4 out of 10
EarlyStopping counter: 5 out of 10
EarlyStopping counter: 6 out of 10
EarlyStopping counter: 7 out of 10
EarlyStopping counter: 8 out of 10
EarlyStopping counter: 9 out of 10
EarlyStopping counter: 10 out of 10
Early stopping at epoch 21
Trial 97, Fold 2: Test Accuracy = 0.4845
EarlyStopping counter: 1 out of 10
EarlyStopping counter: 2 out of 10
EarlyStopping counter: 1 out of 10
EarlyStopping counter: 2 out of 10
EarlyStopping counter: 3 out of 10
EarlyStopping counter: 4 out of 10
EarlyStopping counter: 5 out of 10
EarlyStopping counter: 1 out of 10
EarlyStopping counter: 2 out of 10
EarlyStopping counter: 3 out of 10
EarlyStopping counter: 4 out of 10
EarlyStopping counter: 5 out of 10
EarlyStopping counter: 6 out of 10
EarlyStopping counter: 7 out of 10
EarlyStopping counter: 8 out of 10
EarlyStopping counter: 9 out of 10
EarlyStopping counter: 10 out of 10
Early stopping at epoch 19
Trial 97, Fold 3: Test Accuracy = 0.4773
EarlyStopping counter: 1 out of 10
EarlyStopping counter: 2 out of 10
EarlyStopping counter: 3 out of 10
EarlyStopping counter: 4 out of 10
EarlyStopping counter: 5 out of 10
EarlyStopping counter: 6 out of 10
EarlyStopping counter: 7 out of 10
EarlyStopping counter: 8 out of 10
EarlyStopping counter: 9 out of 10
EarlyStopping counter: 10 out of 10
Early stopping at epoch 10
Trial 97, Fold 4: Test Accuracy = 0.4563
EarlyStopping counter: 1 out of 10
EarlyStopping counter: 2 out of 10
EarlyStopping counter: 3 out of 10
EarlyStopping counter: 1 out of 10
EarlyStopping counter: 2 out of 10
EarlyStopping counter: 3 out of 10
EarlyStopping counter: 4 out of 10
EarlyStopping counter: 5 out of 10
EarlyStopping counter: 6 out of 10
EarlyStopping counter: 7 out of 10
EarlyStopping counter: 8 out of 10
EarlyStopping counter: 9 out of 10
EarlyStopping counter: 10 out of 10
Early stopping at epoch 15
Trial 97, Fold 5: Test Accuracy = 0.4431
Trial 97 completed: Mean Accuracy = 0.4531
