Trial 82 hyperparameters:
embed_dim: 128
depths: [2, 2, 6, 2]
num_heads: [4, 8, 16, 32]
window_size: 14
mlp_ratio: 2.5295742393507976
drop_rate: 0.17096020199717704
attn_drop_rate: 0.16336374502145412
drop_path_rate: 0.12060508681590712
learning_rate: 3.074589162672984e-05
weight_decay: 4.299572554033588e-06
batch_size: 32
optimizer: Adam
label_smoothing: 0.16751814781318303
factor: 1
EarlyStopping counter: 1 out of 10
EarlyStopping counter: 1 out of 10
EarlyStopping counter: 2 out of 10
EarlyStopping counter: 3 out of 10
EarlyStopping counter: 4 out of 10
EarlyStopping counter: 5 out of 10
EarlyStopping counter: 1 out of 10
EarlyStopping counter: 2 out of 10
EarlyStopping counter: 3 out of 10
EarlyStopping counter: 4 out of 10
EarlyStopping counter: 5 out of 10
EarlyStopping counter: 6 out of 10
EarlyStopping counter: 7 out of 10
EarlyStopping counter: 8 out of 10
EarlyStopping counter: 9 out of 10
EarlyStopping counter: 10 out of 10
Early stopping at epoch 19
Trial 82, Fold 1: Test Accuracy = 0.4558
EarlyStopping counter: 1 out of 10
EarlyStopping counter: 1 out of 10
EarlyStopping counter: 2 out of 10
EarlyStopping counter: 3 out of 10
EarlyStopping counter: 1 out of 10
EarlyStopping counter: 1 out of 10
EarlyStopping counter: 1 out of 10
EarlyStopping counter: 1 out of 10
EarlyStopping counter: 2 out of 10
EarlyStopping counter: 3 out of 10
EarlyStopping counter: 4 out of 10
EarlyStopping counter: 5 out of 10
EarlyStopping counter: 6 out of 10
EarlyStopping counter: 7 out of 10
EarlyStopping counter: 8 out of 10
EarlyStopping counter: 9 out of 10
EarlyStopping counter: 10 out of 10
Early stopping at epoch 24
Trial 82, Fold 2: Test Accuracy = 0.4871
EarlyStopping counter: 1 out of 10
EarlyStopping counter: 1 out of 10
EarlyStopping counter: 1 out of 10
EarlyStopping counter: 2 out of 10
EarlyStopping counter: 3 out of 10
EarlyStopping counter: 4 out of 10
EarlyStopping counter: 5 out of 10
EarlyStopping counter: 1 out of 10
EarlyStopping counter: 2 out of 10
EarlyStopping counter: 3 out of 10
EarlyStopping counter: 4 out of 10
EarlyStopping counter: 5 out of 10
EarlyStopping counter: 6 out of 10
EarlyStopping counter: 7 out of 10
EarlyStopping counter: 8 out of 10
EarlyStopping counter: 9 out of 10
EarlyStopping counter: 10 out of 10
Early stopping at epoch 22
Trial 82, Fold 3: Test Accuracy = 0.5783
EarlyStopping counter: 1 out of 10
EarlyStopping counter: 2 out of 10
EarlyStopping counter: 3 out of 10
EarlyStopping counter: 4 out of 10
EarlyStopping counter: 5 out of 10
EarlyStopping counter: 6 out of 10
EarlyStopping counter: 7 out of 10
EarlyStopping counter: 8 out of 10
EarlyStopping counter: 9 out of 10
EarlyStopping counter: 10 out of 10
Early stopping at epoch 11
Trial 82, Fold 4: Test Accuracy = 0.5233
EarlyStopping counter: 1 out of 10
EarlyStopping counter: 2 out of 10
EarlyStopping counter: 3 out of 10
EarlyStopping counter: 4 out of 10
EarlyStopping counter: 5 out of 10
EarlyStopping counter: 6 out of 10
EarlyStopping counter: 7 out of 10
EarlyStopping counter: 8 out of 10
EarlyStopping counter: 1 out of 10
EarlyStopping counter: 2 out of 10
EarlyStopping counter: 3 out of 10
EarlyStopping counter: 4 out of 10
EarlyStopping counter: 5 out of 10
EarlyStopping counter: 6 out of 10
EarlyStopping counter: 7 out of 10
EarlyStopping counter: 8 out of 10
EarlyStopping counter: 9 out of 10
EarlyStopping counter: 10 out of 10
Early stopping at epoch 21
Trial 82, Fold 5: Test Accuracy = 0.4110
Trial 82 completed: Mean Accuracy = 0.4911
[I 2025-04-24 09:18:43,705] Trial 82 finished with value: 0.491077945519003 and parameters: {'embed_dim': 128, 'depths': [2, 2, 6, 2], 'num_heads': [4, 8, 16, 32], 'window_size': 14, 'mlp_ratio': 2.5295742393507976, 'drop_rate': 0.17096020199717704, 'attn_drop_rate': 0.16336374502145412, 'drop_path_rate': 0.12060508681590712, 'learning_rate': 3.074589162672984e-05, 'weight_decay': 4.299572554033588e-06, 'batch_size': 32, 'optimizer': 'Adam', 'label_smoothing': 0.16751814781318303, 'factor': 1}. Best is trial 68 with value: 0.5026770677464627.
C:\Users\hp\anaconda3\Lib\site-packages\optuna\distributions.py:515: UserWarning: Choices for a categorical distribution should be a tuple of None, bool, int, float and str for persistent storage but contains [2, 2, 6, 2] which is of type list.
warnings.warn(message)
C:\Users\hp\anaconda3\Lib\site-packages\optuna\distributions.py:515: UserWarning: Choices for a categorical distribution should be a tuple of None, bool, int, float and str for persistent storage but contains [2, 2, 18, 2] which is of type list.
warnings.warn(message)
C:\Users\hp\anaconda3\Lib\site-packages\optuna\distributions.py:515: UserWarning: Choices for a categorical distribution should be a tuple of None, bool, int, float and str for persistent storage but contains [3, 6, 12, 24] which is of type list.
warnings.warn(message)
C:\Users\hp\anaconda3\Lib\site-packages\optuna\distributions.py:515: UserWarning: Choices for a categorical distribution should be a tuple of None, bool, int, float and str for persistent storage but contains [4, 8, 16, 32] which is of type list.
warnings.warn(message)
Trial 83 hyperparameters:
embed_dim: 128
depths: [2, 2, 6, 2]
num_heads: [4, 8, 16, 32]
window_size: 14
mlp_ratio: 2.7845684286102053
drop_rate: 0.18390250943137598
attn_drop_rate: 0.1597529671911986
drop_path_rate: 0.11814319269928188
learning_rate: 1.5528556714854725e-05
weight_decay: 4.3111858223680095e-06
batch_size: 32
optimizer: Adam
label_smoothing: 0.16614838185754638
factor: 1
EarlyStopping counter: 1 out of 10
EarlyStopping counter: 2 out of 10
EarlyStopping counter: 1 out of 10
EarlyStopping counter: 2 out of 10
EarlyStopping counter: 3 out of 10
EarlyStopping counter: 4 out of 10
EarlyStopping counter: 5 out of 10
EarlyStopping counter: 6 out of 10
EarlyStopping counter: 7 out of 10
EarlyStopping counter: 8 out of 10
EarlyStopping counter: 9 out of 10
EarlyStopping counter: 10 out of 10
Early stopping at epoch 14
Trial 83, Fold 1: Test Accuracy = 0.4060
EarlyStopping counter: 1 out of 10
EarlyStopping counter: 2 out of 10
EarlyStopping counter: 1 out of 10
EarlyStopping counter: 2 out of 10
EarlyStopping counter: 3 out of 10
EarlyStopping counter: 1 out of 10
EarlyStopping counter: 2 out of 10
EarlyStopping counter: 3 out of 10
EarlyStopping counter: 1 out of 10
EarlyStopping counter: 2 out of 10
EarlyStopping counter: 3 out of 10
EarlyStopping counter: 4 out of 10
EarlyStopping counter: 5 out of 10
EarlyStopping counter: 6 out of 10
EarlyStopping counter: 7 out of 10
EarlyStopping counter: 8 out of 10
EarlyStopping counter: 9 out of 10
EarlyStopping counter: 10 out of 10
Early stopping at epoch 22
Trial 83, Fold 2: Test Accuracy = 0.5029
EarlyStopping counter: 1 out of 10
EarlyStopping counter: 1 out of 10
EarlyStopping counter: 2 out of 10
EarlyStopping counter: 3 out of 10
EarlyStopping counter: 4 out of 10
EarlyStopping counter: 5 out of 10
EarlyStopping counter: 6 out of 10
EarlyStopping counter: 7 out of 10
EarlyStopping counter: 8 out of 10
EarlyStopping counter: 9 out of 10
EarlyStopping counter: 10 out of 10
Early stopping at epoch 13
Trial 83, Fold 3: Test Accuracy = 0.4682
EarlyStopping counter: 1 out of 10
EarlyStopping counter: 2 out of 10
EarlyStopping counter: 1 out of 10
EarlyStopping counter: 2 out of 10
EarlyStopping counter: 3 out of 10
EarlyStopping counter: 4 out of 10
EarlyStopping counter: 5 out of 10
EarlyStopping counter: 6 out of 10
EarlyStopping counter: 7 out of 10
EarlyStopping counter: 8 out of 10
EarlyStopping counter: 9 out of 10
EarlyStopping counter: 10 out of 10
Early stopping at epoch 14
Trial 83, Fold 4: Test Accuracy = 0.4884
EarlyStopping counter: 1 out of 10
EarlyStopping counter: 1 out of 10
EarlyStopping counter: 2 out of 10
EarlyStopping counter: 3 out of 10
EarlyStopping counter: 4 out of 10
EarlyStopping counter: 1 out of 10
EarlyStopping counter: 2 out of 10
EarlyStopping counter: 3 out of 10
EarlyStopping counter: 4 out of 10
EarlyStopping counter: 5 out of 10
EarlyStopping counter: 6 out of 10
EarlyStopping counter: 7 out of 10
EarlyStopping counter: 8 out of 10
EarlyStopping counter: 9 out of 10
EarlyStopping counter: 10 out of 10
Early stopping at epoch 18
Trial 83, Fold 5: Test Accuracy = 0.4641
Trial 83 completed: Mean Accuracy = 0.4659
[I 2025-04-24 09:49:34,667] Trial 83 finished with value: 0.46592817175287615 and parameters: {'embed_dim': 128, 'depths': [2, 2, 6, 2], 'num_heads': [4, 8, 16, 32], 'window_size': 14, 'mlp_ratio': 2.7845684286102053, 'drop_rate': 0.18390250943137598, 'attn_drop_rate': 0.1597529671911986, 'drop_path_rate': 0.11814319269928188, 'learning_rate': 1.5528556714854725e-05, 'weight_decay': 4.3111858223680095e-06, 'batch_size': 32, 'optimizer': 'Adam', 'label_smoothing': 0.16614838185754638, 'factor': 1}. Best is trial 68 with value: 0.5026770677464627.
C:\Users\hp\anaconda3\Lib\site-packages\optuna\distributions.py:515: UserWarning: Choices for a categorical distribution should be a tuple of None, bool, int, float and str for persistent storage but contains [2, 2, 6, 2] which is of type list.
warnings.warn(message)
C:\Users\hp\anaconda3\Lib\site-packages\optuna\distributions.py:515: UserWarning: Choices for a categorical distribution should be a tuple of None, bool, int, float and str for persistent storage but contains [2, 2, 18, 2] which is of type list.
warnings.warn(message)
C:\Users\hp\anaconda3\Lib\site-packages\optuna\distributions.py:515: UserWarning: Choices for a categorical distribution should be a tuple of None, bool, int, float and str for persistent storage but contains [3, 6, 12, 24] which is of type list.
warnings.warn(message)
C:\Users\hp\anaconda3\Lib\site-packages\optuna\distributions.py:515: UserWarning: Choices for a categorical distribution should be a tuple of None, bool, int, float and str for persistent storage but contains [4, 8, 16, 32] which is of type list.
warnings.warn(message)
Trial 84 hyperparameters:
embed_dim: 128
depths: [2, 2, 6, 2]
num_heads: [4, 8, 16, 32]
window_size: 14
mlp_ratio: 2.5497066983155587
drop_rate: 0.230662358019812
attn_drop_rate: 0.12936191151170887
drop_path_rate: 0.45698080190110074
learning_rate: 4.020031923199224e-05
weight_decay: 6.2315324309237865e-06
batch_size: 32
optimizer: Adam
label_smoothing: 0.18152935159538072
factor: 4
EarlyStopping counter: 1 out of 10
EarlyStopping counter: 2 out of 10
EarlyStopping counter: 3 out of 10
EarlyStopping counter: 4 out of 10
EarlyStopping counter: 5 out of 10
EarlyStopping counter: 6 out of 10
EarlyStopping counter: 7 out of 10
EarlyStopping counter: 8 out of 10
EarlyStopping counter: 9 out of 10
EarlyStopping counter: 10 out of 10
Early stopping at epoch 10
Trial 84, Fold 1: Test Accuracy = 0.3350
EarlyStopping counter: 1 out of 10
EarlyStopping counter: 2 out of 10
EarlyStopping counter: 3 out of 10
EarlyStopping counter: 4 out of 10
EarlyStopping counter: 5 out of 10
EarlyStopping counter: 6 out of 10
EarlyStopping counter: 7 out of 10
EarlyStopping counter: 8 out of 10
EarlyStopping counter: 9 out of 10
EarlyStopping counter: 1 out of 10
EarlyStopping counter: 2 out of 10
EarlyStopping counter: 3 out of 10
EarlyStopping counter: 4 out of 10
EarlyStopping counter: 5 out of 10
EarlyStopping counter: 1 out of 10
EarlyStopping counter: 2 out of 10
EarlyStopping counter: 1 out of 10
EarlyStopping counter: 2 out of 10
EarlyStopping counter: 3 out of 10
EarlyStopping counter: 4 out of 10
EarlyStopping counter: 5 out of 10
EarlyStopping counter: 6 out of 10
EarlyStopping counter: 7 out of 10
EarlyStopping counter: 8 out of 10
EarlyStopping counter: 9 out of 10
EarlyStopping counter: 10 out of 10
Early stopping at epoch 29
Trial 84, Fold 2: Test Accuracy = 0.4214
EarlyStopping counter: 1 out of 10
EarlyStopping counter: 2 out of 10
EarlyStopping counter: 3 out of 10
EarlyStopping counter: 1 out of 10
EarlyStopping counter: 2 out of 10
EarlyStopping counter: 3 out of 10
EarlyStopping counter: 4 out of 10
EarlyStopping counter: 5 out of 10
EarlyStopping counter: 6 out of 10
EarlyStopping counter: 7 out of 10
EarlyStopping counter: 8 out of 10
EarlyStopping counter: 9 out of 10
EarlyStopping counter: 10 out of 10
Early stopping at epoch 15
Trial 84, Fold 3: Test Accuracy = 0.3608
EarlyStopping counter: 1 out of 10
EarlyStopping counter: 2 out of 10
EarlyStopping counter: 1 out of 10
EarlyStopping counter: 2 out of 10
EarlyStopping counter: 3 out of 10
EarlyStopping counter: 4 out of 10
EarlyStopping counter: 5 out of 10
EarlyStopping counter: 6 out of 10
EarlyStopping counter: 7 out of 10
EarlyStopping counter: 8 out of 10
EarlyStopping counter: 9 out of 10
EarlyStopping counter: 10 out of 10
Early stopping at epoch 14
Trial 84, Fold 4: Test Accuracy = 0.3288
EarlyStopping counter: 1 out of 10
EarlyStopping counter: 2 out of 10
EarlyStopping counter: 3 out of 10
EarlyStopping counter: 1 out of 10
EarlyStopping counter: 2 out of 10
EarlyStopping counter: 3 out of 10
EarlyStopping counter: 4 out of 10
EarlyStopping counter: 5 out of 10
EarlyStopping counter: 6 out of 10
EarlyStopping counter: 7 out of 10
EarlyStopping counter: 8 out of 10
EarlyStopping counter: 9 out of 10
EarlyStopping counter: 10 out of 10
Early stopping at epoch 14
Trial 84, Fold 5: Test Accuracy = 0.3506
Trial 84 completed: Mean Accuracy = 0.3593
[I 2025-04-24 10:06:22,882] Trial 84 finished with value: 0.3593478734687987 and parameters: {'embed_dim': 128, 'depths': [2, 2, 6, 2], 'num_heads': [4, 8, 16, 32], 'window_size': 14, 'mlp_ratio': 2.5497066983155587, 'drop_rate': 0.230662358019812, 'attn_drop_rate': 0.12936191151170887, 'drop_path_rate': 0.45698080190110074, 'learning_rate': 4.020031923199224e-05, 'weight_decay': 6.2315324309237865e-06, 'batch_size': 32, 'optimizer': 'Adam', 'label_smoothing': 0.18152935159538072, 'factor': 4}. Best is trial 68 with value: 0.5026770677464627.
C:\Users\hp\anaconda3\Lib\site-packages\optuna\distributions.py:515: UserWarning: Choices for a categorical distribution should be a tuple of None, bool, int, float and str for persistent storage but contains [2, 2, 6, 2] which is of type list.
warnings.warn(message)
C:\Users\hp\anaconda3\Lib\site-packages\optuna\distributions.py:515: UserWarning: Choices for a categorical distribution should be a tuple of None, bool, int, float and str for persistent storage but contains [2, 2, 18, 2] which is of type list.
warnings.warn(message)
C:\Users\hp\anaconda3\Lib\site-packages\optuna\distributions.py:515: UserWarning: Choices for a categorical distribution should be a tuple of None, bool, int, float and str for persistent storage but contains [3, 6, 12, 24] which is of type list.
warnings.warn(message)
C:\Users\hp\anaconda3\Lib\site-packages\optuna\distributions.py:515: UserWarning: Choices for a categorical distribution should be a tuple of None, bool, int, float and str for persistent storage but contains [4, 8, 16, 32] which is of type list.
warnings.warn(message)
Trial 85 hyperparameters:
embed_dim: 128
depths: [2, 2, 6, 2]
num_heads: [4, 8, 16, 32]
window_size: 14
mlp_ratio: 2.839676016103781
drop_rate: 0.16825904346174214
attn_drop_rate: 0.04637801355635862
drop_path_rate: 0.06873246778267449
learning_rate: 8.39777798007741e-05
weight_decay: 3.3745042596860386e-06
batch_size: 32
optimizer: Adam
label_smoothing: 0.047208159608426906
factor: 1
EarlyStopping counter: 1 out of 10
EarlyStopping counter: 2 out of 10
EarlyStopping counter: 3 out of 10
EarlyStopping counter: 1 out of 10
EarlyStopping counter: 2 out of 10
EarlyStopping counter: 3 out of 10
EarlyStopping counter: 1 out of 10
EarlyStopping counter: 2 out of 10
EarlyStopping counter: 3 out of 10
EarlyStopping counter: 1 out of 10
EarlyStopping counter: 2 out of 10
EarlyStopping counter: 3 out of 10
EarlyStopping counter: 4 out of 10
EarlyStopping counter: 5 out of 10
EarlyStopping counter: 6 out of 10
EarlyStopping counter: 7 out of 10
EarlyStopping counter: 8 out of 10
EarlyStopping counter: 9 out of 10
EarlyStopping counter: 1 out of 10
EarlyStopping counter: 2 out of 10
EarlyStopping counter: 3 out of 10
EarlyStopping counter: 4 out of 10
EarlyStopping counter: 5 out of 10
EarlyStopping counter: 6 out of 10
EarlyStopping counter: 7 out of 10
EarlyStopping counter: 8 out of 10
EarlyStopping counter: 9 out of 10
EarlyStopping counter: 10 out of 10
Early stopping at epoch 34
Trial 85, Fold 1: Test Accuracy = 0.4302
EarlyStopping counter: 1 out of 10
EarlyStopping counter: 2 out of 10
EarlyStopping counter: 3 out of 10
EarlyStopping counter: 4 out of 10
EarlyStopping counter: 1 out of 10
EarlyStopping counter: 2 out of 10
EarlyStopping counter: 3 out of 10
EarlyStopping counter: 4 out of 10
EarlyStopping counter: 1 out of 10
EarlyStopping counter: 2 out of 10
EarlyStopping counter: 3 out of 10
EarlyStopping counter: 4 out of 10
EarlyStopping counter: 5 out of 10
EarlyStopping counter: 1 out of 10
EarlyStopping counter: 2 out of 10
EarlyStopping counter: 3 out of 10
EarlyStopping counter: 4 out of 10
EarlyStopping counter: 5 out of 10
EarlyStopping counter: 6 out of 10
EarlyStopping counter: 7 out of 10
EarlyStopping counter: 8 out of 10
EarlyStopping counter: 9 out of 10
EarlyStopping counter: 10 out of 10
Early stopping at epoch 27
Trial 85, Fold 2: Test Accuracy = 0.5306
EarlyStopping counter: 1 out of 10
EarlyStopping counter: 2 out of 10
EarlyStopping counter: 1 out of 10
EarlyStopping counter: 2 out of 10
EarlyStopping counter: 3 out of 10
EarlyStopping counter: 4 out of 10
EarlyStopping counter: 5 out of 10
EarlyStopping counter: 6 out of 10
EarlyStopping counter: 7 out of 10
EarlyStopping counter: 8 out of 10
EarlyStopping counter: 9 out of 10
EarlyStopping counter: 10 out of 10
Early stopping at epoch 13
Trial 85, Fold 3: Test Accuracy = 0.3396
EarlyStopping counter: 1 out of 10
EarlyStopping counter: 2 out of 10
EarlyStopping counter: 1 out of 10
EarlyStopping counter: 2 out of 10
EarlyStopping counter: 3 out of 10
EarlyStopping counter: 4 out of 10
EarlyStopping counter: 5 out of 10
EarlyStopping counter: 6 out of 10
EarlyStopping counter: 7 out of 10
EarlyStopping counter: 8 out of 10
EarlyStopping counter: 9 out of 10
EarlyStopping counter: 10 out of 10
Early stopping at epoch 14
Trial 85, Fold 4: Test Accuracy = 0.4565
EarlyStopping counter: 1 out of 10
EarlyStopping counter: 2 out of 10
EarlyStopping counter: 1 out of 10
EarlyStopping counter: 2 out of 10
EarlyStopping counter: 3 out of 10
EarlyStopping counter: 4 out of 10
EarlyStopping counter: 5 out of 10
EarlyStopping counter: 1 out of 10
EarlyStopping counter: 2 out of 10
EarlyStopping counter: 3 out of 10
EarlyStopping counter: 4 out of 10
EarlyStopping counter: 5 out of 10
EarlyStopping counter: 6 out of 10
EarlyStopping counter: 7 out of 10
EarlyStopping counter: 8 out of 10
EarlyStopping counter: 9 out of 10
EarlyStopping counter: 10 out of 10
Early stopping at epoch 20
Trial 85, Fold 5: Test Accuracy = 0.4653
Trial 85 completed: Mean Accuracy = 0.4444
