[I 2025-04-24 10:46:46,419] Trial 85 finished with value: 0.44442975182143296 and parameters: {'embed_dim': 128, 'depths': [2, 2, 6, 2], 'num_heads': [4, 8, 16, 32], 'window_size': 14, 'mlp_ratio': 2.839676016103781, 'drop_rate': 0.16825904346174214, 'attn_drop_rate': 0.04637801355635862, 'drop_path_rate': 0.06873246778267449, 'learning_rate': 8.39777798007741e-05, 'weight_decay': 3.3745042596860386e-06, 'batch_size': 32, 'optimizer': 'Adam', 'label_smoothing': 0.047208159608426906, 'factor': 1}. Best is trial 68 with value: 0.5026770677464627.
C:\Users\hp\anaconda3\Lib\site-packages\optuna\distributions.py:515: UserWarning: Choices for a categorical distribution should be a tuple of None, bool, int, float and str for persistent storage but contains [2, 2, 6, 2] which is of type list.
warnings.warn(message)
C:\Users\hp\anaconda3\Lib\site-packages\optuna\distributions.py:515: UserWarning: Choices for a categorical distribution should be a tuple of None, bool, int, float and str for persistent storage but contains [2, 2, 18, 2] which is of type list.
warnings.warn(message)
C:\Users\hp\anaconda3\Lib\site-packages\optuna\distributions.py:515: UserWarning: Choices for a categorical distribution should be a tuple of None, bool, int, float and str for persistent storage but contains [3, 6, 12, 24] which is of type list.
warnings.warn(message)
C:\Users\hp\anaconda3\Lib\site-packages\optuna\distributions.py:515: UserWarning: Choices for a categorical distribution should be a tuple of None, bool, int, float and str for persistent storage but contains [4, 8, 16, 32] which is of type list.
warnings.warn(message)
Trial 86 hyperparameters:
embed_dim: 128
depths: [2, 2, 6, 2]
num_heads: [4, 8, 16, 32]
window_size: 14
mlp_ratio: 2.526024468263342
drop_rate: 0.09210251790762389
attn_drop_rate: 0.09760825151098636
drop_path_rate: 0.13603828611618893
learning_rate: 1.1175869469554431e-05
weight_decay: 1.2450998390442961e-06
batch_size: 64
optimizer: Adam
label_smoothing: 0.07292458202832336
factor: 1
EarlyStopping counter: 1 out of 10
EarlyStopping counter: 2 out of 10
EarlyStopping counter: 3 out of 10
EarlyStopping counter: 4 out of 10
EarlyStopping counter: 1 out of 10
EarlyStopping counter: 2 out of 10
EarlyStopping counter: 3 out of 10
EarlyStopping counter: 4 out of 10
EarlyStopping counter: 5 out of 10
EarlyStopping counter: 6 out of 10
EarlyStopping counter: 7 out of 10
EarlyStopping counter: 8 out of 10
EarlyStopping counter: 9 out of 10
EarlyStopping counter: 10 out of 10
Early stopping at epoch 18
Trial 86, Fold 1: Test Accuracy = 0.4289
EarlyStopping counter: 1 out of 10
EarlyStopping counter: 2 out of 10
EarlyStopping counter: 3 out of 10
EarlyStopping counter: 1 out of 10
EarlyStopping counter: 2 out of 10
EarlyStopping counter: 1 out of 10
EarlyStopping counter: 1 out of 10
EarlyStopping counter: 1 out of 10
EarlyStopping counter: 2 out of 10
EarlyStopping counter: 3 out of 10
EarlyStopping counter: 4 out of 10
EarlyStopping counter: 5 out of 10
EarlyStopping counter: 1 out of 10
EarlyStopping counter: 2 out of 10
EarlyStopping counter: 1 out of 10
EarlyStopping counter: 2 out of 10
EarlyStopping counter: 3 out of 10
EarlyStopping counter: 4 out of 10
EarlyStopping counter: 5 out of 10
EarlyStopping counter: 6 out of 10
EarlyStopping counter: 7 out of 10
EarlyStopping counter: 8 out of 10
EarlyStopping counter: 9 out of 10
EarlyStopping counter: 10 out of 10
Early stopping at epoch 30
Trial 86, Fold 2: Test Accuracy = 0.4944
EarlyStopping counter: 1 out of 10
EarlyStopping counter: 2 out of 10
EarlyStopping counter: 1 out of 10
EarlyStopping counter: 2 out of 10
EarlyStopping counter: 3 out of 10
EarlyStopping counter: 4 out of 10
EarlyStopping counter: 5 out of 10
EarlyStopping counter: 6 out of 10
EarlyStopping counter: 7 out of 10
EarlyStopping counter: 8 out of 10
EarlyStopping counter: 9 out of 10
EarlyStopping counter: 10 out of 10
Early stopping at epoch 13
Trial 86, Fold 3: Test Accuracy = 0.4329
EarlyStopping counter: 1 out of 10
EarlyStopping counter: 2 out of 10
EarlyStopping counter: 3 out of 10
EarlyStopping counter: 1 out of 10
EarlyStopping counter: 2 out of 10
EarlyStopping counter: 3 out of 10
EarlyStopping counter: 4 out of 10
EarlyStopping counter: 5 out of 10
EarlyStopping counter: 6 out of 10
EarlyStopping counter: 7 out of 10
EarlyStopping counter: 8 out of 10
EarlyStopping counter: 9 out of 10
EarlyStopping counter: 10 out of 10
Early stopping at epoch 15
Trial 86, Fold 4: Test Accuracy = 0.4441
EarlyStopping counter: 1 out of 10
EarlyStopping counter: 2 out of 10
EarlyStopping counter: 3 out of 10
EarlyStopping counter: 4 out of 10
EarlyStopping counter: 5 out of 10
EarlyStopping counter: 6 out of 10
EarlyStopping counter: 7 out of 10
EarlyStopping counter: 1 out of 10
EarlyStopping counter: 2 out of 10
EarlyStopping counter: 3 out of 10
EarlyStopping counter: 4 out of 10
EarlyStopping counter: 5 out of 10
EarlyStopping counter: 6 out of 10
EarlyStopping counter: 1 out of 10
EarlyStopping counter: 2 out of 10
EarlyStopping counter: 3 out of 10
EarlyStopping counter: 4 out of 10
EarlyStopping counter: 5 out of 10
EarlyStopping counter: 6 out of 10
EarlyStopping counter: 7 out of 10
EarlyStopping counter: 8 out of 10
EarlyStopping counter: 9 out of 10
EarlyStopping counter: 10 out of 10
Early stopping at epoch 25
Trial 86, Fold 5: Test Accuracy = 0.4328
Trial 86 completed: Mean Accuracy = 0.4466
[I 2025-04-24 11:26:55,704] Trial 86 finished with value: 0.4466253569946783 and parameters: {'embed_dim': 128, 'depths': [2, 2, 6, 2], 'num_heads': [4, 8, 16, 32], 'window_size': 14, 'mlp_ratio': 2.526024468263342, 'drop_rate': 0.09210251790762389, 'attn_drop_rate': 0.09760825151098636, 'drop_path_rate': 0.13603828611618893, 'learning_rate': 1.1175869469554431e-05, 'weight_decay': 1.2450998390442961e-06, 'batch_size': 64, 'optimizer': 'Adam', 'label_smoothing': 0.07292458202832336, 'factor': 1}. Best is trial 68 with value: 0.5026770677464627.
C:\Users\hp\anaconda3\Lib\site-packages\optuna\distributions.py:515: UserWarning: Choices for a categorical distribution should be a tuple of None, bool, int, float and str for persistent storage but contains [2, 2, 6, 2] which is of type list.
warnings.warn(message)
C:\Users\hp\anaconda3\Lib\site-packages\optuna\distributions.py:515: UserWarning: Choices for a categorical distribution should be a tuple of None, bool, int, float and str for persistent storage but contains [2, 2, 18, 2] which is of type list.
warnings.warn(message)
C:\Users\hp\anaconda3\Lib\site-packages\optuna\distributions.py:515: UserWarning: Choices for a categorical distribution should be a tuple of None, bool, int, float and str for persistent storage but contains [3, 6, 12, 24] which is of type list.
warnings.warn(message)
C:\Users\hp\anaconda3\Lib\site-packages\optuna\distributions.py:515: UserWarning: Choices for a categorical distribution should be a tuple of None, bool, int, float and str for persistent storage but contains [4, 8, 16, 32] which is of type list.
warnings.warn(message)
Trial 87 hyperparameters:
embed_dim: 128
depths: [2, 2, 6, 2]
num_heads: [4, 8, 16, 32]
window_size: 14
mlp_ratio: 2.6301770924613446
drop_rate: 0.19930338842820022
attn_drop_rate: 0.07026047340764231
drop_path_rate: 0.11554347493439429
learning_rate: 2.9833434421070755e-05
weight_decay: 4.9862178624236894e-05
batch_size: 32
optimizer: SGD
label_smoothing: 0.06163143409634517
factor: 1
EarlyStopping counter: 1 out of 10
EarlyStopping counter: 2 out of 10
EarlyStopping counter: 3 out of 10
EarlyStopping counter: 4 out of 10
EarlyStopping counter: 5 out of 10
EarlyStopping counter: 6 out of 10
EarlyStopping counter: 7 out of 10
EarlyStopping counter: 8 out of 10
EarlyStopping counter: 9 out of 10
EarlyStopping counter: 10 out of 10
Early stopping at epoch 10
Trial 87, Fold 1: Test Accuracy = 0.3368
EarlyStopping counter: 1 out of 10
EarlyStopping counter: 2 out of 10
EarlyStopping counter: 3 out of 10
EarlyStopping counter: 4 out of 10
EarlyStopping counter: 5 out of 10
EarlyStopping counter: 1 out of 10
EarlyStopping counter: 1 out of 10
EarlyStopping counter: 2 out of 10
EarlyStopping counter: 3 out of 10
EarlyStopping counter: 4 out of 10
EarlyStopping counter: 5 out of 10
EarlyStopping counter: 1 out of 10
EarlyStopping counter: 2 out of 10
EarlyStopping counter: 3 out of 10
EarlyStopping counter: 4 out of 10
EarlyStopping counter: 5 out of 10
EarlyStopping counter: 6 out of 10
EarlyStopping counter: 1 out of 10
EarlyStopping counter: 2 out of 10
EarlyStopping counter: 3 out of 10
EarlyStopping counter: 4 out of 10
EarlyStopping counter: 5 out of 10
EarlyStopping counter: 1 out of 10
EarlyStopping counter: 2 out of 10
EarlyStopping counter: 3 out of 10
EarlyStopping counter: 4 out of 10
EarlyStopping counter: 5 out of 10
EarlyStopping counter: 6 out of 10
EarlyStopping counter: 7 out of 10
EarlyStopping counter: 8 out of 10
EarlyStopping counter: 9 out of 10
EarlyStopping counter: 10 out of 10
Early stopping at epoch 37
Trial 87, Fold 2: Test Accuracy = 0.3355
EarlyStopping counter: 1 out of 10
EarlyStopping counter: 1 out of 10
EarlyStopping counter: 2 out of 10
EarlyStopping counter: 1 out of 10
EarlyStopping counter: 2 out of 10
EarlyStopping counter: 3 out of 10
EarlyStopping counter: 4 out of 10
EarlyStopping counter: 5 out of 10
EarlyStopping counter: 1 out of 10
EarlyStopping counter: 2 out of 10
EarlyStopping counter: 3 out of 10
EarlyStopping counter: 4 out of 10
EarlyStopping counter: 5 out of 10
EarlyStopping counter: 6 out of 10
EarlyStopping counter: 7 out of 10
EarlyStopping counter: 8 out of 10
EarlyStopping counter: 9 out of 10
EarlyStopping counter: 10 out of 10
Early stopping at epoch 24
Trial 87, Fold 3: Test Accuracy = 0.3740
EarlyStopping counter: 1 out of 10
EarlyStopping counter: 2 out of 10
EarlyStopping counter: 3 out of 10
EarlyStopping counter: 1 out of 10
EarlyStopping counter: 2 out of 10
EarlyStopping counter: 3 out of 10
EarlyStopping counter: 4 out of 10
EarlyStopping counter: 5 out of 10
EarlyStopping counter: 6 out of 10
EarlyStopping counter: 7 out of 10
EarlyStopping counter: 8 out of 10
EarlyStopping counter: 1 out of 10
EarlyStopping counter: 2 out of 10
EarlyStopping counter: 3 out of 10
EarlyStopping counter: 1 out of 10
EarlyStopping counter: 2 out of 10
EarlyStopping counter: 3 out of 10
EarlyStopping counter: 4 out of 10
EarlyStopping counter: 5 out of 10
EarlyStopping counter: 6 out of 10
EarlyStopping counter: 7 out of 10
EarlyStopping counter: 8 out of 10
EarlyStopping counter: 9 out of 10
EarlyStopping counter: 10 out of 10
Early stopping at epoch 29
Trial 87, Fold 4: Test Accuracy = 0.3499
EarlyStopping counter: 1 out of 10
EarlyStopping counter: 2 out of 10
EarlyStopping counter: 3 out of 10
EarlyStopping counter: 4 out of 10
EarlyStopping counter: 5 out of 10
EarlyStopping counter: 6 out of 10
EarlyStopping counter: 7 out of 10
EarlyStopping counter: 8 out of 10
EarlyStopping counter: 9 out of 10
EarlyStopping counter: 10 out of 10
Early stopping at epoch 11
Trial 87, Fold 5: Test Accuracy = 0.3290
Trial 87 completed: Mean Accuracy = 0.3450
[I 2025-04-24 12:07:23,550] Trial 87 finished with value: 0.3450476410128371 and parameters: {'embed_dim': 128, 'depths': [2, 2, 6, 2], 'num_heads': [4, 8, 16, 32], 'window_size': 14, 'mlp_ratio': 2.6301770924613446, 'drop_rate': 0.19930338842820022, 'attn_drop_rate': 0.07026047340764231, 'drop_path_rate': 0.11554347493439429, 'learning_rate': 2.9833434421070755e-05, 'weight_decay': 4.9862178624236894e-05, 'batch_size': 32, 'optimizer': 'SGD', 'label_smoothing': 0.06163143409634517, 'factor': 1}. Best is trial 68 with value: 0.5026770677464627.
C:\Users\hp\anaconda3\Lib\site-packages\optuna\distributions.py:515: UserWarning: Choices for a categorical distribution should be a tuple of None, bool, int, float and str for persistent storage but contains [2, 2, 6, 2] which is of type list.
warnings.warn(message)
C:\Users\hp\anaconda3\Lib\site-packages\optuna\distributions.py:515: UserWarning: Choices for a categorical distribution should be a tuple of None, bool, int, float and str for persistent storage but contains [2, 2, 18, 2] which is of type list.
warnings.warn(message)
C:\Users\hp\anaconda3\Lib\site-packages\optuna\distributions.py:515: UserWarning: Choices for a categorical distribution should be a tuple of None, bool, int, float and str for persistent storage but contains [3, 6, 12, 24] which is of type list.
warnings.warn(message)
C:\Users\hp\anaconda3\Lib\site-packages\optuna\distributions.py:515: UserWarning: Choices for a categorical distribution should be a tuple of None, bool, int, float and str for persistent storage but contains [4, 8, 16, 32] which is of type list.
warnings.warn(message)
Trial 88 hyperparameters:
embed_dim: 128
depths: [2, 2, 6, 2]
num_heads: [4, 8, 16, 32]
window_size: 14
mlp_ratio: 2.9960128148938
drop_rate: 0.1603592149136427
attn_drop_rate: 0.27340491846591397
drop_path_rate: 0.04458330992445373
learning_rate: 4.56009251550066e-05
weight_decay: 1.9937908639020903e-05
batch_size: 32
optimizer: Adam
label_smoothing: 0.028032832454084618
factor: 1
EarlyStopping counter: 1 out of 10
EarlyStopping counter: 2 out of 10
EarlyStopping counter: 3 out of 10
EarlyStopping counter: 4 out of 10
EarlyStopping counter: 5 out of 10
EarlyStopping counter: 6 out of 10
EarlyStopping counter: 7 out of 10
EarlyStopping counter: 1 out of 10
EarlyStopping counter: 2 out of 10
EarlyStopping counter: 1 out of 10
EarlyStopping counter: 2 out of 10
EarlyStopping counter: 3 out of 10
EarlyStopping counter: 4 out of 10
EarlyStopping counter: 1 out of 10
EarlyStopping counter: 2 out of 10
EarlyStopping counter: 3 out of 10
EarlyStopping counter: 4 out of 10
EarlyStopping counter: 5 out of 10
EarlyStopping counter: 6 out of 10
EarlyStopping counter: 7 out of 10
EarlyStopping counter: 8 out of 10
EarlyStopping counter: 9 out of 10
EarlyStopping counter: 10 out of 10
Early stopping at epoch 26
Trial 88, Fold 1: Test Accuracy = 0.4868
EarlyStopping counter: 1 out of 10
EarlyStopping counter: 2 out of 10
EarlyStopping counter: 3 out of 10
EarlyStopping counter: 1 out of 10
EarlyStopping counter: 2 out of 10
EarlyStopping counter: 1 out of 10
EarlyStopping counter: 2 out of 10
EarlyStopping counter: 3 out of 10
EarlyStopping counter: 4 out of 10
EarlyStopping counter: 5 out of 10
EarlyStopping counter: 6 out of 10
EarlyStopping counter: 7 out of 10
EarlyStopping counter: 8 out of 10
EarlyStopping counter: 9 out of 10
EarlyStopping counter: 10 out of 10
Early stopping at epoch 19
Trial 88, Fold 2: Test Accuracy = 0.4653
EarlyStopping counter: 1 out of 10
EarlyStopping counter: 2 out of 10
EarlyStopping counter: 3 out of 10
EarlyStopping counter: 1 out of 10
EarlyStopping counter: 2 out of 10
EarlyStopping counter: 3 out of 10
EarlyStopping counter: 1 out of 10
EarlyStopping counter: 2 out of 10
EarlyStopping counter: 3 out of 10
EarlyStopping counter: 1 out of 10
EarlyStopping counter: 2 out of 10
EarlyStopping counter: 3 out of 10
EarlyStopping counter: 1 out of 10
EarlyStopping counter: 2 out of 10
EarlyStopping counter: 3 out of 10
EarlyStopping counter: 4 out of 10
EarlyStopping counter: 5 out of 10
EarlyStopping counter: 6 out of 10
EarlyStopping counter: 7 out of 10
EarlyStopping counter: 8 out of 10
EarlyStopping counter: 9 out of 10
EarlyStopping counter: 10 out of 10
Early stopping at epoch 29
Trial 88, Fold 3: Test Accuracy = 0.4955
EarlyStopping counter: 1 out of 10
EarlyStopping counter: 1 out of 10
EarlyStopping counter: 2 out of 10
EarlyStopping counter: 1 out of 10
EarlyStopping counter: 2 out of 10
EarlyStopping counter: 3 out of 10
EarlyStopping counter: 4 out of 10
EarlyStopping counter: 5 out of 10
EarlyStopping counter: 6 out of 10
EarlyStopping counter: 7 out of 10
EarlyStopping counter: 8 out of 10
EarlyStopping counter: 9 out of 10
EarlyStopping counter: 10 out of 10
Early stopping at epoch 15
Trial 88, Fold 4: Test Accuracy = 0.4948
EarlyStopping counter: 1 out of 10
EarlyStopping counter: 2 out of 10
EarlyStopping counter: 3 out of 10
EarlyStopping counter: 4 out of 10
EarlyStopping counter: 5 out of 10
EarlyStopping counter: 1 out of 10
EarlyStopping counter: 2 out of 10
EarlyStopping counter: 1 out of 10
EarlyStopping counter: 1 out of 10
EarlyStopping counter: 2 out of 10
EarlyStopping counter: 3 out of 10
EarlyStopping counter: 4 out of 10
EarlyStopping counter: 5 out of 10
EarlyStopping counter: 6 out of 10
EarlyStopping counter: 7 out of 10
EarlyStopping counter: 8 out of 10
EarlyStopping counter: 9 out of 10
EarlyStopping counter: 10 out of 10
Early stopping at epoch 21
Trial 88, Fold 5: Test Accuracy = 0.4556
Trial 88 completed: Mean Accuracy = 0.4796
[I 2025-04-24 12:48:38,248] Trial 88 finished with value: 0.4796120851129991 and parameters: {'embed_dim': 128, 'depths': [2, 2, 6, 2], 'num_heads': [4, 8, 16, 32], 'window_size': 14, 'mlp_ratio': 2.9960128148938, 'drop_rate': 0.1603592149136427, 'attn_drop_rate': 0.27340491846591397, 'drop_path_rate': 0.04458330992445373, 'learning_rate': 4.56009251550066e-05, 'weight_decay': 1.9937908639020903e-05, 'batch_size': 32, 'optimizer': 'Adam', 'label_smoothing': 0.028032832454084618, 'factor': 1}. Best is trial 68 with value: 0.5026770677464627.
C:\Users\hp\anaconda3\Lib\site-packages\optuna\distributions.py:515: UserWarning: Choices for a categorical distribution should be a tuple of None, bool, int, float and str for persistent storage but contains [2, 2, 6, 2] which is of type list.
warnings.warn(message)
C:\Users\hp\anaconda3\Lib\site-packages\optuna\distributions.py:515: UserWarning: Choices for a categorical distribution should be a tuple of None, bool, int, float and str for persistent storage but contains [2, 2, 18, 2] which is of type list.
warnings.warn(message)
C:\Users\hp\anaconda3\Lib\site-packages\optuna\distributions.py:515: UserWarning: Choices for a categorical distribution should be a tuple of None, bool, int, float and str for persistent storage but contains [3, 6, 12, 24] which is of type list.
warnings.warn(message)
C:\Users\hp\anaconda3\Lib\site-packages\optuna\distributions.py:515: UserWarning: Choices for a categorical distribution should be a tuple of None, bool, int, float and str for persistent storage but contains [4, 8, 16, 32] which is of type list.
warnings.warn(message)
Trial 89 hyperparameters:
embed_dim: 128
depths: [2, 2, 6, 2]
num_heads: [4, 8, 16, 32]
window_size: 14
mlp_ratio: 3.2009578714553975
drop_rate: 0.13033059279925654
attn_drop_rate: 0.2867477342881787
drop_path_rate: 0.08762960474458875
learning_rate: 0.00020345130859270792
weight_decay: 4.216778324042579e-06
batch_size: 32
optimizer: Adam
label_smoothing: 0.020564917010912745
factor: 1
EarlyStopping counter: 1 out of 10
EarlyStopping counter: 2 out of 10
EarlyStopping counter: 3 out of 10
EarlyStopping counter: 1 out of 10
EarlyStopping counter: 2 out of 10
EarlyStopping counter: 3 out of 10
EarlyStopping counter: 4 out of 10
EarlyStopping counter: 5 out of 10
EarlyStopping counter: 6 out of 10
EarlyStopping counter: 7 out of 10
EarlyStopping counter: 8 out of 10
EarlyStopping counter: 9 out of 10
EarlyStopping counter: 10 out of 10
Early stopping at epoch 15
Trial 89, Fold 1: Test Accuracy = 0.3333
EarlyStopping counter: 1 out of 10
EarlyStopping counter: 2 out of 10
EarlyStopping counter: 3 out of 10
EarlyStopping counter: 4 out of 10
EarlyStopping counter: 5 out of 10
EarlyStopping counter: 6 out of 10
EarlyStopping counter: 7 out of 10
EarlyStopping counter: 8 out of 10
EarlyStopping counter: 9 out of 10
EarlyStopping counter: 10 out of 10
Early stopping at epoch 13
Trial 89, Fold 2: Test Accuracy = 0.3333
EarlyStopping counter: 1 out of 10
EarlyStopping counter: 2 out of 10
EarlyStopping counter: 3 out of 10
EarlyStopping counter: 1 out of 10
EarlyStopping counter: 2 out of 10
EarlyStopping counter: 3 out of 10
EarlyStopping counter: 4 out of 10
EarlyStopping counter: 5 out of 10
EarlyStopping counter: 6 out of 10
EarlyStopping counter: 7 out of 10
EarlyStopping counter: 8 out of 10
EarlyStopping counter: 9 out of 10
EarlyStopping counter: 10 out of 10
Early stopping at epoch 14
Trial 89, Fold 3: Test Accuracy = 0.3333
EarlyStopping counter: 1 out of 10
EarlyStopping counter: 2 out of 10
EarlyStopping counter: 3 out of 10
EarlyStopping counter: 4 out of 10
EarlyStopping counter: 5 out of 10
EarlyStopping counter: 6 out of 10
EarlyStopping counter: 7 out of 10
EarlyStopping counter: 8 out of 10
EarlyStopping counter: 9 out of 10
EarlyStopping counter: 10 out of 10
Early stopping at epoch 12
Trial 89, Fold 4: Test Accuracy = 0.3333
EarlyStopping counter: 1 out of 10
EarlyStopping counter: 1 out of 10
EarlyStopping counter: 2 out of 10
EarlyStopping counter: 3 out of 10
EarlyStopping counter: 4 out of 10
EarlyStopping counter: 5 out of 10
EarlyStopping counter: 6 out of 10
EarlyStopping counter: 1 out of 10
EarlyStopping counter: 1 out of 10
EarlyStopping counter: 2 out of 10
EarlyStopping counter: 3 out of 10
EarlyStopping counter: 4 out of 10
EarlyStopping counter: 5 out of 10
EarlyStopping counter: 6 out of 10
EarlyStopping counter: 7 out of 10
EarlyStopping counter: 8 out of 10
EarlyStopping counter: 9 out of 10
EarlyStopping counter: 10 out of 10
Early stopping at epoch 22
Trial 89, Fold 5: Test Accuracy = 0.3369
Trial 89 completed: Mean Accuracy = 0.3341
