[I 2025-04-24 17:30:58,567] Trial 97 finished with value: 0.4530960118226348 and parameters: {'embed_dim': 128, 'depths': [2, 2, 6, 2], 'num_heads': [4, 8, 16, 32], 'window_size': 7, 'mlp_ratio': 3.21715291032504, 'drop_rate': 0.1774267542594385, 'attn_drop_rate': 0.16801173200519892, 'drop_path_rate': 0.101724377719208, 'learning_rate': 5.331959770549367e-05, 'weight_decay': 8.182103303900524e-05, 'batch_size': 32, 'optimizer': 'AdamW', 'label_smoothing': 0.14052735862593774, 'factor': 1}. Best is trial 68 with value: 0.5026770677464627.
C:\Users\hp\anaconda3\Lib\site-packages\optuna\distributions.py:515: UserWarning: Choices for a categorical distribution should be a tuple of None, bool, int, float and str for persistent storage but contains [2, 2, 6, 2] which is of type list.
warnings.warn(message)
C:\Users\hp\anaconda3\Lib\site-packages\optuna\distributions.py:515: UserWarning: Choices for a categorical distribution should be a tuple of None, bool, int, float and str for persistent storage but contains [2, 2, 18, 2] which is of type list.
warnings.warn(message)
C:\Users\hp\anaconda3\Lib\site-packages\optuna\distributions.py:515: UserWarning: Choices for a categorical distribution should be a tuple of None, bool, int, float and str for persistent storage but contains [3, 6, 12, 24] which is of type list.
warnings.warn(message)
C:\Users\hp\anaconda3\Lib\site-packages\optuna\distributions.py:515: UserWarning: Choices for a categorical distribution should be a tuple of None, bool, int, float and str for persistent storage but contains [4, 8, 16, 32] which is of type list.
warnings.warn(message)
Trial 98 hyperparameters:
embed_dim: 128
depths: [2, 2, 6, 2]
num_heads: [4, 8, 16, 32]
window_size: 14
mlp_ratio: 2.598706792347881
drop_rate: 0.08487130043800116
attn_drop_rate: 0.23266124016956455
drop_path_rate: 0.1430105462837396
learning_rate: 3.1597956858222135e-05
weight_decay: 1.9685120032826764e-06
batch_size: 64
optimizer: Adam
label_smoothing: 0.06503992636630954
factor: 1
EarlyStopping counter: 1 out of 10
EarlyStopping counter: 2 out of 10
EarlyStopping counter: 1 out of 10
EarlyStopping counter: 2 out of 10
EarlyStopping counter: 3 out of 10
EarlyStopping counter: 1 out of 10
EarlyStopping counter: 2 out of 10
EarlyStopping counter: 3 out of 10
EarlyStopping counter: 4 out of 10
EarlyStopping counter: 5 out of 10
EarlyStopping counter: 6 out of 10
EarlyStopping counter: 1 out of 10
EarlyStopping counter: 2 out of 10
EarlyStopping counter: 3 out of 10
EarlyStopping counter: 4 out of 10
EarlyStopping counter: 5 out of 10
EarlyStopping counter: 6 out of 10
EarlyStopping counter: 7 out of 10
EarlyStopping counter: 8 out of 10
EarlyStopping counter: 9 out of 10
EarlyStopping counter: 10 out of 10
Early stopping at epoch 26
Trial 98, Fold 1: Test Accuracy = 0.4551
EarlyStopping counter: 1 out of 10
EarlyStopping counter: 2 out of 10
EarlyStopping counter: 1 out of 10
EarlyStopping counter: 2 out of 10
EarlyStopping counter: 1 out of 10
EarlyStopping counter: 2 out of 10
EarlyStopping counter: 1 out of 10
EarlyStopping counter: 2 out of 10
EarlyStopping counter: 3 out of 10
EarlyStopping counter: 1 out of 10
EarlyStopping counter: 2 out of 10
EarlyStopping counter: 3 out of 10
EarlyStopping counter: 4 out of 10
EarlyStopping counter: 5 out of 10
EarlyStopping counter: 6 out of 10
EarlyStopping counter: 7 out of 10
EarlyStopping counter: 8 out of 10
EarlyStopping counter: 9 out of 10
EarlyStopping counter: 10 out of 10
Early stopping at epoch 25
Trial 98, Fold 2: Test Accuracy = 0.4946
EarlyStopping counter: 1 out of 10
EarlyStopping counter: 1 out of 10
EarlyStopping counter: 2 out of 10
EarlyStopping counter: 1 out of 10
EarlyStopping counter: 2 out of 10
EarlyStopping counter: 3 out of 10
EarlyStopping counter: 4 out of 10
EarlyStopping counter: 5 out of 10
EarlyStopping counter: 1 out of 10
EarlyStopping counter: 2 out of 10
EarlyStopping counter: 3 out of 10
EarlyStopping counter: 1 out of 10
EarlyStopping counter: 2 out of 10
EarlyStopping counter: 3 out of 10
EarlyStopping counter: 4 out of 10
EarlyStopping counter: 5 out of 10
EarlyStopping counter: 6 out of 10
EarlyStopping counter: 7 out of 10
EarlyStopping counter: 8 out of 10
EarlyStopping counter: 9 out of 10
EarlyStopping counter: 10 out of 10
Early stopping at epoch 28
Trial 98, Fold 3: Test Accuracy = 0.4835
EarlyStopping counter: 1 out of 10
EarlyStopping counter: 1 out of 10
EarlyStopping counter: 2 out of 10
EarlyStopping counter: 3 out of 10
EarlyStopping counter: 4 out of 10
EarlyStopping counter: 5 out of 10
EarlyStopping counter: 6 out of 10
EarlyStopping counter: 7 out of 10
EarlyStopping counter: 8 out of 10
EarlyStopping counter: 9 out of 10
EarlyStopping counter: 10 out of 10
Early stopping at epoch 12
Trial 98, Fold 4: Test Accuracy = 0.4237
EarlyStopping counter: 1 out of 10
EarlyStopping counter: 1 out of 10
EarlyStopping counter: 2 out of 10
EarlyStopping counter: 3 out of 10
EarlyStopping counter: 4 out of 10
EarlyStopping counter: 5 out of 10
EarlyStopping counter: 6 out of 10
EarlyStopping counter: 7 out of 10
EarlyStopping counter: 8 out of 10
EarlyStopping counter: 1 out of 10
EarlyStopping counter: 2 out of 10
EarlyStopping counter: 3 out of 10
EarlyStopping counter: 4 out of 10
EarlyStopping counter: 5 out of 10
EarlyStopping counter: 6 out of 10
EarlyStopping counter: 7 out of 10
EarlyStopping counter: 8 out of 10
EarlyStopping counter: 9 out of 10
EarlyStopping counter: 10 out of 10
Early stopping at epoch 23
Trial 98, Fold 5: Test Accuracy = 0.4430
Trial 98 completed: Mean Accuracy = 0.4600
[I 2025-04-24 18:25:56,682] Trial 98 finished with value: 0.45997436956713533 and parameters: {'embed_dim': 128, 'depths': [2, 2, 6, 2], 'num_heads': [4, 8, 16, 32], 'window_size': 14, 'mlp_ratio': 2.598706792347881, 'drop_rate': 0.08487130043800116, 'attn_drop_rate': 0.23266124016956455, 'drop_path_rate': 0.1430105462837396, 'learning_rate': 3.1597956858222135e-05, 'weight_decay': 1.9685120032826764e-06, 'batch_size': 64, 'optimizer': 'Adam', 'label_smoothing': 0.06503992636630954, 'factor': 1}. Best is trial 68 with value: 0.5026770677464627.
C:\Users\hp\anaconda3\Lib\site-packages\optuna\distributions.py:515: UserWarning: Choices for a categorical distribution should be a tuple of None, bool, int, float and str for persistent storage but contains [2, 2, 6, 2] which is of type list.
warnings.warn(message)
C:\Users\hp\anaconda3\Lib\site-packages\optuna\distributions.py:515: UserWarning: Choices for a categorical distribution should be a tuple of None, bool, int, float and str for persistent storage but contains [2, 2, 18, 2] which is of type list.
warnings.warn(message)
C:\Users\hp\anaconda3\Lib\site-packages\optuna\distributions.py:515: UserWarning: Choices for a categorical distribution should be a tuple of None, bool, int, float and str for persistent storage but contains [3, 6, 12, 24] which is of type list.
warnings.warn(message)
C:\Users\hp\anaconda3\Lib\site-packages\optuna\distributions.py:515: UserWarning: Choices for a categorical distribution should be a tuple of None, bool, int, float and str for persistent storage but contains [4, 8, 16, 32] which is of type list.
warnings.warn(message)
Trial 99 hyperparameters:
embed_dim: 96
depths: [2, 2, 6, 2]
num_heads: [3, 6, 12, 24]
window_size: 7
mlp_ratio: 2.780919073741688
drop_rate: 0.1973260652401285
attn_drop_rate: 0.18829742729844418
drop_path_rate: 0.399702146494261
learning_rate: 2.4464245888134677e-05
weight_decay: 1.3417416605016543e-06
batch_size: 32
optimizer: AdamW
label_smoothing: 0.040367137652043486
factor: 1
EarlyStopping counter: 1 out of 10
EarlyStopping counter: 2 out of 10
EarlyStopping counter: 3 out of 10
EarlyStopping counter: 4 out of 10
EarlyStopping counter: 5 out of 10
EarlyStopping counter: 6 out of 10
EarlyStopping counter: 1 out of 10
EarlyStopping counter: 2 out of 10
EarlyStopping counter: 3 out of 10
EarlyStopping counter: 4 out of 10
EarlyStopping counter: 5 out of 10
EarlyStopping counter: 1 out of 10
EarlyStopping counter: 2 out of 10
EarlyStopping counter: 3 out of 10
EarlyStopping counter: 4 out of 10
EarlyStopping counter: 1 out of 10
EarlyStopping counter: 2 out of 10
EarlyStopping counter: 3 out of 10
EarlyStopping counter: 4 out of 10
EarlyStopping counter: 5 out of 10
EarlyStopping counter: 6 out of 10
EarlyStopping counter: 7 out of 10
EarlyStopping counter: 8 out of 10
EarlyStopping counter: 9 out of 10
EarlyStopping counter: 10 out of 10
Early stopping at epoch 28
Trial 99, Fold 1: Test Accuracy = 0.4581
EarlyStopping counter: 1 out of 10
EarlyStopping counter: 2 out of 10
EarlyStopping counter: 3 out of 10
EarlyStopping counter: 4 out of 10
EarlyStopping counter: 5 out of 10
EarlyStopping counter: 1 out of 10
EarlyStopping counter: 2 out of 10
EarlyStopping counter: 3 out of 10
EarlyStopping counter: 4 out of 10
EarlyStopping counter: 5 out of 10
EarlyStopping counter: 6 out of 10
EarlyStopping counter: 1 out of 10
EarlyStopping counter: 2 out of 10
EarlyStopping counter: 3 out of 10
EarlyStopping counter: 4 out of 10
EarlyStopping counter: 1 out of 10
EarlyStopping counter: 2 out of 10
EarlyStopping counter: 3 out of 10
EarlyStopping counter: 4 out of 10
EarlyStopping counter: 5 out of 10
EarlyStopping counter: 6 out of 10
EarlyStopping counter: 7 out of 10
EarlyStopping counter: 8 out of 10
EarlyStopping counter: 9 out of 10
EarlyStopping counter: 10 out of 10
Early stopping at epoch 30
Trial 99, Fold 2: Test Accuracy = 0.4966
EarlyStopping counter: 1 out of 10
EarlyStopping counter: 1 out of 10
EarlyStopping counter: 2 out of 10
EarlyStopping counter: 3 out of 10
EarlyStopping counter: 4 out of 10
EarlyStopping counter: 5 out of 10
EarlyStopping counter: 6 out of 10
EarlyStopping counter: 1 out of 10
EarlyStopping counter: 1 out of 10
EarlyStopping counter: 2 out of 10
EarlyStopping counter: 3 out of 10
EarlyStopping counter: 4 out of 10
EarlyStopping counter: 5 out of 10
EarlyStopping counter: 6 out of 10
EarlyStopping counter: 7 out of 10
EarlyStopping counter: 8 out of 10
EarlyStopping counter: 9 out of 10
EarlyStopping counter: 10 out of 10
Early stopping at epoch 24
Trial 99, Fold 3: Test Accuracy = 0.5288
EarlyStopping counter: 1 out of 10
EarlyStopping counter: 2 out of 10
EarlyStopping counter: 3 out of 10
EarlyStopping counter: 4 out of 10
EarlyStopping counter: 5 out of 10
EarlyStopping counter: 6 out of 10
EarlyStopping counter: 7 out of 10
EarlyStopping counter: 8 out of 10
EarlyStopping counter: 9 out of 10
EarlyStopping counter: 10 out of 10
Early stopping at epoch 13
Trial 99, Fold 4: Test Accuracy = 0.4494
EarlyStopping counter: 1 out of 10
EarlyStopping counter: 1 out of 10
EarlyStopping counter: 1 out of 10
EarlyStopping counter: 2 out of 10
EarlyStopping counter: 3 out of 10
EarlyStopping counter: 4 out of 10
EarlyStopping counter: 5 out of 10
EarlyStopping counter: 6 out of 10
EarlyStopping counter: 7 out of 10
EarlyStopping counter: 1 out of 10
EarlyStopping counter: 2 out of 10
EarlyStopping counter: 3 out of 10
EarlyStopping counter: 4 out of 10
EarlyStopping counter: 5 out of 10
EarlyStopping counter: 6 out of 10
EarlyStopping counter: 1 out of 10
EarlyStopping counter: 2 out of 10
EarlyStopping counter: 3 out of 10
EarlyStopping counter: 4 out of 10
EarlyStopping counter: 5 out of 10
EarlyStopping counter: 6 out of 10
EarlyStopping counter: 7 out of 10
EarlyStopping counter: 8 out of 10
EarlyStopping counter: 9 out of 10
EarlyStopping counter: 10 out of 10
Early stopping at epoch 30
Trial 99, Fold 5: Test Accuracy = 0.4568
Trial 99 completed: Mean Accuracy = 0.4780
[I 2025-04-24 18:54:08,290] Trial 99 finished with value: 0.4779517925236389 and parameters: {'embed_dim': 96, 'depths': [2, 2, 6, 2], 'num_heads': [3, 6, 12, 24], 'window_size': 7, 'mlp_ratio': 2.780919073741688, 'drop_rate': 0.1973260652401285, 'attn_drop_rate': 0.18829742729844418, 'drop_path_rate': 0.399702146494261, 'learning_rate': 2.4464245888134677e-05, 'weight_decay': 1.3417416605016543e-06, 'batch_size': 32, 'optimizer': 'AdamW', 'label_smoothing': 0.040367137652043486, 'factor': 1}. Best is trial 68 with value: 0.5026770677464627.
Best hyperparameters: {'embed_dim': 128, 'depths': [2, 2, 6, 2], 'num_heads': [4, 8, 16, 32], 'window_size': 14, 'mlp_ratio': 2.8859252729165528, 'drop_rate': 0.14376422440199177, 'attn_drop_rate': 0.16147072703456217, 'drop_path_rate': 0.07894141037454817, 'learning_rate': 3.0176840296221454e-05, 'weight_decay': 1.4789889052203777e-06, 'batch_size': 32, 'optimizer': 'Adam', 'label_smoothing': 0.12926376177953994, 'factor': 1}
Best value: 0.5026770677464627
