[I 2025-04-24 13:18:37,756] Trial 89 finished with value: 0.3340553407506773 and parameters: {'embed_dim': 128, 'depths': [2, 2, 6, 2], 'num_heads': [4, 8, 16, 32], 'window_size': 14, 'mlp_ratio': 3.2009578714553975, 'drop_rate': 0.13033059279925654, 'attn_drop_rate': 0.2867477342881787, 'drop_path_rate': 0.08762960474458875, 'learning_rate': 0.00020345130859270792, 'weight_decay': 4.216778324042579e-06, 'batch_size': 32, 'optimizer': 'Adam', 'label_smoothing': 0.020564917010912745, 'factor': 1}. Best is trial 68 with value: 0.5026770677464627.
C:\Users\hp\anaconda3\Lib\site-packages\optuna\distributions.py:515: UserWarning: Choices for a categorical distribution should be a tuple of None, bool, int, float and str for persistent storage but contains [2, 2, 6, 2] which is of type list.
warnings.warn(message)
C:\Users\hp\anaconda3\Lib\site-packages\optuna\distributions.py:515: UserWarning: Choices for a categorical distribution should be a tuple of None, bool, int, float and str for persistent storage but contains [2, 2, 18, 2] which is of type list.
warnings.warn(message)
C:\Users\hp\anaconda3\Lib\site-packages\optuna\distributions.py:515: UserWarning: Choices for a categorical distribution should be a tuple of None, bool, int, float and str for persistent storage but contains [3, 6, 12, 24] which is of type list.
warnings.warn(message)
C:\Users\hp\anaconda3\Lib\site-packages\optuna\distributions.py:515: UserWarning: Choices for a categorical distribution should be a tuple of None, bool, int, float and str for persistent storage but contains [4, 8, 16, 32] which is of type list.
warnings.warn(message)
Trial 90 hyperparameters:
embed_dim: 128
depths: [2, 2, 6, 2]
num_heads: [4, 8, 16, 32]
window_size: 14
mlp_ratio: 2.270129000932869
drop_rate: 0.11079899334882438
attn_drop_rate: 0.013391786367072691
drop_path_rate: 0.1765128691774826
learning_rate: 1.3467801799031635e-05
weight_decay: 1.663791986144299e-06
batch_size: 32
optimizer: Adam
label_smoothing: 0.05524616456514948
factor: 2
EarlyStopping counter: 1 out of 10
EarlyStopping counter: 1 out of 10
EarlyStopping counter: 2 out of 10
EarlyStopping counter: 3 out of 10
EarlyStopping counter: 4 out of 10
EarlyStopping counter: 5 out of 10
EarlyStopping counter: 6 out of 10
EarlyStopping counter: 7 out of 10
EarlyStopping counter: 8 out of 10
EarlyStopping counter: 1 out of 10
EarlyStopping counter: 1 out of 10
EarlyStopping counter: 2 out of 10
EarlyStopping counter: 3 out of 10
EarlyStopping counter: 4 out of 10
EarlyStopping counter: 5 out of 10
EarlyStopping counter: 6 out of 10
EarlyStopping counter: 7 out of 10
EarlyStopping counter: 8 out of 10
EarlyStopping counter: 9 out of 10
EarlyStopping counter: 10 out of 10
Early stopping at epoch 25
Trial 90, Fold 1: Test Accuracy = 0.4698
EarlyStopping counter: 1 out of 10
EarlyStopping counter: 1 out of 10
EarlyStopping counter: 2 out of 10
EarlyStopping counter: 3 out of 10
EarlyStopping counter: 1 out of 10
EarlyStopping counter: 2 out of 10
EarlyStopping counter: 3 out of 10
EarlyStopping counter: 4 out of 10
EarlyStopping counter: 5 out of 10
EarlyStopping counter: 6 out of 10
EarlyStopping counter: 7 out of 10
EarlyStopping counter: 8 out of 10
EarlyStopping counter: 9 out of 10
EarlyStopping counter: 1 out of 10
EarlyStopping counter: 2 out of 10
EarlyStopping counter: 3 out of 10
EarlyStopping counter: 4 out of 10
EarlyStopping counter: 5 out of 10
EarlyStopping counter: 6 out of 10
EarlyStopping counter: 7 out of 10
EarlyStopping counter: 8 out of 10
EarlyStopping counter: 9 out of 10
EarlyStopping counter: 10 out of 10
Early stopping at epoch 27
Trial 90, Fold 2: Test Accuracy = 0.4264
EarlyStopping counter: 1 out of 10
EarlyStopping counter: 2 out of 10
EarlyStopping counter: 3 out of 10
EarlyStopping counter: 4 out of 10
EarlyStopping counter: 5 out of 10
EarlyStopping counter: 6 out of 10
EarlyStopping counter: 7 out of 10
EarlyStopping counter: 8 out of 10
EarlyStopping counter: 9 out of 10
EarlyStopping counter: 10 out of 10
Early stopping at epoch 11
Trial 90, Fold 3: Test Accuracy = 0.3863
EarlyStopping counter: 1 out of 10
EarlyStopping counter: 2 out of 10
EarlyStopping counter: 3 out of 10
EarlyStopping counter: 4 out of 10
EarlyStopping counter: 5 out of 10
EarlyStopping counter: 6 out of 10
EarlyStopping counter: 7 out of 10
EarlyStopping counter: 8 out of 10
EarlyStopping counter: 9 out of 10
EarlyStopping counter: 10 out of 10
Early stopping at epoch 12
Trial 90, Fold 4: Test Accuracy = 0.4331
EarlyStopping counter: 1 out of 10
EarlyStopping counter: 1 out of 10
EarlyStopping counter: 1 out of 10
EarlyStopping counter: 1 out of 10
EarlyStopping counter: 2 out of 10
EarlyStopping counter: 3 out of 10
EarlyStopping counter: 4 out of 10
EarlyStopping counter: 5 out of 10
EarlyStopping counter: 6 out of 10
EarlyStopping counter: 7 out of 10
EarlyStopping counter: 8 out of 10
EarlyStopping counter: 1 out of 10
EarlyStopping counter: 2 out of 10
EarlyStopping counter: 3 out of 10
EarlyStopping counter: 4 out of 10
EarlyStopping counter: 5 out of 10
EarlyStopping counter: 1 out of 10
EarlyStopping counter: 2 out of 10
EarlyStopping counter: 1 out of 10
EarlyStopping counter: 2 out of 10
EarlyStopping counter: 3 out of 10
EarlyStopping counter: 4 out of 10
EarlyStopping counter: 5 out of 10
EarlyStopping counter: 6 out of 10
EarlyStopping counter: 7 out of 10
EarlyStopping counter: 8 out of 10
EarlyStopping counter: 9 out of 10
EarlyStopping counter: 10 out of 10
Early stopping at epoch 36
Trial 90, Fold 5: Test Accuracy = 0.3963
Trial 90 completed: Mean Accuracy = 0.4224
[I 2025-04-24 13:47:04,282] Trial 90 finished with value: 0.42238294944193155 and parameters: {'embed_dim': 128, 'depths': [2, 2, 6, 2], 'num_heads': [4, 8, 16, 32], 'window_size': 14, 'mlp_ratio': 2.270129000932869, 'drop_rate': 0.11079899334882438, 'attn_drop_rate': 0.013391786367072691, 'drop_path_rate': 0.1765128691774826, 'learning_rate': 1.3467801799031635e-05, 'weight_decay': 1.663791986144299e-06, 'batch_size': 32, 'optimizer': 'Adam', 'label_smoothing': 0.05524616456514948, 'factor': 2}. Best is trial 68 with value: 0.5026770677464627.
C:\Users\hp\anaconda3\Lib\site-packages\optuna\distributions.py:515: UserWarning: Choices for a categorical distribution should be a tuple of None, bool, int, float and str for persistent storage but contains [2, 2, 6, 2] which is of type list.
warnings.warn(message)
C:\Users\hp\anaconda3\Lib\site-packages\optuna\distributions.py:515: UserWarning: Choices for a categorical distribution should be a tuple of None, bool, int, float and str for persistent storage but contains [2, 2, 18, 2] which is of type list.
warnings.warn(message)
C:\Users\hp\anaconda3\Lib\site-packages\optuna\distributions.py:515: UserWarning: Choices for a categorical distribution should be a tuple of None, bool, int, float and str for persistent storage but contains [3, 6, 12, 24] which is of type list.
warnings.warn(message)
C:\Users\hp\anaconda3\Lib\site-packages\optuna\distributions.py:515: UserWarning: Choices for a categorical distribution should be a tuple of None, bool, int, float and str for persistent storage but contains [4, 8, 16, 32] which is of type list.
warnings.warn(message)
Trial 91 hyperparameters:
embed_dim: 128
depths: [2, 2, 6, 2]
num_heads: [4, 8, 16, 32]
window_size: 14
mlp_ratio: 2.6916032950372144
drop_rate: 0.13991044944893521
attn_drop_rate: 0.14406693252941613
drop_path_rate: 0.13836347767851692
learning_rate: 3.3019565308722566e-05
weight_decay: 2.4638182060806145e-06
batch_size: 32
optimizer: Adam
label_smoothing: 0.14880632115537173
factor: 1
EarlyStopping counter: 1 out of 10
EarlyStopping counter: 2 out of 10
EarlyStopping counter: 3 out of 10
EarlyStopping counter: 4 out of 10
EarlyStopping counter: 1 out of 10
EarlyStopping counter: 1 out of 10
EarlyStopping counter: 2 out of 10
EarlyStopping counter: 3 out of 10
EarlyStopping counter: 4 out of 10
EarlyStopping counter: 5 out of 10
EarlyStopping counter: 6 out of 10
EarlyStopping counter: 7 out of 10
EarlyStopping counter: 8 out of 10
EarlyStopping counter: 9 out of 10
EarlyStopping counter: 10 out of 10
Early stopping at epoch 17
Trial 91, Fold 1: Test Accuracy = 0.4445
EarlyStopping counter: 1 out of 10
EarlyStopping counter: 2 out of 10
EarlyStopping counter: 3 out of 10
EarlyStopping counter: 4 out of 10
EarlyStopping counter: 5 out of 10
EarlyStopping counter: 6 out of 10
EarlyStopping counter: 7 out of 10
EarlyStopping counter: 1 out of 10
EarlyStopping counter: 1 out of 10
EarlyStopping counter: 2 out of 10
EarlyStopping counter: 1 out of 10
EarlyStopping counter: 2 out of 10
EarlyStopping counter: 3 out of 10
EarlyStopping counter: 4 out of 10
EarlyStopping counter: 5 out of 10
EarlyStopping counter: 6 out of 10
EarlyStopping counter: 7 out of 10
EarlyStopping counter: 8 out of 10
EarlyStopping counter: 9 out of 10
EarlyStopping counter: 10 out of 10
Early stopping at epoch 23
Trial 91, Fold 2: Test Accuracy = 0.5115
EarlyStopping counter: 1 out of 10
EarlyStopping counter: 2 out of 10
EarlyStopping counter: 3 out of 10
EarlyStopping counter: 4 out of 10
EarlyStopping counter: 5 out of 10
EarlyStopping counter: 6 out of 10
EarlyStopping counter: 7 out of 10
EarlyStopping counter: 8 out of 10
EarlyStopping counter: 9 out of 10
EarlyStopping counter: 10 out of 10
Early stopping at epoch 10
Trial 91, Fold 3: Test Accuracy = 0.5265
EarlyStopping counter: 1 out of 10
EarlyStopping counter: 2 out of 10
EarlyStopping counter: 3 out of 10
EarlyStopping counter: 4 out of 10
EarlyStopping counter: 5 out of 10
EarlyStopping counter: 1 out of 10
EarlyStopping counter: 2 out of 10
EarlyStopping counter: 3 out of 10
EarlyStopping counter: 1 out of 10
EarlyStopping counter: 2 out of 10
EarlyStopping counter: 3 out of 10
EarlyStopping counter: 4 out of 10
EarlyStopping counter: 5 out of 10
EarlyStopping counter: 6 out of 10
EarlyStopping counter: 7 out of 10
EarlyStopping counter: 8 out of 10
EarlyStopping counter: 9 out of 10
EarlyStopping counter: 10 out of 10
Early stopping at epoch 20
Trial 91, Fold 4: Test Accuracy = 0.4954
EarlyStopping counter: 1 out of 10
EarlyStopping counter: 2 out of 10
EarlyStopping counter: 3 out of 10
EarlyStopping counter: 1 out of 10
EarlyStopping counter: 2 out of 10
EarlyStopping counter: 3 out of 10
EarlyStopping counter: 4 out of 10
EarlyStopping counter: 5 out of 10
EarlyStopping counter: 6 out of 10
EarlyStopping counter: 7 out of 10
EarlyStopping counter: 8 out of 10
EarlyStopping counter: 9 out of 10
EarlyStopping counter: 10 out of 10
Early stopping at epoch 15
Trial 91, Fold 5: Test Accuracy = 0.4170
Trial 91 completed: Mean Accuracy = 0.4790
[I 2025-04-24 14:19:24,768] Trial 91 finished with value: 0.47899295094891076 and parameters: {'embed_dim': 128, 'depths': [2, 2, 6, 2], 'num_heads': [4, 8, 16, 32], 'window_size': 14, 'mlp_ratio': 2.6916032950372144, 'drop_rate': 0.13991044944893521, 'attn_drop_rate': 0.14406693252941613, 'drop_path_rate': 0.13836347767851692, 'learning_rate': 3.3019565308722566e-05, 'weight_decay': 2.4638182060806145e-06, 'batch_size': 32, 'optimizer': 'Adam', 'label_smoothing': 0.14880632115537173, 'factor': 1}. Best is trial 68 with value: 0.5026770677464627.
C:\Users\hp\anaconda3\Lib\site-packages\optuna\distributions.py:515: UserWarning: Choices for a categorical distribution should be a tuple of None, bool, int, float and str for persistent storage but contains [2, 2, 6, 2] which is of type list.
warnings.warn(message)
C:\Users\hp\anaconda3\Lib\site-packages\optuna\distributions.py:515: UserWarning: Choices for a categorical distribution should be a tuple of None, bool, int, float and str for persistent storage but contains [2, 2, 18, 2] which is of type list.
warnings.warn(message)
C:\Users\hp\anaconda3\Lib\site-packages\optuna\distributions.py:515: UserWarning: Choices for a categorical distribution should be a tuple of None, bool, int, float and str for persistent storage but contains [3, 6, 12, 24] which is of type list.
warnings.warn(message)
C:\Users\hp\anaconda3\Lib\site-packages\optuna\distributions.py:515: UserWarning: Choices for a categorical distribution should be a tuple of None, bool, int, float and str for persistent storage but contains [4, 8, 16, 32] which is of type list.
warnings.warn(message)
Trial 92 hyperparameters:
embed_dim: 128
depths: [2, 2, 6, 2]
num_heads: [4, 8, 16, 32]
window_size: 14
mlp_ratio: 2.9055885103396504
drop_rate: 0.14401143271308386
attn_drop_rate: 0.19966166836989574
drop_path_rate: 0.15956433237565276
learning_rate: 2.8367555667212324e-05
weight_decay: 2.3740116124105863e-06
batch_size: 32
optimizer: Adam
label_smoothing: 0.13416561189493603
factor: 1
EarlyStopping counter: 1 out of 10
EarlyStopping counter: 2 out of 10
EarlyStopping counter: 3 out of 10
EarlyStopping counter: 1 out of 10
EarlyStopping counter: 2 out of 10
EarlyStopping counter: 3 out of 10
EarlyStopping counter: 1 out of 10
EarlyStopping counter: 2 out of 10
EarlyStopping counter: 3 out of 10
EarlyStopping counter: 1 out of 10
EarlyStopping counter: 2 out of 10
EarlyStopping counter: 3 out of 10
EarlyStopping counter: 4 out of 10
EarlyStopping counter: 5 out of 10
EarlyStopping counter: 6 out of 10
EarlyStopping counter: 7 out of 10
EarlyStopping counter: 8 out of 10
EarlyStopping counter: 9 out of 10
EarlyStopping counter: 10 out of 10
Early stopping at epoch 23
Trial 92, Fold 1: Test Accuracy = 0.4344
EarlyStopping counter: 1 out of 10
EarlyStopping counter: 2 out of 10
EarlyStopping counter: 1 out of 10
EarlyStopping counter: 2 out of 10
EarlyStopping counter: 3 out of 10
EarlyStopping counter: 4 out of 10
EarlyStopping counter: 5 out of 10
EarlyStopping counter: 6 out of 10
EarlyStopping counter: 7 out of 10
EarlyStopping counter: 1 out of 10
EarlyStopping counter: 2 out of 10
EarlyStopping counter: 3 out of 10
EarlyStopping counter: 4 out of 10
EarlyStopping counter: 5 out of 10
EarlyStopping counter: 6 out of 10
EarlyStopping counter: 7 out of 10
EarlyStopping counter: 8 out of 10
EarlyStopping counter: 9 out of 10
EarlyStopping counter: 10 out of 10
Early stopping at epoch 23
Trial 92, Fold 2: Test Accuracy = 0.5140
EarlyStopping counter: 1 out of 10
EarlyStopping counter: 2 out of 10
EarlyStopping counter: 3 out of 10
EarlyStopping counter: 4 out of 10
EarlyStopping counter: 5 out of 10
EarlyStopping counter: 1 out of 10
EarlyStopping counter: 2 out of 10
EarlyStopping counter: 3 out of 10
EarlyStopping counter: 4 out of 10
EarlyStopping counter: 5 out of 10
EarlyStopping counter: 6 out of 10
EarlyStopping counter: 7 out of 10
EarlyStopping counter: 8 out of 10
EarlyStopping counter: 9 out of 10
EarlyStopping counter: 10 out of 10
Early stopping at epoch 16
Trial 92, Fold 3: Test Accuracy = 0.5468
EarlyStopping counter: 1 out of 10
EarlyStopping counter: 2 out of 10
EarlyStopping counter: 3 out of 10
EarlyStopping counter: 4 out of 10
EarlyStopping counter: 5 out of 10
EarlyStopping counter: 6 out of 10
EarlyStopping counter: 7 out of 10
EarlyStopping counter: 8 out of 10
EarlyStopping counter: 9 out of 10
EarlyStopping counter: 10 out of 10
Early stopping at epoch 11
Trial 92, Fold 4: Test Accuracy = 0.4300
EarlyStopping counter: 1 out of 10
EarlyStopping counter: 2 out of 10
EarlyStopping counter: 3 out of 10
EarlyStopping counter: 1 out of 10
EarlyStopping counter: 1 out of 10
EarlyStopping counter: 1 out of 10
EarlyStopping counter: 2 out of 10
EarlyStopping counter: 3 out of 10
EarlyStopping counter: 4 out of 10
EarlyStopping counter: 5 out of 10
EarlyStopping counter: 6 out of 10
EarlyStopping counter: 7 out of 10
EarlyStopping counter: 8 out of 10
EarlyStopping counter: 9 out of 10
EarlyStopping counter: 10 out of 10
Early stopping at epoch 18
Trial 92, Fold 5: Test Accuracy = 0.4363
Trial 92 completed: Mean Accuracy = 0.4723
[I 2025-04-24 14:54:10,644] Trial 92 finished with value: 0.4722949362426613 and parameters: {'embed_dim': 128, 'depths': [2, 2, 6, 2], 'num_heads': [4, 8, 16, 32], 'window_size': 14, 'mlp_ratio': 2.9055885103396504, 'drop_rate': 0.14401143271308386, 'attn_drop_rate': 0.19966166836989574, 'drop_path_rate': 0.15956433237565276, 'learning_rate': 2.8367555667212324e-05, 'weight_decay': 2.3740116124105863e-06, 'batch_size': 32, 'optimizer': 'Adam', 'label_smoothing': 0.13416561189493603, 'factor': 1}. Best is trial 68 with value: 0.5026770677464627.
C:\Users\hp\anaconda3\Lib\site-packages\optuna\distributions.py:515: UserWarning: Choices for a categorical distribution should be a tuple of None, bool, int, float and str for persistent storage but contains [2, 2, 6, 2] which is of type list.
warnings.warn(message)
C:\Users\hp\anaconda3\Lib\site-packages\optuna\distributions.py:515: UserWarning: Choices for a categorical distribution should be a tuple of None, bool, int, float and str for persistent storage but contains [2, 2, 18, 2] which is of type list.
warnings.warn(message)
C:\Users\hp\anaconda3\Lib\site-packages\optuna\distributions.py:515: UserWarning: Choices for a categorical distribution should be a tuple of None, bool, int, float and str for persistent storage but contains [3, 6, 12, 24] which is of type list.
warnings.warn(message)
C:\Users\hp\anaconda3\Lib\site-packages\optuna\distributions.py:515: UserWarning: Choices for a categorical distribution should be a tuple of None, bool, int, float and str for persistent storage but contains [4, 8, 16, 32] which is of type list.
warnings.warn(message)
Trial 93 hyperparameters:
embed_dim: 128
depths: [2, 2, 6, 2]
num_heads: [4, 8, 16, 32]
window_size: 14
mlp_ratio: 2.967366872463397
drop_rate: 0.1567330797097972
attn_drop_rate: 0.2502543411466608
drop_path_rate: 0.10948593006467039
learning_rate: 2.3030271341068793e-05
weight_decay: 3.1151035823189673e-06
batch_size: 32
optimizer: Adam
label_smoothing: 0.15733114318057237
factor: 1
EarlyStopping counter: 1 out of 10
EarlyStopping counter: 2 out of 10
EarlyStopping counter: 3 out of 10
EarlyStopping counter: 4 out of 10
EarlyStopping counter: 5 out of 10
EarlyStopping counter: 1 out of 10
EarlyStopping counter: 1 out of 10
EarlyStopping counter: 2 out of 10
EarlyStopping counter: 3 out of 10
EarlyStopping counter: 4 out of 10
EarlyStopping counter: 1 out of 10
EarlyStopping counter: 2 out of 10
EarlyStopping counter: 3 out of 10
EarlyStopping counter: 4 out of 10
EarlyStopping counter: 5 out of 10
EarlyStopping counter: 6 out of 10
EarlyStopping counter: 7 out of 10
EarlyStopping counter: 8 out of 10
EarlyStopping counter: 9 out of 10
EarlyStopping counter: 10 out of 10
Early stopping at epoch 25
Trial 93, Fold 1: Test Accuracy = 0.4365
EarlyStopping counter: 1 out of 10
EarlyStopping counter: 2 out of 10
EarlyStopping counter: 3 out of 10
EarlyStopping counter: 4 out of 10
EarlyStopping counter: 5 out of 10
EarlyStopping counter: 1 out of 10
EarlyStopping counter: 2 out of 10
EarlyStopping counter: 3 out of 10
EarlyStopping counter: 1 out of 10
EarlyStopping counter: 2 out of 10
EarlyStopping counter: 3 out of 10
EarlyStopping counter: 4 out of 10
EarlyStopping counter: 5 out of 10
EarlyStopping counter: 6 out of 10
EarlyStopping counter: 7 out of 10
EarlyStopping counter: 8 out of 10
EarlyStopping counter: 9 out of 10
EarlyStopping counter: 10 out of 10
Early stopping at epoch 21
Trial 93, Fold 2: Test Accuracy = 0.4863
EarlyStopping counter: 1 out of 10
EarlyStopping counter: 2 out of 10
EarlyStopping counter: 3 out of 10
EarlyStopping counter: 4 out of 10
EarlyStopping counter: 5 out of 10
EarlyStopping counter: 6 out of 10
EarlyStopping counter: 7 out of 10
EarlyStopping counter: 8 out of 10
EarlyStopping counter: 9 out of 10
EarlyStopping counter: 1 out of 10
EarlyStopping counter: 2 out of 10
EarlyStopping counter: 3 out of 10
EarlyStopping counter: 4 out of 10
EarlyStopping counter: 5 out of 10
EarlyStopping counter: 6 out of 10
EarlyStopping counter: 7 out of 10
EarlyStopping counter: 8 out of 10
EarlyStopping counter: 1 out of 10
EarlyStopping counter: 2 out of 10
EarlyStopping counter: 3 out of 10
EarlyStopping counter: 4 out of 10
EarlyStopping counter: 5 out of 10
EarlyStopping counter: 6 out of 10
EarlyStopping counter: 7 out of 10
EarlyStopping counter: 8 out of 10
EarlyStopping counter: 9 out of 10
EarlyStopping counter: 10 out of 10
Early stopping at epoch 30
Trial 93, Fold 3: Test Accuracy = 0.5370
EarlyStopping counter: 1 out of 10
EarlyStopping counter: 2 out of 10
EarlyStopping counter: 3 out of 10
EarlyStopping counter: 4 out of 10
EarlyStopping counter: 5 out of 10
EarlyStopping counter: 6 out of 10
EarlyStopping counter: 7 out of 10
EarlyStopping counter: 8 out of 10
EarlyStopping counter: 9 out of 10
EarlyStopping counter: 10 out of 10
Early stopping at epoch 12
Trial 93, Fold 4: Test Accuracy = 0.5014
EarlyStopping counter: 1 out of 10
EarlyStopping counter: 2 out of 10
EarlyStopping counter: 3 out of 10
EarlyStopping counter: 4 out of 10
EarlyStopping counter: 5 out of 10
EarlyStopping counter: 6 out of 10
EarlyStopping counter: 1 out of 10
EarlyStopping counter: 1 out of 10
EarlyStopping counter: 2 out of 10
EarlyStopping counter: 3 out of 10
EarlyStopping counter: 4 out of 10
EarlyStopping counter: 5 out of 10
EarlyStopping counter: 6 out of 10
EarlyStopping counter: 7 out of 10
EarlyStopping counter: 8 out of 10
EarlyStopping counter: 9 out of 10
EarlyStopping counter: 10 out of 10
Early stopping at epoch 19
Trial 93, Fold 5: Test Accuracy = 0.4140
Trial 93 completed: Mean Accuracy = 0.4751
